,이름,별점,리뷰,날짜
134,VanJiyeon,5.0,"Myeongdong is a great place to shop, eat and a place to meet up Korean friends. It is easy to locate and easy to reach. It is just two stops away from Seoul.  It has lots of facial, skin products, trend clothing and foods. It even has a gun range! You can try it for the first time. 14 years old and above. Valid passport and cash of course.  Here you no need for guide, just walk the walk... try not to go on weekends, tonnes of tourists and koreans.  There is self cert halal food!","Written December 3, 2019"
135,Kind S,5.0,A good place to shop! There are lots of stores to see from skincare to fashion. I recommend going to Music Korea if you're a K-Pop Fan since they sell albums at a cheaper price! Don't miss out on the food carts on the main street. You'll definitely miss it once you're home!!,"Written December 2, 2019"
136,MaryC12345678,5.0,"Soak it all in- the crowds, the street food vendors, retail vendors, noise, smells, etc. Try the spectrum of street food- you won’t regret it. Oh yes, if you get lost and don’t know where north or south is, look for the people wearing red (I think they are known as the Red Angels who are the Tourist Guides) and they will direct you! They also will provide you maps of this area because it is very easy to get lost. Now go and have fun!!","Written December 1, 2019"
137,fedra l,4.0,"Great place to spend an evening. Many shops with great deals of cosmetic product. At the end of the road there are some multi storey malls with amazing food ""delicatesen"" in the basement.","Written December 1, 2019"
138,GlobetrotterJ16,5.0,"Myeongdong is a must visit when in Seoul, no doubt about it. Not too far from some of the major sights and palaces of Seoul, this area is defined by its street food stalls and alleys full of branded shops. The streets are packed with tourists and locals alike, plenty of delicious food all over, whether in street stalls or in cafes and restaurants. Lots of beauty/cosmetic stores, fashion and the works. Just a great area to get lost in and absorb Seoul.","Written December 1, 2019"
139,JuanJuanCS,5.0,"A great beauty care shopping experience as you'll be spoiled wilth various brands- Tony Moly, Etude House, Face Shop, Laneige- just to name a few. Just in case you missed 1 outlet, worry not. As there are other Franchisees around.  Also there are alot of souvenir shops around.  If you like Almond Nuts, then this is the place you should head to. It's called Honey Bee Almond & Friends (HBAF). There are alot of varieties of Almond- Flavoured Nuts to choose from. Before you decide to buy any flavour(s), please feel free to try the samples provided. Comes in various packaging sizes. There are some sales happening right now.  Some of the highly recommended flavours are: 1) Laver Almond 2) Wasabi Almond 3) Black Sugar Milk Tea Almond (if you like Bubble Milk Tea drink. Similar taste) 4) Tiramisu Almond  Happy Almond-ing....","Written December 1, 2019"
140,Krishhere,5.0,Had heard so much about this shopping area but what was on display went beyond all that. This is the place for korean beauty products. Lots and lots of street food joints and you will be spoilt for choices. The food looks visually appearing and everything we tried was yummy. The streets are choc a bloc with shoppers and there it is fun to just sit somewhere munching on the food and watch the world go buy. You can spend hours at this place. A must visit if you are in Seoul,"Written November 30, 2019"
141,Munni,5.0,"Paradise for a girls soul. Cosmetic haven and absolute delight for Korean street food. Everywhere you look, there are shops selling Korean brand cosmetics. Shopping and savoring sumptuous street foods is a walk in heaven. A must visit to stock up on your common and wierd Korean cosmetics","Written November 30, 2019"
142,sofjan2018,5.0,"Very festive place. All kinds of shops, plenty of restaurants, street foods, etc. It is always crowded. Definitely worth a visit when you are in Seoul. And if you need Won, those small currency exchange kiosks in Myeongdong have very favorable exchange rate, as long as you have 100 dollar bills. With 100 USD bill, you will get within 1% of the daily exchange rate. But with 50 dollar or smaller bills, they might ding you, could be 5% to 10% less of the exchange rate.","Written November 29, 2019"
143,peng chiew,4.0,Interesting place if you're looking for cosmetics. Go for the street food as the restaurants here serve Korean food that's below par with a higher price. It's hard to bargain even with the stalls and mom-pop kind of retail outlets as I have the impression that they have fixed the prices.,"Written November 28, 2019"
144,Faismoh,4.0,This street is simply a good visit. There are all kinds of shops from stalls to big departmental stores and prices vary accordingly. It has great street food especially at night and it’s a good place to interact with everyday Koreans. It’s worth a visit,"Written November 27, 2019"
145,MyrnaB,5.0,The shopping here was fantastic. The Korean face products were not too expensive and street food was awesome.,"Written November 26, 2019"
146,Delnyon,5.0,"This area got it all. Small shops big departments store, food street and restaurants. Gets very busy late evening specially on weekends.","Written November 26, 2019"
147,Super_CJPI,5.0,"Even if you are not a shopaholic, you would agree that this place is a shopping heaven especially for cosmetics. There's a lot of brands you can find here without good price. Find shop called, Baviphat where the items here are much cheaper than the other shops. If you are buying from the stalls, bargain as much as you can!","Written November 25, 2019"
148,Delnyon,5.0,"Lively, vibrant, busy, bustling, this a great area for shopping, to eat a bite and feel the proper Seoul atmosphere","Written November 25, 2019"
149,Maxwell,4.0,"Fun place to wander around at night and stock up on k-beauty supplies. Shop employees will be handing out “free” sheet masks in exchange for ushering you into the stores and trying to make a sale, so be prepared lol. This place gets packed after dark w/ tourists and locals alike. Tons of delicious restaurants and street food to choose from, so come hungry.","Written November 24, 2019"
150,Alex D,3.0,Good place to spend an hour. Go after dark when the street food vendors have set up and the stores are still open. A bit touristy but good fun nonetheless.,"Written November 24, 2019"
151,Patrick L,5.0,"A good spot to spent your evening here - plenty of food stalls and others like clothing, souvenirs, cosmetics accessories, etc. Take your time to walk from one end of the street to the other. A must visut place whenever you're in Seoul.","Written November 24, 2019"
152,Jason H,5.0,One of the best place for hawker food in Seoul plus shopping! Cold weather this time and there’s a Nanta Show here!,"Written November 23, 2019"
153,gill,5.0,"There are a lot of people and shops in this area. when I first went there, there were so many people that it was inconvenient but after a while i feel comfortable. If you want to taste Korean street food, go here!","Written November 23, 2019"
154,Margaretllc,5.0,"Day and night both speak the local food and shopping culture - delicious and interesting street food, most trendy beauty and clothing shops. Unquestionably crowded but amazing just to walk around!","Written November 22, 2019"
155,Sohfiyah,5.0,"This is a crazy and great shopping district where there are a lot of lanes that you can cover. Definitely a place that you can visit a few times during your stay in Seoul. A lot of things can be found there like clothing, skin care, food etc...","Written November 22, 2019"
156,BeeBeePop,4.0,This is a must do if you visit Seoul! The street food is fantastic. It however gets really crowded and you see the same cosmetic shops scattered all over the place. The staff at the cosmetic shops here are not as friendly as those in other parts of Seoul and not so willing to give samples as compared to past visits; but a still must do when you are in Seoul.,"Written November 22, 2019"
157,ol b,5.0,"If you love shopping, this is a good place to be. Very busy street, lots of big brands have shops here. It's also nice to be here at nighttime.","Written November 21, 2019"
158,José Manuel J,5.0,"This a great area to walk around, do some shopping if you're into that and also to eat. You can walk to the cable car that will take you to the Seoul Tower from there and there is also a church that you can visit. Overall is a good place to visit as there are multiple options and there is a subway station nearby too.","Written November 20, 2019"
159,Jay Y,5.0,"First night in Seoul, we head over after dinner not knowing what to expect. We used an undercrossing, and as soon as you started back up the stairs, the smell of cooking food was like a beacon. Lining both sides and in the center of the streets were random booths, selling everything from pop sockets to fish pancakes. Was definitly a great experience walking up and down and seeing all the different vendors, and all the stores behind still open as well","Written November 20, 2019"
160,ahriev,5.0,"I really2 like Myeongdong because I can visit it in night time and it still so full of people... If you looking for cosmetic, this is the place that you should visit. For muslim, there are food stal that has halal logo (even the chicken), just search the halal logo in the stall You can access the shopping district from myeongdong station and walk to euljiro4(sa)-ga (even though the areas near euljiro4(sa)-ga not to crowded. Along with the route you can find cheap cloth store (check out the basement of the store to pay and more goods)","Written November 18, 2019"
161,Isabel V,5.0,"We came in at 9pm and the streets were still bustling. Most of the stores closed at 11pm so we had fun looking around the shops and the stalls, eating street food along the way.","Written November 17, 2019"
162,terry S,5.0,"Good street food, and a massive selection And range of shopping Options. Well worth a trip with all ages of children and adults","Written November 16, 2019"
163,Luv_Mort,4.0,"Myeongdong Street Food - 짱 ♡ almost all of the food at the Myeongdong Street Food Should try : Gimbap, Eomuk, Dak-kkochi, Hotteok, Bingsu, Ppopgi, Yangnyeom-chikin, Cheesy Grilled Mussel, Jokbal, Bossam, Japchae, Jajangmyeon, Okonomiyaki, Grilled Garlic Butter Shrimp, Bindae-tteok, Honey Vanilla Ice Cream Bread, Strawberry, etc... 👍","Written November 16, 2019"
164,Jeremiah,5.0,"I brought my wife here and it was like she was in Disneyland. I’m not into shopping, but it made her super happy. Everything is very cheap with decent quality. It’s not all beauty and makeup products, but it’s definitely a woman shopping zone.","Written November 16, 2019"
165,Keshira haLev F,5.0,Myeongdong reminded us of Harajuku - it's filled with street food vendors and little shops (mostly clothing and skin care/cosmetics). Great for people watching or getting amongst the throng and wandering around a bit!,"Written November 15, 2019"
166,Meow Leng,4.0,"Must try the street food even some are repeatings. For the street clothes stall, we noticed that they are not putting any price tag. I guess if you are tourist, they will just quote you higher price. Please be alert and aware. Of course, the cosmetics is alot and many brands to choose and great offer for masks. During the trips to Seoul, I never purchase any mask even they are in cheap price. Because I have seen alot mask promo, they actually put the mask at outside the store during day time under the sun. Choose those store with tax free and with promo. Plan to go there at least 2-3 days so that you can see which store offering lower price for the same items.","Written November 14, 2019"
167,miles_for_smiles,4.0,"This is a must do when in Seoul; the street food and whole area comes alive especially at nighttime. Indulge and enjoy... from hearty dishes to dessert, there is something to everyone’s taste. It’s packed with people but generally easy to navigate. Shopping is an added bonus here!","Written November 12, 2019"
168,silver s,5.0,Myeongdong is a must when visiting Seoul. There’s plenty of shopping and a variety of street foods to enjoy. If you get tired of that you can always go underground shopping. You can bargain and get get some deals too.,"Written November 11, 2019"
169,mila,3.0,"Many shops with cheap stuff, a lot of face masks and cosmetics etc. Been there 1 hour nothing interesting","Written November 11, 2019"
170,wildeastern,5.0,"A delightful street sprawled with endless beauty shops makes one lost for choice..but rest assured the cosmetics sold are Korean products and clearly labelled.Shop assistants are happy to explain if there's a need. There are freebies handed out at almost every shop and lots of instore offers. The most popular are the korean sheet masks which are just amazing ! There are small cafes in area n the area is next to the subway , easy to get to.","Written November 11, 2019"
171,Itay V,5.0,"Anything from high end brands in huge stores, to smaller discount shops, cosmetics, street food - and a great bubbling atmosphere.","Written November 11, 2019"
172,d_veen54,3.0,"If you love shopping , beauty products , clothes and food., you must go there and i really like this overcrowded area specialy at night with crazy food stands...a real must i would say. Also you can visit Seoul tower and hannam village.","Written November 10, 2019"
173,jemster,3.0,"A lot of shopping options. Good street food options, but we had dinner prior, so we couldn't really eat anymore. Street food probably a bit expensive relatively compared to the restaurant options. Many shops, a lot of tourists, and a bit difficult to move around as there were so many people. Mostly selling cosmetics. Have never seen so many face masks in my life!","Written November 10, 2019"
174,Rolskyeatsandtravels,4.0,"The first thing we saw stepping out of the taxi is the KoreaMart. We then proceeded to shop for unique Korean snacks, Maxim coffee, chocopie, all kinds of face masks, as pasalubong.  We also tried the streetfood of sausage&tekkbokki, fish cake on a stick. We were too full to try the rocket potato and seafood.  We also shopped at Innisfree. There are a lot of make-up stores here.  There are also many ""tiangge""style sellers of clothes, coats, socks, trinkets, etc.  A must place to visit ecen if you are looking to shop.","Written November 10, 2019"
175,Khalaf K,5.0,It’s definitely one of the most attractive street for shopping in Seoul and it’s highly recommended especially during the sales time. The shops open till 11 PM and most restaurants open till mid night. It’s good place for hanging around with friends and family especially during both the weekdays and weekends. Some goods are sold with a very good price and recommended to buy during sales and reduction session.,"Written November 9, 2019"
176,Tay Wei Hong,5.0,Nice shopping street. Suggest to go during early Nov as the cooling weather can ensure you won’t sweat while shopping around here. Recommend to try Innisfree Green cafe. Nice soufflé.,"Written November 9, 2019"
177,Amanda R,5.0,"I spent 9 days in Seoul and must have gone to Myeongdong 3 or 4 times, I loved everything about this place, specially the night market with loads of good food. Definatly one of the best neighborhoods in Seoul.","Written November 8, 2019"
178,Ian Y,5.0,Very cool night market with many fun street vendor foods to try. Bustling with activity all hours of the night.,"Written November 8, 2019"
179,obaidtaj,5.0,The best place for shopping and food in seoul but more expensive than other streets in seoul..but it's really nice.,"Written November 8, 2019"
180,jenniebartels,5.0,Close to Lotte Hotel. Short walking distance and discovering little shops. Lovely Korean face creams found here.,"Written November 7, 2019"
181,Brian F,4.0,There are so many shops here of various sizes selling a variety of items. At night a large number of food and drink stalls are set up with a. huge variety of tasty Korean foods. It does get very busy but well worth a visit,"Written November 6, 2019"
182,Just Jack,4.0,"Has about everything you would expect to include ""bargains "" but I found for some items, just shopping in traditional stores would find the same price or slightly cheaper. It was fun and worth a trip if you're being dragged their by you gf/wife just seeing that many people shopping and eating street food is part of the charm","Written November 6, 2019"
183,Sadicay,5.0,"Street food and shopping. Also you can buy souvenirs and treats, like the famous almond honey butter and cute socks.  Its a very lively place, big crowd.  There are a lot of restos in this area, better check them out.","Written November 6, 2019"
184,Saha S,4.0,"A must visit shopping street if you really love to shopping or like to window shopping.you can get everything from here. Even at night you will feel like morning here. A place where you can shop, observe people.  A lot tourist you can see here with various style of seller and customer. A largest Uniqlo in seoul and 11 levels of dyson also available here.I stay here for 7 nights and what i can say this place is very crowded and happening. Not suitable for anyone who want to relax and quiet place but for shopping its really awesome.No word can describe :)","Written November 6, 2019"
185,Donnabelle22,4.0,Love the tiny shops selling cheap and good cosmetics and yummy street food! The energy of the place is great! Totally enjoyed it.,"Written November 6, 2019"
186,Nur Hamid,5.0,"Many shops to shop and plenty of street food stalls, even halal food are available. Many options to buy souvenirs to bring home for family and friends","Written November 6, 2019"
187,Ernesto B,4.0,"Very popular place. Clean and lot of tourists, the food is exciting and clean especially in street. There specialty shops around the area. The ambiance are very celebrating. Will coming back again for our next Holiday. Thank you","Written November 5, 2019"
188,rak garcia,4.0,"The place was swarming with tourists and locals alike, but the dizzying scene was compensated by the delicious street foods and a plethora of shopping options. Then again, food prices were too pricy. Anyway, if you're in for your first experience in Seoul, this area should be one of your first destinations!  Also, there is a tourist information center just near Myeongdong Catheral where you can ask for directions of money exchange shops, luggage coin lockers and the like. The guides directing us were really friendly and willing to help.","Written November 5, 2019"
189,Mary L,3.0,Myeongdong is not what it used to be. Totally disappointed ☹️ streets filled by food vendors and most of clothing shops converted to make up shops:(,"Written November 5, 2019"
190,Vong N,3.0,"Please make sure you compare prices before you make your decision to buy. Prices vary double. I bought some nuts in a shop which offered tasting. (It looked like special store), it costs W6,300 each. I picked few bags with different flavours and paid. Once I stepped out and walked to the next shop which offered buy one , get one free. Another similar experience was happened in Namdaemun market, I bought 2 packs of stainless steel chopsticks at W5,000 each, at the next shop ( just 3 steps away), it costed W10,000 for 3 packs. This experience told me that I need to compare prices in different shops before I make final decision to buy.","Written November 5, 2019"
191,KH NG,5.0,A great place to have anything in affordable and reasonable price. You will love this place and to me is better than others country with such place. Trust me you won't regret as the variety of food and goods to buy is pretty awesome...,"Written November 4, 2019"
192,Toshi1192,5.0,"So many shops and nice restaurants,cafe,etc... Start 4pm street foods. One day can spend this site. If with little kids bit hard area I think,coz so many peoples here.","Written November 3, 2019"
193,meperez,5.0,"Shop and dine in Myeongdong whenever you find yourself in Seoul. They have everything and more! So many great restaurants, street food could be a bit pricey but the ambience and the fun vibe covers for it all. You will also find hundreds of cosmetics and souvenir shops. Cafes and bingsu shops are tops too!","Written November 3, 2019"
194,Budin NJ,4.0,"The night market is a must to visitors here... an excellent variety of local el fresco food available to cater for all and some even sell Halal food. There are also retail outlets adjacent mostly selling cosmetics, sport shoes, etc !","Written November 2, 2019"
195,Paul,3.0,This place is too crowded and I only went there for shopping. Didn't try any restaurants there but luckily the snack along the side of the street was pretty good.,"Written November 2, 2019"
196,Evelyn Chandra,3.0,Mostly sell cosmetic product and almost all are selling the same type of food just with a bit different taste/ price... the food is pricey and some were tasteless.,"Written November 1, 2019"
197,MsLigs,5.0,"Very alive and vibrant area, for me a good place to explore when in Seoul and it’s best to go there late in the afternoon and in the evening when food stalls are lining in the streets with different varieties of street food. One of the special thing to visit in this area is the dog cafe and cat cafe. It is also a good place to shop for cosmetics and souvenirs, etc.","Written November 1, 2019"
198,Robert J,4.0,"This area is a must for travellers to visit. If you are into Labels you will find them all here. Also street food, cafes and coffee shops. Also a pretty impressive cathedral for those interested in such.","Written November 1, 2019"
199,sirwilsonqatar,4.0,"A must go in Seoul. Opens till 11-12am. Tows of street food and shopping. Grab s ok me facial masks for your girlfriends and wives. Go for the bbq pork skewers, cheese lobsters and boba tea. Skip the fried chicken cutlet and red bean porridge.","Written October 31, 2019"
200,Pissed Off Reviewer,5.0,Great place to shop. All of them are smaller shops on both sides of the street and there is no traffic in the street so everybody goes there.,"Written October 31, 2019"
201,melaniej239,5.0,"The Myeongdong Market was easy to get to and the street food was the best. You Can sample fried chicken, octopus, escargot, squid, coffee and shop for clothing. There are so many vendors we loved it.","Written October 30, 2019"
202,kristianess,5.0,"When I think of Korea, I think of 2 main things: face products and yummy food! The Myeongdong Night Market helped to kill 2 birds with 1 stone. First off, this market is crowded and very lively. There booths set up on the streets selling food, clothes, and souvenirs. The food was amazing! The 2 main things I would recommend are the Roast Lobster with Cheese and the egg bread. Both were really great. The streets are also lined with some of the most popular Korean skincare brands, including my personal favorite “Holika Holika”. Overall, if you’re wanting to eat some yummy food while sfocking up on face products, I would highly recommend shopping!","Written October 30, 2019"
203,Radfopa,5.0,"If you want to shop, eat, drink or just watch the hectic Seoul world stroll by then this is the place for you. There is so much activity, lights, people but it is all safe and interesting. A highlight was the Korean Fried Chicken and beer - I am not a shopper.","Written October 29, 2019"
204,Patrick L,4.0,"A lot of different types and sizes of shops selling a wild range of products. Is a must-go place for first-timer. There are also a LOT of restaurants. You could spend a whole day here. Moreover, there are also numerous fx shops here.","Written October 29, 2019"
205,LCJ330,5.0,Highly recommend those who are interested in shopping (clothing/cosmetics) to stay in the area. The street comes alive at night when the food vendors push out their carts. Avoid the overly westernized foods as they are pricey and not very tasty. For those purchasing face masks/beauty make sure you shop around the same product can vary as much as 50% from a different store. Dr Jart masks are a must buy.,"Written October 29, 2019"
206,Dina S,2.0,"We had a fabulous time shopping and trying the various foods sold along the streets in Myeongdong. The rose ice cream (6000KRW) was especially pretty and yummy. Green tea/yoghurt/strawberry flavour and also chocolate flavour. We also enjoyed Egg Bread (2000KRW), Chestnut, Ginko Seeds, Fish Ball skewers, bbq pork, and much more.","Written October 29, 2019"
207,Journey796484,5.0,There were so many street foods and street markets with a Korean atmosphere and you could find your travel special from there,"Written October 29, 2019"
208,nodough500,5.0,"If you like shopping and street food, this is the place to go. Tons of food choices from sweets, fried chicken, churros, meats, seafood, etc, and lots of local foods you won't see anywhere else. It all smelled delicious even though I couldn't sample any of it because of food allergies. The shopping was just as extensive with both mainstream retailers everyone knows, to local stores, to carts with ""authentic"" goods. Lots of people during the evening, but grest for people watching. Most full service restaurants here are inside the buildings that line the streets on the second or third floors. Just a fun area to go and explore.","Written October 28, 2019"
