,이름,별점,리뷰,날짜
71,Kira Yvonne Lim,4.0,"It's a well known fact that Myeong-dong is a beauty product wonderland and not to mention, beer and fried chicken.  It's a must go for any first timer in Seoul and also beauty products fanatics.  It's a lovely and vibrant place with tons of street food too. The only downsides are the animal cafes not letting kids in, a pity.","Written January 8, 2020"
72,Christie Nguyen,5.0,"First time or frequent visitors, this place is a must! Street food stalls are by 4pm everyday until past midnight. Shops and shops and shops, and restaurants after restaurants, cafes and salons and OMG everything you need. If you can, visit this place weeknights, because it’s extremely packed on the weekend.","Written January 7, 2020"
73,DebWhite,5.0,"This was a great place to shop! We visited on a Sunday afternoon. Plenty of tourist friendly stores. Traditional and touristy gifts, food and candy. Definitely a must-do when visiting Seoul.","Written January 6, 2020"
74,minnesotans4,4.0,"We were in Seoul overnight and wanted to shop for their wonderful Korean beauty products. We stayed at a hotel near Incheon and debated whether to take the AREX Incheon Airport Express train from the airport or uber. The one way train ticket was definitely cheaper at 9,000 South Korean won compared to the $75 USD uber but we opted for the uber due to time constraints. Taking the shuttle back to the airport, finding the express train, and coordinating the train schedule plus a transfer to Myeongdong Street from Seoul Station seemed too much of a hassle and time consuming. Travel time was between 45-60 minutes. Be prepared for the crowds since this was one of the main shopping/tourist streets. The stores accept credit cards but have SK won for the street vendors. We found ATMs in the area. We tried some of the street food but after awhile tired of the greasy fried food. There were some rather unique concoctions: fish shaped waffles, dumplings with red bean paste, and seasoned chicken/rice cakes to name a few. We were there for the beauty products and found Innisfree to have the best selections. We loved: Jeju orchid enriched cream, green tea seed serum, green tea seed eye cream, volcanic pore clay masks, wrinkle cream and of course the masks. The jellyfish vital mask was one of my favorites. Credit cards were accepted plus duty free was an option with a passport. These products can be ordered online but was cheaper in the stores. What was interesting about this area was that there were literally no garbage cans to throw away wrappers etc. from the street food. Fun experience and felt very safe in the area.","Written January 6, 2020"
75,Joseatstheworld,4.0,The street comes alive at night and better when the weather is a bit cooler. Much nicer than nigjt market in Taiwan.,"Written January 4, 2020"
76,kikitan99,5.0,Fantastic place for people who love to shop. All kind of shops with many cheap things. Lots of street food as well. Love it! Never leave Seoul without going to Myeongdong,"Written January 4, 2020"
77,Patrick S,5.0,Great choices of appetising street food. Good crowd also creates a festive atmosphere. Seems very safe place to go with family. Some very good restaurant as well at very reasonable prices. Definitely an area not to miss when visiting Seoul. I stayed a week in Seoul and been there almost every evening.,"Written January 3, 2020"
78,stephenchan,4.0,"It is a perfect place for shopping of skin care, fashion items, etc. etc. Lots of people no matter it is weekend or weekday.","Written January 2, 2020"
79,Luleelee,5.0,"Wow! You have to visit Myeongdong- the shops here are amazing- lots of beauty shops in particular! “Free” face masks are offered to lure you into shops but sometimes you can just take them and keep walking. It is super crowded here so be aware you will be bumped into n jostled a bit- all part of the experience! By about 4pm the street food carts come out- oh my goodness the variety, the look n smell is delicious! Is there anything fried that is not tasty?? No!! Try the crepes with Nutella, banana n cornflakes- yum! Egg rolls, corn dogs, fried chicken- all sooo good!","Written January 2, 2020"
80,Nor Hafizah,4.0,"The street was packed with so many shops selling cosmetics at a good price. You can shop them for souvenirs, eat the street food.","Written January 1, 2020"
81,Calvin,5.0,"A must visit if you want to do some shopping and have street food! If you know you way around, Namdaemun Market, Myeongdong Cathedral, Bank of Korea Museum and various shopping malls are nearby - although Hoehyeon station maybe closer to Namdaemun market. You have to try kalguksu and mandu dumplings at Myeongdong Kyoja! They have 2 of 3 locations in Myeongdong, but best go to the original place (established 1966?)","Written January 1, 2020"
82,Cory T,5.0,"Very busy, huge Korean and Western stores everywhere with amazing deals. We picked up a lot of awesome clothes and makeup for superb prices. Can strongly recommend.","Written December 31, 2019"
83,Payge,5.0,"This is the place you have to visit if you are in Seoul. I went here almost every day whilst I was in Korea (for two weeks). There is so much here for everyone, in terms of beauty, music, niknaks, food etc. I would 100% recommend going here at night for the market, it is a once in a lifetime experience. The two best things I found in Myeongdong were - Nanta Theatre and Underground shopping centre.  The Nanta theatre was absolutely hilarious and can be loved by people of all ages. The underground shopping centre - found when going into the myeongdong subway station, was okay, there wasnt much there other than niknaks and socks, but there are a few kpop album shops there with such a large range of albums, all for very cheap. I'm from the UK and albums here (mainly bought through amazon) cost 4/5 times more than what I found here. I spent over £1000 on albums whilst here, and actually got my moneys worth, wheras in the UK this would have gotten me 30 albums at the most.","Written December 31, 2019"
84,lovetotravel88888888,5.0,Very interesting place to wonder around. So many shops and side streets full of shops. So many Korean beauty products and also Tom’s flavoured Almond shops. Also there is also a big Art box here as well. It gets busy during the day but that is nothing compared to nighttime when all the street food vendors come out. Please be careful because people will just push and shove when it’s really busy. That being said we still loved the place. Go and enjoy all it has to offer.,"Written December 31, 2019"
85,paulinehhchan,5.0,"Myeongdong shopping street has all the beauty goods you need to find, every brand , every product. The freebies that comes with every purchase is also quite generous. Watch out for periodic value 1+1 buys if you intend to stay few days.","Written December 31, 2019"
86,Bulldogmom15,5.0,There’s no shortage of Korean beauty products here. However if you’re looking for just about anything else chances are you’ll find it here. There’s also lots of food choices available.,"Written December 29, 2019"
87,Fengww,5.0,Shopping street is interesting and fun for everyone . Ladies are the happiness because we get to buy fashionable items .,"Written December 29, 2019"
88,Emma C,5.0,"Myeongdong is chock-full of shops selling most things, but for me it is a place for beauty products and girly nic-nacs...and street food.  Towards the evening time the area fills with folk selling all kinds of Korean food...BBQ, stir frys, snacky bits and dumplings. I love love love the food and ambience here.","Written December 28, 2019"
89,Kelly C,5.0,"This Myeongdong Street seems never ending road. Before our legs breaks from sores, there are still lots more and more to walk. Filled with many nearby shopping centres and of course street food. It’s very Yummy and walking down the streets during winter is superb cooling for us! In fact, it’s quite freezing. Will definitely come back here again!","Written December 27, 2019"
90,Adrian Lee,5.0,"Night street of famous Myeongdong Street Night Foods, famous for its nightlife packs with people around. Had the lobsters baked cheese with read bean and Chocolate pancake that is so delicious and tasty. Is a night so lively not to be missed, environment and atmosphere is always so lively with bursting energy everywhere ☺️☺️☺️☺️.  Had teh lovely dinner over three street of night stalls around the Myeongdong Street walk. Lots of things to see and hang around the area.","Written December 27, 2019"
91,Romuluz75,4.0,"As part of our tour itinerary, we visited the Myeongdong street for a couple of hours. There is a Lotte duty free mall nearby as well, though its more for branded goods. The Myeongdong street was packed with locals and tourists alike. Most of the shops are selling cosmetics, face masks, fashion accessories, and many streetside stalls with local food.","Written December 26, 2019"
92,Veritas,4.0,"Interesting area with quite a number of cute places , shops , restaurants and night market . I prefer this area over Gangnam area which is to large and takes too long time to walk. Recomendable for tourists.","Written December 25, 2019"
93,2824,5.0,Located just along the train station. This place boasts a lot of fashion shopping and food( both street food and restaurants). Really a haven for the foodies even in winter.,"Written December 24, 2019"
94,Tom Slenderina,3.0,"My first impression was cosmetics...cosmetics and lotsa cosmetics although i did see a uniqlo store down the road.. Honestly i didnt go into any of the cosmetics store who offered free masks (only if you go into the store). I ve had my share of experiences where you go in and it would take me all my might to just get out and continue elsewhere. I just walked past and it was a wonderful experience of sights, smell, hustle and bustle of everyone around. You can get lost in here lol","Written December 23, 2019"
95,PRECIOUS TRAVELS,4.0,"Myeongdong Street is super tourist friendly; there are many shops, cafes, restaurants as well as lots of street food and shopping. Most places have English speakers and/or menus, so it is easy to find what you want. This is also cosmetics center, so if you like or want any of those products: this is a place to get it! Don't be afraid to walk around some before you make final decisions on purchases because there are many vendors providing the same foods/products/souvenirs.","Written December 23, 2019"
96,Vanessa Tan,5.0,"Perfect place for first timer. U get food and u get shopping. This is the place to shop for beauty products. Night market starts at about 4pm where vendors start setting up, buzzling till 11.30pm. very convenient with Myeongdong station and euljiro 1(San) station nearby.","Written December 22, 2019"
97,Karen Q,3.0,"Street is full of shops selling cosmetics. Sellers will try to lure you into their shops by offering you free mask. In the evening, there will be lots and lots of vendors selling street food. Price of food in this area are generally more expensive than other places like Hongdae, Ehwa Woman’s Univ and Namdaemun Market. Streets are usually packed even on weekdays.  Am giving it a 3 star because i am not into cosmetics and i think the prices are a more expensive too. I think this place is overrated, though i must say there are some pretty good eateries around eg Migabon (portion is smaller than Bon Juk but i found it nicer than Bon Juk) Myeongdong Kyoja (their dumplings are superb) and Yoogane Chicken Galbi. Apart from cosmetics, there are of course other shops/ mart selling other korean food eg almonds, potato chips etc","Written December 22, 2019"
98,Joyce W,5.0,"Really enjoyed the food street and all. The place is huge. Some food street is not cheap, prawn is 10000 won. So tasty. Corn is 2000 won only. Enjoyed walking and managed to find good cheap shopping. Masks are really worth it!","Written December 22, 2019"
99,rae_hunt,5.0,"Plenty of stuff to buy especially souveniers. My kids bought loads of socks😊 for themselves as well as for friends. Fila stores are almost everywhere and the shoes are a bargain. Vendors start to setup their carts only around 3pm onwards so will be better to go there after 3pm to soak in the ambience. Hard to find rubbish bin so keep all your trash before disposing them properly. Train station is nearby as well, so will be a good experience to take the public transport. Plenty of cosmetics shops and a good place to buy snacks home as souveniers because it is cheapest here.","Written December 21, 2019"
100,Jane Peh,5.0,2nd time here and I really love it here; bustling and full of energy.  Bought so much stuff here; really went crazy with the shopping 🤤,"Written December 21, 2019"
101,Jack Y,4.0,"Surprisingly, of all the places that I have been to that are famous for street food such as Taiwan and Thailand, I actually like Seoul. I guess the only drawback for Seoul is that the street food is quite expensive and not exactly value for money. However, taste wise I really loved Seoul street food. They have all sorts of delicious food from cheesy lobster go soufflé with strawberries.","Written December 21, 2019"
102,Ima-Momski,5.0,"I loved the food street there. If you want to find Korean original Cosmetic you better going to Young Lottee shopping(DutyFree). The difference shopping etude product between Shaila duty free and MeyngDong is the number of things (package)and expired date ( pls check). Of Course the duty free is long than Myeongdong. The price can be diference betwen 3000 idr per item. Its all up to your decision.  I think 2.5 hours is not enough for first shopper like me. In the winter session, (-3 C) you must wear appropiate custom, since this is an outside area. And do not take more than 15 minute in the outside. visit a shop every 15 minute is the best to maintain your stamina.  There are alot of the same shop, so be careful if you make an appointment. be more specific on the location.  Take Care and have Fun.. happy shopping...  Korea have a lot type of Cosmetic, pls brows and learn first about the product that you are looking for before it. its save your time.  The Food there is amazing. I tried grill Lobster with Mozarela, expensive but worthed. Eggbread is safe for muslim. ignore the fried ""type"". Korean street Seller are friendly but good sales person(They wont give up until you buy :).)","Written December 21, 2019"
103,bw Y,5.0,"Just beside Line 4 Myeongdong station exit 5, 6 7, 8, 9 n 10. A lot branded shop, hawker food stall, souvenir shop etc.","Written December 20, 2019"
104,Nila,5.0,"Awesome place with friendly people ، clean erea , cheap cosmetics products , also street food must try .","Written December 20, 2019"
105,Julie,5.0,"Filled with cosmetic shops, clothes, cafes, Korean restaurant and so on. Suitable for shopping, dining,hanging etc.. Very cool during the winter...","Written December 20, 2019"
106,JDTS,4.0,"I am not much into shopping, but you can see scores of people going on a shopping spree there. Try to go in the evening, there are lots of eateries and a very long food street with lots of choices. Food street is not that cheap though, it can cost you KRW 15,000-20,000 per person if you try 4 or 5 types of food.","Written December 20, 2019"
107,KinSeng,5.0,"The family loved Myeongdong that we came back more than 4x during our two weeks stay in Seoul. It is different when going in daytime and nighttime.  It is more lively at night with street food vendors putting up in front of the shops selling shoes, beauty products, clothes etc.  Be careful as it is crowded and packed with people.","Written December 20, 2019"
108,Maria A,5.0,"It was my favorite place to go around and browse. There is also plenty options to have lunch and dinner, aside from the lovely street food! The croissants are great","Written December 19, 2019"
109,emily young,3.0,shopping was fun and reallllllly Interesting the food was delicious.. but there were too many people,"Written December 19, 2019"
110,Jon A,5.0,"Wife and I only had two days in South Korea, so we had to be very selective in the things we wanted to see/do. Tripadvisor pointed me to this destination so we decided to give it a shot. I honestly cannot tell you how much I ate that night, but I can tell you it was a near endless supply of food for hours.  The stalls on the streets are just knockoffs, but somewhat entertaining to look at and the brick and mortar's offer a wide variety of items to purchase (cosmetics, shoes, dollar stores, etc)  If you only have a few days in South Korea, I recommend stopping by and filling your stomach for a few hours. Bring a lot of Won!","Written December 19, 2019"
111,WBS,3.0,"I stayed 4 nights in Myeongdong. If you are into beauty n skincare, this place is for you. Lots of masks, toiletries and skincare on sale. As for street food, it’s rather pricey, and sometimes prices vary from stall to stall. A stick of fish cake can cost krw 1000 to krw 4000. I tried grilled scallop which cost krw 10000. The shell was huge but contained very little meat, swimming in cheese. I felt I was eating cheese alone.  The cheese hotdog was nice but you need to ignore the colour of oil used to fry it. Dark brown oil- recycled many times. Common sight at stalls that sell deep fried food.  Stalls sell more or less the same type of food. Always ask for the price first.","Written December 18, 2019"
112,maelingng,4.0,"Amazing energy in this city. The crowd just continues to bustle up to 11pm with street food vendors and ‘face mask pushers’ in a backdrop of visual stimulus of bright neon lights and aesthetic display of modern shops.  Great exposure and almost like a smorgasbord of Korean food in bite size quantity peppered at every corner. I would highly recommend trying the street food, it could certainly be good enough to make a meal out of it!","Written December 18, 2019"
113,cmanis01,5.0,"My husband and I love shopping and this is a must! There is quite a verity of shops here, lots of cosmetics. If you enjoy shopping and people watching this is the place for you!","Written December 15, 2019"
114,Sean,4.0,"Lots of brands here. There are deals to be found, but it's more like a pretty high end outdoor mall. There is a soup and dumpling place here that rocked my socks though.","Written December 15, 2019"
115,Della G,4.0,"Quite a shoppers delight mostly for young women. This shopping area features are Korean skin care and cosmetics products. Many of the cosmetic shops offer samples in addition to 50% or more discount for purchases if bought in quantity. You can also have duty free purchases over a certain amount spent. It is also a great area for fashion clothing,shoes and accessories. In the evening this area has so much neon signage that it is almost blinding. As in any shopping area in Seoul there is a great quantity of food stalls and also different cafes and eateries. Quite a challenge trying to maneuver amongst the throngs of shoppers.","Written December 13, 2019"
116,daphne-jem,4.0,Beauty shops are in every corner. After buying their products they will give you free facial mask (10pcs) or their new launch make-up. Street foods have the same pricing. So accessible to MTR.,"Written December 13, 2019"
117,TK Chew,4.0,"Stayed right at the beginning of Myeongdong shopping street. Street have a wide variety of Korean speciality Street food. Having hot fish cake in a soup cup is unbelievable on a freezing cold winter night. The strawberries are superb as well. Since the street caters primarily to tourists, prices are on a slightly high side. Lots of stores selling beauty products at decent prices. Avoid the restaurants though, the prices are high and quality not to the standard where you can find elsewhere.","Written December 12, 2019"
118,Sarah,5.0,"Best place to buy cosmetic products, shoes & clothes. Offers variety of street foods. Unfortunately all are not HALAL for muslim travellers. Good place to hang out.","Written December 12, 2019"
119,dblien,4.0,It is the same night market every where. There are normal goods. A lot of Masks and skin care are sole there. Natural Publish is good quality and popular in Korea. You must try fried lobster in street. It is fresh and nice. Beef steak is nice too.,"Written December 10, 2019"
120,vallerie99,4.0,"Crowded everyday and it has so many skin care shop especially face sheet mask and one time a salesman tried to trick me with giving me a sheet mask for free but when i want to get it, they try to pull me inside their store 🤦🏻‍♀️😀","Written December 10, 2019"
121,Hai65,4.0,"Went here in the midst of winter, in the rain at -6 degrees. Despite the weather, the place was crowded with tourists trying all sorts of street food from cheesy baked scallops to cream puffs. In addition, one can try all sorts of beauty products and cosmetics which is cheaper than other outlets. Just have to be wary of hustlers who will try to persuade you to buy as many of their products as possible and will even reward you with a free luggage bag in you buy in bulk. A good place to shop and eat and enjoy the atmosphere.","Written December 10, 2019"
122,Gail,4.0,"Loved the shopping around here. Everything we wanted for our girls trip. Can’t believe how active it is around the clock everyday of the week. Sales people in the street trying to get us into their stores was a little annoying which is why I give it 4 stars instead of 5. Great food, products and access to surrounding neighborhoods in Seoul.","Written December 9, 2019"
123,Jenny Q,5.0,"Shopping, eating, sightseeing...it's all here. Almost all kinds of shops can be found here. The street food especially at night really made our trip memorable, it was sooo good! You can see different kinds of people walking around, fun to walk around here.","Written December 9, 2019"
124,Bruno Lamps,5.0,"I was hosted in a hotel in this area for 12 days. Really enjoyed the street food, easy access to subway, convenience stores, banks, and diversified commerce.","Written December 9, 2019"
125,JeffLTS,5.0,Went with wife and 2 teenage girls....enough said. We were surrounded by street food stalls and more importantly cosmetics shops throwing free gifts at us.,"Written December 7, 2019"
126,Groundnuts,4.0,"Visited for the second time after a span of 4 years. Still lots of thing to see, street food, shops malls, etc... Now malls re all decorated with Christmas lightings. Make sure u don't miss the street food.","Written December 6, 2019"
127,John R,4.0,"During the day this is a street of cosmetics and young fashion, interesting enough and with plenty of restaurants of all Korean varieties with a couple of western ones as well. A labyrinthine network of little streets with shops and restaurants for all tastes. But in the evening it becomes a delight of impromptu stalls making and selling all sorts of Korean delicacies, fruit and drinks. Even some stalls selling costume jewelry and cosmetics. On a cold winter's evening when I was there, plenty of warming snacks and drinks. Not to be missed.","Written December 6, 2019"
128,ileannkneel,5.0,"Sure, you can go during the day but at night this place truly comes alive, especially on weekends. About 3 blocks square, the food stalls congregate along one strip and it is on this strip that we spent most of our time as we are foodies. From live octopus to egg cake, fruit smoothies to scallops in large seashells, the choices are endless and a veritable taste sensation. Prices are reasonable to a tad pricey for what you get but where else can you have so much selection in such a condensed space.  We also had a Korean massage for a reasonable price but it is a dry massage through towels and a hospital-like gown; more of a pressure point session than a true massage... a bit of a disappointment.  The stores offer packaged almonds, dragon's beard candy, ice cream, face and beauty products, and numerous tourist trinkets. But really, it is all the neon and energy and liveliness in the crowds that make this place work. An hour will do or stay the whole evening; it's totally up to you. Also, as it is downtown it is walkable from anywhere in the tourist area and certainly a short walk to a bus or metro stop. Definitely go; one of our highlights. 5 stars.","Written December 5, 2019"
129,pandora m,4.0,Love the street food in this place. There are a lot of variety compared to some markets. Slightly pricey for the food but quite standard throughout the street I.e. no need to look for best price or haggle.  It was quite crowded on a weekday night (wednesday) up to 930pm when we left. So can imagine it to be worse during weekends. There are also a lot of bulk discounts for cosmetics.  Even though you are not into cosmetics. Can just drop by to eat or soak into the atmosphere!,"Written December 5, 2019"
130,Jimclt,5.0,I stay at the hotel at Myeongdong and had most of my meals here. Great Korean restaurant as well as street food. Hot food during the cold weather. Not to be missed.,"Written December 5, 2019"
131,WillRod321,4.0,"Great place to go shopping, easy to get too and lots of places to eat if you are hungry I would suggest a week day if possible as weekends are just too busy","Written December 4, 2019"
132,KarenK,5.0,Myeongdong supplies all my needs from yummy food to egg toasts to Tom's Farm flavoured almonds to skincare and makeup!!!  Highly recommended to stay in the Myeongdong area as u can stroll through the night market each night after u are done touring tourist attractions in the day!,"Written December 4, 2019"
133,Nicholas Z,5.0,"Crowded as usual but a lot of shopping can be done here. For those looking to purchase korean snacks and smaller items/accessories, suggest to compare prices at each of the korean marts to get the best/most competitive prices","Written December 3, 2019"
