,이름,별점,리뷰,날짜
210,aisle67,4.0,We went there primarily to shop nearby and took a coffee break inside one of the cafes. The structure is really impressive for the architecture and good for photos. It is also a subway stop so it's handy to exit here and look around this shopping neighborhood.,"Written July 27, 2018"
211,Fasya F,4.0,Love how this place offer bazzars and some events. They have some good places to go. My favorite is kakao store^^,"Written July 27, 2018"
212,Sumit S,5.0,"enjoyed the design and if you go in the evening it is decorated with colorful light, found not much to do.","Written July 23, 2018"
213,Liza N,4.0,"This is a huge place full of interesting architectural designs. There are some shops indoors; another museum, cool eating/cafe area inside. Lots of great spots for pics. My daughter was there a couple of months ago during Fashion week & said you could see all kinds of ordinary people dressed wild, over the top, & cool during that time around there. - Our favorite part was relaxing outdoors on the big blue lounge beds. You must take your shoes off & then just lay down relax & enjoy the shaded breeze.","Written July 22, 2018"
214,JHL,4.0,"As many are aware of, the design is the work of the famous Zaha Hadid. Looking very cool with futuristic curvy edges. But, the inside is not impressive. There were just a few events and shops. It felt like a newly built office building. There are some things to have fun, though. I found a free piano to play near the entrance in the middle.","Written July 22, 2018"
215,승혁 김,5.0,"Actually I didn't take many events there. When I was there, there were some special exhibition or shows, but I didn't have enough time, so I can't enjoy them. But I looked around design shops and design museum there, and it was great experience.","Written July 22, 2018"
216,kpiddy,4.0,"There are so many amazing buildings in Seoul to see, mostly historical palaces, but there's something new and very impressive to see, Dongdaemun Design Plaza (DDP) it is rather futuristic.  The DDP is divided into a Design Hall, Art Hall, and Museum Hall, the whole complex is free to the public to visit, we walked through one of the buildings, but got more joy out of walking around outside.  The complex was built on the former sight of Dongdaemun Stadium, built by the Japanese in the 1920s during the Japanese occupation. During the process of redevelopment of the sight, relics were found which are now displayed on a large surface under the canopy of the curved roofline. There are many other interesting things to see, do and eat in the area, it's a great part of Seoul to explore.","Written July 21, 2018"
217,Bill C,3.0,"It’s definitely worth seeing and walking around the exterior of this building but it wasn’t worth paying 10,000 Won to visit the museum inside. There wasn’t much in the museum and it featured some drawings, paintings, and hanboks. There was a gift shop in the museum.","Written July 12, 2018"
218,Rickie:Lost In Music,5.0,"What a fantastic idea. So much creativity to see and on the day we went, there was an African food market. Typical Seoul to always be thought provoking and creative. Great coffee shop inside if you need to shelter from the heat (or cold) too.","Written July 11, 2018"
219,Bangor 4 ever,5.0,Visited the Van Cleef & Arpels exhibit. Worth the visit ! Very nice outdoor fashion show also. Nice music !,"Written July 10, 2018"
220,Grace O,4.0,This is the place where Seoul Fashion Week is conducted and it sits near the famous Dongdaemun Shopping Area. The building is contemporarily artsy and most people come here to take pictures on the photogenic spots.,"Written July 2, 2018"
221,A Y,5.0,"I went to the DPP for the first time a few years ago, checking out its architecture and the galleries inside. It's a must visit for anyone who visits Seoul, in particular if you are interested in architecture and design. Great photo ops both day and night. When I went this time for the exhibition on The Art of Aardman Animations: Wallace and Gromit & Friends, it was pouring. Glad that I already had a detailed look on my last visit. Despite the heavy rain, a trip there to see the exhibition was very worthwhile. The exhibition has already gone to Germany and Australia, and is in Seoul now. Lucky I could catch it here. I am a huge fan of Aardman animations and had a great time viewing the sketches, videos, original sets, with all the details. If you go, note that photo are not allowed except at 4 spots.","Written July 1, 2018"
222,doofvfood (with botak ahjussi),4.0,"Besides the beautiful architecture of the DDP (we have not visited the galleries), the highlight is the LED rose garden which looked so beautiful at night! A must visit when in Seoul!","Written June 30, 2018"
223,Sadi,5.0,"Very artistic and very big but very interesting. Lots of things happening inside, even if you didn’t want to do anything it’s just nice to be there and enjoy the scenery. Lots of shopping opportunities. Love Seoul.","Written June 28, 2018"
224,susi w,3.0,"The only cool thing about this place is the design of the plaza and the rose led garden so go at night to see it lit up. Shopping is the same as everywhere else. I like Namdaemun market more than Gwangjang market because the street food is better. I'm not a big souvenir shopper so once you see 1 market, they're pretty much the same except for the food variety. If you're tight on time, you can stay in this area and skip Myeongdong and Namdaemun. They're pretty much the same but this area is cleaner and more modern. If street food is more important to you and you're shopping for eyeglasses, Myeongdong and Namdaemun have more street food variety and eyeglasses selections.","Written June 25, 2018"
225,Roy T,3.0,went to dongdaemun and pass by the DDP for a look around wonderful architecture but thats just it.. nothing special inside..,"Written June 24, 2018"
226,acukiert,2.0,"The design of the complex is great, but that is all about it. Many empty stores and spaces. Better to be seen than visited.","Written June 24, 2018"
227,Peter P,5.0,"No doubt DDP is one of the most interesting sites to see in Seoul. Designed by famed Iranian architect Zaha Hadid, DDP is a fascinating contradiction to the squarish city that is Seoul. To really appreciate the marvel, visitors need to spend at least half a day walking and discover all its nooks and crannies.","Written June 24, 2018"
228,Anna,5.0,"As great it is to walk around, you should really go in and check their design stores with some tasty coffee","Written June 23, 2018"
229,john ting,4.0,"The name of the place speak for it. It's a very decent plaza to hangout for awhile, all specially created gifts, toys, travel item etc. One of the booth attract me it's the 3D printing, you take pictures surrounded by lotsa camera from 4 direction and the owner can print your photo into 3D form. But a little costly for me. 25CM size cost you 550,000 won.","Written June 19, 2018"
230,604wunl,5.0,Nice building and design. Walking distance to dongdaemun shopping district. There is a museum too. Visit if you enjoy design and arts.,"Written June 19, 2018"
231,Choi Junhee,5.0,"Wow. This place amazing and beautiful. It's also the venue conferences, fashion shows, trade shows,.... The museum hall is a harmonious blend of Korean design and globalization. I will be back here when I come back Korea.","Written June 16, 2018"
232,Heng,5.0,This is my first encounter with zaha hadid’s architecture and can finally understand her talents. Every architect who is aspiring to be great should come here to study her work. Architectural documentation does no credit to her.,"Written June 16, 2018"
233,Cristian C,3.0,"Happy I've seen it, architecture alone is breathtaking. But nothing else. It's just a fancy mall. Come if you want to drop your kids to a playground, come for food trucks and coffee shops, come for cheap memorabilia shopping. You won't find here anything you may not find elsewhere in Seoul's markets. Set your expectations straight, you'll have a great time. Come for design, art, modernism, you'll leave craving for more.","Written June 16, 2018"
234,thelonious22,4.0,"Beautiful building designed by Zaha Hadid. Even though nothing of interest went on inside or around the building for me, it is worth an hour just to look around the building.","Written June 9, 2018"
235,OVeeh H,5.0,"I was amazed by this building, seeing all the curves. I am an engineer so i appreciate from its exterior alone. I wonder how they have drawn this. There were nice buildings also within the vicinity so i guess visiting this place is worth it from the shopping plazas around here. There is alao an ancient Seoul city wall under and a LED rose garden which is better seen at night.","Written June 8, 2018"
236,ECWorld,4.0,"Stunning architecture and well worth a look particularly in the evening. For those interested in reasonably priced Korean fashion, its proximity to the Nandaemun fashion malls is an extra plus","Written June 7, 2018"
237,Angelin Velle,5.0,"Easily accessible by Dongdaemun History and Culture Metro station. Big and beautiful building, rather unique and artistic design. A great place to walk and take a stroll at in the evening if you are coming to Dongdaemun, lots of shopping and eateries opposite it.","Written June 6, 2018"
238,DGY86,5.0,The design of the building is fabulous! At night it looks amazing. It shows Seoul´s modernity. I recommend to visit it.,"Written May 29, 2018"
239,vilmatriplouis,5.0,"This place is a must to see, The architectuur can you campare with the modern part of Valencia, or the Gugenheim building in Bilbao. In the building you will be surprises buy the rolling lines of the wall’s.","Written May 28, 2018"
240,Tohmatohs,5.0,"This is a very artsy place where designers or architects would love it. Even so, do come and take a quick visit before heading over to Dongdaemun for your shopping.  There are many exhibits which are quite interesting to see and you can chill at the rooftop grass field.","Written May 27, 2018"
241,Mayeli H,5.0,"The design plaza is interesting to visit, with many modern sculptures and exhibits. I went to the Aardman exhibit, displaying many canimated creations such as Shawn the Sheep and Walace and Gromit. They explain the many different aspects that make clay figures into a movie, the final product. The exhibit provides you with original set pieces, drawings, and characters previously used. After you finish at the exhibit, there is a picture taking area where you can pose with you favorite characters of the Aardman studios. The building is interesting, modern, and unique. Would definitely recommend.","Written May 24, 2018"
242,ksarman,4.0,What I love It s the design The Main building is so stylish There is a nice garden around with lot of pleasant sitting area All around you ll find department store that open all night long Enjoy,"Written May 23, 2018"
243,Aqilla A,5.0,"I only spent a while here because of time restriction, but if you wait until evening, the food truck will be open for business, and the surrounding will be lit. Inside, there are lots of exhibits and art market. On the top floor, they have a beautiful roof top garden and some restaurants. Definitely an artsy place I would recommend if you love art and design!","Written May 22, 2018"
244,Lee M,5.0,It is amazing area for shopping especially at night there is beautiful designs of clothes with good prices,"Written May 19, 2018"
245,Karen K,3.0,"A very artistic and modern plaza where local youngsters love to hang around. There are special labs for art students, seminar rooms, auditorium and a library. On certain days, there performance for budding young people to show cast their talents (singing, dancing) as well as flea markets selling their handicrafts from jewelries to caricature. It is situated right opposite the Dongdaemun shopping district. If you happen to be in the area, do take a stroll in the plaza to have the feel of arts.","Written May 19, 2018"
246,Bella A,5.0,The place itself it’s amazing and the expositions inside are changing constantly and very interesting. We were there for the Fashion week and the location fitting amazingly with the event. One of my favorite places of the area. The surroundings have a lot of cool places to visit too,"Written May 15, 2018"
247,priti Shah,4.0,"On first sight this Massive amazing architectural structure looks like a huge space ship. It is designed to host various events domestic and international, launches, fashion shows,,conventions, different performances .Museum is remarkable.Nice shops selling lots of local Korean items , souvenirs ,stationary etc We had nice steaming hot coffee in one of the many cafes One must visit plaza in day time and evening as it is different . In the evening it has lighting going on and off making different patterns which was a sight to see On first sight It gave an illusion as if some offices were there which were lit. It is surrounded by an open area where people can chill. Some people were skating also This futuristic structure is right opposite the shopping area which is a fashion hub I was impressed and suggest a sure visit","Written May 12, 2018"
248,Eyfashionaire,4.0,"It is a nice building, surrounded by malls and restaurants. Good for photo taking but the place itself has nothing much. Perhaps spend an hour or less there, take some photos and move to the shopping malls nearby or find a nice cafe to relax. There is a tour bus station (hop-on, hop-off) nearby, and a metro station right beside.","Written May 11, 2018"
249,Cookingismypassion,4.0,"I can't forget the view that welcomed me to this mall, so many LED roses bulbs all aglow! Good thing we went there at night. Plus weather right now is good, spring season, not too cold and not too hot. Plus, I was so ecstatic when I saw the area where my favorite Kpop group performed a dance (Highlight boy band) last year! ❤️💕 woohoo!!!","Written May 9, 2018"
250,rpyap,5.0,"At first glance, the DDP looks like a set from a sci-fi movie (more like a giant space ship). The building has a very modern and futuristic design so it makes a very nice background for photos. Don't forget to go to the back for the LED roses which light up at night. There are not too many shops inside the building, though. But there are a lot of stores surrounding the DDP where you can do your shopping. Worth the visit.","Written May 5, 2018"
251,Jaycee C,5.0,"Upon arriving at the DDP , as soon as I stepped inside I can instantly tell the design was by the famous Zaha Hadid. He buildings are huge and have very unique designs. It is definitely a place for those who love art and architecture or even photography as the building offers a lot of amazing angles to shoot from. The exterior of the building contains a section that has a lot of glass flowers that light up at night. This building is useful during the day for daytime interior visits, and also glamours at night time when the flowers light up !","Written May 2, 2018"
252,SabySG,5.0,"Only stopped here because the building looked so cool from outside (my husband and I were on a bus tour). Didn't go inside, but walking around the building is cool enough; cool vibe and great people, lots of food stands around and great architecture, would highly recommend.","Written May 2, 2018"
253,Xin Ling Charlotte,3.0,The only unique experience here is the building features and the way the path is design. Building is quite big and there is a mini flea market going on the day I was visiting. Thus there are some local product on sales where they promote their products.,"Written April 14, 2018"
254,wheretojenny,3.0,The only nice thing I saw around this place is the colorful piano. The white roses looks dirty already and even their lights are getting dimmer. Hope they clean or fix them tho. They look better when brighter. You can spend a hour or two here and that's it unless there's an event or something.,"Written April 12, 2018"
255,devanshibansal,5.0,"In awe of the architectural structure. it's designed by Late Starchitect Zaha Hadid. It's a must visit, mostly for the architecture. Their Archive cafe is also very nice, with really good breads and hot chocolate.","Written April 8, 2018"
256,Shikataganai73,4.0,Interesting art pieces around the plaza. Inside is a museum with special exhibits at times. Right outside is the Seoul City Tour double decker bus which you can buy a ticket for to enjoy sites around the area.,"Written April 8, 2018"
257,Shweta R,4.0,"This area is bustling and so lively at night. It is more of a wholesale market where people from all around the globe sell their stuff. The place has a array of shopping malls from luxury brands to locals ones selling souveniers. This is the place to buy local souveniers which are cute and cheap. I have attached the Business card of two such sellers from whom we bought cute Koreans nail clippers, magnets, ceramic items, mirrors and so on. There is also a Zara outlet in one of the mall which sells clothes at very good prices. If you are lucky you can find amazing clothes from Massimo Dutti at never imaginable prices at the same Zara outlet. DDP is a must visit.","Written April 6, 2018"
258,GuideInSeoul,2.0,"This is exotic and nice building, for sure. Made several shots of it. But inside... I was expecting something unusual inside as well, however there's only food and shops. Sometimes exhibitions.","Written April 4, 2018"
259,Johanes L,4.0,"In this plaza there is a exhibition hall, and fortunately I went there when Pixar had a big event on their 30th anniversary. I had a great time with my kids, watched all the history of Pixar and got more knowledge of how did they made animation movies such like Toy Story, UP, etc","Written April 3, 2018"
260,Sister_A28,3.0,Impressive place in terms of design but lacks an information counter or signages in English. Good to walk around if you have no agenda.,"Written April 2, 2018"
261,Yuke_rachmawati,5.0,"The Dongdaemun Design Plaza was amazing, i came here in the night and the lights make it more magical to see. Since the mall around here they open 24 hours so this area will be packed by tourist and local who shop.","Written April 2, 2018"
262,AleArriaza,5.0,"If you are ever in Seoul and want to enjoy modern architecture, the Dongdaemun Design Plaza is a MUST!","Written March 29, 2018"
263,jd068,5.0,"This amazing building has to be seen to be appreciated. Go to the top floor and out to see the ""green roof"", walk up and down the stairs, explore the inside. There are many small shops selling design goods and souveniers, and cafes as well.","Written March 27, 2018"
264,Christy C,4.0,"Not really a big attraction, but it does have dining options and a interesting area for photos at night. The LED rose garden is worth seeing at night without it being too crowded. It is tucked away in the back of the building with stone walls surrounding making for architecturally intriguing photos. When Seoul Fashion Week is held here it is great place for people watching.","Written March 25, 2018"
265,Didz Ybanez,4.0,"Their operating hour is Tuesday-Sunday from 10AM to 7PM with extended hours of up to 9PM during Wednesdays and Fridays. This landmark is very accessible since it is connected to Seoul Subway through “Dongdaemun History & Culture Park Station”. There are also a lot of shopping malls and duty free shops around the area, including stalls that appeared to turn into a street market at night.","Written March 23, 2018"
266,Erica Dozier,5.0,"A beautifully constructed building, great place to go at night & take pictures. Coffee shops inside.","Written March 19, 2018"
267,Shin23_Traveller,5.0,"I took lots of pictures here. It is so futuristic feel...huge and wide buildings. If you love stationery, there is a Monami concept stall where sells nice quality pens which i feel is a good souvenirs to friends or relatives. Not to mention it is a Korean brand.","Written March 17, 2018"
268,Gerald W,5.0,"A must see in Seoul, especially at night. Very impressive architecture by late Zaha Hadid, she was an Iraqi-British architect. Looks like an U.F.O. has landed. Has a lot of interesting design shops inside","Written March 14, 2018"
269,Roberto632,5.0,It's an amazing center of design and market. The architecture looks like a spacecraft and inside you find many shops and restaurants. Don't miss it!,"Written March 12, 2018"
270,kenkeh,4.0,We walked through a big modern coffee shop gate A3 inside the DDP and out into the led rose light garden which was outdoor .During night time it was brilliant the glowing rose flower lights shine bright and lovely filled the gardens in DDP .,"Written March 9, 2018"
271,trainer_2015,5.0,"I can say we were lucky because in our everyday itinerary we need to pass by in Dongdaemun Design Plaza. The modern, amazing architecture is simply picture perfect. We had the opportunity to view this beautiful architectural work both day and night. This is near Dongdaemun shopping district/market. It is worth your time to visit if you happen to be in Seoul.","Written March 6, 2018"
272,Moitravel76,5.0,"If you are into modern design and architecture, this is the place to visit. Designed by the late Zaha Hadid, marvelous building","Written March 6, 2018"
273,JuliusC888,4.0,Showcases modern architecture of curves and modern materials. There are art shops inside that features unique designs. There is a pay museum at upper level. You can also relax at garden/open areass around the building. Right across the streets are several shopping malls some at duty free prices.,"Written March 5, 2018"
274,taniands,5.0,"There's a rose lampions (?) near the gate and people definetly came here to take a picture with that. it was so beautiful tho. Inside the Plaza we can buy souvenirs, the place was so huuugee and incredible. there's also a lot of restaurants and stores nearby.","Written February 23, 2018"
275,b_kashan,4.0,"I enjoyed seeing and being there, it was something unusual but interesting and modern, there were many traditional restaurants nearby.","Written February 22, 2018"
276,JanMichael_24,5.0,"Modern space. Good shops and restaurants inside. I tried Aori ramen! They have cubicles for the introverts! I just didn't have much fun because, there are a couple of couples on my left and right who wouldn't stop chatting. The division didn't stop them. But the food was delicious. I will be back this springtime! Yay!","Written February 15, 2018"
277,patricklA4625AM,5.0,Very modern and impressively designed and on a subway station and near the Dongdaemun fashion towers and department stores. Modern crafts to buy. A welcome addition to the tourist trail in central Seoul,"Written February 13, 2018"
278,R2735PF,4.0,"The out side is in aluminium panels. The interior has wood staircases with a very interestin design. Is different exhibitions. Souvenir shop,rest area. Subway lines 2, 4 or 5 can get ypu there.","Written February 13, 2018"
279,PaulK1960,5.0,Chanced upon this place while visiting a local market. Very impressive structure that is worth a visit in its own right,"Written February 9, 2018"
280,123ratna,5.0,"it's a must visit building in South Korea, a masterpiece by zaha Hadid, building without edges...all about the curves, from outside to inside. It has beautiful large park on the site and also roof garden completed with many function in one building, shoppes, museum, etc. it's an honour for me to be there.","Written February 8, 2018"
281,nyxmoko,3.0,Definitely an area that appeals to people who like shopping. Lots of shops and bargains to be had. Metro nearby.,"Written February 7, 2018"
282,diaozhadelaowai,4.0,Looks wonderful on the outside! Good for pics. The shape is artsy and interesting. We didn't do much inside other than wander around.,"Written February 4, 2018"
283,MikeyBoy1951,5.0,"A must see when in Seoul. For photographers of all levels, this massive and unique design looks spectacular at night. During the day, it is a wonderful place to find younger locals who are always willing to practice their English with you....and of course a selfie or two!","Written February 3, 2018"
284,Katherine D,4.0,"There are many little shops in this Plaza, but the most interesting is the building itself. Inside and out is it a marvel.","Written February 1, 2018"
285,Ardiyanti D,4.0,I was there in the night. Not really sure what to see except the fake roses field. The roses are so beautiful in the dark!,"Written January 31, 2018"
286,Lynns98816,4.0,"We went here on Sunday night to enjoy LED Rose Garden. We came from exit 1 of Dongdaemun History and Culture Park station. The building was so awesome. There was a skating rink there. Besides of rose garden, there was some exhibitions inside the building. Some of the exhibitions were free.","Written January 31, 2018"
287,tsetseflyerer,4.0,"The place looks surreal but I enjoyed visiting it especially since we went there at night. The building is a sight to see definitely but nothing much to do there. There is some shopping inside but the malls across the street from the DDP are more interesting. We looked for the touted thousand lighted roses but they were a dud. They looked like their lights were on their last blink, and they were not worth braving the very cold temp for. One visit is enough for me.","Written January 30, 2018"
288,Ernie L,5.0,Shop till you drop or take a walk with art it its futuristic form. Even when it is closed it will still make you awe with their thousands and thousands LED ROSES at the back and the night spot lights emphasize the sexy contour of the building!,"Written January 24, 2018"
