,이름,별점,리뷰,날짜
62,807mel,5.0,Such a beautiful place to take picture. The building design are unique and beautiful. You can enter the underground and enjoy your shopping.,"Written September 11, 2019"
63,AnttilaKarri,4.0,"Exhibitions are well set and have lots of works present. Not to mention the building itself, which is sick!","Written September 10, 2019"
64,Phylesia M,5.0,"I love this area! It’s such a treat for my eyes every time I see DDP. Such a beautiful architectural design that has to be seen in person as photos don’t do it justice. Also the shopping here is very good, the business hours of the shopping centers is staggered so it offers shopping pretty much 24 hours. I prefer this area over Myeongdong, although it’s also crowded it’s more “open” with the shopping centers vs outdoor shopping streets.","Written September 6, 2019"
65,tilla55,4.0,"Just walking around and experiencing the innovative space, new views opening up, was interesting. The stores + museums (Disney) inside were of the boring mall variety.","Written September 4, 2019"
66,Shermaine_csm,5.0,Very Impressive with the architecture by the late zaha hadid. There's a cafe inside and some shops underground.,"Written September 3, 2019"
67,Luca C,4.0,"Beautiful place where to spend a night. There are some kiosks for street food, shops, people all around and a pleasant atmosphere. The Design of the entire area is just amazing!","Written September 2, 2019"
68,Henry V,5.0,"This place simply has to be seen to be appreciated. The design is on a large staggering scale and surprises when compared to the many tiny alleyways that are in surrounding neighbourhoods. The fashion malls in the area are unbelievable in terms of number of shops, selection and pricing.","Written August 21, 2019"
69,Khadeejah Abdullah,5.0,"Very beautiful, lots of English signs and explanation. Good for photography walking. We got the opportunity to see Seoul metro station","Written August 16, 2019"
70,meilin l,4.0,"Seoul - a city of 24 hour fried chicken, beer and shoju with ladies shopping non stop till 5 am in 8-9 Stories malls of shops including basement shopping.  Important note to Seoul :- Come with empty luggage as you don’t need clothes, masks or cosmetics ! You can shop till you are broke. Always bring cash in Won or $$.  Tips for shopaholic: - Remember you can always go back to hotel to shower and re-consider that dress and go back to the mall at 3 am to buy and then celebrate the great achievements of full luggage and extra luggage and then have a late supper of fried chicken with beer after.  Most important- Download Naver map as Google map don’t work in Seoul !","Written August 14, 2019"
71,Claire E,5.0,Loved the architecture and the shops inside the exhibition area! Bought quite a few interesting things there like a bookmark inspired by the DDP architecture and rlly good leather card holder. We did not plan to specifically visit this place but it turned out to be so pleasant!,"Written August 13, 2019"
72,Victorianlad,3.0,"My hotel was close to this unusual collection of buildings so we took time to explore, including the design exhibition.  I found the architecture a bit too 'brutalist' but some will like it.  The archaeological diggings in the centre of the buildings were interesting, with bi-lingual signage.  We found a Vietnamese restaurant chain outlet inside so inexpensively lunched at that.  The below ground Metro station is one of Seoul's busiest and quite a labyrinth, but if confused, just ask a younger local as many now speak English and are exceedingly helpful.","Written August 9, 2019"
73,smjkxsnoopy,3.0,Cool place but nothing special other than the building itself. Stores and restaurants inside is like any other typical shopping area. A place to stopby while you shop and dongdaemun.,"Written August 6, 2019"
74,Neal,3.0,"The building itself is wonderful but full of wasted space. You walk around expecting something great but it never comes. The shops around the area are a waste of time, selling knock-offs and cheap local style ""aji-ma"" style clothing.","Written August 5, 2019"
75,Grahame H,3.0,"Interesting building but inside there was a huge hall with many unusual chairs which I suppose were interesting but not particularly inspiring. The interior is worn and in need of renovation, all in all it seemed like a bit of a white elephant","Written August 4, 2019"
76,Wojciech L,5.0,Amazing architecture - the work of Zaha Hadid. Interestingly arranged interiors - from the design galery to the shopping center. Worth a visit.,"Written August 3, 2019"
77,Satuah,5.0,"Here you can easily spend lot of time, impressive place also from outside and inside. Loved ""furniture exhibition"" where you see and can try design chairs all over from the world.","Written August 1, 2019"
78,Passport47233461404,5.0,A fantastic ceremony to honour those who gave their lives in the Korean War. The main hall was filled with people.,"Written July 30, 2019"
79,Elizabeth G,4.0,Some interactive design fun with chairs and pianos. This will either be a nice rest stop as there are tons of seating options inside and some lay down options outside or an enjoyable hangout spot if you enjoy design and art. Possibly a great place to get high quality gifts.,"Written July 28, 2019"
80,Jinnie,5.0,The plaza architect is stunning and exotic. It's really cool experience to walk through the buildings. There are some cherry blossom at the back of the plaza. (early April),"Written July 22, 2019"
81,Diendi S,5.0,I really like it here. They had some pianos laying around so I got to play them. I like the idea of entertaining fellow visitors :)  This doesn't have the LED rose since it's an exhibition that ended a long time ago (sad). But we got to walk around and appreciate the buildings in the night.  I know that they over some exhibition at the halls but for God's sake this place is huge. We just had like 30 minutes to go around the area so I really want to go back and visit this place again!,"Written July 22, 2019"
82,jchuii,4.0,"Cool building outside and in, located in the centre of Dongdaemun with the large shopping plazas, can come in to have a look around.","Written July 18, 2019"
83,Kat,5.0,"I really love the DDP - first of all its exterior design is so pleasing to my eyes. It’s curvy and fluid and just super cool. In the evening when it’s lights go on, it really looks like a spaceship out of Star Trek. I enjoy walking around its many corners adoring them over and over again. The inside is as cool as the outside. With interesting exhibitions, stores, and the most interesting stairs this place is really worth checking out and especially if you are into design, style, architecture and space.","Written July 17, 2019"
84,Valerie,4.0,"This building has a very cool architecture style and for those who love photography, you can also have a photo hunting day here in DDP.","Written July 5, 2019"
85,Syamim Safian (Mint),4.0,This place is good start for people who are still beginner in understanding minimalist art and urban landscape. The unique thing about this museum in my opinion that it is the pioneer of art sharing which is seen globally in terms of minimalist and urban art.,"Written July 5, 2019"
86,Kelvin P,5.0,A very stunning building. Every corner of this building is a very good photo spot. Also don't forget to take photos at 'I Seoul U' sign while you are here.,"Written July 3, 2019"
87,LG_Kay,4.0,"This plaza stands out in Dongdaemun area, with its large and unique design building. It is used to host various exhibitions, fashion shows, conferences etc. The building consists of the Art Hall, Museum, Design Laboratory, Oullim Square and Dongdaemun History & Culture Park. Just behind the plaza is a small and quiet park, with many free seats with umbrella covers.","Written July 3, 2019"
88,Mona Piega,5.0,I wasn't actually able to explore the place due to lack of time but I happened to pass by and took a selfie. I am awed by its spaceship-like design. I heard this is a shopping place for designer clothes and shoes so I think prices here are more expensive compared to those shopping streets like Myeong-dong.,"Written July 3, 2019"
89,247Carpe_Diem,4.0,I like the design of the building - inside and outside. There is coffee area as well. Love the design!,"Written July 2, 2019"
90,nancyrose,4.0,this design plaza is a sleek soft metal building with surrounding galleries shops & restaurants which is all very interesting and fun for the entire family! there is also the river close by below ground level to explore or picnic‼️👍,"Written June 28, 2019"
91,Michael T,4.0,"Dongdaemun Design Plaza’s curvy and wave structure catches my eye in a neighbourhood of straight, boxy office buildings. Without the signages you would not know where is the entrance to the building.  We walked around the DPP on a late afternoon to appreciate its exterior. Each different angle gives you a fresh perspective of the building.  We didn’t visit any of the indoor exhibitions. There are shops, cafe and restaurants in the basement, and street artists who could do a quick portrait for you.  The DDP is directly connected to a subway station. I’ll recommend a visit in the early evening.","Written June 27, 2019"
92,Linda K,4.0,One can't miss this delightful building when in the area -- but the delightful exterior far exceeds the utilitarian interior.,"Written June 26, 2019"
93,Jopard,4.0,"If you are a designer or has likes to see various creative work then this is an area you should visit while in Seoul. There are a lot of shops, exhibits, activities that you can visit and experience. Coffee shops, food shops, etc..are available as this is located on top of a subway train station (Dongdaemum History & Culture Park)","Written June 26, 2019"
94,Tiddy W.,5.0,"Good place to visit, chill and can be a nice place to explore. Recommend for people who interest in any event or designs. Flee market and food trucks available sometimes. Nice and creative architecture. Place to visit for designs and creative goods seeking. Temporary events rotate periodically. As time of my visit, there are many interesting events such as Hello Paul Smith and The Art of Disney The Magic of Animation. Flee market and food trucks in the evening as well. More spaces to walk around and chill out. Easy to access with many public transportations.  Idea to visit if you have spare time.","Written June 18, 2019"
95,Junie D,4.0,"If you happen to pass by this attraction, go ahead and give it a visit. You will be marvelled by the design/structure of this building. It seems to be a convention area for special events. The time we went there were several food and retail carts along the garden area. The adjoining underpass had shops to check out. Overall a good place to hang out and chill after a long day.","Written June 10, 2019"
96,wireless_in_CA,4.0,"This building was full of curves and flowing lines that made it one of the coolest buildings we visited. Inside an almost all white walkway spiraled up to the top floor making for a long walk along the outer circumference of DDP. A staircase with an oddly angled and brown contrasting steps brought us back down.  The building and surrounding areas were open 24 hours a day. I walked around for free inside but to visit any of the exhibits or museums you just had to pay an admission fee (roughly W16000 for adults). On the ground floor was a temporary exhibit on Disney animation which seemed to be quite popular. There also was a Disney store and lots of silkscreened animation scenes from the likes of Frozen, Big Hero 6, and Moana. On the second floor was an art museum. On the third floor was a children’s play area, some collaboration space and on the roof, a viewing area and a cafe. In the back was a lush landscaped area with seating, a piano and various art pieces. In the front was a large courtyard where lots of people were congregated.  My daughter previously visited during the nighttime and enjoyed seeing the building lit up. We will have to visit again.","Written June 5, 2019"
97,eshadkamble,5.0,The way its made it's super unique and beautiful. Situated in the biggest shopping district of Seoul. This area is surrounded by malls. Must visit to click some great pictures,"Written June 4, 2019"
98,RuiYee,4.0,Dongdaemun Design Plaza’s architecture is amazing..great sight with several shopping centers nearby.,"Written June 4, 2019"
99,Zee,4.0,"Glad that we saw this on-going Disney exhibition from 2019.4.19 to 2019.8.18. Really nice to relive the childhood memories and learnt more about how Disney actually evolves through the years. :-)Tickets are @ 15,000 KRW for an adult.  There's another area with cafes and shops. Else just take a seat outdoor and enjoy the breeze.  We saw the LED rose at night too!","Written May 26, 2019"
100,Deborah W,5.0,"Don't miss a visit to the DDP if you want to get away from temples for a while and see an ultra-modern side of Seoul. Aside from the architecture, the centre has other attractions, and shops. When I visited there was a Disney Animation exhibition. Definitely worth seeing. Oh, and if you play the piano, there are several dotted around the complex. Just sit down and play!","Written May 25, 2019"
101,BengJYT,5.0,The building designed by the wellknown late Zaha Hadid looks like a scifi spaceship landed in the middle of the city aurrounded by shopping malls. It looks amazing and walking in it feels like inside something surreal. Every corner is curved giving the feeling of endless boundary without borders. Really very interesting design concept and realization.,"Written May 24, 2019"
102,Crystal J,3.0,"I may have selected the wrong time to visit so take that into account. First, if you enjoy architecture, the building itself is so unique and beautiful that you can’t go wrong. The building, the artistic statues outside (perhaps the correct term would be sculptures?) are definitely worth seeing in person. The interior is peaceful and calm which contradicts what you might anticipate looking at the space age like exterior. However, there wasn’t a lot going on inside during my particular visit. If you have young kids, they would have fun on I believe it was the third or possibly fourth floor.","Written May 23, 2019"
103,Gretchen,5.0,Beautiful structure. I was so amazed how it was done. You have to see it for yourself. One of the best place I have visited in South Korea. Superb 😊,"Written May 15, 2019"
104,Sophie,4.0,"I came shopping here around Dongdaemun area, and came upon this beautiful design plaza. It is a great picture opportunity, and you can sit or drink and eat around here. They have places for you to sit, and just chill. This plaza is just right behind the station. It is convenient and nice to get to.","Written May 13, 2019"
105,Daoaksorn,4.0,Nice place for photo shoot. There are a lot of points for photo. Sometime has show or exhibition there.,"Written May 10, 2019"
106,Lizayam,4.0,"First time to visit DDP and was impressed with its design. It’s like an infinity elongated curve from start to end. It would be nice if you could see the plaza in its total structure as it is quite unique and futuristic. We were there late afternoon and when it got dark, the lights gave the plaza an awsome ambience. They have this attraction which we visited and waited for hours the so-called led rose garden where hundreds or thousands of roses automatically light up as the sun sets. It was a nice view as the night went deeper. There are also have art hall, museum, design lab, design market, culture and history park but most of them were closed when we were there. It’s quite tiring if you tour around the big plaza but there are coffee shops and restaurants where you can eat and rest. It’s good to visit this place.","Written May 6, 2019"
107,cheeerz,3.0,"I do love design so, I was really looking forward to my visit to the Dongdaemun Design Plaza (DDP). Having dragged my family to it, I must say, I was --- disappointed.  Yes, amidst Seoul’s skyline, the DDP’s facade is aesthetically unique for it’s fluid lines and steel curvatures. There is no doubt, its sheer outline exudes design.  But once, we appreciated the swooping façade and geometries, there is just emptiness inside the building: empty rooms, empty echoey corridors and vast empty spaces. For a designer, space is a design element but when we went (around 4 pm on April 17) there were no exhibits, no permanent showcase not even, food trucks. Just one big EMPTY building.  OK, if you are a modern architecture design nut (and enjoy photographing shapes) but, you might want to skip this if you have mixed group. For a showcase design plaza, they really could have done more with it.","Written May 5, 2019"
108,Grc830,5.0,Dongdaemon Design Plaza has a modern architecture. It's about 19 mins walk from train station. It's a must visit place.,"Written May 2, 2019"
109,Jin Feng O,4.0,Ideally for teenagers that love shopping as some of the shops operate till 3am late night and lots branded is on sales ;),"Written April 27, 2019"
110,M. Lee,4.0,"When we visited, it was really cold, but there were still so many people around. There weren't that many food stalls opened as we had hoped for, but there was a piano there that we enjoyed playing.","Written April 24, 2019"
111,Steven R,4.0,Its good to see in the daylight but more spectacular at night with all the LED flowers all light up too.There is a cafe inside..Looks like a huge spaceship with its many windows.lots of photo opportunities.The steps leading out of the area are also light up.,"Written April 23, 2019"
112,Johannes R,5.0,If you like architecture and are interested in design you definitely should take at least a walk around this spacious building. You can also go to the design exhibition.,"Written April 18, 2019"
113,BillyGoodLife,5.0,A huge design of greatness with glimpse of city’s history and culture. Went there to watch the rose lights but arrived before dark. Amazed. Bejeweled. Enchanted. Must see!,"Written April 15, 2019"
114,CDNgirl1230,2.0,"We aren't only to find out there were no exhibits. Literally zero things to look at inside. It's a nice enough building, but we were expecting to see actual design work inside, only to discover they were between exhibits, have no permanent collections, and most people went for the market out front and the children's playland on the top floor. It was very disappointing. Would highly recommend finding out if there's actually something to look at before you go, else just stop by if it's on your way to someplace else. Not worth it to go to Dongdaemun just to look at an empty building.","Written April 15, 2019"
115,tulaykaracaorenli,5.0,"Generally Seoul has not fine architecturel profile.. but this DDP is well aesthetic huge building.. I experienced and felt touching, watching, listening a functional sculpture..a little bit in some where of the DDP I lost or confused about the horizon.. I advice at least two hours to spent in there..","Written April 13, 2019"
116,Angelia W,4.0,We went in the evening. There was a food and art fair when we were there. A live musical performance as well. Food trucks were available and the local youth were spending their evening enjoying the good food and music.,"Written April 13, 2019"
117,ymt888,4.0,We stumbled upon DDP after exiting from the subway station. It was very crowded at that time as it was Seoul Fashion Week. There were many fashionable people dressed up and posing for photographers. Very interesting to watch. And of course the exterior design by renowned Zaha Hadid is something to look out for.,"Written April 12, 2019"
118,yuet oi c,4.0,"Spectacular 3D architecture design! Impressive concept! Worth a visit. Beautiful from inside & outside for photos. There was a change of new lease for the shops, so we didn’t get to see many shops on that day. Shops were being refurbished.","Written April 9, 2019"
119,Marco Ho,4.0,"Besides the great amazing architecture, the thousands of LED rose flowers art exhibition also one of the most romance attraction at Design Plaza, it will close on 30-04-19, don't miss it at night time together with you lover, so romantic for photo taking.","Written April 5, 2019"
120,Yazeed Y,5.0,"Easy access to this wonderful sight to behold. One of Zaha Hadids final master pieces. I visited unknowingly on the anniversary of her death of 31.03, 3 years ago and you can see the reason she was famous. It’s an architectural piece of art for the ages. I am stunned looking at the curves of the building and then to find out it’s mostly usable space was incredible. I thought it would be simply design, but it’s functional which makes it doubly amazing. I absolutely loved every aspect of the building and the exhibits. Another South Korean architectural marvel.","Written April 1, 2019"
121,Donzgel,5.0,"Fashion district and the design of the buildings were very modern and state-of-the-art, indeed! There were also nearby malls and night market.","Written March 31, 2019"
122,Debridley R,5.0,This is the worlds largest 3D atypical structure. The architecture is amazing. It has beautiful graceful curves. The whole structure is column free. At night time it is lit up and is really pretty.,"Written March 29, 2019"
123,Adventure beyond imagination,4.0,The design plaza is so unique with futuristic exterior. Inside it likes a maze. Without direction information it’s hard to find the right way. Somehow busy due to the fashion week.,"Written March 26, 2019"
124,Steven K,4.0,I think this place is a worthwhile place to visit while in Seoul. The building is nothing like I’ve seen before. Easy access via subway,"Written March 22, 2019"
125,TravelwithContext,5.0,"If you’re into modern infrastructure, engineering, construction, or art muesuem, you must visit Dongdaemun Design Plaza. This place is perfect for couples or families of all ages. This destination is a futuristic multi-use facility that serves as a museum, shopping center, café, holds public community events, and is connected to the train system. It’s best to visit at night so you could view the beautiful artificial flowers that light-up. The vibe here is very relaxing as people could be found everywhere socializing and being present in the moment.","Written March 20, 2019"
126,mstickler,4.0,"I didn’t go inside, and suspect that it is even more impressive at night, but it is impressive to be sure. You can exit the subway station directly to it.","Written March 19, 2019"
127,Singapore Lee,5.0,Wonderful park to spend an afternoon. Lots of things to see and close to the famous fashion center. Connected by metro and located near many restaurants.,"Written March 16, 2019"
128,Jay Santos,5.0,Use Exit 10 to check out the front of DDP illuminated at night.  Then walk a long its corridors and admire the changing lights of the structure.,"Written March 11, 2019"
129,adrianyong,4.0,"Designed by world renowned architect, Zaha Hadid, DDP is the world’s largest atypical architecture. The DDP is comprised of five halls: Art Hall, Museum, Design Lab, Design Market, and Dongdaemun History and Culture Park. The Art Hall is the primary launch pad for the Korean creative industry.","Written March 8, 2019"
130,marymary H,5.0,The building alone is worth the time and then there is so much more going on - I took a couple of hours looking around - it is very organic form and I was really interested in the planting scheme as well. Lovely that there were pianos dotted around for anyone to play when i was there and the very nice restaurants inside too.,"Written March 3, 2019"
131,Qing Q,5.0,"Very nice place, took a picture of it and check in to Facebook! Alot of people as well so it's nice. Other than that, nothing much","Written March 3, 2019"
132,Ken,5.0,"The architectural design is very unique by following the contour of the surroundings.  The thousand led flower lighting was mesmerising in the evening and is great for photography!  In addition to near metro station, there are nice shops and restaurants there as well.","Written March 2, 2019"
133,Dave Kuante Wu,5.0,"Located in a Seoul-style block, dongdaemun design plaza is a extremely strange but spectacular construction. Just like zaha always did, she made DDP the an unusual construction and a representation of dongdaemun or even the whole Seoul.  I always like zaha’s design and think it very cool to take photo here. You can take very instergrammable photos inside or outside the building since the the Zaha style is everywhere here.  If you hope to take some pure architecture photos, I would recommend you to come the eighth floor of lotte FITIN which is a shopping mall facing to DDP. There are lots of clean windows allowing you to take amazing photos of DDP at night. In contrast, there are some buildings nearby where you can not take satisfying photos for its dirty windows and terrible views.","Written February 26, 2019"
134,PrinceandPrincessMom,5.0,This is a must see building in Dongdaemun. It looks like a space ship at night with glistering lights all around. The inside is white with curves and angles on the stairways that are pleasing to the eyes. There was an art exhibition on the ground floor and interesting design items for sale when I was there in the beginining of Feburary. There are two cafeterias that I can see on the top floor. They even have a piano outside around the middle entrance under cover for passerbys to display their talents. You can easily spend half a day there if you are into art and design.,"Written February 22, 2019"
135,Bruno C,4.0,"Nice building, there are various shops / restaurants/ galleries inside. I took the chance to visit a korean art exposition. It is a good way to spend a couple hours","Written February 13, 2019"
