,이름,별점,리뷰,날짜
136,TanWidya,2.0,We went DDP for photostop only. I think we just need 1 hour to explore this place. There are some foodtrucks in December 2018.,"Written January 30, 2019"
137,SurfingWild,5.0,"Located in Dondaemun, and very close to our hotel, this was a really interesting place to visit for all the family. The building is truly stunning and the design resembles something from the future or like an extra-terrestrial space ship. You can wander around the outside, underneath and inside and the different views of the building continually surprise.  Inside there were many things happening. There is a huge and fantastic play area for children, an exhibition of Wallace & Grommit, many shops and restaurants and cultural and art displays. Even the stairways in the building are far from normal and cleverly designed.  Probably the best time to visit is in the evening time and at night when the building comes to life with subtly placed lights so it even more resembles a flying saucer or space ship.  During our visit in the evening time, there were stands outdoors where people were selling handcrafted items such as jewellery, singers and musicians performing, and food trucks from the Seoul Bamdokkaebi Night Market offering all kinds of really delicious local and foreign snacks and street food.","Written January 27, 2019"
138,Whay,5.0,"I find the night view of this beautiful and serene amongst the hustle and bustle of the city. It's a modern walk thru the garden where you will find lit roses and standalone pianos to be played by any passers by (which can be heard from most parts of the spot). In the day you can do more with the design labs, art halls and others alike.","Written January 24, 2019"
139,K M,3.0,Mnet Music Awards 2018 was done here! There are free entrance in some areas for exhibits and garden. It is located near shopping malls and very convenient to go to because of nearby train station.,"Written January 22, 2019"
140,Yazid,5.0,Nice lighting around the area. The week that we went there they are having the mama awards but unfortunately we did not see any celebrity. Overall the building is nice.,"Written January 21, 2019"
141,harriskirrie,5.0,"This museum is both stunning yet totally accessible in terms of bringing good design to all echelons of public and taste. It is also situated in a fantastic area of shopping, architecture and leisure. Allow several hours to visit the area or stay in one of many nearby hotels.","Written January 16, 2019"
142,liyana1987,4.0,"I visited DDP at night. Beautiful building and lights. If you're here, be sure not to miss the LED rose garden.","Written January 16, 2019"
143,LC888,5.0,"So glad I got to see this building. Also Love the shop inside. If you are an architect, this is a must place to visit in Seoul.","Written January 10, 2019"
144,binahkoh,4.0,"Unusual and unique gifts all under one roof! We bought baby socks, a big hexagonal dish, a foldable backpack, a watch and K-pop paraphernalia. We had fun checking out the wares that were on display.  Tired and hungry? Perk-me-up treats are available at the AID cafe. Scones, sandwiches cake and coffees and teas. They were excellent.","Written January 4, 2019"
145,BobTai2012,5.0,"What are pleasant surprise, so many lights were light up and the view is nice. This building with super modern look!","Written December 23, 2018"
146,Arifur Rahman,4.0,the architecture is amazing. best time to visit is evening so that you can see the lights & reflections over the huge building. there are some exhibition halls inside the building. an iconic land mark of Seoul. highly recommended.,"Written December 22, 2018"
147,Jenny T,4.0,Beautiful building. Attached with the subway that link to main station. Nearby shopping area and restaurants. Didnt get ti catch a show there because we didi not plan to. But indeed it is a beautiful building to admire.,"Written December 22, 2018"
148,Roystontoh,4.0,To be able to conceive such a beautiful building and making it a reality is awesome. Must visit the LED Rose garden at Noght,"Written December 17, 2018"
149,MarkoRamius23,5.0,"Went there with the intent to explore any design exhibitions. In the end, plans were mired by the architecture and Kakao store.  The architecture was fascinating enough to capture even a layman's eyes. At ever angle near the building, it was stunning to see it especially closer to sunset. Spent some time taking photos of the building. Even more fascinating was how the building was not so obtrusive that it was rude to the environment. It remained modestly unobtrusive, retaining the harmony and yet feature it's avant-garde intent.  For families, they can pop by the Kakao shop for photo opportunities with the cute figurines there. Shopping is welcomed there too.  The basement has F&B outlets and shops. The building is conveniently connected to the Dongdaemun History & Culture Park.","Written December 9, 2018"
150,krintz,1.0,"It’s a beautiful building and you should visit if you are a champion of significant architecture. If you love art, you will be shattered with disappointment. There is no art here.  Changing exhibitions means that all galleries were closed. Buildings designed to be galleries have been turned into job fairs, malls and food courts. It’s pathetic that a civic project has been allowed to be so misaligned with the original intent.","Written December 4, 2018"
151,Peter_Bomberg,5.0,The architecture is stunning but the usage of the space is a bit confusing (seems to be more of an exhibition hall than a museum) so if you want to see the interior find an event or you will be limited to the hallways and public spaces.  That being said I strongly recommend a visit (the entrance stairway alone is worth the visit in my opinion) and the archaeological area at the base is very interesting,"Written December 1, 2018"
152,MLim,3.0,"Apart from the unique architecture, there isn't much to do here. Wouldn't recommend coming all the way for this.","Written November 29, 2018"
153,Mattison,5.0,This is a great place to shop for unique gifts and souvenirs. We did the majority of our Christmas shopping here.,"Written November 28, 2018"
154,FrontofHouse_KINGDU,5.0,"you must try this branch of Aori japanese ramen. the soup broth is so thick and yummy. the sliced pork doesn’t smell and it was so soft, it melted in my mouth. the noodle was not soft or over cooked and it still had a good bite to it. i ate here in 2 consecutive days. you have to ask for their english menu","Written November 28, 2018"
155,botman121803,4.0,"We were not aware if there was any exhibit going on the time. We came at night and did not explore much, but it was already awesome.","Written November 25, 2018"
156,amazinggirls,1.0,Remember : on Monday they closed!!! No one told me even this TripAdvisor that DDP is closed every Monday... we took far away travel to DDP from Gangnam-gu after myeongdong by train but when we are here is closed... only design market is open... lost our time!!!,"Written November 22, 2018"
157,neeratraveler,5.0,"Dongdaemun design plaza designed by Zaha Hadid is beautiful and futuristic with curvaceous forms. There is artwork exhibited, a cafe and much more. I enjoyed walking around it and admiring the beatiful forms. There are also other stores and restaurants in the surrounding area.","Written November 18, 2018"
158,shirleyyc,4.0,It’s a pretty awesome looking building to go see! It’s also where all the shopping malls are so it’s worth it to go see and the light up white roses are just outside!,"Written November 17, 2018"
159,TShahrizam,4.0,"I visited Dongdaemun Design Plaza when I when to visit the Dongdaemun Market. It is nearby and you have to visit this place to enjoy its unique architecture. It is a major cultural complex and host events such as Korean Fashion Week and so on. But if not for those shows, you just visit the place to appreciate its unique design and architecture.","Written November 15, 2018"
160,tsuyu67,3.0,"The design of the building is unique and there’s spiral staircase within. First floor showcases designer clothes, bags. There’s a design museum. It is basically a place that shows designers’ stuff.","Written November 14, 2018"
161,Miguel P,5.0,"It's a must see, appreciate the design of the building and come at night so you can see the different lighting fixtures. Also don't forget to see the LED rose garden.","Written November 12, 2018"
162,michellebrown2000,5.0,"Unfortunately we missed this as it doesnt open until 10.00 which is when we had to leave we were only in Soeul for 23 hours so did the night market and missed this as our hotel hadnt mentioned it. was so near The building is stunning shame we didnt get the full experience, check the opening timings if your going as it changes weedays/weekends","Written November 12, 2018"
163,Sean S,4.0,"Fantastic structure on the edge of the inner city of Seoul in the bustling markets of Dongdaemun. Located on the site of the old baseball stadium the DDP represents a unique piece of building which looks like a huge sculpture in the classic curvy design of Zaha Hadid. Carefully built using BIM modelling the building contains galleries, shops and public areas inside and outside for just viewing and enjoying the atmosphere. The building has lots of secretes and is worth a tour. In December 2018 there will be a display of fine jewelry from the famous jewelry house of Switzerland. Definitely worth a look !","Written November 7, 2018"
164,enjhelo13,5.0,Dongdaemun Design Plaza is a well known architecture and unique structure in Seoul. Better be here and be amaze!,"Written November 7, 2018"
165,Sarah53187,5.0,"We visited just after sunset, around dusk. The lights came on shortly after we arrived. Fantastic building, it's great to be able to wander around & view it from all angles. Really beautiful, so glad we visited.","Written November 7, 2018"
166,Alex P,4.0,"When around late afternoon, you cannot miss that landmark. Got a mix feeling about the place.... got shops and quite confusing for me. The lights display/design has dimmed (when I was there) and not as impressive as initially thoughts but still acceptable view at night. Use your imagination and photo app ;-)","Written November 6, 2018"
167,Hesti Yulistiani,5.0,"Visited this iconic architectural site on 26 October 2018 about 5 PM, it’s the perfect time to take pictures only a couple hours before sunset, we still have natural light, shadow was softer, the angles and length more vibrant. The view was breath-taking.","Written November 6, 2018"
168,Hana S,5.0,DDP is a landmark that can’t be missed in Dongdaemun. Check the design shops and museum in the building for interesting design items. There was a street play by a young group about plastic pollution and a Halloween-themed food truck lane. DDP is more beautiful at night.,"Written November 4, 2018"
169,Janice G,5.0,"ddp has an amazing architecture, quiet interesting ... Walking was quiet cool and we had a wonderful time , perfect weather when we went there last october...","Written November 4, 2018"
170,Luxecarol,3.0,"Only visited during the day. Some people say here that it looks great at night. Im sure it would. They pulled down a huge baseball complex to build this amazing shell of a building on this site. Its great looking on the outside, but its the opposite of the Tardis. Big on the outside, virtually nothing on the inside. A couple of unattended sad sort of museums ( with boxes etc just lying around) , a small shopping centre and a train station entry. Must have cost a bomb. Nice curvy lines yes, practical/ useful - not at all. Underutilised. An opportunity lost ( a concert hall it should have been or just a modern stadium etc ) and I love modern architecture, but only if it is functional.","Written November 1, 2018"
171,Izaxi,5.0,"It is a rare opportunity to visit the Master Architect of the world, Zaha Hadid. Walk inside and outside and enjoy this rare piece of art, Magnificent and FREE!","Written October 29, 2018"
172,retnomaruthi,5.0,"I didn't have any expectation going there, but it smacked me right in the face I am glad we went there. it fulfils its role as design centre, there are museum, halls, marketplace for budding artists and also shopping/eating centre in one place, making it a one-stop destination for everyone. you can definitely have great pictures in the building's premise, just find angles that you like. favorite photo spot is the stairs.","Written October 27, 2018"
173,AnnAnn428,5.0,"We purposely went there to see the landscape and the building, modern and we were like walking under a space ship hoping to meet some aliens there. Don't miss the LED Rose garden. Did not went for shopping there.","Written October 25, 2018"
174,A T,5.0,"This beautiful curvilinear building and artwork is an oxymoron to historical and cultural park. We only had time to walk the west side of the building and browse the arty design themed shops in the south part of the building. There are interesting pieces to buy in these shops. It’s a worthwhile visit on its own, or if some of your party prefers shopping for clothes at the malls across the street and you don’t.","Written October 23, 2018"
175,erguizajerry,4.0,"After seeing Korea's traditional houses, Dondaemun's design plaza shows the other side of Korea. The place is best viewed at night to see how the lights on the building facade highlights its modern design/architecture.","Written October 22, 2018"
176,TravelingLia,4.0,South Koreans joke about how this place looks like a spaceship. There's not much to see in the inside if there are no events like the Seoul Fashion Show. It is the outside that will be fun for most of tourists. You'll get nice Instagram photos here.,"Written October 22, 2018"
177,Gow,5.0,This was very near my hotel and it was really impressive at night. The building was lit up and looked very modern. There was so much to do around the building. Highly recommended.,"Written October 20, 2018"
178,Kairos_75,5.0,"Try visiting when they hold the evening markets. The whole place is amazingly designed (hence the name) and some of the galleries and exhibits are definitely good. Even the stairways are nicely designed, not forgetting the lightings. a good 1hr walk, even when your aim was to shop at DDM","Written October 20, 2018"
179,Brandon Travel Reviews,5.0,The building is beautiful and an amazing work of art. The walkways and overhanging beams make for great photos. There's many small boutiques inside that sell some of the most unique gifts and home decor I've ever seen! The top floor has a green-space and restaurant. Great area for just walking around.,"Written October 19, 2018"
180,Robin B,3.0,"We went to see this at the end of our trip; the design museum was closed (not sure why.) There’s a nice gift shop inside with handcrafted items by Korean artists which are reasonable and better quality (bought some earrings.). Ended up at a shopping area (Lotte) across the street which was standard fare (most of the clothing had no prices on them, a little odd.)","Written October 19, 2018"
181,Matt1147,5.0,"Checked out Dongdaemun Design Plaza at night. Cool to see it all lit up! Close to a market. Had someone playing the piano, and a neat LED flower garden.","Written October 18, 2018"
182,yks007,3.0,"We visited the place at night to look at the Led garden, It was beautiful. It is quite easy to find the Led garden. It was quite impressive.","Written October 17, 2018"
183,taitaihk,5.0,"This Zaha Hadid-designed building is absolutely stunning, both inside and out and is a must see if you are interested in architecture. Photos don’t do it justice as it is such a vast space from up close. Inside there is a large exhibition space featuring young designers which is great for browsing for gifts. Outside it is a short walk through the park to the shopping area of Dongdaemun.","Written October 17, 2018"
184,WabiSabiWanderer,5.0,"Come over to experience one of the last great architectural masterpieces by Zaha Hadid. It will not disappoint. She quickly understood that Seoul is defined by its seven rings of mountains. Resembling a blobby mountainscape, you can walk on top of the complex and see the mountains yourself. Come at about dusk. The night illumination of this building is stunning. Inside, one of the ""wings"" has a great collection of design stores that is easy to walk through and enjoyable to browse. The other ""wings"" have changing exhibitions and shows. Incredibly easy to get to as it is connected to the subway. Don't forget the world famous GwangJang Open Market featured on travel shows worldwide for the cheapest and best eats. Take a stroll along the Cheonggye Cheon Canal to get away from the city.","Written October 14, 2018"
185,AnneFrenchie,5.0,We arrived just before sunset & had the chance to see the transformation of this piece of art with the day & night time. An absolute gem in the Centre of Seoul. Worth going to appreciate the beauty created by an amazing artist.,"Written October 14, 2018"
186,Judey V,5.0,It was fun in there and the epic designs of structures are superb! Definitely an instagram-worthy place! Spend the afternoon there while waiting for our flight back to our country and it was the right decision!,"Written October 13, 2018"
187,Been a few places,5.0,Visited the DDP at night and it was so beautiful. The architectural beauty of Zaha Hadid's design is accentuated at night with lights to wonderful effect. Didn't enter the building rather enjoyed the building and sculptures from outside. Definitely worth a look.,"Written October 7, 2018"
188,PeterBruceG,5.0,Beautiful. Hard to find the entrance. Great outdoor space as well. The area has shopping and food. Make sure to look for the rose garden.,"Written October 3, 2018"
189,Pioneer167098,4.0,"Great location,and everything looks new, suitable for girls' stay. Easy going to all major points with metro or taxi, and many good food choices around. Definitely will choose it again.","Written October 2, 2018"
190,Larissa D,4.0,Place has a peculiar architecture and an interesting one. The exhibits are also informative. Lets you learn about the Korean culture as well as culture of others.,"Written October 2, 2018"
191,Rikkumsz,4.0,We were lucky that this beautiful piece of architecture was located almost next to our hotel. This place is really amazing. Walked around for one hour and took pictures from every direction. The forms are just amazing. It also stores a museum and some shops. Opposite the famous shopping buildings Lotte and APM wholesale.,"Written October 2, 2018"
192,Diandra S,3.0,"I think most people come here to see the unique architecture. But if you like art, go inside. Many shops there sell novelties and artsy things","Written October 1, 2018"
193,William T,5.0,"it’s better to visit DDP at sunset, so you can enjoy a breathtaking view from the building and enjoy the vibrant walking areas.","Written September 26, 2018"
194,Abby T,4.0,"This building is definitely one-of-a-kind in Seoul with its neo-futuristic design and massive perimeter (kind of looks like a UFO, IMO). Best visited at night when all of its lights are switched on. Tip: For foodies like myself, there is an awesome food court at Doota Mall (opposite DDP), Basement 1. Worth a visit!","Written September 24, 2018"
195,Peter G,5.0,"Sculptures were fascinating and architecture amazing, definitely worth a walk around and spend some time relaxing with a coffee","Written September 18, 2018"
196,Anders H,4.0,The Design Plaza is an interesting building and if you are in the neigbourhood you should drop by. Wheter it's worth a major detour depend on what's on display.,"Written September 18, 2018"
197,maila_ani,3.0,"It is better to view this from a distance so you can appreciate the whole architecture. But once inside, there is not much to do.","Written September 16, 2018"
198,DMTH,5.0,"It is a very interesting building, especially for someone who loves to take architecture pictures ! There is a small russian district nearby.","Written September 13, 2018"
199,lpincher94,4.0,"I'm not much into artworks but my sister really wanted to go so we headed over. From the outside it is stunning, with a couple of lovely statues, and inside is pretty cool too - though not as much to see as I thought there would be. A few of the areas were pretty enjoyable to look at, and I enjoyed the design plaza with all the different shops - lots of cute little items for sale.","Written September 13, 2018"
200,Moon,4.0,The building itself is great...especially if you like architecture photography. The shops downstairs are nothing special. but as its close to Dongdeamun Market its certainly worth a look around.,"Written September 9, 2018"
201,Glenis L,5.0,"While staying in Dongdaedum, visited DDP many times. Loved the Farmer's Market, the LED flowers at night,and the design shops full of interesting and innovative products. Such an interesting building and the space around it.","Written September 7, 2018"
202,coellomilton,5.0,"If you are walking around the Dongdaemun area in Seoul City and all of a sudden you notice a piece of architecture that looks like a spaceship. Don't worry Seoul City is not about to suffer an alien invasion, don't you dare to run, what you actually have to do is to go inside that magnificent piece of architecture and let the fantastic futuristic concept and vision of the famous Iraqui-British architect Zaha Hadid to gravitate towards you, so you can experience a different state of mind while been there.  I've been in Dongdaemun Design Plaza (DDP) several times and every time I go there is always a new experience, I never get bored of that place. There are so many things you can do there, take a look at the art and design galleries, there are also food festivals at night so you can try Korean and western food as well. Inside the building, you will see galleries, souvenirs shops, coffee shops and more.  If you have an Instagram profile then you can check the Instagram profile of Dongdaemun Design Plaza and you can see what they have to offer because they upload a schedule of their monthly activities there. I will highly recommend you to go there day and night time as well, so you can appreciate how different the style and feeling of the architecture can be.","Written August 30, 2018"
203,fm2mm,4.0,"During my short trip to Seoul, I tried to walk around the city as much as I could and found that stumbling upon the DDP around night was one of the highlights of my time there. It's absolutely stunning, there's ample space to just sit and relax, chat with friends, or take in the sights. Lots of stores as well, including a LINE Friends one that was super interesting to check out and do some souvenir shopping at. Not sure it this would still be here but there were also lots of pop-up pianos that you were welcome to use and created a really awesome atmosphere. Nearby electronic rose garden was also absolutely stunning. Overall, even if you can't stay long, definitely try to stop by the DDP during your time in Seoul.","Written August 23, 2018"
204,caroltay2018,4.0,"Omg, this place you can shop and shop till you drop.... many many kinds of fashion outlets and all the newest fashion are found here...","Written August 20, 2018"
205,Hsu J,5.0,"a new place to hangout, and very stylish even at night. People are very relaxed and there's night markets every Friday and Saturday. Though not many foods for selection, you won't regret visiting.","Written August 12, 2018"
206,MartijnTiemens,5.0,"We visited the Dongdaemun Design Plaza late in the afternoon after a day of sightseeing as I was interested in seeing the Zaha-Hadid designed building in real life.  The building itself is breathtakingly beautiful and equally impressive in my opinion and worth the trip alone. What makes it even better is that there is a very large kids play area on the top floor that provided hours of (air-conditioned) fun for our kids on a very hot day. In a busy city like Seoul that does not have a tremendous amount of activities for kids (note we live in Sydney, Australia so we're very spoilt for choice) this can be an absolute life saver and I don't understand why the play area is not advertised more.  If I were to make a top 3 of things to visit in Seoul, the DDP would definitely be in it.","Written August 6, 2018"
207,lielyaES,3.0,"If I say this the same as mangga dua jakarta indonesia. Goods there tend to be expensive. If not join the tour then this place can be missed. But if you join a tour then try touring around the building, you will find Korean street food","Written August 3, 2018"
208,AndrewTan,4.0,Very impressive architecture. Saw the led roses lit up at night. Beautiful. There were stalls selling handmade accessories and essential oils. There were also carts selling food and drinks at night. Prices are quite high tho.,"Written August 1, 2018"
209,Ree,5.0,"The architecture is beautiful and very futuristic looking. There are a bunch of shops inside, The second time I came here (in 2015 I think), there was some type of event going on outside with a stage set up and some music artists were performing. It was no one I recognized and I think they were rehearsing for something later in the day or evening. It definitely seemed like things were still being set up. The subway stops right at the DDP, so it's convenient to get to via subway. You could spend so much time just taking photos outside before even going inside to explore. It's also close to Doota and other shopping areas right across the street so expect to spend a few hours in this area if you want to go shopping.","Written July 29, 2018"
