,Unnamed: 0.1,index,Unnamed: 0,서울대공원부정단어리뷰,index.1,단어,번역
34,34,9,255,so love..this place....many many books and also other little stalls inside the book store. More korean language book as well. A huge area just for stationeries as well...,34,little,so love..이 곳....많은 책과 서점 내부의 다른 작은 포장 마차. 더 많은 한국어 책도. 문구류만을 위한 넓은 공간...
35,35,0,23, Not much has changed since I was a kid I felt like it was smaller than I expected In the past it felt like collecting and selling luxurious brands but now I feel like Im just bringing in miscellaneous things and ,35,much,어렸을때랑 별반 달라진게 없는데 생각보다 작다는 느낌이 들었습니다 예전에는 고급 브랜드를 모아서 파는 느낌이었는데 지금은 그냥 잡다한 것들만 가져와서 파는 느낌이에요
36,36,1,33, After much effort I went to Gwanghwamun and stopped by Kyobo Bookstore to shop for books while waiting for my appointment time Books and people are overflowing ,36,much,고심끝에 광화문에 들렀다가 약속시간을 기다리며 교보문고에 들러 책과 사람들이 넘쳐
37,37,2,63,Huge bookstore offers a wide variety of literature on pretty much categories even on foreign material Unfortunately literature about cycling is not available  take care its a bit cold down there,37,much,거대한 서점은 외국 자료에 대해서도 거의 범주에 대한 다양한 문헌을 제공합니다. 불행히도 사이클링에 대한 문헌은 구할 수 없습니다. 그곳은 약간 춥습니다.
38,38,3,99,Nice place but the air refresher is too much to handle,38,much,좋은 곳이지만 공기 정화기는 처리하기에는 너무 많습니다.
39,39,4,220,"There is a huge variety of books here, in fact same as similar shops everywhere in the world. Possible to find books in English, one good plus. For stationary materials, it is better and cheaper to enter smaller shops specific for stationary. You will lose much less time. Same is valid for other goods such as souvenirs, wallets, bags, toys, etc. If you want to buy only book and have specific list, enter and buy. Otherwise you can become crazy in crowd. As a summary, other than huge variety of books, nothing special.",39,much,"이곳에는 엄청나게 다양한 책이 있으며, 사실 전 세계 어디에서나 비슷한 상점이 있습니다. 영어로 된 책을 찾을 수 있다는 장점이 있습니다. 고정 재료의 경우 고정 전용 작은 상점에 들어가는 것이 더 좋고 저렴합니다. 훨씬 적은 시간을 잃게 됩니다. 기념품, 지갑, 가방, 장난감 등 다른 상품도 마찬가지입니다. 책만 구매하고 특정 목록이 있는 경우 입장하여 구매하세요. 그렇지 않으면 군중 속에서 미쳐버릴 수 있습니다. 요약하자면 엄청나게 다양한 책을 제외하고는 특별한 것은 없습니다."
40,40,5,224,"This bookstore could give Taipei’s Eslite a run for its money. It’s really big with everything from books and stationery to music and lifestyle items and gadgets. Quite a wide selection of English books too. But it was really really crowded on a Sunday afternoon. Great place for browsing and buying, but not so much for hanging out and reading.",40,much,"이 서점은 타이페이의 Eslite에게 돈을 벌 수 있습니다. 책과 문구류부터 음악, 생활용품, 가제트에 이르기까지 모든 것이 정말 큽니다. 영어 책도 꽤 다양합니다. 하지만 일요일 오후에는 정말 사람들로 붐볐습니다. 둘러보고 구매하기에는 좋은 곳이지만 어울리고 책을 읽기에는 그다지 적합하지 않습니다."
41,41,6,225,"Lovely bookstore - you can just find almost anything you need. I went there for a TOPIK book. But also there is an unspeakable number and shape of post it and other sorts of stickers which I also find amazing along with the kids. Staff is friendly and helpful. There is a restaurant there, if you get hungry after having browsed all the stuff. Every time I come to Korea I visit the bookstore, I like it this much.",41,much,사랑스러운 서점 - 필요한 거의 모든 것을 찾을 수 있습니다. 나는 TOPIK 책을 위해 거기에 갔다. 그러나 또한 포스트잇과 다른 종류의 스티커가 아이들과 함께 놀랍습니다. 직원들은 친절하고 도움이 됩니다. 모든 물건을 둘러본 후 배가 고프면 레스토랑이 있습니다. 한국에 올 때마다 서점을 방문할 때마다 이곳이 너무 좋아요.
42,42,7,226,"I made it a point to go there each time I visit Seoul. One of the main reasons was to buy the same book in Singapore, it cost almost three times as much as the amount I paid in Korea. I usually get the Korean language books such as the ones published by TTLK books as they sell it online in USD excluding shipping cost. I also like to look at the various merchandise ranging from stationery to audio accessories and sometimes, you may get good buys.",42,much,서울에 갈 때마다 꼭 가보고 싶은 곳입니다. 가장 큰 이유 중 하나는 같은 책을 싱가포르에서 사서 한국에서 지불한 금액의 거의 세 배에 달하는 가격이었습니다. 저는 보통 TTLK 도서에서 출판된 것과 같은 한국어 도서를 온라인에서 배송비를 제외하고 USD로 판매하기 때문에 구입합니다. 문구류부터 오디오 악세서리까지 다양한 굿즈 구경하는 것도 좋아하는데 가끔 좋은 물건을 살 수도 있어요.
43,43,8,228,"For me as a book lover, this place is a must visit regardless if they mostly have Korean books, it;s just a MUST VISIT. They even have Japanese selection of books! Though the English section was I guess not that big but there is! You can see almost everything in this huge bookstore, they got the record bar and gadget section and so on, the place is not much of an English friendly place though, but we managed by talking to some customers they are very helpful when it comes to speaking English.",43,much,책을 좋아하는 저에게 이 곳은 대부분 한국 책이 있더라도 꼭 방문해야 할 곳입니다. 그들은 심지어 일본 책을 가지고 있습니다! 영어 섹션이 그렇게 크지는 않았지만 있습니다! 이 거대한 서점에서 거의 모든 것을 볼 수 있습니다. 레코드 바와 가제트 섹션 등이 있습니다. 장소는 영어 친화적 인 장소는 아니지만 일부 고객과 이야기하여 관리 할 때 매우 도움이됩니다. 영어 말하기.
44,44,9,232,So much to choose from Great feel Huge wooden table to read at Lots of variety and English books available too,44,much,선택할 수있는 것이 너무 많습니다. 좋은 느낌 거대한 나무 테이블에서 읽을 수있는 다양한 종류와 영어 책도 많이 있습니다.
45,45,10,240,"Who doesn't love a good bookstore? The Kyobo Bookstore has been around since . . .well, forever, it seems, and it still pulls me in every time I visit Seoul. The selection of books in Korean is vast, but there is also a very good selection of books in English, both fiction and non-fiction. I never have any difficulty finding something. But even if you are not in the mood to buy, this is an excellent place to kill some time.  They have increased the floor space devoted to things like stationery and gifts over the years, but books are still at the heart of what they offer. The stationery section is substantial, and anyone should be able to find something here, from Moleskine notebooks to cutesy pens to everything in between. There is also a mini food court in the corner where I had a surprisingly good bowl of bibimbap (stainless steel bowl, sadly, not stone).  There are lots of places to sit in the book area, and pretty much every one one of them was filled with someone reading a book (or doing something on their phone). I can't say how many books were being bought (except the ones I bought), but there was certainly a lot of reading activity going on. The vibe in the Kyobo Bookstore is always a lively one. It has a good feel, a good selection of books and other merchandise, and a good location. Check it out.",45,much,"누가 좋은 서점을 좋아하지 않습니까? 교보문고는 그때부터 존재해 왔습니다. . .글쎄요, 영원히 그럴 것 같고, 여전히 서울을 방문할 때마다 저를 끌어당깁니다. 한국어로 된 책의 선택은 방대하지만 픽션과 논픽션 모두에서 영어로 된 책도 아주 잘 선택되어 있습니다. 나는 무언가를 찾는 데 어려움이 전혀 없습니다. 그러나 구매할 기분이 아니더라도 시간을 보내기에 좋은 곳입니다. 그들은 수년에 걸쳐 편지지와 선물과 같은 물건을 위한 공간을 늘렸지만 여전히 책은 그들이 제공하는 것의 중심에 있습니다. 문구류 섹션은 상당하며 Moleskine 노트북에서 귀여운 펜에 이르기까지 모든 사람이 여기에서 무언가를 찾을 수 있습니다. 의외로 좋은 비빔밥 한그릇(슬프게도 돌이 아닌 스테인레스 그릇)을 먹었던 모퉁이에 미니 푸드코트도 있습니다. 책 구역에는 앉을 수 있는 장소가 많이 있으며 거의 ??모든 공간이 책을 읽고 있는(또는 휴대전화로 무언가를 하는) 사람으로 가득 차 있습니다. 나는 얼마나 많은 책을 (내가 산 책을 제외하고) 사게 되었는지 말할 수 없지만 확실히 많은 독서 활동이 진행되고 있었다. 교보문고의 분위기는 언제나 활기차다. 그것은 좋은 느낌, 좋은 책 및 기타 상품 선택, 좋은 위치를 가지고 있습니다. 확인 해봐."
46,46,11,247,"It is the place to see how much people in Seoul love to read! Many cute stationery and gifts to buy, too.",46,much,서울 사람들이 얼마나 책을 좋아하는지 알 수 있는 곳! 귀여운 문구류와 선물도 많이 구매하세요.
47,47,12,248,"we pop in after visiting Gwanghwamun Square and this place is massive!  for singaporeans, you can relate it to kinokuniya (jap bookstore) that we have in sg and kyobo is almost as big as kino or maybe kyobo is twice in size?  there are a wide array of books, mostly in korean though, there is some english books and magazines around.  but the thing i'm keen is the vast variety of stationery they have! As i'm a part time student so i naturally have a soft spot to their cute monthly calendars, stickers, korean cartoon related stationery, pens, etc. they are good for souvenirs if you have friends who are still studying or working in office.  Especially in the chilling autumn weather, Kyobo also sell heatpack at 500won each (~SGD $0.60) and this could last about 10 hours. as a tropical kid, i really cannot stand cold weather, so i bought 10 packets of heatpack at one shot. ^ ^ the cashier did look at me strangely though..  *i seriously think korea heatpack is much larger, warmer & better than those i bought from Singapore Daiso. So this could be an alternative for those looking for heatpack in Korea.  come in to take a look and absorb the books culture in korea. i feel this place kinda brings me closer to being a part of korea, than being just a tourist",47,much,"우리는 광화문 광장을 방문한 후 튀어 나오며 이곳은 거대합니다! 싱가포르 사람들의 경우 sg에 있는 kinokuniya(jap 서점)와 관련시킬 수 있으며 kyobo는 거의 kino만큼 크거나 kyobo는 크기가 두 배입니까? 대부분 한국어로 된 다양한 책이 있지만 주변에 영어 책과 잡지가 있습니다. 하지만 내가 열광하는 것은 그들이 가지고 있는 다양한 문구류입니다! 나는 아르바이트생이다 보니 귀여운 월간 달력, 스티커, 한국 만화 관련 문구류, 펜 등이 자연스럽게 마음에 들어요. 아직 공부하고 있거나 사무실에서 일하는 친구가 있다면 기념품으로 좋습니다. 특히 쌀쌀한 가을 날씨에 교보는 히트팩을 개당 500원(~SGD $0.60)에 판매하며 약 10시간 동안 사용할 수 있습니다. 저는 열대어라 추운 날씨를 정말 못 견디어서 히트팩 10팩을 한번에 샀습니다. ^^ 그런데 점원이 저를 이상하게 쳐다보더군요.. *한국 히트팩이 싱가폴 다이소에서 산 것보다 훨씬 크고 따뜻하고 좋습니다. 따라서 한국에서 히트팩을 찾는 사람들에게 대안이 될 수 있습니다. 한국의 책 문화를 살펴보고 흡수하기 위해 방문하십시오. 나는이 장소가 나를 단순한 관광객보다 한국의 일부로 더 가깝게 만든다고 생각합니다."
48,48,13,252,This review is for Gangnam location since I couldn't find one on the trip advisor. We were looking for a couple of books for our kids to learn Korean but found so much more. They have great deals and amount on toys and many small things for gift ideas. Kids enjoyed looking around and throughly enjoyed about 1 to 2 hrs there.,48,much,이 리뷰는 여행 고문에서 찾을 수 없기 때문에 강남 위치에 대한 것입니다. 우리는 아이들이 한국어를 배우기 위해 몇 권의 책을 찾고 있었지만 훨씬 더 많이 찾았습니다. 그들은 장난감과 선물 아이디어에 대한 많은 작은 물건에 대해 큰 거래와 금액을 가지고 있습니다. 아이들은 주변을 둘러보고 약 1-2 시간을 즐겼습니다.
49,49,14,260,"As a book store ,there are many shopping things for you.However there also the best book store in South Korea because of so many books for everyone.And Korean people take care of their children so much that many children with their parents here.Some foreigners also here to buy books,English books and others.All the way,you can come here to find your book.",49,much,"서점으로서, 당신을 위한 많은 쇼핑 물건이 있습니다. 그러나 한국에서 가장 좋은 서점도 있습니다. 모두를 위한 책이 너무 많기 때문입니다. 그리고 한국 사람들은 아이들을 너무 많이 돌봐서 부모와 함께 많은 아이들이 이곳에 있습니다.일부 외국인들도 책과 영어책 등을 사러 옵니다. 여기까지 오면 책을 찾을 수 있습니다."
50,50,15,263,Spent a whole afternoon in the book store. Has best stationery items. I like the reading area very much. It is part of the places to visit every time I am in Seoul.,50,much,서점에서 오후 내내 보냈습니다. 최고의 문구류를 보유하고 있습니다. 나는 독서 공간을 매우 좋아한다. 서울에 갈 때마다 방문하는 곳 중 하나입니다.
51,51,16,267,"Whether you speak Korean or not (do not panic, there is a massive foreign books selection, especially in English) this establishment is a real must for book lovers.  Obviously 60% of the bookstore is made by Korean titles, but even then, the English and other languages sections are well fed. Besides, there is a incredible huge stationery section with plenty of notebooks ( with much more diversity than the sheer Moleskine you find in any bookstore); and the Hot tracks, a CD and DVD store.  It is a pity this bookstore is in the basement of a massive building and not facing the street. Besides, the signalling to get to the bookstore is virtually non existent.  But anyhow, a very recommendable stop in a very central location in near the palace Gyeongbokgung.",51,much,"한국어를 할 수 있든 없든 (당황하지 마십시오. 특히 영어로 된 방대한 양의 책이 있습니다) 이 시설은 책을 사랑하는 사람들에게 꼭 필요한 곳입니다. 분명히 서점의 60%는 한국 책으로 만들어졌지만 그 때에도 영어와 다른 언어 섹션은 잘 먹혀들었습니다. 게다가 수많은 공책이 있는 엄청나게 큰 문구류 섹션이 있습니다(어떤 서점에서나 볼 수 있는 순수한 몰스킨보다 훨씬 더 다양합니다). 핫 트랙, CD 및 DVD 상점. 이 서점은 거대한 건물의 지하에 있고 거리를 향하지 않는 것이 유감입니다. 게다가, 서점에 가는 신호는 거의 존재하지 않습니다. 그러나 어쨌든 경복궁 근처의 매우 중심적인 위치에서 매우 추천할만한 곳입니다."
