,Unnamed: 0.1,index,Unnamed: 0,서울대공원부정단어리뷰,index.1,단어,번역
0,0,0,26, It is easy to search for books and purchase them and when it is difficult to find them ask the staff and they are kind and helpful ,0,staff,책 검색 및 구매가 용이하고 찾기 어려울 때는 직원에게 물어보면 친절하고 도움이 됩니다.
1,1,1,44, Okay the staff were a bit friendly Tendency to be late in answering a question ,1,staff,좋아요 직원들이 조금 친절했습니다 질문에 늦게 답변하는 경향이 있습니다
2,2,2,46, The best book and stationery store I have ever seen Books stationery for every taste First books are divided by subject Secondly all the staff are very friendly and helpful They will be happy to tell you where ,2,staff,내가 본 최고의 책 및 문구점 모든 취향에 맞는 책 문구 첫 번째 책은 주제별로 나누어져 있습니다 두 번째로 모든 직원은 매우 친절하고 도움이 됩니다.
3,3,3,65,Great selection of English books for kids Friendly and helpful staff  For stroller access theres an elevator thru the lobby entrance on the east side of the building,3,staff,다양한 어린이용 영어 책 친절하고 도움이 되는 직원 유모차 이용 시 건물 동쪽 로비 입구를 통해 엘리베이터 이용 가능
4,4,4,77, I went to find the remaining stock to restart my piano study  I was very grateful to the staff for informing me in detail ,4,staff,피아노 공부 다시 시작하려고 남은 재고 찾으러 갔는데 자세히 알려주신 스탭분들 너무 감사했습니다
5,5,5,94,Helpful staff It has what I need HUGE bookstore,5,staff,도움이 되는 직원 필요한 것이 있습니다. 거대한 서점
6,6,6,122,Lovely staff Make sure you give plenty of time to visit this wonderful book shop,6,staff,사랑스러운 직원이 멋진 서점을 방문하는 데 충분한 시간을 할애하십시오.
7,7,7,141, Its spacious there are lots of books and the staff are friendly A place where you will never know where time goes ,7,staff,넓고 책도 많고 직원들도 친절합니다 시간 가는 줄 모를 곳
8,8,8,145, I asked the staff to find the book but it was very unfriendly Im here and Im responding like I cant find it Also the books Im looking for are all sold out so even online bookstores are not enough ,8,staff,직원들에게 책을 찾아달라고 했더니 너무 불친절해서 여기도 왔는데 못찾는 듯이 답장을 해주네요 저도 찾는 책들이 다 품절이라 온라인서점으로도 부족하네요
9,9,9,146, Its spacious big and the staff are friendly and nice The book is a bit expensive Good though ,9,staff,넓고 크고 직원들도 친절하고 좋아요 책이 좀 비싸긴 하지만 좋아요
10,10,10,181, A really long visit I wanted to preorder the book but the staff made me jump 3 times It was not a long visit ,10,staff,정말 오랜만에 방문해서 예약주문하고 싶었는데 직원분이 3번이나 뛰게 해주셨어요 긴 방문은 아니었어요
11,11,11,187, There are many kinds of books and the staff are very friendly ,11,staff,책 종류도 많고 직원들도 친절함
12,12,12,189, There were a lot of different kinds of books and the staff was mostly friendly but there were some bad staff who were not the search bar was not enough it was good to have a parking lot and it was good that it ,12,staff,다양한 종류의 책들이 많았고 직원들은 대부분 친절했지만 검색바가 아닌 불친절한 직원도 있었고 주차장이 있어서 좋았습니다
13,13,13,204, We can see all the books we want and if you have any questions ask the bookstore staff and they will kindly tell you where they are There are a lot of texts so I cant bring my kids ,13,staff,원하는 책은 다 볼 수 있고 궁금한 점이 있으면 서점 직원에게 물어보면 친절하게 위치를 알려줄 것입니다. 문자가 많아서 아이들을 데려갈 수 없어요
14,14,14,208, It is also Kyobo Bookstore but the male staff who guides the QR code at the entrance was so unfriendly and scary ,14,staff,교보문고이기도 하지만 입구에서 QR코드를 안내해주는 남자직원이 너무 불친절하고 무서웠다
15,15,15,214,"Kyobo is a chain, so there are stores all over Seoul, but the Gwanghwamun location is my favorite. They sell books and CDs, which reminds me of what the States used to have in the Borders chains, along with even more stuff. There are cafes and restaurants inside, too. There are sections for foreign languages and, depending on your language, there are likely specialty shops elsewhere that will better serve you. The English section is small, but has great editions, like Oxfords World’s Classics, at cheap prices. The literary selection tends to be canonical, but the staff also has a large section devoted to best-sellers and newly published material, most of which is non-fiction, that is a sort of Korean-American cultural filter. There are always lots of families here and people milling about, reading, gathering books, enmeshed in the written word and the real world. Take some time here, slow down, observe, read something, think a few connected thoughts, have something to eat or drink...and enjoy.  Over the past five or six years, there has been lots of renovation in the areas adjacent, particularly with high end restaurants and shops behind Kyobo and to the left. Jongno has remained the same and the Gwanghwamun Gwangjang is historical. Several years ago the Korean people protested then President Park Geun-Hye with candlelight vigils and songs on the square, every Saturday, for months. These protests began with small numbers that grew into the thousands, and arguably millions. These protests were part of the success in the removal of Park (December, 2016) and were amazing representations of the civil, non-violent assemblage of people for a cause. Democracies around the world would do well to follow in these Korean footsteps.",15,staff,"교보는 체인점이라 서울 곳곳에 매장이 있지만 저는 광화문점을 가장 좋아합니다. 그들은 책과 CD를 팔고 있는데, 이는 미국이 국경 사슬에서 가지고 있던 것을 생각나게 하고 더 많은 물건과 함께합니다. 내부에는 카페와 레스토랑도 있습니다. 외국어에 대한 섹션이 있으며 귀하의 언어에 따라 더 나은 서비스를 제공할 전문 상점이 있을 수 있습니다. 영어 섹션은 작지만 Oxfords World 's Classics와 같은 훌륭한 에디션을 저렴한 가격으로 제공합니다. 문학적 선택은 정경적인 경향이 있지만 스태프는 베스트셀러와 새로 출판된 자료에 대한 많은 섹션을 가지고 있으며 대부분이 논픽션이며 일종의 한국계 미국인 문화 필터입니다. 이곳에는 항상 많은 가족들이 있고, 사람들이 방황하고, 읽고, 책을 모으고, 글과 현실 세계에 얽매여 있습니다. 여기에서 시간을 좀 들이고, 속도를 늦추고, 관찰하고, 무언가를 읽고, 연결된 몇 가지 생각을 생각하고, 먹거나 마실 것을... 그리고 즐기십시오. 지난 5~6년 동안 인접 지역, 특히 교보의 뒤편과 왼쪽에 고급 레스토랑과 상점이 들어서면서 많은 보수 공사가 있었습니다. 종로는 그대로이고 광화문광장은 역사적이다. 몇 년 전 한국 사람들은 몇 달 동안 매주 토요일 광장에서 촛불집회와 노래로 박근혜 당시 대통령에 항의했습니다. 이 시위는 수천, 아마도 수백만으로 성장한 소수에서 시작되었습니다. 이러한 시위는 박근혜 퇴진(2016년 12월)의 성공의 일부였으며 대의를 위한 시민, 비폭력 집회의 놀라운 표현이었습니다. 전 세계의 민주주의 국가들이 이러한 한국의 발자취를 따르는 것이 좋을 것입니다."
16,16,16,227,I always make it a point to stop by and inhale the scent of new books. It's a bit short on space to sit and read but the atmosphere is cozy and the staff very helpful. Plus it's right of the square. Great location,16,staff,나는 항상 멈추고 새 책의 냄새를 맡는 것을 강조합니다. 앉아서 읽을 공간이 조금 부족하지만 분위기는 아늑하고 직원들은 매우 도움이 됩니다. 게다가 그것은 광장의 오른쪽에 있습니다. 훌륭한 위치
17,17,17,259,"I always make a visit to the bookstores of any city I visit, because I am keen to collect cookbooks written in English by locals. Most of these are usually not available on Amazon or other online bookstores.  Kyobo's outlet at Gwanghwamun didn't disappoint. It's large and sprawling, but most of the books are Korean, which is to be expected. As with most brick and mortar bookstores these days, they have cafes, retailers selling pens, art supplies, bags and others to provide some added attraction.  They have a respectable English cookbook collection, but also a selection of books on Korean topics in English. There were some locally written cookbooks, and they looked interesting because several of them were written by well known culinary academics. When I was there in November, they had a promotion on Japanese books and you can enjoy a discount on them. They had also put up a nice display featuring a mix of Japanese cookbooks. I really like this feature.  What I enjoyed about the bookstore was the chairs and benches they had provided within the store to allow people to browse their selections. There are staff there who speak simple English. They have a green practice of charging for carrier bags (which is good).  I'd go back there to check out the cookbooks again. Kyobo is more like Eslite in Taipei (another fabulous bookstore) in its offerings of books and other related products. Kinokuniya in Tokyo is more like the traditional bookstore with a lot more focus on providing books and less on other goods. All are great bookstores, and deserve visits by book lovers.",17,staff,"나는 현지인이 영어로 쓴 요리책을 수집하는 데 열심이기 때문에 방문하는 모든 도시의 서점을 항상 방문합니다. 이들 중 대부분은 일반적으로 아마존이나 다른 온라인 서점에서 구할 수 없습니다. 광화문 교보문고는 실망시키지 않았다. 그것은 크고 넓지 만 대부분의 책은 예상대로 한국어입니다. 요즘 대부분의 오프라인 서점과 마찬가지로 카페, 펜, 미술 용품, 가방 등을 판매하는 소매점에서 추가 매력을 제공합니다. 그들은 훌륭한 영어 요리책 컬렉션을 가지고 있지만 영어로 된 한국 주제에 대한 책도 있습니다. 현지에서 쓰여진 요리책이 몇 권 있었는데 그 중 몇몇은 유명한 요리 학자가 집필했기 때문에 재미있어 보였습니다. 제가 11월에 갔을 때 일본 책 프로모션이 있어서 할인을 받을 수 있었어요. 그들은 또한 일본 요리 책이 혼합 된 멋진 디스플레이를 설치했습니다. 이 기능이 정말 마음에 듭니다. 내가 서점에 대해 즐겼던 것은 사람들이 자신의 선택을 찾아볼 수 있도록 서점 내에 제공한 의자와 벤치였습니다. 간단한 영어를 구사하는 직원이 있습니다. 그들은 캐리어 가방을 충전하는 친환경 관행을 가지고 있습니다 (좋은 것입니다). 나는 요리 책을 다시 확인하기 위해 거기에 다시 갈 것입니다. 교보는 책과 기타 관련 제품을 제공한다는 점에서 타이베이의 Eslite(또 다른 멋진 서점)와 비슷합니다. 도쿄의 기노쿠니야는 다른 상품보다는 책 제공에 훨씬 더 중점을 둔 전통적인 서점에 가깝습니다. 모두 훌륭한 서점이며 책을 사랑하는 사람들이 방문할 가치가 있습니다."
18,18,0,75, It smells like a book and I love it Due to Corona the number of seats available has decreased ,18,number,책냄새나고 좋아요 코로나때문에 좌석이 줄었어요
19,19,1,85,Decent selection of books in English Small music section including a limited number of lps Good stop for expats,19,number,영어로 된 책의 적절한 선택 제한된 수의 lps를 포함한 작은 음악 섹션 국외 거주자를위한 좋은 중지
20,20,2,97, Burger King is so delicious these days Its great that the number of stores has increased compared to before Especially the french fries  ,20,number,요즘 버거킹이 너무 맛있어서 예전에 비해 가게가 늘어난게 대단해 특히 감자튀김
21,21,3,120, Staff aggressive and unfriendly I said yes because I asked if I needed a receipt I want to enter a number So what number is it Hani Need a cash receipt I asked again I said yes so I had to enter the number ,21,number,직원이 공격적이고 비우호적입니다 영수증이 필요하냐고 물었더니 예라고 했습니다 번호를 입력하고 싶어요 그래서 번호가 몇이에요 하니 현금 영수증이 필요해요 다시 물었더니 예라고 해서 번호를 입력해야 했습니다
22,22,4,214,"Kyobo is a chain, so there are stores all over Seoul, but the Gwanghwamun location is my favorite. They sell books and CDs, which reminds me of what the States used to have in the Borders chains, along with even more stuff. There are cafes and restaurants inside, too. There are sections for foreign languages and, depending on your language, there are likely specialty shops elsewhere that will better serve you. The English section is small, but has great editions, like Oxfords World’s Classics, at cheap prices. The literary selection tends to be canonical, but the staff also has a large section devoted to best-sellers and newly published material, most of which is non-fiction, that is a sort of Korean-American cultural filter. There are always lots of families here and people milling about, reading, gathering books, enmeshed in the written word and the real world. Take some time here, slow down, observe, read something, think a few connected thoughts, have something to eat or drink...and enjoy.  Over the past five or six years, there has been lots of renovation in the areas adjacent, particularly with high end restaurants and shops behind Kyobo and to the left. Jongno has remained the same and the Gwanghwamun Gwangjang is historical. Several years ago the Korean people protested then President Park Geun-Hye with candlelight vigils and songs on the square, every Saturday, for months. These protests began with small numbers that grew into the thousands, and arguably millions. These protests were part of the success in the removal of Park (December, 2016) and were amazing representations of the civil, non-violent assemblage of people for a cause. Democracies around the world would do well to follow in these Korean footsteps.",22,number,"교보는 체인점이라 서울 곳곳에 매장이 있지만 저는 광화문점을 가장 좋아합니다. 그들은 책과 CD를 팔고 있는데, 이는 미국이 국경 사슬에서 가지고 있던 것을 생각나게 하고 더 많은 물건과 함께합니다. 내부에는 카페와 레스토랑도 있습니다. 외국어에 대한 섹션이 있으며 귀하의 언어에 따라 더 나은 서비스를 제공할 전문 상점이 있을 수 있습니다. 영어 섹션은 작지만 Oxfords World 's Classics와 같은 훌륭한 에디션을 저렴한 가격으로 제공합니다. 문학적 선택은 정경적인 경향이 있지만 스태프는 베스트셀러와 새로 출판된 자료에 대한 많은 섹션을 가지고 있으며 대부분이 논픽션이며 일종의 한국계 미국인 문화 필터입니다. 이곳에는 항상 많은 가족들이 있고, 사람들이 방황하고, 읽고, 책을 모으고, 글과 현실 세계에 얽매여 있습니다. 여기에서 시간을 좀 들이고, 속도를 늦추고, 관찰하고, 무언가를 읽고, 연결된 몇 가지 생각을 생각하고, 먹거나 마실 것을... 그리고 즐기십시오. 지난 5~6년 동안 인접 지역, 특히 교보의 뒤편과 왼쪽에 고급 레스토랑과 상점이 들어서면서 많은 보수 공사가 있었습니다. 종로는 그대로이고 광화문광장은 역사적이다. 몇 년 전 한국 사람들은 몇 달 동안 매주 토요일 광장에서 촛불집회와 노래로 박근혜 당시 대통령에 항의했습니다. 이 시위는 수천, 아마도 수백만으로 성장한 소수에서 시작되었습니다. 이러한 시위는 박근혜 퇴진(2016년 12월)의 성공의 일부였으며 대의를 위한 시민, 비폭력 집회의 놀라운 표현이었습니다. 전 세계의 민주주의 국가들이 이러한 한국의 발자취를 따르는 것이 좋을 것입니다."
23,23,5,216,"Kyobo bookstore in Jongno-gu (near Gwanghwamun station) is a must-visit for anyone with a passion for books and simply spending time in bookstores. This particular branch (there are others dotted around the city) is, I believe, the largest. It has a vast collection of books in Korean, and sections for a number of other languages, with quite a good selection of books in English. The store also has a stationery section, puzzles and a cafe, and is surrounded by a number of other shops. Unlike so many bookstores these days, Kyobo allows you to spend time simply sitting on the provided comfortable benches, and reading. You'll find the store in the basement, accessible from the station.",23,number,"종로구 교보문고(광화문역 인근)는 책을 좋아하고 책방에서 시간을 보내는 사람이라면 꼭 가봐야 할 곳이다. 이 특정 지점(도시 곳곳에 다른 지점이 있음)이 가장 큰 것 같습니다. 한국어로 된 방대한 양의 책과 여러 다른 언어로 된 섹션이 있으며 영어로 된 책도 꽤 많습니다. 가게에는 문구 코너, 퍼즐, 카페도 있으며, 주변에는 다른 여러 가게가 있습니다. 요즘 많은 서점들과 달리 교보는 제공되는 편안한 벤치에 앉아서 책을 읽는 것만으로도 시간을 보낼 수 있습니다. 역에서 접근할 수 있는 지하에 매장이 있습니다."
24,24,6,225,"Lovely bookstore - you can just find almost anything you need. I went there for a TOPIK book. But also there is an unspeakable number and shape of post it and other sorts of stickers which I also find amazing along with the kids. Staff is friendly and helpful. There is a restaurant there, if you get hungry after having browsed all the stuff. Every time I come to Korea I visit the bookstore, I like it this much.",24,number,사랑스러운 서점 - 필요한 거의 모든 것을 찾을 수 있습니다. 나는 TOPIK 책을 위해 거기에 갔다. 그러나 또한 포스트잇과 다른 종류의 스티커가 아이들과 함께 놀랍습니다. 직원들은 친절하고 도움이 됩니다. 모든 물건을 둘러본 후 배가 고프면 레스토랑이 있습니다. 한국에 올 때마다 서점을 방문할 때마다 이곳이 너무 좋아요.
25,25,0,14, Thank you for the book you want to purchase However I had already scanned the barcode with the kiosk and paid but I was a little dissatisfied with the system in which purchasing a kiosk was meaningless ,25,little,구매하고 싶은 책 감사합니다 하지만 이미 키오스크에서 바코드를 스캔하고 지불했지만 키오스크 구매가 의미없는 시스템에 약간 불만이있었습니다
26,26,1,84, I recently visited Kyobo Bookstore Its a little different from before but it seems to be getting better Not only books but also stationery are available in a wider variety than before so it was nice to see a lot ,26,little,최근에 교보문고에 다녀왔습니다 예전과는 조금 다르지만 점점 좋아지는 것 같아요 책 뿐만 아니라 문구류도 예전보다 더 다양하게 구비되어 있어서 많이 볼 수 있어서 좋았어요
27,27,2,138, A place where reading a book reminds me that Im going a little further ,27,little,책을 읽으면 내가 조금 더 나아가고 있음을 일깨워주는 곳
28,28,3,160, Childrens Corner It would be nice if an older man could speak a little more kindly ,28,little,어린이 코너 나이든 남자가 조금 더 친절하게 이야기 할 수 있다면 좋을 것입니다.
29,29,4,190, Its my favorite space It would be nice if the types of books were a little more diverse but there must be physical limitations ,29,little,내가 제일 좋아하는 공간 책의 종류가 좀 더 다양했으면 좋겠지만 물리적인 제약이 있을텐데
30,30,5,199, There are many types of books but old books feel a lot of touch so I am a little reluctant to buy them ,30,little,책의 종류는 많지만 오래된 책은 촉감이 너무 좋아서 구매하기가 조금 꺼려집니다.
31,31,6,235,"This place is more than a book store. It is more like a mini-shopping center where you can find not only stationery, books, electrical appliances, gadgets but also toys and bags (Hottracks is inside too). They provide small benches here and there for customers who like to linger around for a little bit. If you are hungry, there is a food court.  The store is definitely an excellent place to fend off the afternoon heat and torrential rains. It could get really crowded because of that and also the fact that it is connected to the subway. I have also been to the one in Daegu, too. The Daegu store is smaller and not as crowded.  If you decide to do some serious shopping there, make sure that you bring your passport with you for the instant tax returns / credits (spending 30000 won at one time). It would be nice if they have a coffee shop there, just like the one in Barnes and Noble.",31,little,"이곳은 서점 그 이상입니다. 문구류, 책, 전자 제품, 가제트뿐만 아니라 장난감과 가방도 찾을 수 있는 미니 쇼핑 센터와 비슷합니다(Hottracks도 내부에 있음). 이곳저곳에서 잠시 머물고 싶은 고객들을 위해 이곳저곳에 작은 벤치를 제공합니다. 배가 고프면 푸드 코트가 있습니다. 상점은 확실히 오후의 더위와 폭우를 피할 수 있는 훌륭한 장소입니다. 그 때문에 지하철과 연결되어 있기 때문에 정말 혼잡 할 수 있습니다. 저도 대구에 다녀왔습니다. 대구점은 규모가 작고 붐비지 않습니다. 그곳에서 진지하게 쇼핑을 하기로 결정했다면 즉시 세금 환급/공제(한 번에 30,000원 ??지출)를 위해 여권을 반드시 지참하십시오. Barnes and Noble에 있는 것과 같은 커피숍이 있으면 좋을 것입니다."
32,32,7,250,"That's a great place to spend hours and hours. They have tons of books of all areas, korean, japanese, chinese, english and even other languages. They also have a great magazine section. There's also right around there - this is not Kyobo, but it's right in there, I even got lost in the boundaries lol- a great stationary shop, i guess my favorite in Seoul; a CD/DVD store in case you are interested in some films or some kpop stuff; some small electronic shop (i bought instant films there); a cosmetic store... it's all there! Restrooms and water fonts are clean and big - as they usually are in Seoul, actually. And, what surprised me the most, there's a quite small food court, but very efficient, with a little more than a dozen choices of dishes, my friend and I tried some of them and they were all delicious! There's also a baskin robbins for some dessert, a dunkin' donuts and some coffee shop I don't remember which. It's all set for you to spend all day drowned in books, or even if you are coming for any of the attractions in gwanghwamun and decided to take a time off to chill a little bit.",32,little,"그것은 몇 시간과 몇 시간을 보낼 수있는 좋은 장소입니다. 그들은 한국어, 일본어, 중국어, 영어 및 기타 언어까지 모든 영역의 수많은 책을 보유하고 있습니다. 그들은 또한 훌륭한 잡지 섹션을 가지고 있습니다. 바로 그 주변에 있습니다. - 여기는 교보가 아니라 바로 안에 있어요. 심지어 경계에서 길을 잃었어요. lol- 멋진 문구점, 제가 서울에서 제일 좋아하는 것 같아요. 영화나 케이팝에 관심이 있는 경우를 대비하여 CD/DVD 매장; 작은 전자상가(나는 그곳에서 즉석 필름을 샀다); 화장품 가게... 다 있어요! 화장실과 물 글꼴은 실제로 서울에 있는 것처럼 깨끗하고 큽니다. 그리고 나를 가장 놀라게 한 것은 아주 작은 푸드 코트가 있지만 매우 효율적이며 12가지가 조금 넘는 요리를 선택할 수 있다는 것입니다. 제 친구와 저는 그 중 일부를 시도했는데 모두 맛있었습니다! 디저트를 위한 baskin robbins, 던킨 도너츠, 그리고 기억나지 않는 커피숍도 있습니다. 하루 종일 책에 푹 빠져 지내거나, 광화문 관광명소에 들렀다가 잠시 휴식을 취하기로 결정한 당신을 위한 모든 준비가 되어 있습니다."
33,33,8,253,"I love wandering through this book store. The have a decent section of English books and around the outside you can find anything from pens and notebooks to candles, watches, and cool little knickknacks.",33,little,"나는 이 서점을 돌아다니는 것을 좋아합니다. 영어 책의 적절한 섹션이 있으며 외부에는 펜과 공책에서 양초, 시계 및 멋진 작은 장식품에 이르기까지 무엇이든 찾을 수 있습니다."
