,번역
64,거대한 장소. 그 뒤에 산의 아주 좋은 보기. 동물원은 꽤 크고 동물도 많지만 시설을 개선해야 합니다. 나는 돌아가도 상관없어요. 동물 애호가라면 꼭 가봐야 할 곳입니다.
65,"당신이 시골에 있고 ""큰 도시 공원""을 경험하고 싶다면 반드시 서울 대공원을 방문해야 합니다. 관광, 명소, 놀이기구(어린이도 가능), 양궁, 스키 리프트, 동물원에서 제공하는 것이 너무 많습니다. 그리고 수많은 레스토랑과 스낵바가 있어 가족이나 친구와 함께 즐거운 시간을 보내기에 완벽한 장소입니다."
66,우리는 8월에 거기에 갔고 우리에게는 너무 덥습니다. 우리는 30분 동안만 걸을 수 있었고 떠나기로 결정했습니다. 동물원은 꽤 오래되었습니다. 직원이 정보를 잘 제공하지 않습니다 (케이블카 정류장에서 동물원으로가는 길을 따라 걸을 때 우리는 동물원까지 셔틀 버스가 있다는 것을 알았지 만 안내 직원이 알려주지 않았습니다. 그래서 우리는 아래로 걸어 가야합니다. 정말 더운 날씨).
67,동물원은 광대하다. 많은 동물. 침팬지들은 즐겁게 지내고 있습니다. 스카이 리프트를 타고 앉아서 휴식을 취하십시오. 가장 좋은 것은 돌고래와 물개 쇼입니다. 매표소에서 공연 시간을 물어보세요. 젖고 싶으면 앞쪽에 앉으세요. 당신은 거기에 도달하기 위해 지하철을 사용할 수 있습니다.
68,"동물원은 4호선 서울대공원역 외부에 있는 서울대공원의 일부입니다. 주말에는 지하철을 타세요... 그곳에서 운전하는 모든 교통체증은 가치가 없습니다. 역에서 나오면 대공원 본관까지 긴 도보 거리가 있습니다. 입구. kfc와 편의점에서도 끓는 bundegi (누에 번데기)를 주로 형성하는 약간의 (imo) 냄새가 날 것입니다 ... 동물원이 크므로 물을 얻는 것이 좋습니다. 물과 음료도 내부에 얻을 수 있습니다. 공원 입구에서 동물원까지 더 걸어갈 수는 있지만 권장하지는 않습니다. 부스에 가서 코끼리 트램을 타려면 1000원을 지불하십시오. 트램은 공원의 모든 장소를 치고 동물원 앞에 내려줍니다. 약 5000원에 스카이 리프트도 탈 수 있습니다. 동물원이 큽니다. 솔직히 너무 큽니다. 내 말은 많은 다른 동물 전시관이 길게 뻗은 나무와 풀로 분리되어 있다는 것입니다. 그래서 당신은 오르막길을 많이 걷고 그 시간 동안 아무것도 보지 못합니다. 그것이 당신이보고 싶은 것이라면 좋겠지 만 낭비되는 공간이 많은 것 같았습니다. 동물 우리의 일부(많은)는 다소 작았습니다. 원숭이와 유인원 부분은 작았습니다. 공원은 비교적 깨끗하고 다양한 길을 따라 많은 포장 마차가 있습니다. 불행히도 그들은 모두 소시지, ""콘도그"", 어묵과 같은 것을 막대기로 판매합니다. 그리고 커피. 나쁜 맛의 커피. 막대기의 ""고기""는 꽤 나빴습니다. 여기 욕실을 사용하지 마십시오. 지하철에서 사용하거나 시간이 있으면 길 건너 박물관에 가십시오. 동물원 뒤쪽에서 스카이 리프트를 타고 산책을 할 수 있습니다. 재미있고 정말 멋진 광경을 볼 수 있습니다. 사람들이 떠나기 시작할 때 긴 줄을 예상하십시오. 참고로, 스카이 리프트에서 옷을 조심하십시오. 앉을 때 미니스커트를 조정하십시오. 한국을 처음 방문한다면 담요와 매트를 깔고 야영을 하는 사람들을 곳곳에서 볼 수 있습니다. 그들은 노숙자가 아닙니다. 그들에게 잔돈을 주지 마십시오. 동물원은 친구나 가족과 함께 하루를 보내기에 아주 좋은 공원입니다. 편안한 신발을 신으십시오. 간식과 물을 가져오세요. 젖은 티슈를 가져 오십시오."
69,"애들데리고 가기 너무 좋은곳, 가격싸고 볼거리 많고, 약간 많이 걸어야하는 경우가 있지만 약간의 운동은 모두에게 좋을듯. 입장료는 싸지만 케이블카는 싸지 않네요. 다양한 동물들을 볼 수있어 좋네요. if you want to visit a zoo that's not too pricey but has lots of things to see would be this place. it is really big place so get ready to walk for a bit. the zoo entrance fee itself is quite cheap but the cable lift is pricey. my kids love this place."
70,동물원이 세계에서 10번째로 크다고 발표되었지만 약간 관리가 제대로 되지 않고 더 이상 동물이 전시되지 않는 곳이 있습니다. 봄의 시작을 알리는 것인지도 모르겠습니다. 이것은 여전히 ????지하철 안에 있지만 명동에 머무르는 곳에서 멀리 떨어져 있습니다. 여전히 지하철과 연결되어 있지만
71,"매우 훌륭하고 큰 동물원, 우리는 5 시간 동안 거기에 있었고 모든 것을 보지 못했습니다. 일요일에 꽤 붐볐음에도 불구하고 공원은 군중 속에 갇힌 느낌이 들지 않을만큼 충분히 큽니다. 아주 멋진 파빌리온(특히 호랑이 부분)이 있지만 불행히도 특정 동물을 위한 아주 작은 새장도 있습니다. 3월 말은 여전히 ??약간 춥고 일부 동물은 여전히 ??내부에 보관되어 있으며(동물 애호가로서 이에 대한 불만은 없음) 잔디와 꽃이 여전히 자리 잡고 있어야 합니다. 나는 확실히 그 장소를 추천합니다. 꼭 방문해야 하지만 4월 중순이나 그 이후에 가는 것이 좋습니다. 가격도 매우 저렴(성인 3000원)"
72,"이 곳을 방문하기 전에 잘 쉬고 편안한 신발을 신고 음료수와 간식을 준비해야합니다. 왜냐하면이 곳을 보려면 하루 종일 걸릴 것입니다. 서울대공원은 3개의 공원이 하나로 되어 있습니다. 동물원, 서울랜드 테마파크, 과학관이 있습니다. 그래서 모든 연령대가 포함됩니다! 모두를 위한 무언가가 있습니다! 다른 입장료, 동물원의 경우 물어보면 약 3,000원 ??할인입니다. 볼 것이 너무 많으며 큰 동물원이기 때문에 걸을 준비가되었습니다. 싱가포르보다 더 크다. 디자인은 울타리가 없는 개방형 동물원이지만 겨울이었기 때문에 일부 동물은 인클로저에 있었습니다. 산책로가 있기 때문에 어떤 동물을보고 싶은지 계획해야합니다 (바닥에 색칠 된 색상 조정). 서울랜드 테마파크는 그냥 구경만 했어요. 내가 서 있던 곳에서 좋아 보인다. 그것은 또한 성인과 어린이 모두를위한 놀이기구로 큽니다. 그랜드 파크 건너편에는 과학 박물관인 새 건물이 있습니다. 오후 5시경에 문을 닫으므로 이 곳을 보고 싶다면 다른 곳보다 우선순위를 두십시오. 2. 아이들을 위한 멋진 박물관입니다."
73,우리는 슬로프 걷기를 절약하기 위해 동물원 상단으로 체어 리프트를 가져갔습니다. 체어 리프트에서 내린 후 유리 인클로저 덕분에 대부분의 동물을 가까이에서 볼 수 있습니다. 대부분의 동물은 상당히 활동적이며 구멍에서 잠자는 것이 아닙니다. 화장실은 동물원 전체에 풍부하고 깨끗하게 유지됩니다. 성수기가 아니기 때문에 스낵 식품을 판매하는 키오스크가 가깝고 아직 실내 식당이 있기 때문에 괜찮습니다. 나는 동물을 안전하게 가까이에서 볼 수있는 기회를 위해이 동물원을 적극 추천합니다.
74,"지하철 역 바로 밖, 명동에서 지하철로 약 30분. 동물원과 놀이동산, 장미정원이 있습니다. 섹션별로 요금이 별도로 부과되므로 원하는 곳을 선택하기만 하면 됩니다. 공원 자체는 무료이며 공원 내 교통비만 지불하면 됩니다. 공원 주위를 순환하는 코끼리 기차는 다양한 섹션과 3개의 다른 ""스카이 라인""에서 정차합니다. 단풍이 물든 연못과 강이 있어 경치가 아주 좋고, 많은 한국인들이 소풍을 하고 가족단위로 놀이동산과 동물원을 찾는다."
75,"서울 도심 속 자연을 볼 수 있는 좋은 곳입니다. 동물원에서만 돌아다녀도 하루가 걸렸다. 우리가 공원에 도착했을 때 코끼리 모양 버스, 케이블카 및 입장료를 탈 수 있는 표를 사십시오. 그곳에서 다양한 종류의 사랑스러운 동물들을 볼 수 있습니다. 유일한 것은 음식의 맛이 레스토랑에서 맛있지 않고 맛에 비해 비싸다는 것입니다. 튀긴 감자와 바베큐의 길거리 음식은 괜찮습니다. 2,500원에 한 잔의 맥주도 즐길 수 있습니다. 동물원에서 하루를 보낸 후 우리는 걷는 것이 너무 지쳤습니다. 여하튼 특히 동물을 사랑한다면 정말 좋은 곳입니다."
76,"1. 매우 접근하기 쉽고 지하철과 직접 연결되며 짧은 코끼리 또는 스카이 라인 여행으로 들어갑니다. 1 세와 함께 우리는 기차를 선호했습니다. 그러나 스카이 라인은 길 아래에 그물이있어 매우 안전하므로 스카이 라인을 통해 돌아 왔습니다. 2개의 탈의실이 있는 약 30분입니다. 산 주변은 볼 가치가 있습니다. 그것이 당신의 관심이라면 사랑스러운 관광. 2. 매우 깔끔하고 조직적입니다. 주황색, 노란색, 파란색, 갈색 라인을 따라 사슴 공원, 새, 아프리카 사파리와 같은 특정 투어를 해보세요. 돌고래 루트 등 우리는 돌고래와 새를했습니다. 새 하나는 대부분 내 아기를 편안하게 유지하는 냉각 장치가 있는 건물 안에 있기 때문입니다. 돌고래 쇼와 물개 쇼는 10 분 정도였습니다. 추가 지불 없음. 3. 음식 판매점, 화장실, 수유실은 매우 저렴하게 사용할 수 있습니다. 그냥 피크닉 매트를 들고 거기에서 음식을 구입하십시오. 그들은 버거 킹, 카페 티아모, c4u, 한국 음식 레스토랑 및 길거리 음식을 저렴하게 가지고 있습니다. 4. 유모차를 고용하는 것은 좋은 생각입니다. 유모차는 충분한 공간과 그늘이 있어 매우 편안합니다. 부피가 큰 것을 가지고 다니지 마십시오. 하루종일 2000원. 5. 삼림욕은 트레킹과 시간이 필요하다. 우리는 다음 방문을 위해 그것을 건너 뛰었습니다. 6. 확실히 한 번 방문으로는 충분하지 않습니다. 너무 많이 걷고, 너무 많이 볼 수 있습니다. 자녀가 동물원을 좋아하거나 조류 관찰자라면 매우 가치가 있습니다. 7. 성인 2명과 아기 1명이 1일 여행을 4만원 미만으로 커버했습니다. 이것은 모든 것을 더 멋지게 만듭니다. 나는 두 번째 방문을 확신합니다. 그리고, 오. ...세계 5대 동물원에 랭크되었습니다 ??"
77,그냥 동물원입니다. 기차를 탈 수 있어요? 그리고 봄이나 가을을 바라보면 너무 노멀이지만 겨울과 여름은 침대
78,이것은 아마도 우리가 서울에 있는 동안 방문한 모든 관광지 중에서 가장 마음에 들지 않는 곳이었을 것입니다. 그러나 나는 그것이 9일의 방문의 마지막 날인 것에 의해 아마 약간 흐려진다는 것을 인정할 것이다. 그리고 우리는 지쳤다. 우리는 지하철로 도착했고 동물원 입구까지 걸어가는 것이 우리의 팁이었을 것입니다. 일종의 긴 산책로. 양쪽의 노점상들이 긍정적인 부분이었습니다. 우리는 그들의 상품을 보고 동쪽으로 향하는 것을 즐겼습니다. 거기에서 거대한 입구 지역을 가로질러 동물원 입구까지 스키 리프트를 위한 loooong 라인까지 걸어갑니다. 스키 리프트를 타고 산의 측면까지 올라가 동물원을 통해 산을 내려가는 것이 좋습니다. 이것은 매우 현명한 제안입니다. 그러나 1/2 정도 올라가는 리프트가 하나 있으며 나머지는 다른 리프트로 전환해야 합니다. 두 번째 리프트에는 다시 거대하고 느린 줄이 있었기 때문에 우리는 그곳에서 시작하여 동물원을 방문하기로 결정했습니다. 동물원 자체는 매우 실망스러웠습니다. 그것은 아시아에서 가장 큰 동물원 중 하나로 청구되며 다른 동물원을 방문하지 않았기 때문일 수 있습니다. 그러나 이것은 좋은 동물원이 아닙니다. 동물의 종류가 많지 않고 그들의 인클로저가 매우 오래되었습니다. 전체 장소가 나에게 일종의 실행처럼 느껴졌습니다. 우리는 미국의 많은 동물원을 방문했습니다. 그리고 각 동물원은 항상 적어도 하나의 특별하거나 독특한 전시품을 가지고 있는 것 같습니다. 여기가 아닙니다. 모든 한국 가족들과 하루 종일 어울리고 밖에 있는 방법으로 방문하는 것은 재미있었지만 모든 산책의 가치가 있는 것은 아닙니다.
79,"최근에 나는 야생 동물 사진에 초점을 맞춘 사진 워크샵을 진행했습니다. 동물을 스토킹하고 사진을 찍으려고 하는 대신, 우리는 서울 동물원으로 향하여 피험자를 찾을 확률을 높였습니다. 네, 동물원 - 사진을 찍기에는 좀 애매한 곳이라고 생각했던 곳입니다. 글쎄, 나는 많은 면에서 틀렸다. 첫째, 서울 동물원은 더 이상 칙칙한 동물 전시물이 있는 3급 공원이 아니며 동물에 대한 최적의 보살핌도 받지 못합니다. 장소는 단순히 놀랍습니다. 좋은 봄날에 있다는 것은 거대하고 깨끗하고 아름답고 진정한 기쁨입니다. 전시회에는 크레인, 황새 및 기타 물새의 거대한 인클로저를 포함하여 많은 워크 인이 포함되어있어 일반 대중이 난간 이외의 장벽없이 넘어 가고, 수영하고, 날아 다니는 새를 볼 수 있습니다. 새들이 말 그대로 당신 주위에서 펄럭이는 열대 새들을 위한 다른 워크인이 있습니다. 그리고 호랑이 전시회는 정말 예외적입니다. 하지만 당연히 대형 전시회는 아닙니다! 둘째, 사진을 찍기 좋은 곳입니다. 때로는 배럴에서 물고기를 쏘는 것만큼 쉽습니다. 그러나 비행 중 크레인을 잡으려고 하는 것과 같은 다른 경우에는 현장에서 고품질 야생 동물 사진을 찍는 데 무엇이 필요한지 알 수 있습니다. 또한 유비쿼터스 셀카봉을 들고 구애를 하는 젊은 커플도 많이 있었습니다. 당연히 그 장소에는 공정한 몫보다 더 많은 아이들이 있었지만 장소가 정말 넓기 때문에 더 작은 공원에 쉽게있을 수 있었기 때문에 발이 떨어지지 않았습니다. 동물원에서 그렇게 즐거운 시간을 보낸 지 수십 년이 되었습니다. 마지막은 샌디에고 동물원이었습니다. 서울 동물원은 (아직) 샌디에고 동물원과 같은 수준은 아니지만 그 수준에 가까워지고 있습니다. 입장료 3,000원에 서울 동물원은 한국의 숨은 보석 중 하나여야 합니다. 서울대공원 서울동물원은 경기도 서울 남단에 위치하고 있습니다. 서울 동물원은 지하철역에서 도보(또는 트램)로 1.5km 떨어져 있습니다. 지하철 2번 출구에서 약 0.5km 떨어진 곳에 1km 엘리베이터가 있습니다. 관람시간 : 오전 09:00 ~ 오후 19:00 (계절에 따라 일부 전시관은 오후 5시 마감) 입장료 : 대인(19세 이상) : 3,000원 ??청소년(13~18세) : 2,000원 ??소인(6세~ 12): 1,000원. 6세 미만은 무료입니다. 식물원과 돌고래 쇼는 추가 비용이 듭니다. 서울 동물원 가는 방법: 4호선 서울대공원역 하차 후 2번 출구로 나오세요. 지도를 따라가세요: http://www.exploringkorea.com/seoul-zoo-seoul-grand-park/에서 지도 보기"
80,"나는 과천에 위치한 서울 대공원을 방문했고 전반적으로 긍정적인 경험이었습니다. 나는 동물원 섹션 만 방문하고 놀이 공원 인 서울 랜드는 방문하지 않았습니다. 내 친구들은 서울랜드가 롯데월드나 에버랜드에 비하면 별로 가치가 없다고 하더군요. 동물원에는 모든 종류와 종, 모든 대륙의 많은 동물이 있습니다. 파충류, 큰 포유류, 물개, 코끼리, 사자 등 생각할 수 있는 모든 것이 있습니다. 이 공원은 또한 산 사이에 완벽하게 위치하고 있으며 멋진 전망을 제공합니다. 또한 식사 및 스낵 옵션이 상당히 다양합니다. 공원에 대한 나의 더 큰 불만은 약간 무너진 느낌이 든다는 것입니다. 인클로저는 상당히 오래되었고 일부 동물은 약간 건강에 해로운 것처럼 보였습니다. 또한 일종의 테마(사파리, 다양한 clades 또는 cintinents를 위한 테마), 동물 또는 직원과의 더 큰 상호 작용을 허용하는 특별 이벤트, 어린이 전용 세션이 없습니다."
81,도시에서 벗어나 하루를 보내기에 좋은 곳입니다. 우리는 아침 일찍 가서 학교 그룹이 도착하기 전에 처음 한 시간 동안 동물원을 거의 혼자 가졌습니다. 그들이 문제가 아니라 오히려 그 반대였습니다. 그들이 다른 동물에 대해 배울 때 얼마나 잘 행동하고 세심한지 보는 것이 좋았습니다. 하늘길은 재미있었고 우리에게 산책을 구해줬고 동물원과 공원의 식물과 꽃은 모두 아름다웠습니다.
82,시부모님은 저와 아내를 서울대공원으로 데려갔습니다. 우리는 동물원에만 갔지만 그만한 가치가있었습니다. 선선한 기온에도 불구하고 곳곳에 봄꽃이 활짝 피었습니다. 시어머니가 돌아다니려면 휠체어가 필요해서 공원에서 휠체어를 빌렸습니다. 유일한 문제는 가파른 언덕이었지만 우리 모두는 그녀를 밀어냈습니다. 비용은 최소한이었다. 적은 인파로 인해 입구 근처에 주차할 수 있었습니다. 코끼리 기차도 1인당 1달러 정도가 좋았습니다. 많은 커피와 음식 장소가 어디에나 있었습니다. 그들은 돌고래 쇼를 취소했습니다. 그러나 다른 모든 전시회는 가능했습니다. 공원은 자동차와 지하철로 접근할 수 있습니다. 그래서 그것을 하려는 사람들을 위한 놀이기구의 카니발도 있습니다. 발표는 한국어와 영어였다. 가고 싶은 오후가 있다면 꼭 가보세요. 그들은 또한 당신을 돕기 위해 다양한 언어로 된 가이드 북을 가지고 있습니다.
83,나는 그것을 사랑한다! 우리는 동물원에 가서 스카이 리프트를 타고 동물들을 관찰했습니다. 식물원 너무 좋아요. 동물원 자체가 정말 예쁘다.
84,"서울 남쪽에 있는 아름다운 녹색 공원입니다. 대부분의 사람들이 동물원이나 테마파크를 방문하기 위해 이곳을 찾는 반면, 공원 자체는 1~2시간 동안 평화로운 산책을 즐길 수 있습니다. 공원은 인근 지하철(4호선 서울대공원역)으로 쉽게 접근할 수 있지만 공원이 거대하기 때문에 약간의 거리를 걸어야 합니다."
