,번역
85,"아마도 나는 최근에 미국의 몇몇 동물학 시설을 방문했고 오하이오주 콜럼버스 출신으로 저명한 동물 전문가인 Jack Hannah가 수년 동안 동물원 디렉터였으며 명예 디렉터로 남아 있다는 사실에 실망했을 것입니다. 서울대공원 동물원이 가장 마음에 들었던 점은 바로 접근성입니다. 그것은 찾기가 매우 쉽고 접근하기가 매우 쉽습니다. 그것은 수도권 서울의 일부인 과천과 같은 한국 도시에 대해 많은 것을 말해줍니다. 서울대공원의 부지는 넓다. 그냥 가서 하이킹을 하기 좋은 곳이고, 그렇게 하기 위해 그곳에 가는 많은 현지인들을 볼 수 있습니다. 보도는 셔틀 버스 및 서비스 차량의 진입로로 두 배이므로 매우 넓습니다. 공원은 당신이 앉아서 휴식을 취할 수 있는 아름다운 거대한 활엽수와 푸른 잔디의 작은 섬으로 가득합니다. 많은 사람들이 한국식 목재 데크를 가지고 있으며 지역의 맛이 나는 미적인 덮개를 하고 있으며 아프리카를 테마로 한 지붕이 덮인 정자가 있어 단체로 쉴 수 있는 곳도 있습니다. 서울대공원은 동물원이 아니라 다양한 부분이 있습니다. 주차장에서 당신은 일반 공원 입구로 이어지는 나무가 늘어선 넓은 산책로를 찾을 수 있습니다. 공원 전체에 적절한 서양식 화장실 시설이 있습니다. 공원으로 리프트를 타거나 여러 승객 플랫폼을 견인하는 견인 차량인 ""코끼리 기차""를 타는 옵션이 있습니다. 그래도 자녀를 잡으십시오. 운전자에게는 정지 및 탈출 속도의 두 가지 속도만 있습니다. 코끼리열차는 1회 이용시 약 600원이며 동물원 입구와 다른 공원까지만 이동합니다. 총 3~4곳 정도 있었던 것 같아요. 동물원 입구에서 1회 입장료는 성인 3,000원입니다. 그들은 당신에게 전체 파티에 대해 한 장의 티켓 만 줄 것이며 티켓에 인원 수가 표시되므로 동물원 입구를 통과하기 전에 헤어지지 마십시오. 일단 동물원에 들어가면 기반 시설의 명백한 마모에 정말 실망했습니다. 어디를 가나 시설은 페인트 칠과 녹 처리를 요구했습니다. 우리는 다양한 ""무리"" 동물을 많이 만났고 그들은 광대한 야외 인클로저에 있었습니다. 제 생각에 동물들에게는 좋은 일이지만, 대부분 너무 멀리 떨어져 있어 실제로 관찰할 수 없었습니다. 다행히 공원에는 동물의 주조된 복제품이 가득합니다. 그것은 내가 추측하는 아이들에게 많은 사진 기회를 제공합니다. 우리가 정말 보고 싶었던 것 중 하나는 서울대공원 동물원 영어 웹페이지에 광고된 돌고래 쇼였습니다. 마침내 해양관을 찾았을 때 매표소에는 셔터가 내려져 있었습니다. 돌고래 쇼의 공연 일정이나 입장료를 알려주는 표지판이 없었고 주변에 물어볼 사람도 없었습니다. 해양관 주변에 여러 해양 서식지가 건설되었지만 잘 보존되지 않았습니다. 물은 짙은 녹색 색조로 더러워졌고 서식지의 벽은 몇 년 동안 다시 칠하지 않았으며 페인트가 몇 년 동안 방치되어 닳았거나 표면이 부서진 곳이 많았습니다. 해양 포유류가 열악한 환경 때문에 수년에 걸쳐 죽었다고 해도 나는 놀라지 않을 것입니다. 결국 서식지마다 바다사자의 종류가 한 두 마리밖에 없었고 너무 건강해 보이지 않았습니다. 그들은 거의 물 밖으로 나오지 않았고 너무 더러워서 그들을 보는 것이 거의 불가능했습니다. 나중에 안내원에게 돌고래 쇼에 대해 물었고 그녀는 영어 웹 페이지에 광고가 있음에도 불구하고 돌고래 쇼를 2년 넘게 한 번도 본 적이 없다고 말했습니다. 해양 전시관 외부의 모습에서 나는 그들이 동물이 죽어감에 따라 마모로 해양 전시물을 제거하기를 희망하고 있다고 확신합니다. 확인 할 수는 없지만 일반적으로 해양 전시관 및 주변 해양 서식지의 유지 관리 부족, 공연 부족, 서식지에서 쓰레기를 청소하거나 물을 바꾸는 것만으로 동물을 돌보지 않는 것은 매우 의심됩니다. . 산양전시장에 높은 점수를 주겠다. 그들은 정말 높은 바위 절벽 산을 제조했으며 거의 ??모든 사용 가능한 선반과 고원에 거대한 염소 떼가 펼쳐져 있었고 좁은 바위 길에서 서로를 지나치며 적극적으로 오르락 내리락했습니다. 자연스러운. 그들이 얼마나 확실한지 보는 것은 굉장했고 나는이 전시회가 실제로 동물의 본질을 포착했다고 느꼈습니다. 기린 서식지도 잘 만들어졌습니다. 내가 거기에 있었을 때 야외에 세 곳이 있었고 그들은 2층 플랫폼을 가지고 있어서 그들이 그렇게 가까이 오면 눈을 마주할 수 있습니다. 미어캣도 정말 재미있게 봤습니다. 전시장에는 3개밖에 없었지만 조금 작아 보였다. 흥미로운 점은 펜이 상대적으로 작았고 짧은 플렉시 유리 벽으로 고객과 분리되어 있었다는 것입니다. 감독되지 않은 아이들이 쓰레기를 먹이는 것은 쉬울 것입니다. 나는 내가 거기에 있는 동안 한 아이가 무언가를 먹고 있다는 것을 알아차렸고 작은 미어캣 중 하나가 그의 옆으로 급히 달려가서 먹을 수 있는 것이 오는지 확인하기 위해 플렉시글라스 안에 서서 기다리고 있었습니다. 하지만 이 작은 녀석들을 가까이서 볼 수 있어서 즐거웠습니다. 그들은 사랑 스럽다! 동물원에 입장할 때 받는 브로셔에는 공원 주변을 운행하는 셔틀 버스가 있어 장소 사이 또는 출구로 이동할 수 있다고 나와 있지만, 우리는 브로셔에 정류장으로 표시된 모든 장소에 있었고 버스를 본 적이 없습니다. 운영. 내가 떠날 때 안내원에게 물었을 때 그녀는 버스가 하루 일찍 운행되고 있다고 말했지만 우리는 약 4 시간 동안 거기에 있었고 버스를 한 번도 본 적이 없다고 말했습니다. 동물원과 주변 언덕을 가로지르는 언덕을 하이킹하면서 좋은 운동을 하고 거대한 활엽수에서 목욕을 하고 싶다면 이곳이 제격입니다. 결국 입장료는 3000원. 아마도 그것은 내가 미국에서 방문한 동물원의 청결함과 더 나은 관리의 차이일 것입니다. 모든 동물원은 입장료가 훨씬 더 높습니다. 미국 동물원에서도 물 한 병에 3달러 이상을 지불해야 하지만 여기 서울 그랜드 파크의 생수는 1,000원에 불과하며 공원 전체에 무료 분수, 음식, 기념품/장난감 가게가 있습니다. 동물원에 입장하면 유모차 대여가 가능하고 코인 로커도 있는데 500원 정도 했던 것 같아요."
86,"나는 여기에서 몇 가지 다른 리뷰를 읽었으며 일반적으로 같은 감정을 공유합니다. 동물원 자체는 놀랍습니다. 전 세계에서 수많은 동물을 볼 수 있습니다. 장미 정원도 훌륭합니다. 나는 모든 것을 넘어서 놀라운 전망을 제공하는 곤돌라를 탔습니다. 그러나 나는 동물에 대해 약간 걱정합니다. 말 그대로 새장에서 약 3피트 떨어진 곳에 손을 놓고 동물에게 먹이를 줄 수 있습니다. 나는 긴팔 원숭이에게 치토스를 주는 사람들을 보았다. 좀 웃기긴 했지만 보면서 죄책감이 들었다. 다른 나라, 동물원 운영 방식에 대한 견해는 다르지만 전반적으로 즐거운 시간을 보냈습니다."
87,"나는 일반적으로 동물원의 열렬한 팬이며 이 동물원을 보기를 고대하고 있었습니다. 당신은 거기에 도착하는 직접적인 지하철 노선이 있습니다. 동물원은 하루 종일 입장하는 데 3 달러와 같이 정말 저렴했습니다. 많은 동물을 볼 수 있습니다. 나는 그것을 사랑했다. 하지만 한 가지 언급할 점이 있습니다. 그곳에서 동물들을 돌보는 것에 대해 걱정이 됩니다. 동물들이 최상의 상태가 아니며 행복하지도 않다는 것을 알 수 있습니다. 특히 재규어 케이지는 매우(!) 작습니다... 그래서 이 사실이 저의 방문의 어두운 면이었습니다 :(하지만 동물원은 동물원에 있습니다 아름다운 환경, 그래서 당신은 정말로 도시에서 탈출 한 느낌이 듭니다."
88,"나는 휴일에 갈 때마다 동물원을 방문하는 것을 좋아합니다. 그러나 내가 방문한 날에는 약간의 비가 내렸다. 동물원은 실제로 거대한 공원 안에 있습니다. 동물원 자체를 한 바퀴 도는 것은 규모 때문에 자연 속 산책을 하는 것과 비슷합니다. 건물 중 일부는 약간 낡았고 허물어졌습니다. 새가 거기에 있었지만 새 전시는 방문자에게 모두 닫혔습니다(이유를 말하는 한국 표시를 읽을 수 없음). 호랑이 전시회는 새로운 지역에서 개조되었습니다. 다른 동물들은 내가 갔을 때 비교적 ""행복한"" 것 같았습니다(도쿄 우에노 동물원의 동물들이 신경증이 된 것처럼 보이는, 즉 원을 그리며 걷는 것 등)은 매우 조용해서 좋았습니다."
89,내 여보와 나는 5월에 동물원에서 멋진 하루를 보냈습니다. 이곳은 넓기 때문에 편안한 신발은 필수입니다. 사자와 뱀 구덩이는 지금까지 내가 가장 좋아하는 것이었습니다. 그러나 나는 음식 선택이 그렇게 좋지 않았다고 말할 것입니다. 그냥 내 의견. 세 부분 패키지 거래를 구입해야 합니다.
90,이 장소는 훌륭했고 너무 커서 우리가 피곤하고 하루 동안 너무 더워지기 전에 모든 것을 할 수 없었습니다. 많은 동물이 있고 그들은 인클로저를 멋지게 만들었습니다. 가이드 맵은 영어로 되어 있었지만 영어를 구사하는 직원은 거의 없었습니다. 그러나 우리가 동물을 보고 싶었기 때문에 이것은 그다지 중요하지 않았습니다. 그들은 입장료에 포함 된 놀라운 돌고래와 물개 사자 쇼를했습니다. 다양한 종류의 사랑스러운 식물이 있는 인상적인 온실이 있었습니다. 우리는 또한 조감도를 얻기 위해 스카이 리프트를 탔고 (앞으로 돌아 가기) 매우 비싸지 않았습니다. 동물원은 금연이어서 좋았습니다. 몇 가지 음식 옵션이 있었고 하나는 김치 바를 제공하는 좋은 한국 음식 옵션이 많았습니다. 완료하는 데 각각 약 2시간이 걸리는 특정 루프를 수행하려는 경우 경로를 따라 컬러 라인이 있었습니다. 우리는 이것을 사용하지 않았지만 좋은 옵션이었습니다. 전반적으로이 동물원은 거대하고 매우 훌륭하게 이루어졌습니다. 우리는 우리가 방문할 수 있어서 기뻤고 우리가 전체 장소를 볼 수 없어서 조금 슬펐습니다(또는 다른 날에 다시 돌아올 시간이 있습니다).
91,우리는 동물원과 장미 정원에 갔다. 동물원은 거대하고 우리는 그곳에서 반나절 이상을 보냈고 시간을 들여 공원 전체를 탐험했습니다. 장미 정원은 아름답고 우리가 거기에 있었을 때 공연이 진행 중이었습니다.
92,동물원에 가려고 서울대공원에 갔다. 우리는 이 장소가 얼마나 거대한지 깨닫지 못했습니다! 거기에는 할 일이 많고 우리는 하루 이상을 보내고 더 많은 일을 할 수 있었습니다. 동물원은 일반적으로 좋지만 일부 전시품은 약간 실망스럽습니다. 나는 일부 동물의 복지에 대해 약간 걱정했습니다. 그러나 그들은 개선될 것이라는 희망을 갖고 몇 가지 일을 하고 있습니다. 주변 지역은 환상적입니다. 숲의 많은 멋진 전망. 분명히 하이킹 코스도 많이 있습니다. 다음에 더 잘 볼 수 있도록 케이블카 옵션도 있습니다!
93,동물원에 가지 않고 벚꽃을 보러 특별히 왔습니다. 벚꽃이 만발하고 군중이 여의도 공원만큼 많지 않았기 때문에 공원 전체를 사랑합니다.
94,"어린이 공원, 동물원, 어린이 박물관 등 대부분의 물건은 무료입니다. 좋은 운동화 신고 몸을 따뜻하게 하세요!!!! 1 월과 3 월에 갔다가 다시 갈 것입니다."
95,"어제 날씨가 추워서 손님이 거의 없었어요. 그 지역은 거대했고 견딜 수없는 추위로 어린 아이들과 함께 여행하기가 어려웠습니다. 꼭 방문해야 하는 경우 여기를 추천합니다. 지하철에서 나와 5-10분 정도 직진하면 바로 앞에 건물이 있습니다. 여기에서 트램 틱을 구입하십시오. 어린 아이들과 함께 동물원에 가려고 하지 마십시오. 매우 먼 거리입니다. 최소 15분. 트램은 서울 동물원과 서울 랜드로 이동합니다. 동물원에서 내려 동물원 진드기와 스카이 리프트 진드기를 구입하십시오. 그들은 다른 카운터에서 판매됩니다. 동물원 꼭대기까지 스카이 리프트를 타고 천천히 내려갑니다. 스카이 리프트는 약 10분이며, 전체 지역의 멋진 전망을 제공합니다. 내 생각에 돈 가치가 있습니다."
96,"서울의 대공원은 매우 커서 서울 동물원까지 걸어서 1.5분 정도 걸립니다. 풍경은 훌륭합니다. 키가 큰 나무, 시원한 날씨, 산을 배경으로 한 배경으로 제가 이른 아침에 거기에 갔을 때 서울의 노인 그룹이 이리저리있었습니다. 내가 싱가포르 동물원에 가장 익숙하기 때문에 동물원에 대한 나의 기대치는 높은 편이다. 서울의 동물원은 저에게 광대합니다. 볼 동물은 많지만, 보려면 걷는 데 시간이 걸립니다. 내가 월요일 아침에 거기에 있었을 때 많은 음식과 음료 매장이 열리지 않았습니다. 대부분의 간판에 이러한 정보가 한국어로만 표시되어 있기 때문에 한국인이 아닌 사람들이 동물에 대해 더 많이 배우는 것도 어렵습니다. 약간의 영어가 확실히 도움이 될 것입니다! 공원은 꼭 가봐야 할 곳은 아니지만 도시의 번잡함에서 벗어나 휴식을 취하고 싶다면 좋을 것 같아요. 나는 2013년 10월에 이곳에 있었고 날씨는 서서히 가을로 변하고 있었습니다. 서울에서 가을의 전체 작품을 보려면 11 월에 거기로 가십시오."
97,"나는 2013년 10월에 이곳을 방문했는데 날씨가 이 곳을 여행하기에 정말 좋았습니다. 우리가 왔을 때 모든 동물은 여전히 ????잠드는 것 같습니다 (약 10am). 이 곳은 냄새가 나지 않고 잘 관리되어 있으며 한 곳에서 다른 곳으로의 트랙이 쉽고 15 분마다 무료 셔틀 버스를 제공합니다. 우리는 돌고래 쇼를 무료로 보았고 어쩐지 재미있습니다. 캥거루에게 먹이를 줄 수 있는 캥거루 먹이주기 체험과 새의 낙원(굉장합니다!!)도 놓치지 마세요. 방문하려면 지하철 4호선 서울대공원역 2번 출구를 이용하세요. 입장료는 3000원, 스카이리프트는 동물원 입구에서 9000원(인근 사자호랑이 전시관). 동물원을 위에서 내려다보는 풍경이 좋기 때문에 스카이 리프트를 사용하는 것이 좋습니다."
98,걸어서 동물원을 마칠 수 있습니다. 내가 방문하는 동안 호랑이가 없었고 수족관은 폐쇄되었습니다. 그래도 사랑스러운 기린!
99,"이것은 깨끗하고 아름답게 배치된 정말 멋진 동물원입니다. 그것은 또한 저렴합니다. 많이 걸을 준비를 하고 있지만 볼 생물이 너무 많습니다. 우리가 가장 좋아하는 곳은 아기 오랑우탄, 침팬지, 미어 고양이 및 3마리의 아기 호랑이를 본 보육원이었습니다."
100,"저희는 4인 가족이며 9살 딸과 3살 아들이 있습니다. 우리는 2013년 9월 1일에 서울 대공원에 갔고 그것을 좋아했습니다. 나는 지하철 4호선을 타고 서울대공원에서 하차하는 것을 강력히 추천한다. 2번 출구로 나가면 sgp 트램 승하차 구역까지 약 1/4마일을 걸을 것입니다. 동물원 입구가 약 1/2에서 3/4마일 오르막이기 때문에 트램을 타기 위해 비용을 지불하는 것이 좋습니다. 트램은 2,700원입니다. 트램 구역은 모두 나가서 붐비는 것처럼 보이지만 트램은 트램 사이에 약 30초 정도만 기다리면 바로 잇따라 옵니다. 그들은 소처럼 우리를 옮겼습니다! 우리는 트램에 만족했습니다. 그래서 트램이 멈췄을 때 우리는 동물원 입장권을 샀고(여기에는 다른 명소로 들어갈 수 있는 특별한 ""테마"" 티켓이 포함되어 있었습니다. 나는 그것이 장미 정원이었음을 거의 확신하지만 우리는 결코 가보지 못했습니다) 동물원(총 9,600원, 가격이 믿기지 않을 정도). 좋습니다. 일단 동물원에 도착하면 스키 리프트를 타고 꼭대기까지 올라가서 걸어 내려가서 하루라고 부르거나 운동화를 조일 수 있는 좋은 장소를 찾으세요. 정상까지 걸어가는 길은 오르막이며 사자와 다른 ""고양이""를 볼 수 있지만 그만한 가치가 있습니다. 나는 사자가 아닌 6마리 이상의 사자가 있는 동물원에 가본 적이 없습니다! 이 동물원에는 들소, 곰(수많은), 돌고래부터 사슴까지 모든 것이 있습니다. 오늘의 하이라이트는 사슴이 내 딸과 아들의 손을 먹는 것이었습니다 (직원이 권장하지는 않지만 상추 나 당근보다 어린 아이가있는 경우 아이들은 땅에서 찾은 녹색 잎을 먹였습니다. 그리고 그들은 그것을 먹었다). 우리는 이 동물원에 대해 전혀 불만이 없었습니다. 사실 그것은 우리의 기대를 날려버렸습니다. 욕실 매우 깨끗하고 음료수와 스낵을 정가에 판매하는 편의점 (동물원에 있기 때문에 잭이 아닌 음료수는 900 원) 및 다양한 동물. 팁 #1 - 여기에서 하루 종일 허용합니다. 그래서, 우리는 트램을 다시 탔고 우리가 도착했을 때 트램을 탔던 적재/하역 지역으로 곧장 갈 것이라고 생각했습니다. …아니요. 돌아오기 전에 서울랜드에 한 번 들렀다. tip #2 - 서울대공원에는 동물원보다 더 많은 것이 있다!!! 누가 알았어?? 글쎄, 우리는 그렇게하고 우리는 곧 다시 향하고 있습니다! 우리는 놀라운 하루를 보냈습니다!"
101,"서울대공원에 있는 동물원을 리뷰하기 전에 자연 서식지에서 야생 동물을 보는 것이 항상 선호된다는 점을 말씀드리고 싶습니다. 그것은 훨씬 더 스릴 있고 가치 있는 경험입니다. 동물원이 있는 한 서울대공원은 다양한 동물과 종에 대한 정확한 정보를 제공합니다. 모든 동물원 전시물은 야생 동물을 보기에는 너무 작습니다. 그러나 우리는 현대 동물원에서 대부분의 동물이 현재 포로 상태이거나 여러 가지 이유로 야생으로 돌아갈 수 없다는 것을 분명히 해야 합니다. 오늘날 동물원은 단순히 와우 요인을 위해 사나운, 이국적 또는 기이한 동물을 전시하지 않고 주로 교육을 위한 것입니다. 동물원 관리는 항상 조건과 동물이 대중에게 ""보여지는"" 방법을 개선하기 위해 노력할 수 있습니다. 그러므로 나는 서울 최고의 동물원을 전 세계의 다른 동물원들과 비교하고 있습니다. 동물원은 미국의 많은 동물원과 비슷하지만 확실히 종 다양성과 전시 품질 모두에서 샌디에고 동물원 아래에 못이 박혀 있습니다. 서울 대공원은 내가 본 중국의 어떤 동물원보다 훨씬 낫습니다. 비록 많이 사랑받는 판다를 제외하더라도 말입니다. 전시회는 더 깨끗하고 더 넓으며 간판은 내가 아시아에서(그리고 일부는 미국에서) 방문한 다른 동물원보다 훨씬 더 많은 정보를 제공합니다. 나는 여기에서 즐거운 시간을 보냈습니다. 전시회는 종종 흥미로웠습니다. 그러나 대부분의 동물원과 마찬가지로 더 크고 더 잘 보관해야 하는 개별 전시가 있었습니다. 이것은 결코 서울대공원에만 있는 것이 아니며 샌디에고 동물원에도 개조/확장이 필요한 오래된 전시물이 있습니다."
102,동물원은 지하철역에서 쉽게 갈 수 있었고 웹 사이트에는 정류장과 출구 정보가 나와있어 외국인에게 매우 도움이되었습니다. 우리는 동물원의 전망과 위치에 즐겁게 놀랐습니다. 그것은 아름다운 산악 지역에 둘러싸여 있었습니다. 입장료는 매우 합리적이었지만 방문객들은 공원 전체를 경험하려면 하루 종일 그곳에서 보낼 계획을 세워야 합니다. 우리는 거의 5시간 동안 그곳에 있었고 공원의 절반만 볼 수 있었습니다. 동물 전시는 믿을 수 없었습니다. 우리는 정말 많은 종류의 동물을 보았습니다. 우리가 간 날은 비가 조금 와서 일부 행사가 취소되었습니다. 원숭이들은 모두 최근에 아기를 가졌기 때문에 엄마들이 아이들과 상호 작용하는 것을 보는 것은 매우 깔끔했습니다. 이것은 가족 친화적 인 장소이며 서울을 방문 할 때 꼭보아야 할 명소입니다.
103,"서울대공원은 지하철 m4를 통해 쉽게 접근할 수 있습니다. 그것은 대 공원이며 자연 애호가에게 가장 적합합니다. 공원 입장료는 없지만 서울시에서 잘 관리해 주었다. 권장 사항 : a) 지하철 m4로 이동 b) 아침에 방문, 공기가 신선함 c) 모든 가족 구성원에게 적합 d) 공원이 너무 거대하고 노인에게 부담이 될 것이므로 기차를 타고 공원을 돌아보십시오. e) 동물원을 방문하십시오. 입장료는 3000원이었고 많은 동물이 있었기 때문에 가치가있었습니다. f) 동물원의 하이라이트 : Silverback 고릴라, 오전 1130시에 돌고래 쇼 g) 3-4 시간을 쉽게 보낼 수 있습니다."
104,겨울에 가기로 선택한 것은 좋은 생각이기도 하고 나쁜 생각이기도 했습니다. 잔인한 추위는 용서하지 않았지만보기는 내가 겪었던 모든 떨림과 동상의 가치가있었습니다. 동물원은 산으로 둘러싸여있어 경치가 놀랍도록 아름답고 내부의 개울이 경치를 더욱 아름답게 만듭니다. 꽤 큰 동물원 주변에 방문객을 데려 오는 버스가 있었지만 확실히 좋은 운동이었습니다. 동물원은 대부분의 인클로저가 문을 닫고 동물을 실내에 넣어 난방을 하기 때문에 겨울에 방문하기에 적합하지 않았습니다. 실내 인클로저의 상태는 꽤 나빴고 냄새는 자극적이었고 익숙해지는 데 시간이 걸렸습니다. 그래도 가장 마음에 들었던 것은 아기 동물 코너였는데 유리 패널로 분리된 다양한 동물을 가까이서 볼 수 있었습니다. 아기 표범을 가까이에서 보는 것은 훌륭했습니다. 내가 봄이나 가을에 다시 간다면 자연 인클로저에서 동물을 살펴보기 위해 다시 돌아올 것입니다. 주로 저렴한 입장료와 다양한 동물을 볼 수 있기 때문입니다. 그러나 이번에는 무료 셔틀을 타고 전체 지역을 걷지 않을 것입니다. =피
105,"이 동물들이 살아가야 하는 조건은 끔찍합니다. 동물원 주인은 동물보다 방문객을 끌어들이는 데 더 많은 관심을 갖고 있습니다....그들의 겨울 서식지는 콘크리트 감옥이었고 대부분의 동물은 눈에 띄게 불행해 보였습니다. 따뜻한 달을 위해 설정된 서식지는 실제로 더 좋아 보이지 않았고 동물이 집에서 느낄 수 있는 장소가 아니라 그냥 새장처럼 보였습니다. 나는 떠날 때 너무 슬펐고, 동물원 전체를 볼 수조차 없었습니다. 그들을 지원하지 말고 동물을 제대로 돌보는 동물원에 가십시오."
106,"우리 가족은 올해 첫 눈이 내린 직후 초겨울에 그곳에 갔다. 서울 동물원은 지하철로 쉽게 접근할 수 있는 서울대공원 클러스터에 자리잡고 있습니다. 장소는 조용하고 평화롭고 환상적이었습니다. 팀은 따뜻한 곳의 동물이 사내 보호소에 보관되므로 올바른 방향으로 우리를 안내하여 방문을 즐겁게하기 위해 최선을 다했습니다. 동물원 전문가는 아니지만 큰 고양이, 개, 맹금 및 사슴은 잘 먹고 활기차고 표현력이 뛰어나며 눈싸움을 할 눈도 많이 있습니다. 제 생각에는 특히 아이들을 위한 방문으로 정말 추천할만한 가치가 있습니다. 가격 면에서 성인 1인당 7,000원의 티켓 가격은 입구에서 길고 아름다운 케이블 타기, 동물원 입구까지의 셔틀 및 활기찬 동물을 감안할 때 매우 합리적입니다."
