,번역
107,저는 동물을 사랑하고 동물원을 사랑합니다. 동물이 올바르게 대우받을 때 말이죠. 이 동물원은 그런 곳이 아니었습니다. 동물은 가늘고 일부는 털이 없습니다. 앞뒤로 움직이는 동물들. 우리는 작은 콘크리트 슬래브였습니다(서식지 아님). 내 총각/스튜디오 아파트보다 크지 않은 새장에는 치타 3마리가 들어 있었습니다! 심지어 그 근거 자체도 칙칙했다. 나는 이 동물원에 가는 것을 추천하지 않습니다. 동물을 친절하고 존중하는 마음으로 대하는 더 좋은 동물원이 많이 있습니다.
108,그랜드파크는 지하철역 437번 근처에 있습니다. 첫 번째 이후에는 동물원 입장권을 구입해야 합니다. 두 번째 케이블 길이 더 깁니다. 그런 다음 동물원을 내려가는 것이 즐겁습니다. 다양한 동물과 새들이 많이 있습니다. 그들 중 일부는 특히 아름답습니다.
109,서울 동물원은 아이가 있든 없든 좋은 곳입니다. 거대한 공원에는 다양한 동물을 볼 수 있습니다. 그것은 많은 대화 형 디스플레이로 매우 잘 관리됩니다. 먹고 마실 많은 장소를 포함하여.
110,내가 서울대공원에서 즐겨 방문한 두 곳은 서울랜드 놀이동산과 서울 동물원이다. 서울 동물원에서의 하루는 특히 즐거웠습니다. 산책하기 좋은 곳입니다. 두 개의 다른 스카이 리프트가 하나는 낮은 지역에 있고 다른 하나는 동물원의 정상 부분에 있는 공정한 경사면에 있습니다. 우리는 스카이 리프트를 환상적인 전망과 함께 너무 즐겼기 때문에 우리는 두 스카이 리프트를 모두 타고 언덕 꼭대기까지 올라가 다양한 명소를 걸어 다녔고 우리는 그것이 깔끔하다고 생각하여 다시 더 낮은 스카이 리프트를 탔습니다! 우리가 가장 좋아했던 또 다른 것은 돌고래와 물개 쇼였습니다. 그것은 내가 본 것 중 최고였으며 모든 사람에게 거기에 가도록 권장하지만 들어가기위한 대기열은 항상 매우 길기 때문에 나중에 쇼를 위해 티켓을 구입하고 동물을보고 적어도 30 분 후에 돌아옵니다 앞줄 좌석을 원하면 쇼 시간 전에 줄을 서서 기다리십시오.
111,"서울랜드 놀이동산, 어린이과학관, 동물원, 현대미술관, 경마장 등을 만날 수 있습니다! 여기저기 걸어가는 거리가 멀기 때문에 탈 수 있는 트램이 있습니다."
