,Unnamed: 0.1,index,Unnamed: 0,서울대공원부정단어리뷰,index.1,단어,번역
0,0,0,38, After Corona many stores are missing so there is nothing to see and nothing to shop ,0,nothing,코로나 이후 많은 가게들이 없어져서 볼 것도 없고 쇼핑할 것도 없다
1,1,1,52,Dont plan to go there during national holidays like the Lunar New Year 90 of the shops and restaurants were closed On the good side at least it wasnt crowded We just happened to be there not planned and just realized that nothing to see,1,nothing,설날과 같은 공휴일에는 거기에 갈 계획이 없습니다. 90개의 상점과 레스토랑이 문을 닫았습니다. 적어도 붐비지 않았습니다.
2,2,2,244,Literally nothing much left. Food is still buzzing but shopping and street vendors are really sad... Not worth coming anymore.,2,nothing,말 그대로 얼마 남지 않았습니다. 음식은 여전히 ??붐비지만 쇼핑과 노점상은 정말 슬프다... 더 이상 올 가치가 없습니다.
3,3,3,320,Very interesting place to wonder around. So many shops and side streets full of shops. So many Korean beauty products and also Tom’s flavoured Almond shops. Also there is also a big Art box here as well. It gets busy during the day but that is nothing compared to nighttime when all the street food vendors come out. Please be careful because people will just push and shove when it’s really busy. That being said we still loved the place. Go and enjoy all it has to offer.,3,nothing,주위를 궁금해하는 매우 흥미로운 장소. 많은 상점과 상점으로 가득한 골목길. 한국 미용 제품이 너무 많고 Tom 's Flavored Almond 매장도 있습니다. 또한 여기에도 큰 아트 박스가 있습니다. 낮에는 북적거리지만 노점상들이 다 나오는 밤에 비하면 아무것도 아니다. 사람들이 정말 바쁠 때 밀치고 밀치기만 하니까 조심하세요. 그 말은 우리는 여전히 그 장소를 좋아했습니다. 가서 모든 것을 즐기십시오.
4,4,4,396,"Many shops with cheap stuff, a lot of face masks and cosmetics etc. Been there 1 hour nothing interesting",4,nothing,"저렴한 물건, 많은 안면 마스크 및 화장품 등이있는 많은 상점. 1 시간 동안 흥미로운 것이 없었습니다."
5,5,5,444,"With expectations set pretty high after watching loads of Youtube videos on this neighborhood, I was understandably left feeling 'eh' about it after getting a chance to experience this for a few days.  First off, I loved the vibe of the neighborhood, despite how crowded it became every night. That said, the neighborhood actually is not that big - two main thoroughfares, primarily, each maybe 4-5 blocks long. Lots of side streets with other shops and food options, but the main action really is on the thoroughfares. Lots of cosmetic shops, lots of cheap clothing of the Forever 21 quality level.  The street food was very much hit or miss, nothing completely mind blowing. Lots of repeat stands, but note that not all the stands have the same quality. I tried to use the length of the lines for each as a rough gauge on how good the stand may be - also a hit or miss approach.  Two tips and heads up (literally): - there are a lot of hidden eateries, cafes, and shops in all the buildings above ground level. really pay attention and look up to see what you may be missing out on! I found a few cafes that I loved - grab a coffee and a window seat and you can people watch all the action down below for awhile - garbage cans are really hard to come by. stay with the vendor you purchase food from and chuck your garbage with them after you're done, or come prepared",5,nothing,"이 동네에서 수많은 Youtube 비디오를 본 후 기대치가 꽤 높아진 상태에서 며칠 동안 이것을 경험할 기회를 얻은 후 나는 당연히 그것에 대해 '어'를 느꼈습니다. 우선, 나는 매일 밤 얼마나 붐볐음에도 불구하고 동네의 분위기를 좋아했습니다. 즉, 이웃은 실제로 그렇게 크지 않습니다. 두 개의 주요 도로, 주로 각각 4-5블록 길이입니다. 다른 상점과 음식 옵션이있는 많은 골목길, 그러나 주요 활동은 실제로 도로에 있습니다. 많은 화장품 가게, Forever 21 품질 수준의 많은 값싼 의류. 길거리 음식은 아주 많이 히트하거나 놓쳤습니다. 반복 스탠드가 많지만 모든 스탠드의 품질이 동일한 것은 아닙니다. 나는 스탠드가 얼마나 좋은지 대략적인 척도로 각 라인의 길이를 사용하려고 노력했습니다. 두 가지 팁과 주의사항(문자 그대로): - 1층 위의 모든 건물에는 숨겨진 식당, 카페, 상점이 많이 있습니다. 정말로 주의를 기울이고 무엇을 놓치고 있는지 찾아보십시오! 나는 내가 좋아하는 몇 개의 카페를 찾았습니다. 커피와 창가 자리를 잡고 잠시 동안 아래에서 모든 활동을 볼 수 있습니다. 쓰레기통을 찾기가 정말 어렵습니다. 음식을 구입한 공급업체에 머물고 음식을 마친 후 쓰레기를 버리거나 준비를 하십시오."
6,6,6,462,Shopping street bustling with tourists and locals alike. Worth a visit... or 2... street food was expensive and had nothing to shout about though,6,nothing,관광객과 현지인으로 붐비는 쇼핑 거리. 방문할 가치가 있는 ... 또는 2... 길거리 음식은 비싸고 외칠 것이 없었습니다.
7,7,7,531,"This is probably the best street if you want to have some shopping in the very city center of Seoul. There're lot of stores, bar, cafe and restaurants, but in my opinion the fashion stores are too commercial and nothing special, they don't represent a good picture of the Korean style. Besides prices are higher compared to the other stores and bar that you can find in the city. Very recommended to young people or to people who like this kind of commercial tourism!",7,nothing,"서울 도심에서 쇼핑을 하고 싶다면 이곳이 가장 좋은 거리일 것입니다. 많은 상점, 바, 카페 및 레스토랑이 있지만 내 생각에 패션 상점은 너무 상업적이고 특별하지 않으며 한국 스타일의 좋은 그림을 나타내지 않습니다. 게다가 가격은 도시에서 찾을 수 있는 다른 상점과 바에 비해 높습니다. 젊은 사람들이나 이런 종류의 상업 관광을 좋아하는 사람들에게 매우 추천합니다!"
8,8,8,580,I expected much more from this place. It was basically streets of lots of facial stuff and nothing much more. The clothing and other stuff like electronics are sooo limited. Was a disappointment for me,8,nothing,나는이 장소에서 훨씬 더 많은 것을 기대했습니다. 그것은 기본적으로 많은 얼굴 재료와 그 이상은 아무것도 없는 거리였습니다. 의류 및 전자 제품과 같은 기타 물건은 너무 제한적입니다. 나에게는 실망이었다
9,9,9,619,"Our apartment rental is right on the edge of this large night market, and we have spent our first two nights wandering through the streets here, just taking it all in. It’s full of people and awesome little shops and stalls. Just looking down the streets with all the lights and visual clutter makes you want to take a photo every five minutes. There’s nothing like this in the states!",9,nothing,"우리 아파트 임대는 이 큰 야시장의 가장자리에 있으며, 우리는 처음 이틀 밤을 여기에서 거리를 배회하면서 보냈습니다. 모든 것을 들이고 있었습니다. 그것은 사람들과 멋진 작은 상점과 포장 마차로 가득합니다. 모든 조명과 시각적 혼란으로 거리를 내려다보는 것만으로도 5분마다 사진을 찍고 싶어집니다. 주에는 이런 것이 없다!"
10,10,10,656,"Some of the sellers are a bit sweet/pushy for you to buy their merchandise, but nothing rude....they have a lot to offer. I did make a mistake and bought a letter opener, thank goodness they allowed it on the plane. It wasn't expensive so it would not of been a money loss just a souvenir loss. :-)",10,nothing,판매자 중 일부는 당신이 그들의 상품을 사기에 약간 달콤하거나 성급하지만 무례하지는 않습니다....그들은 제공할 것이 많습니다. 나는 실수를 해서 편지 오프너를 샀다. 그들이 비행기에서 그것을 허락해줘서 고맙다. 가격이 비싸지 않아서 금전적인 손실이 아니라 기념품의 손실일 뿐이었다. :-)
11,11,11,814,"Street that always crowds by people..nothing much i bought from here but i had fun with their 'pasar malam' atmosphere with new thingy that i had ever see. The most attraction i was looking for here is Spao. It is a boutique that must to visit by kpop fans though. You can enjoy everysing on the 5th floor, and dont forget to take sticker pictures with your bias. They offered awesome stuffs at affordable price. You also can visit everysing at apgujeong branch but you may feel regret if not buy anything at myeongdong branch which is the main everysing shop. M plaza also located in myeongdong, which Kimchi Academy is located, where you can book kimchi experience and hanbok wearing package. Hanji mirror making also including in the package with 30,000 won for 2 hours class. Classes offered in Korean, Japanese or English. They open for new package with ddeobokki making experience for 2012.  Popular Hello Kitty cafe also located here, that one i had skip on my last journey. will visit next time. Myeongdong also one of the place to buy sourvenir but no much choices and quite expensive that you can find the same thing at cheaper price at other market.",11,nothing,"항상 사람들로 붐비는 거리. 여기에서 많이 구입하지 않았지만 내가 본 새로운 물건으로 'pasar malam'분위기를 즐겼습니다. 내가 여기에서 찾고 있었던 가장 큰 매력은 Spao입니다. 그래도 케이팝 팬이라면 꼭 가봐야 할 부티크입니다. 5층에서 에브리싱을 즐길 수 있으며, 취향에 따라 스티커 사진도 잊지 말고 찍어보세요. 그들은 저렴한 가격에 멋진 물건을 제공했습니다. 압구정점에서도 에브리싱을 구경할 수 있지만 에브리싱 본점인 명동점에서 사지 않으면 후회할 수도 있다. 김치학원이 있는 명동에 위치한 엠플라자에서도 김치체험과 한복체험 패키지를 예약할 수 있다. 한지거울만들기도 2시간 수업에 30,000원에 패키지에 포함되어 있습니다. 한국어, 일본어 또는 영어로 수업이 제공됩니다. 2012년 떡볶이 체험과 함께 새로운 패키지를 오픈합니다. 지난 여행에서 건너뛰었던 인기 있는 헬로키티 카페도 이곳에 있습니다. 다음에 방문합니다. 명동도 사우브니르를 살 수 있는 곳 중 하나지만 선택의 폭이 많지 않고 꽤 비싸서 다른 시장에서 더 싼 가격에 같은 것을 찾을 수 있습니다."
12,12,12,874,"With expectations set pretty high after watching loads of Youtube videos on this neighborhood, I was understandably left feeling 'eh' about it after getting a chance to experience this for a few days.  First off, I loved the vibe of the neighborhood, despite how crowded it became every night. That said, the neighborhood actually is not that big - two main thoroughfares, primarily, each maybe 4-5 blocks long. Lots of side streets with other shops and food options, but the main action really is on the thoroughfares. Lots of cosmetic shops, lots of cheap clothing of the Forever 21 quality level.  The street food was very much hit or miss, nothing completely mind blowing. Lots of repeat stands, but note that not all the stands have the same quality. I tried to use the length of the lines for each as a rough gauge on how good the stand may be - also a hit or miss approach.  Two tips and heads up (literally): - there are a lot of hidden eateries, cafes, and shops in all the buildings above ground level. really pay attention and look up to see what you may be missing out on! I found a few cafes that I loved - grab a coffee and a window seat and you can people watch all the action down below for awhile - garbage cans are really hard to come by. stay with the vendor you purchase food from and chuck your garbage with them after you're done, or come prepared",12,nothing,"이 동네에서 수많은 Youtube 비디오를 본 후 기대치가 꽤 높아진 상태에서 며칠 동안 이것을 경험할 기회를 얻은 후 나는 당연히 그것에 대해 '어'를 느꼈습니다. 우선, 나는 매일 밤 얼마나 붐볐음에도 불구하고 동네의 분위기를 좋아했습니다. 즉, 이웃은 실제로 그렇게 크지 않습니다. 두 개의 주요 도로, 주로 각각 4-5블록 길이입니다. 다른 상점과 음식 옵션이있는 많은 골목길, 그러나 주요 활동은 실제로 도로에 있습니다. 많은 화장품 가게, Forever 21 품질 수준의 많은 값싼 의류. 길거리 음식은 아주 많이 히트하거나 놓쳤습니다. 반복 스탠드가 많지만 모든 스탠드의 품질이 동일한 것은 아닙니다. 나는 스탠드가 얼마나 좋은지 대략적인 척도로 각 라인의 길이를 사용하려고 노력했습니다. 두 가지 팁과 주의사항(문자 그대로): - 1층 위의 모든 건물에는 숨겨진 식당, 카페, 상점이 많이 있습니다. 정말로 주의를 기울이고 무엇을 놓치고 있는지 찾아보십시오! 나는 내가 좋아하는 몇 개의 카페를 찾았습니다. 커피와 창가 자리를 잡고 잠시 동안 아래에서 모든 활동을 볼 수 있습니다. 쓰레기통을 찾기가 정말 어렵습니다. 음식을 구입한 공급업체에 머물고 음식을 마친 후 쓰레기를 버리거나 준비를 하십시오."
13,13,13,1038,"This area is heavily populated by Chinese tourists with large suitcases who sit in shops sending photos of items to their friends on Wechat. There's street food, but nothing you can't find in a less touristy area. My advice: avoid myeongdong like the plague - There's better places in Seoul for literally everything on offer here.",13,nothing,이 지역은 큰 여행 가방을 들고 상점에 앉아 Wechat에서 친구에게 품목 사진을 보내는 중국인 관광객으로 많이 붐빕니다. 길거리 음식이 있지만 덜 관광객이 많은 지역에서 찾을 수 있는 것은 없습니다. 내 충고: 전염병처럼 명동을 피하십시오 - 서울에는 말 그대로 모든 것이 제공되는 더 좋은 곳이 있습니다.
14,14,14,1201,"A "" must do"" in Seoul simply to experience all the different food stalls from pancakes to dumplings to octopus ... favourite was the meat filled korean dumplings ... awesome  And as opposed to the sights often seen in asian cities like Thailand , nothing seedy or concerning ... would recommend to do if you are Seould",14,nothing,"팬케이크에서 만두, 문어에 이르기까지 모든 다양한 포장 마차를 경험하기 위해 서울에서 ""해야 할 일"" ... 가장 좋아하는 것은 고기로 채워진 한국 만두였습니다 ... 굉장합니다. 태국과 같은 아시아 도시에서 자주 볼 수있는 광경과는 달리 아무것도 초라한 또는 관련 ... 당신이 Seould라면 할 것을 권장합니다"
15,15,15,1235,"My wife and I heard a lot about myeongdong, how the shops give away freebies like nothing, how attractive the sales are. We walked alone street away from the main street of myeongdong searching for face mask with heavy discount, and attracted by the discount signs outside one shop. Guess what? We didn't get freebies. The shopkeeper tried to talk us into buying face mask which are more "" premium"". And when I ask if there is tax free since I hit the 30k won, the answer was NO because the items were at discount. We were very disappointed. Where are the freebies that everyone talked about? When we went to Lotte Duty free shop, we saw the same items sold at same price, but can claim the tax. We are disappointed. Next time we will see where the crowd go, and stay in main street of myeongdong.",15,nothing,"아내와 나는 명동에 대해, 상점에서 공짜로 사은품을 준다는 것, 세일이 얼마나 매력적인지에 대해 많이 들었습니다. 우리는 명동의 큰길을 벗어나 홀로 거리를 걸으며 큰 할인을 받은 마스크를 찾고 있었고, 한 가게 밖에 있는 할인 표지판에 매료되었습니다. 뭔지 맞춰봐? 우리는 공짜를 얻지 못했습니다. 가게 주인은 우리에게 더 ""프리미엄""한 안면 마스크를 사도록 이야기하려고했습니다. 그리고 3만원이 되어서 면세가 있냐고 물어보니 할인이 되어서 NO 였습니다. 우리는 매우 실망했습니다. 모두가 이야기하는 공짜는 어디 있습니까? 롯데면세점에 갔을 때 같은 물건이 같은 가격에 팔리는 것을 보았지만 세금을 청구할 수 있었다. 우리는 실망했다. 다음 번에는 사람들이 어디로 가는지 살펴보고 명동의 메인 스트리트에 머물 것입니다."
16,16,16,1248,"First time there. However, nothing special. Is the same like in any country. Selling lots of local delicacies. Clothing is more expensive than those selling in any outlets.",16,nothing,처음으로. 그러나 특별한 것은 없습니다. 어느 나라나 마찬가지입니다. 지역 특산물을 많이 판매합니다. 의류는 모든 매장에서 판매하는 것보다 비쌉니다.
17,17,17,1304,"Love this place...night stalls and cafes and food establishments aplenty. Lots of shopping too. Personally, nothing beats the fact that it is such a vibrant place...especially at night. Plenty of hotels there and a good place to see Seoul by night.",17,nothing,"이 장소를 사랑하십시오 ... 야간 포장 마차, 카페 및 음식 시설이 풍부합니다. 쇼핑도 많이 합니다. 개인적으로 이곳이 특히 밤에 이렇게 활기찬 곳이라는 사실을 능가하는 것은 없습니다. 많은 호텔과 밤에 서울을 볼 수있는 좋은 장소."
18,18,18,1407,"This is one of the busiest shopping area for tourists. Beauty products and shops lined up in rows and alleys. Local apparel and shoes stores sprinkled in different corners of the street. You find the latest design of adidas and other popular sneakers here too !  Push carts of food lined the main Myeongdong street starting from the Zara stores.  We have an enjoyable time on Saturday trying tibits and food along this street. Don't take a heavy lunch. You just buy and eat from the push cart. They are hygienic at least for me and my Friend. We were fascinated by a push cart that sell nothing but just Optus and cuttle fish in various form ( grilled, dried and in a cup etc. We tried the pomegranate juice freshly pressed into a plastic bag and a straw. It looks like a fresh blood bag from a blood bank. But the taste is not as sweet as during winter.  We also shop along the way and got bags full of different Brand’s of facial cleansers, masks and facial mist, hair masks etc. There was a Watson store that sell interesting tibits and cosmetic too(items which you can't find in singapore but expensive when purchase online.  A lot of eateries are on the second and 3rd stories of the buildings. Fried chicken, Korean food, Osulloc tea cafe, beer and fried chicken place.  This is a must go place for whoever comes to Seoul. Just to feel the vibe and craziness of the buying bulk of skin care products from tourists from all over the world.  I see more European tourists hovering around the snail based skin care and masks products. Seems like snail is not just for eating, it is for beauty too !",18,nothing,"이곳은 관광객들이 가장 많이 찾는 쇼핑 지역 중 하나입니다. 미용 제품과 상점이 줄지어 늘어서 있고 골목에 있습니다. 거리 곳곳에 지역 의류 및 신발 매장이 흩어져 있습니다. adidas 및 기타 인기 있는 운동화의 최신 디자인도 여기에서 찾을 수 있습니다! 자라 매장을 기점으로 명동 메인 거리에 포장 마차들이 줄지어 늘어서 있다. 우리는 토요일에 이 거리를 따라 tibits와 음식을 맛보며 즐거운 시간을 보냅니다. 무거운 점심을 먹지 마십시오. 당신은 푸시 카트에서 사서 먹습니다. 그들은 적어도 나와 내 친구에게는 위생적입니다. 우리는 Optus와 다양한 형태의 오징어 (구이, 말린 것, 컵 등) 만 판매하는 푸시 카트에 매료되었습니다. 비닐 봉지와 빨대에 갓 짜낸 석류 주스를 시도했습니다. 신선한 피처럼 보입니다. 혈액 은행에서 가져온 가방 그러나 맛은 겨울만큼 달콤하지 않습니다. 우리는 또한 길을 따라 쇼핑을 하고 다양한 브랜드의 페이셜 클렌저, 마스크 및 페이셜 미스트, 헤어 마스크 등으로 가득 찬 가방을 구입했습니다. 판매하는 Watson 매장이 있었습니다. 재미있는 티빗과 화장품도(싱가포르에서는 볼 수 없지만 온라인으로 구매하면 비싸다. 건물 2, 3층에 식당이 많다. 후라이드 치킨, 한식, 오설록 티카페, 맥주, 프라이드 치킨) 서울에 오는 사람이라면 꼭 가봐야 할 곳입니다. 전 세계 관광객들로부터 스킨케어 제품을 대량 구매하는 분위기와 광기를 느끼기 위해. 달팽이 베이스 스킨케어 제품과 마스크 제품입니다. 달팽이는 먹는 것뿐만 아니라 아름다움을 위한 것입니다!"
19,19,19,1412,"I went with my family to experience the street food culture. Because we were there for only one night we tried a variety of foods. None of them were amazing sadly.The best (to me) being the deep fried shrimp 새우튀김. The worst beight either the cup 'o flaverless watermelon or the chewy and flavorless Cheese Ricecake 치즈떡.  Being a holiday weekend, the street was crawling with tourists. I think I heard WAY more Chinese than Korean, not that its a good or bad thing. Also, it feels that the stores in Myeongdong cater to young female shoppers. Being a guy in his 30's there was really nothing for me to shop for.  Also, not a great place to bring young children because of the crowd and lack of things that interest them.  If your on a date, maybe a great place to check out.",19,nothing,나는 가족과 함께 길거리 음식 문화를 경험하기 위해 갔다. 우리는 하룻밤 동안 거기에 있었기 때문에 다양한 음식을 시도했습니다. 슬프게도 그들 중 누구도 놀랍지 않았습니다. (내게는) 가장 좋은 것은 새우튀김이었습니다. 최악은 컵'오맛 수박이나 쫄깃하고 맛없는 치즈 떡 치즈떡. 휴일 주말이라 거리는 관광객들로 붐볐다. 한국보다 중국말을 더 많이 들은 것 같아요. 좋다 나쁘다 보다는요. 또한 명동의 가게들은 젊은 여성 쇼핑객들을 위한 것 같다. 30대 남자라서 딱히 살만한게 없었어요. 또한 군중과 관심있는 물건이 없기 때문에 어린 아이들을 데려오기에 좋은 곳이 아닙니다. 데이트 중이라면 체크 아웃하기 좋은 곳이 될 것입니다.
20,20,20,1415,"It was our first family trip to S Korea and we picked Myeondong because of the positive review's from TripAdvisor. We picked Philstay명동 hotel which was ideally located in the Myeondong area, no frills nothing fancy as we were on a budget. The reviews/reviewers for spot on Myeondong is basically a huge shopping paradise ranging from inexpensive item's to upscale name brand's. Huge plus was that were on our hotel was on the street where they have the street foods at night, everything was so affordable around $5 or less and so delicious and so much variety. I would absolutely recommend experiencing this area of Myeondong to anyone!",20,nothing,그것은 한국에 대한 우리의 첫 가족 여행이었고 트립 어드바이저의 긍정적 인 리뷰 때문에 명동을 선택했습니다. 우리는 명동 지역에 이상적으로 위치한 Philstay 명동 호텔을 선택했습니다. 명동의 명소에 대한 리뷰/리뷰어는 기본적으로 저렴한 품목에서 고급 브랜드 브랜드에 이르기까지 거대한 쇼핑 천국입니다. 거대한 플러스는 우리 호텔이 밤에 길거리 음식이 있는 거리에 있다는 것이었습니다. 모든 것이 5달러 이하로 매우 저렴하고 너무 맛있고 다양했습니다. 나는 누구에게나 명동의이 지역을 경험하는 것을 절대적으로 추천합니다!
21,21,21,1423,"This shopping area can be skip to my opinion, nothing special over here, the university shopping street is much better,",21,nothing,이 쇼핑 지역은 내 의견으로 건너 뛸 수 있습니다. 여기에는 특별한 것이 없습니다. 대학 쇼핑 거리가 훨씬 낫습니다.
22,22,22,1429,"This is definitely a shopping place, for food , clothes, comestic etc there are night market u can explore the food while shopping. Not too bad, is a commercial shopping street, nothing to expect.",22,nothing,"이것은 확실히 쇼핑 장소입니다. 음식, 옷, 코미디 등을 쇼핑하는 동안 음식을 탐색할 수 있는 야시장이 있습니다. 그다지 나쁘지 않은 상업 쇼핑 거리이며 기대할 것은 없습니다."
