,Unnamed: 0.1,index,Unnamed: 0,서울대공원부정단어리뷰,index.1,단어,번역
52,52,52,3362,"Myeongdong was an absolute madhouse and I enjoyed every second of it. We did very little actual shopping here but visited three times just for the fun of it. At night, the main street had a couple dozen food stalls. I tried about five of them one night and they were all delicious. If nothing else, you've got to come here to experience the mass of humanity and light and sound.",52,nothing,명동은 절대적인 미친 집이었고 나는 그 모든 순간을 즐겼습니다. 우리는 여기에서 실제 쇼핑을 거의 하지 않았지만 재미를 위해 세 번 방문했습니다. 밤이 되면 메인 스트리트에는 수십 개의 포장 마차가 있었습니다. 하룻밤에 5개 정도 먹어봤는데 다 맛있었어요. 다른 것이 아니라면 이곳에 와서 인류의 덩어리와 빛과 소리를 경험해야 합니다.
53,53,53,3385,"Just prepare your Korean won and walk along the street. If you have nothing to buy ,just enjoy the food. From Halal Kebab right up to the lobster cooked with cheese. Oh man...it is soo delicious.",53,nothing,원화를 준비하고 길을 따라 걸으면 됩니다. 살 것이 없으면 그냥 맛있게 드세요. 할랄 케밥부터 치즈를 곁들인 랍스터까지. 어머...너무 맛있어요.
54,54,54,3426,To be honest..nothing really special here..the street food here is actually quite on the high side compare to a meal elswhere..i only came here for a mask shopping which is really cheap depending on the brand you choose..other than that i find item quite pricey here..,54,nothing,솔직히 말해서.. 여기에서 특별한 것은 없습니다.. 여기의 길거리 음식은 실제로 다른 곳의 식사와 비교할 때 상당히 높은 편입니다. 나는 선택한 브랜드에 따라 정말 저렴한 마스크 쇼핑을 위해 여기에 왔어요. .기타 그보다 여기에서 꽤 비싼 항목을 찾습니다.
55,55,55,3456,"I have to say it's always interesting to come to Myeongdong. It's always changing. Most visitors are tourists but locals come here too. You can find most of the shops and stores in Myeongdong in other malls or areas in the city. But the experience of shopping outside with street food and merchant vendors make this area an interesting place to come. I recommend coming here at night time with some appetite and roam the alleys and try various foods. Bring cash (Korean won) to make things more easier. You will easily get full trying many types of foods. The food vendors are general clean and nothing crazy or weird food. Also there's many restaurants as well but too many to pick from! Finding a public restroom could be difficult but if you go into large shopping centers or coffee shops, you will be fine. It's family friendly but it gets crowded. I would say myeondong is more for shopping at known brands such as makeups and shoes while dongnaemun is more for local merchants and clothes. There's definitely a different feel. I think you can give yourself about 1-2 hours to go through myeondong streets/alleys.",55,nothing,명동에 오는 것은 언제나 흥미롭다고 말하고 싶습니다. 항상 변화하고 있습니다. 대부분의 방문객은 관광객이지만 현지인도 여기에옵니다. 명동에 있는 대부분의 상점과 상점은 도시의 다른 쇼핑몰이나 지역에서 찾을 수 있습니다. 그러나 길거리 음식과 상인들과 함께 밖에서 쇼핑한 경험은 이 지역을 흥미로운 곳으로 만듭니다. 배부르게 배고파서 밤에 와서 골목을 돌아다니며 다양한 음식을 맛보기를 추천한다. 현금(한국 원화)을 가져오시면 더욱 편리합니다. 많은 종류의 음식을 시도하면 쉽게 배부르게 될 것입니다. 식품 공급 업체는 일반적으로 깨끗하고 미친 음식이나 이상한 음식이 없습니다. 또한 많은 레스토랑이 있지만 선택하기에는 너무 많습니다! 공중화장실 찾기가 힘들겠지만 큰 쇼핑센터나 커피숍에 가면 괜찮을 것입니다. 가족 친화적이지만 혼잡합니다. 나는 명동이 화장품과 신발과 같은 유명 브랜드 쇼핑에 더 가깝고 동래문은 지역 상인과 의류에 더 가깝다고 말할 수 있습니다. 확실히 느낌이 다릅니다. 1~2시간 정도면 면동 거리/골목을 돌아다닐 수 있을 것 같아요.
56,56,56,3578,Crowded during the evening. Food booths are nothing special. Typical shops. Restaurants and Bar are around.,56,nothing,저녁에는 붐빕니다. 음식 부스는 특별하지 않습니다. 전형적인 상점. 레스토랑과 바가 주변에 있습니다.
57,57,57,3799,"I read in a review a guy said three hours of shopping and all he walked away with was empty pockets and a happy wife! Well it's true lots of women's clothing and makeup, nothing my size or colour. But my wife had the time of her life. So totally worth it. Happy Wife Happy Life! We went late and stayed until around 1:00am and the area was packed.",57,nothing,나는 리뷰에서 한 남자가 3시간 동안 쇼핑을 하고 빈 주머니와 행복한 아내만 가지고 떠났다고 말했습니다! 제 사이즈나 색깔은 전혀 없고 정말 많은 여성 의류와 메이크업이 있습니다. 하지만 아내에게는 인생의 시간이 있었습니다. 그만한 가치가 있습니다. 행복한 아내 행복한 삶! 우리는 늦게 가서 새벽 1시경까지 머물렀고 그 지역은 붐볐다.
58,58,58,3817,"Myeongdong is a must visit for tourists even if you aren't a shopper at heart, you can still enjoy the street food and just experience the madness! Make sure to visit Sulbing (upstairs above one of the 10 Nature Republic stores) and enjoy the Hello Kitty Cafe. Make sure to stock up on all your skin care needs; but if you do nothing else; hit up the street 7pm or after and visit the food stalls.",58,nothing,명동은 쇼핑객이 아니더라도 관광객이 꼭 방문해야 하는 곳입니다. 여전히 길거리 음식을 즐기고 광기를 경험할 수 있습니다! 설빙(네이처리퍼블릭 10개 매장 중 위층)에 방문하여 헬로키티 카페를 즐겨보세요. 피부 관리에 필요한 모든 것을 비축하십시오. 그러나 당신이 아무것도 하지 않는다면; 오후 7시 이후에 거리를 나와 음식 노점을 방문하십시오.
59,59,59,3900,There is nothing that you can not find in this market. Your family will love it. It has many cosmetics shops.,59,nothing,이 시장에서 찾을 수 없는 것은 없습니다. 당신의 가족은 그것을 좋아할 것입니다. 많은 화장품 가게가 있습니다.
60,60,60,3955,"Waves and waves of tourist...all the shops looked the same. Repeated shops on different streets and they all sell the same products. Young women & men will stand outside the shops trying to promote their products. It's a skin care heaven shopping place for ladies ! There are many cafes, money changers too. I like the ""food hawker"" selling bbq squids, sweet paste coated fresh strawberries, the famous 32cm long ice cream on a cone. I was told that an average of 1,000,000 person passes through the street of Myeongdong. Not a place for young children or parents with prams. Go and experience the ""walk"" even if there is nothing to buy - join the crowd and have fun !",60,nothing,"관광객의 파도와 파도. ..모든 상점은 동일하게 보였다. 다른 거리에 반복되는 상점과 그들은 모두 같은 제품을 판매합니다. 젊은 여성과 남성들은 그들의 제품을 홍보하기 위해 매장 밖에 서 있을 것입니다. 여성분들을 위한 스킨케어 천국 쇼핑공간입니다! 많은 카페, 환전소도 있습니다. 나는 바베큐 오징어, 달콤한 페이스트 코팅 된 신선한 딸기, 콘에 유명한 32cm 길이의 아이스크림을 판매하는 ""푸드 호커""를 좋아합니다. 명동의 거리에는 평균 100만 명이 통행한다고 들었다. 어린 아이들이나 유모차를 가진 부모를 위한 장소가 아닙니다. 살 것이 없더라도 가서 ""산책""을 경험하십시오. 군중에 합류하여 즐겁게 지내십시오!"
61,61,61,3997,"Depending on what time of day you go there and also what weekday you may encounter normally crowded streets to very very busy streets. Before the shops are people trying to get you to come inside the shops and give you masks as a treat, especially on the weekend. Honestly nothing bothered me there and I knew the place was good to get CDs for a good price. It is after all a shopping street and as such one should see it. The shop assistants are good with English, Japanese, Korean and Chinese. Was a fun place to stroll around and just explore.",61,nothing,"당신이 거기에 가는 시간과 평일에 따라 일반적으로 붐비는 거리에서 매우 붐비는 거리를 만날 수 있습니다. 가게 앞에 사람들이 당신을 가게 안으로 들어오게 하고, 특히 주말에 간식으로 마스크를 주려고 합니다. 솔직히 거기에는 아무 것도 신경쓰이지 않았고 좋은 가격에 CD를 사기에 좋은 곳이라는 것을 알았습니다. 역시 상가이므로 보아야 합니다. 점원은 영어, 일본어, 한국어, 중국어를 잘합니다. 주변을 산책하고 탐험하기에 재미있는 곳이었습니다."
62,62,62,4319,"For the shopaholic, it's paradise. Designer stores aplenty, with a phenomenal range of food outlets and restaurants. The street stalls are a must see, and the local food available from them can't be missed. Shop prices were disappointingly similar (if not more expensive) than Europe, but there is literally nothing that you can't find. It's an experience!",62,nothing,"쇼핑 중독자에게는 천국입니다. 디자이너 매장이 풍부하며 경이로운 범위의 식품 매장과 레스토랑이 있습니다. 노점상은 꼭 봐야 하며, 이곳에서 판매하는 현지 음식도 놓칠 수 없습니다. 상점 가격은 유럽과 실망스러울 정도로 비슷했지만(더 비싸지는 않더라도) 말 그대로 찾을 수 없는 것은 없습니다. 경험입니다!"
63,63,63,4373,"Competition is strife. There will be repeats of many standard makeup stores, and there are a couple of clothes stores but nothing quite sales-y like the street fashion in the underground stores. However, the store clerks are well-versed in either Mandarin or a bit of English and are super-attentive to your needs.  I dislike the crazy crowds that come here, but it would be a must-visit if you must shop in Seoul. I preferred going to Hongdae or the underground malls for my shopping thrill.",63,nothing,경쟁은 투쟁이다. 많은 일반 메이크업 매장이 반복될 것이고 옷가게도 몇 군데 있지만 지하 매장의 스트리트 패션처럼 판매가 잘되는 매장은 없습니다. 그러나 점원은 북경어 또는 약간의 영어에 능통하며 귀하의 요구에 매우 세심한주의를 기울입니다. 나는 여기에 오는 미친 인파를 싫어하지만 서울에서 쇼핑해야한다면 꼭 가봐야 할 곳입니다. 나는 쇼핑 스릴을 위해 홍대나 지하상가에 가는 것을 선호했다.
64,64,64,4403,"The shops are fine but really nothing you can't find in a hundred other places. The main reason to come here is for the amazing street food at night, some of the best I have had anywhere, especially the fried mozzarella with condensed milk (trust me, it tastes a whole lot better than it sounds) and the pork meatballs. We ended up eating here every night.",64,nothing,"상점은 괜찮지 만 다른 백 곳에서는 찾을 수없는 것이 없습니다. 여기에 오는 주된 이유는 밤에 놀라운 길거리 음식, 내가 어디에서나 맛본 것 중 최고, 특히 연유를 곁들인 튀긴 모짜렐라(생각보다 훨씬 맛있습니다)와 돼지고기 미트볼 때문입니다. 우리는 매일 밤 여기에서 식사를 마쳤습니다."
65,65,65,4456,Myeongdong is always the place to go if you're looking for anything in particular or nothing at all. It's a collection of all the famous Korean stores plus western stores too. Beware that it's always crazy crowded and that street vendors only come out at night or on the weekends,65,nothing,명동은 특별한 것을 찾고 있거나 전혀 찾고 있지 않다면 항상 갈 곳입니다. 그것은 모든 유명한 한국 상점과 서양 상점의 모음입니다. 항상 미친듯이 붐비고 노점상은 밤이나 주말에만 온다는 점을 유의하세요.
66,66,66,4575,"It is an obligatory for foreigners to come here, who never heard of Myeongdong right! It's like your Korea trip is incomplete without visiting Myeongdong, a shopping heaven and cramp with peoples! lol. So many things u can check out here, like gazillion cosmteic shops, trying Korean street foods, famous Korean boutiques, acccessories, Cafes etc. Almost everything can be found here. Since I stay nearby Myeongdong, I came here every night, eventho I have nothing to buy.",66,nothing,"명동이라는 말을 들어본 적도 없는 외국인은 무조건 와야 하는 곳! 쇼핑의 천국 명동을 방문하지 않고는 한국 여행이 불완전한 것과 같습니다! ㅋㅋㅋ. 수많은 화장품 매장, 한국의 길거리 음식, 유명한 한국 부티크, 액세서리, 카페 등 여기에서 확인할 수 있는 것이 너무 많습니다. 거의 모든 것을 여기에서 찾을 수 있습니다. 명동 근처에 묵어서 매일 밤 여기로 왔는데 뭐 살게 없네요."
67,67,67,4746,I personally find that there is nothing much to buy at Myeongding. Lots of Korean beauty and cosmetic products. Perhaps this place is good for the ladies as most of the shops carry clothes just for the ladies.,67,nothing,나는 개인적으로 명딩에서 살 것이 별로 없다고 생각한다. 한국 미용 및 화장품이 많이 있습니다. 아마도 이곳은 여성들에게 좋은 곳일 것입니다. 대부분의 상점에는 여성들만을 위한 옷이 있습니다.
68,68,68,4779,It's called them shopping center but there's nothing unique about it. Many western brands and mostly cosmetic shops. If you want to buy the same things that you can buy everywhere so this is the place for you,68,nothing,쇼핑센터라고 하지만 딱히 특이한 점은 없습니다. 많은 서양 브랜드와 대부분 화장품 매장. 어디에서나 살 수 있는 똑같은 물건을 사고 싶다면 여기가 당신을 위한 곳입니다.
69,69,69,4791,This is the shoppers' heaven. Do nothing but shop till you drop.  Shops mainly are cosmetics / beauty / clothes / accessories / shoes.  There are also a lot food street food available along the streets.,69,nothing,이것은 쇼핑객의 천국입니다. 떨어질 때까지 쇼핑 외에는 아무것도 하지 마십시오. 매장은 주로 화장품/미용/의류/액세서리/신발입니다. 거리를 따라 먹을 수 있는 길거리 음식도 많이 있습니다.
70,70,70,4888,"You here about London, New York, Paris etc. They have nothing on this place!! I have never seen so many shops in my life!! There were shops within shops, shops on top of shops. It really is a shopping paradise!! Even if you don't like shopping there will be something here for you I guarantee.  My top tip is to go in the evening. The whole place lights up!!",70,nothing,"당신은 런던, 뉴욕, 파리 등에 대해 여기 있습니다. 그들은 이곳에 아무것도 없습니다!! 살면서 이렇게 많은 가게는 처음 봤어요!! 상점 안에 상점이 있고 상점 위에 상점이 있습니다. 그야말로 쇼핑의 천국!! 당신이 쇼핑을 좋아하지 않더라도 여기에 당신을 위한 무언가가 있을 것입니다. 저의 최고 팁은 저녁에 가는 것입니다. 온통 불이 들어옵니다!!"
71,71,71,5017,"As another reviewer said, there are a ton of Korean cosmetic shops here! I saw probably 2 or 3 shops for each brand, and I think they outnumbered all the other kinds of shops combined. So, if you're looking to stock up on some fantastic Korea beauty products for half of what they would cost to order them online, this is the place for you! They also lure you into the stores with free samples, although you don't have to buy anything. There are other kinds of shops if you want to take a look around, but nothing special. Mostly over-priced clothes and souvenir shops. My boyfriend did get a very amusing hat here though....",71,nothing,"다른 평론가가 말했듯이 이곳에는 한국 화장품 가게가 엄청나게 많다! 브랜드별로 2~3개 정도 본 것 같은데, 다른 모든 매장을 다 합친 것보다 많은 것 같아요. 따라서 온라인 주문 비용의 절반으로 환상적인 한국 미용 제품을 구입하고 싶다면 여기가 바로 당신입니다! 그들은 또한 당신이 아무것도 살 필요가 없지만 무료 샘플로 상점으로 당신을 유인합니다. 둘러보고 싶다면 다른 종류의 상점이 있지만 특별한 것은 없습니다. 대부분 고가의 옷과 기념품 가게. 내 남자 친구는 여기에서 매우 재미있는 모자를 얻었습니다."
72,72,72,5107,"My friends and I went to Myeongdong many times, and we got very bad experience there. We do like shopping and dining there, but somehow they'll show their temper / unfriendly attitude if you just buy little stuff or nothing to buy in the shop. Not only retail shops, but restaurants. So-called shopping paradise, just so so.  對於旅客來說，明洞係一個非常出名的購物地點！但係如果在店鋪只消費少少或者完全無消費，?貨員就立?黑面、發脾氣！這裡?對稱不上係一個購物天堂！所謂的購物熱點就是這樣！",72,nothing,"내 친구와 나는 명동에 여러 번 갔고 우리는 거기에서 매우 나쁜 경험을했습니다. 우리는 거기에서 쇼핑하고 식사하는 것을 좋아하지만 가게에서 물건을 조금 사거나 아무것도 사지 않으면 어떻게 든 화를 내거나 불친절한 태도를 보일 것입니다. . 소매점 뿐만 아니라 음식점, 쇼핑의 천국이라 불리는 쇼핑의 천국 명동은 여행객들에게 아주 유명한 쇼핑 명소입니다! 그러나 상점에서 약간만 소비하거나 전혀 소비하지 않으면 판매원은 즉시 얼굴을 붉히고 화를 낼 것입니다! 이것은 확실히 쇼핑 천국이 아닙니다! 이른바 쇼핑 핫스팟이 바로 그것입니다!"
73,73,73,5169,"Its was really cold in winter therefore wear proper winter clothes especially young children. It does get crowded but being in asia its nothing surprising.  Moreover there are lots of variety such as designer brands, local brands and market like stalls. I would recommend a whole day to fully explore the place and the street food there is good and there are heaps of places to eat and have a cuppa. I would recommended anyone who would like to buy pressies to bring home stop by here also.",73,nothing,"겨울에는 정말 추웠으므로 특히 어린 아이들에게 적절한 겨울 옷을 입으십시오. 붐비지 만 아시아에 있다는 것은 놀라운 일이 아닙니다. 또한 디자이너 브랜드, 지역 브랜드 및 시장과 같은 포장 마차와 같은 다양한 종류가 있습니다. 나는 하루 종일 장소와 거리 음식을 완전히 탐험하는 것이 좋으며 먹고 마실 곳이 많이 있습니다. 나는 집에 들르기 위해 pressies를 사고 싶은 사람에게도 여기를 추천 할 것입니다."
74,74,74,5170,Myeongdong has lots of shopping and for beauty products at least 3 or 4 of the same shops. If you head downward there are a tonne of restaruants serving all types of food. But there is nothing better than a good Korean BBQ.,74,nothing,명동은 쇼핑이 많고 미용 제품을 위해 같은 가게가 최소 3~4개 있습니다. 아래로 내려가면 모든 종류의 음식을 제공하는 수많은 레스토랑이 있습니다. 그러나 좋은 한국식 바베큐보다 더 좋은 것은 없습니다.
75,75,75,5195,"i love going to myeongdong, there so many cosmetic shop and delicious food. and you can shopping all around the time here. you must give space to long time here. becuse if you just going one or two hours here you get nothing. kkkkk",75,nothing,나는 명동에 가는 것을 좋아합니다. 화장품 가게와 맛있는 음식이 너무 많습니다. 여기에서 언제든지 쇼핑할 수 있습니다. 여기에 오랜 시간 공간을 주어야 합니다. 여기에서 한 두 시간만 가면 아무것도 얻을 수 없기 때문입니다. ㅋㅋㅋㅋ
76,76,76,5215,really nothing to see here unless you are coming from a 3rd world country. Prices are high and you can find everything in other shopping malls.,76,nothing,제 3 세계 국가에서 오지 않는 한 여기에서 볼 것이 없습니다. 가격이 비싸고 다른 쇼핑몰에서 모든 것을 찾을 수 있습니다.
77,77,77,5240,"Myeongdong has a long history. It's been a centre of shopping for Seoulites for years. But by 2000, Japanese started to occupy this area, and in recent few years all the tourists started coming to this area, and now it got to a point where you see more tourists than locals in the area. One of its attraction was that the area is all walk-only streets and cars are not allowed in. But now the downside is that it gets more people to fill the streets than the cars passing by, making it one of the hardest to place in Seoul to walk around. Now, it is a nice shopping district indeed. But that's if you want to hop in Uniqlo, H&M, Zara and all those global fashion brands which are available everywhere else in the world, and by the way cost more than most of other countries. Most shops are also available in many other downtown spots in Seoul, there's not a single unique shop that you can only visit in Myeongdong. Therefore, I wouldn't recommend this area so much. You can go once as a tourist attraction, but if you're looking for genuine items you can only get in Korea, I'd look elsewhere. You know almost everywhere in Seoul is extremely crowded but this area is one of the worst. It used to have history, but nothing is special now, except for Myeongdong Cathedral which is the best catholic structure you can see in Korea.",77,nothing,"명동은 오랜 역사를 가지고 있습니다. 수년 동안 서울 사람들을위한 쇼핑 센터였습니다. 그러나 2000년이 되자 일본인이 이 지역을 점령하기 시작했고 최근 몇 년 동안 모든 관광객이 이 지역을 방문하기 시작했고 지금은 이 지역의 현지인보다 관광객이 더 많이 보이는 지경에 이르렀습니다. 그 매력 중 하나는이 지역이 모두 도보 전용 거리이며 자동차는 진입 할 수 없다는 것입니다. 그러나 지금 단점은 지나가는 자동차보다 더 많은 사람들이 거리를 채우고있어 배치하기 가장 어려운 곳 중 하나라는 것입니다. 걸어서 서울. 지금은 참으로 멋진 쇼핑 지역입니다. 하지만 Uniqlo, H&M, Zara 및 전 세계 어디에서나 구할 수 있고 다른 대부분의 국가보다 비용이 많이 드는 모든 글로벌 패션 브랜드를 구매하려는 경우입니다. 대부분의 상점은 서울의 다른 많은 도심지에도 있지만 명동에서만 방문할 수 있는 독특한 상점은 없습니다. 따라서 이 지역은 그다지 추천하지 않습니다. 관광명소로 한 번 가도 되지만 한국에서만 구할 수 있는 진품을 찾는다면 다른 곳을 찾아봐야겠습니다. 서울의 거의 모든 곳이 매우 혼잡하다는 것을 알고 있지만 이 지역은 최악의 지역 중 하나입니다. 예전에는 역사가 있었지만 지금은 한국에서 볼 수 있는 최고의 가톨릭 건축물인 명동성당을 제외하고는 특별한 것이 없습니다."
78,78,78,5382,"If you love Korean stuffs and a fan of these Korean telenovelas, this is a haven for you. This is Seoul's #1 shopping district for nothing, it got everything. No need for further introductions, upon arrival in Seoul, get a taxi and shop till you drop. Visited last Sep-12 during ""Experience Hyundai"" trip.",78,nothing,"한국 물건을 좋아하고 한국 텔레노벨라의 팬이라면 이곳이 당신을 위한 안식처입니다. 이것은 서울의 #1 쇼핑 지구이며 모든 것을 갖추고 있습니다. 더 이상 소개할 필요 없이 서울에 도착하면 택시를 타고 내릴 때까지 쇼핑을 하면 됩니다. ""Experience Hyundai"" 여행 중 지난 9월 12일에 방문했습니다."
79,79,79,5384,"No matter you are a real shopper or only a window shopper; Myeongdong is really a ""heaven"" for you. The only problem for me is I found nothing to eat because am vegetarian.",79,nothing,"당신이 진짜 쇼핑객이든 그저 쇼핑객이든 상관없이; 명동은 정말 당신에게 ""천국""입니다. 저에게 유일한 문제는 채식주의자이기 때문에 먹을 것이 없다는 것입니다."
