,Unnamed: 0.1,index,Unnamed: 0,서울대공원부정단어리뷰,index.1,단어,번역
23,23,23,1430,"Very convenient for buying Korean cosmetic brands - many stores of the same brand within walking distance of one another. Take your time to test out products and the staff are usually very helpful ( if you speak Mandarin, staff can give product information in more details). Always ask for more freebies if you intend to buy larger quantities. If you shop at Aritaum, Olive Young, Innisfree and Too cool for School and purchase at least KRW30,000, you get immediate tax refund off your purchase price- so no need to claim tax refund at airport. But do confirm at the cashier before making payment.  The food stalls at the shopping street are not cheap and quality so-so. Better off saving the money and eating at more established and quality eateries in vicinity.  There are many stores of established hair salon chains in the area where you can rest and do your hair in between shopping. There should usually be someone who can speak Mandarin ( I went to a salon early one morning and the Mandarin speaking staff wasn't around and they telephoned a translator to speak with me so they could understand what style I wanted(nothing Beats showing them a picture though ) - talk about service !) or very basic English. Prices are not much more expensive than Singapore.",23,nothing,"한국 화장품 브랜드 구매에 매우 편리합니다. 같은 브랜드의 많은 매장이 서로 도보 거리에 있습니다. 시간을 내어 제품을 테스트해 보세요. 직원들은 일반적으로 매우 도움이 됩니다(만다린어를 할 수 있는 경우 직원이 제품 정보를 더 자세히 알려줄 수 있습니다). 더 많은 양을 구매하려는 경우 항상 더 많은 사은품을 요청하십시오. 아리따움, 올리브영, 이니스프리, 투쿨포스쿨에서 쇼핑하고 3만원 이상 구매하면 구매금액에서 즉시 세금환급을 받을 수 있어 공항에서 세금환급을 신청할 필요가 없다. 그러나 지불하기 전에 계산원에서 확인하십시오. 쇼핑 거리의 포장 마차는 싸고 품질이 좋지 않습니다. 돈을 절약하고 근처에 더 유명하고 품질이 좋은 식당에서 먹는 것이 좋습니다. 쇼핑 사이에 휴식을 취하고 머리를 할 수 있는 지역에는 기존 미용실 체인점이 많이 있습니다. 보통 만다린어를 할 수 있는 사람이 있어야 합니다(어느 날 아침 일찍 미용실에 갔는데 만다린어를 구사하는 직원이 주변에 없었고 내가 원하는 스타일을 이해할 수 있도록 통역사에게 전화를 걸어 대화를 나눴습니다. 그림 ) - 서비스에 대해 이야기하십시오!) 또는 매우 기본적인 영어. 가격은 싱가포르보다 훨씬 비싸지 않습니다."
24,24,24,1458,"The most shopper friendly shopping street with food and shops at every corner. It was rather easy navigating the streets too unlike other districts where you feel like you are going round in circles or there is nothing much to do. Plenty of food push carts along the way too. They have a 3 level Nature Republic and Olive Young, a good place to get your seaweed snacks also. On top of that you can get a clear view of the Seoul Tower.",24,nothing,모든 모퉁이에 음식과 상점이 있는 가장 쇼핑하기 쉬운 쇼핑 거리입니다. 빙글빙글 도는 느낌이 들거나 할 일이 별로 없는 다른 지역들과 달리 거리를 돌아다니기도 쉬웠다. 길을 따라 많은 음식이 카트를 밀고 있습니다. 3층 네이처리퍼블릭과 올리브영이 있어서 해초 안주도 먹을 수 있어요. 무엇보다 서울타워가 한눈에 들어온다.
25,25,25,1563,"I'm not quite sure about the attraction of Myeongdong. Food? There are a few good restaurants but nothing that really stands out. Shopping? There are a few good stores, but nothing that I can't get anywhere else in Korea. When I first came to Korea 5 years ago, Myeongdong had a larger variety of stores and restaurants. It was a place you could go on a date, watch a movie, walk around, do some shopping or chat at a cafe. Now it is an over crowded tourist trap. The big cosmetic stores really killed the joy of this place. It seems like all the stores sell the same thing, and it is the same cosmetic stores in every direction, which you can get almost anywhere in Seoul. And the worst part is this shopping street is very crowded. If you do have to cross this off your list of places to visit, then the are a few things that I would recommend, Myeongdong Kalguksu restaurant, the Catholic Cathedral and Ouga Korean BBQ restaurant.",25,nothing,"명동의 매력은 잘 모르겠습니다. 음식? 좋은 레스토랑이 몇 군데 있지만 눈에 띄는 것은 없습니다. 쇼핑? 좋은 가게가 몇 군데 있지만 한국에서 구할 수 없는 것은 없습니다. 5년 전 내가 처음 한국에 왔을 때 명동에는 더 다양한 상점과 레스토랑이 있었다. 데이트도 하고, 영화도 보고, 산책도 하고, 쇼핑도 하고, 카페에서 담소도 나눌 수 있는 곳이었어요. 지금은 붐비는 관광객 함정입니다. 큰 화장품 가게는 정말로 이곳의 즐거움을 죽였습니다. 모든 가게가 같은 것을 파는 것 같고, 서울의 거의 모든 곳에서 구할 수 있는 모든 방향에서 같은 화장품 가게입니다. 그리고 최악의 부분은이 쇼핑 거리가 매우 혼잡하다는 것입니다. 꼭 가봐야 할 곳 목록에서 빼야 한다면 명동 칼국수 식당, 천주교 대성당, 오가 한식 바베큐 식당을 추천합니다."
26,26,26,1596,"Most stores give samples and freebies when you buy there (there were two that did not give us anything but we had huge discounts of like 50% so that's fine). Other places may offer some samples and freebies but nothing beats cosmetics/skincare shopping at Myeongdong. The shopping is awesome & there are lots of street food stalls, although it's more expensive than other places, possibly due to the large number of tourists in the area. There are money changers near the China Embassy if you need more money and Lotte is just opposite the street if you want to buy high end stuff. Must go even if you're not buying stuff - you can just eat there too, plenty of food options!",26,nothing,대부분의 상점은 구매 시 샘플과 사은품을 제공합니다. 다른 곳에서는 샘플과 사은품을 제공할 수 있지만 명동에서 화장품/스킨케어 쇼핑을 하는 것만큼 좋은 것은 없습니다. 쇼핑은 굉장하고 많은 길거리 음식 노점이 있지만 다른 곳보다 비싸지 만 아마도이 지역의 많은 관광객으로 인해 발생할 수 있습니다. 돈이 더 필요하면 중국 대사관 근처에 환전소가 있고 고급 물건을 사고 싶다면 길 건너편에 롯데가 있습니다. 물건을 사지 않더라도 꼭 가봐야 합니다. 그곳에서도 다양한 음식을 먹을 수 있습니다!
27,27,27,1647,"Surprisingly for such a busy well known tourist attraction, the stores around here for shopping close at around 10pm. There's so much people in each store and in every cosmetic store everything is mainly sold to cater to the many Chinese tourist that come to visit the city, which only buy in bulk and nothing else. I personally do not like the foreign crowd this area attracts and find it too busy to enjoy the shopping. I would definitely recommend going to the less busy areas to meet your shopping needs as most Korean cosmetic brands can be found everywhere. They do tend to hand out more samples while walking the streets but tend to find that they hesitate on whom they give it to. Worth checking out but not the best for finding deals and bargains unless you love to fight the crowds!",27,nothing,이렇게 붐비는 유명한 관광 명소에 대해 놀랍게도 이 주변의 쇼핑 상점은 밤 10시경에 문을 닫습니다. 가게마다 사람이 너무 많고 화장품 가게마다 주로 도시를 방문하는 많은 중국인 관광객을 위해 모든 것이 판매되며 대량 구매만 하고 다른 것은 없습니다. 나는 개인적으로 이 지역이 끌리는 외국인 군중을 좋아하지 않으며 쇼핑을 즐기기에는 너무 바쁘다는 것을 알게 되었습니다. 대부분의 한국 화장품 브랜드를 어디에서나 찾을 수 있으므로 쇼핑 요구를 충족시키기 위해 덜 바쁜 지역으로 가는 것이 좋습니다. 그들은 거리를 걸으면서 더 많은 샘플을 나눠주는 경향이 있지만 누구에게 줄지 망설이는 경향이 있습니다. 체크 아웃할 가치는 있지만 군중과 싸우는 것을 좋아하지 않는 한 거래 및 할인을 찾는 데 가장 적합하지는 않습니다!
28,28,28,1783,"Terrible, everywhere they write about wide range of clothes choice, but there is nothing to choose. Polyether is every where and they call it designers clothes!!! Don't spend your money for this...",28,nothing,끔찍합니다. 어디에서나 다양한 옷 선택에 대해 쓰지만 선택할 수 있는 것은 없습니다. 폴리에테르는 어디에나 있고 디자이너 옷이라고 부릅니다!!! 이런 데 돈 쓰지 마세요...
29,29,29,1807,"You can actually skip it.. Waste of time. Try the mall really better than wasting your energy and time, theres actually nothing so good to see or an xtra ordinary to get amused or amazed.. Hope point taken",29,nothing,당신은 실제로 그것을 건너뛸 수 있습니다.. 시간 낭비입니다. 에너지와 시간을 낭비하는 것보다 쇼핑몰을 더 잘 사용해보십시오. 실제로 볼 수있는 좋은 것은 없으며 재미를 느끼거나 놀랄만한 평범한 것은 없습니다. . 희망 포인트 가져 가기
30,30,30,1883,Literally nothing much left. Food is still buzzing but shopping and street vendors are really sad... Not worth coming anymore.,30,nothing,말 그대로 얼마 남지 않았습니다. 음식은 여전히 ??붐비지만 쇼핑과 노점상은 정말 슬프다... 더 이상 올 가치가 없습니다.
31,31,31,1898,Very interesting place to wonder around. So many shops and side streets full of shops. So many Korean beauty products and also Tom’s flavoured Almond shops. Also there is also a big Art box here as well. It gets busy during the day but that is nothing compared to nighttime when all the street food vendors come out. Please be careful because people will just push and shove when it’s really busy. That being said we still loved the place. Go and enjoy all it has to offer.,31,nothing,주위를 궁금해하는 매우 흥미로운 장소. 많은 상점과 상점으로 가득한 골목길. 한국 미용 제품이 너무 많고 Tom 's Flavored Almond 매장도 있습니다. 또한 여기에도 큰 아트 박스가 있습니다. 낮에는 북적거리지만 노점상들이 다 나오는 밤에 비하면 아무것도 아니다. 사람들이 정말 바쁠 때 밀치고 밀치기만 하니까 조심하세요. 그 말은 우리는 여전히 그 장소를 좋아했습니다. 가서 모든 것을 즐기십시오.
32,32,32,1941,Shopping street bustling with tourists and locals alike. Worth a visit... or 2... street food was expensive and had nothing to shout about though,32,nothing,관광객과 현지인으로 붐비는 쇼핑 거리. 방문할 가치가 있는 ... 또는 2... 길거리 음식은 비싸고 외칠 것이 없었습니다.
33,33,33,2002,"Our apartment rental is right on the edge of this large night market, and we have spent our first two nights wandering through the streets here, just taking it all in. It’s full of people and awesome little shops and stalls. Just looking down the streets with all the lights and visual clutter makes you want to take a photo every five minutes. There’s nothing like this in the states!",33,nothing,"우리 아파트 임대는 이 큰 야시장의 가장자리에 있으며, 우리는 처음 이틀 밤을 여기에서 거리를 배회하면서 보냈습니다. 모든 것을 들이고 있었습니다. 그것은 사람들과 멋진 작은 상점과 포장 마차로 가득합니다. 모든 조명과 시각적 혼란으로 거리를 내려다보는 것만으로도 5분마다 사진을 찍고 싶어집니다. 주에는 이런 것이 없다!"
34,34,34,2017,"Some of the sellers are a bit sweet/pushy for you to buy their merchandise, but nothing rude....they have a lot to offer. I did make a mistake and bought a letter opener, thank goodness they allowed it on the plane. It wasn't expensive so it would not of been a money loss just a souvenir loss. :-)",34,nothing,판매자 중 일부는 당신이 그들의 상품을 사기에 약간 달콤하거나 성급하지만 무례하지는 않습니다....그들은 제공할 것이 많습니다. 나는 실수를 해서 편지 오프너를 샀다. 그들이 비행기에서 그것을 허락해줘서 고맙다. 가격이 비싸지 않아서 금전적인 손실이 아니라 기념품의 손실일 뿐이었다. :-)
35,35,35,2111,Myeongdong literally 'bright cave' or 'bright tunnel' but it is really nothing like a cave or tunnel but it is bright all right. Bright all night with the wonderful aroma of street food and great shops for good bargains for all things under the sun.,35,nothing,명동은 말 그대로 '밝은 동굴' 또는 '밝은 터널'이지만 실제로는 동굴이나 터널 같은 것이 아니지만 밝습니다. 거리 음식의 멋진 향기와 태양 아래 모든 것을 저렴하게 구입할 수 있는 훌륭한 상점으로 밤새도록 밝습니다.
36,36,36,2133,"I guess it is cool to see and visit this shopping street, but do not expect to actually find anything. There is a lot of nothing and actual stores that seems to be legit sells counterfeit goods for original prices, so be aware.",36,nothing,"나는이 쇼핑 거리를보고 방문하는 것이 멋지다고 생각하지만 실제로 아무것도 찾을 것으로 기대하지 마십시오. 물건도 없고, 위조품을 정상가로 판매하는 것이 합법인 것처럼 보이는 실제 매장도 많으니 주의하세요."
37,37,37,2146,"The whole area is just a shopper's pure delight and haven! Everywhere you turn, every nook and corner, every building you enter, every lane you go to, it's nothing but shops, shops and more shops... the place never sleep, I think.....it's literally ""shop till you drop""....",37,nothing,"전체 지역은 쇼핑객의 순수한 기쁨이자 안식처입니다! 회전하는 모든 곳, 모든 구석과 모퉁이, 들어가는 모든 건물, 가는 모든 차선, 상점, 상점 및 더 많은 상점... 절대 잠들지 않는 곳, 제 생각에.....말 그대로 ""당신이 갈 때까지 쇼핑""입니다. 하락""...."
38,38,38,2193,"Maybe it is only because I am a guy but this shopping area was nothing special for me. During the day time it is a bit more leisurely but at night the streets become much more narrow because of the food vendors and it seems busier. I did find that there are multiple shops from the same company located in this center which kind of confused me but what the heck,....I am a guy. I also found out that there was no haggling over prices there. You don't like the price, goes elsewhere. Street food vendors were ok but a bit pricey. Had grilled lobster from one of them that ran around 15,000 won which is between $13 to $15 US. But what the heck is cheese on it for???? I would rather have had butter!",38,nothing,"내가 남자이기 때문일 수도 있지만이 쇼핑 지역은 나에게 특별하지 않았습니다. 낮에는 조금 여유롭지만 밤이 되면 노점상으로 인해 거리가 훨씬 좁아지고 더 분주해 보입니다. 나는이 센터에 위치한 같은 회사의 여러 상점이 나를 혼란스럽게했지만 도대체 ....나는 남자라는 것을 알았습니다. 나는 또한 거기에서 가격에 대해 흥정이 없다는 것을 발견했습니다. 가격이 마음에 들지 않아 다른 곳으로 이동합니다. 길거리 음식 공급 업체는 괜찮 았지만 조금 비쌌습니다. $ 13에서 $ 15 US 사이 인 약 15,000 원에 달하는 그 중 하나에서 구운 랍스터를 먹었습니다. 근데 치즈가 뭐에용???? 차라리 버터를 먹었으면 좋았을텐데!"
39,39,39,2347,"We took a nice hotel in this area after hearing about this ""wonderful"" shopping district. The hotels and surrounding areas are quite nice and elegant, but those shopping streets are more like a flea-market that is run mostly by Chinese... Location is still nice and central, but there is nothing particularly interesting to buy here and no decent restaurant for regular tourist. Seoul is a beautiful city and there are much better areas for tourists.",39,nothing,"우리는 이 ""멋진"" 쇼핑 지구에 대해 들은 후 이 지역의 멋진 호텔을 잡았습니다. 호텔과 주변 지역은 꽤 멋지고 우아하지만 그 쇼핑 거리는 주로 중국인이 운영하는 벼룩 시장과 비슷합니다. 일반 관광객을 위한 식당. 서울은 아름다운 도시이며 관광객을 위한 훨씬 더 나은 지역이 있습니다."
40,40,40,2349,"Hyper shopping? It was ok, but nothing that special. Nice to 'window-shop' and walk around for a bit.",40,nothing,하이퍼 쇼핑? 괜찮 았지만 특별한 것은 없었습니다. '창문 쇼핑'을 하고 잠시 돌아다니기 좋습니다.
41,41,41,2453,"True, there is nothing that sets this shopping street apart from any other in Asia, but I had nice strolls at different times of day. The street food was tasty, I felt safe, and enjoyed watching the people. I treated myself to some Korean lipstick as cosmetics are all the rage. You can find almost anything there and in every price point all around this area.",41,nothing,"사실, 이 쇼핑가가 아시아의 다른 쇼핑가와 다른 점은 없지만, 나는 하루 중 다른 시간대에 좋은 산책을 했습니다. 길거리 음식은 맛있었고, 나는 안전하다고 느꼈고, 사람들을 보는 것을 즐겼습니다. 나는 한국 립스틱을 화장품처럼 대했다. 이 지역의 모든 가격대에서 거의 모든 것을 찾을 수 있습니다."
42,42,42,2460,"Like any other big city, the shopping district can be a rather interesting experience and the Myeongdong area in Seoul is not different. In my opinion, this is nothing special - there's a ton of people and stores selling everything between heaven and earth, most of which seem like rubbish quality. In terms of safety, Korea in general is a plus. Not at one time, did we fear anything and even when crowded, it's a safe place.",42,nothing,여느 대도시와 마찬가지로 쇼핑가는 다소 흥미로운 경험이 될 수 있으며 서울의 명동 지역도 다르지 않습니다. 내 생각에 이것은 특별한 것이 아닙니다. 하늘과 땅 사이에 모든 것을 파는 수많은 사람들과 상점이 있으며 대부분이 쓰레기처럼 보입니다. 안전성 면에서는 전반적으로 한국이 플러스입니다. 한 번에 두려운 것이 없었고 사람이 많아도 안전한 곳이었습니다.
43,43,43,2535,"Myeongdong is always a good location for tourists due to its proximity to city center, many shopping and restaurants, as well as plenty of money exchange with best price.  It is a paradise for girls/women as there are many skin care and fashion shops. The shops close late at night so there plenty of time for making choices.  The apparent good side is exactly its shortcomings. There is nothing else to do from shopping skin care. It is actually small and one can walk through every single alleys within one hour. If shopping skin care is not the ultimate purpose, Dongdaemun in fact has a design complex which adds a bit more cultural content. For vibrancy and youth culture, area around Hongik University is my first pick.",43,nothing,"명동은 시내 중심가와 가깝고 쇼핑과 레스토랑이 많고 환전이 용이하고 가격도 저렴하여 관광객들에게 항상 좋은 위치에 있습니다. 스킨케어, 패션 숍이 즐비해 여성의 천국이다. 상점은 밤 늦게 문을 닫으므로 선택할 시간이 충분합니다. 겉보기에 좋은 점은 바로 단점입니다. 스킨케어 쇼핑 외에 할 일이 없습니다. 실제로는 작아서 한 시간 안에 모든 골목을 다 걸을 수 있습니다. 쇼핑 스킨 케어가 궁극적인 목적이 아니라면 동대문에는 사실 좀 더 문화적인 콘텐츠를 더한 디자인 콤플렉스가 있습니다. 활기와 청년 문화를 위해 홍대 주변을 가장 먼저 선택합니다."
44,44,44,2761,"I don’t usually like shopping streets. Shopping is not in my DNA.  Myeondong Shopping Street was for me more of an eating street with plenty of roadside stalls, than shops.  I tried the lobster - nothing fabulous. Can skip.  Egg bun was delicious!  Children found the sausages too peppery.  Strawberries were incredibly sweet.  But I had to say that my spirits were dampened by the sight of a disabled man crawling on the streets. It was a pitiful sight and I wonder why there weren’t more people who donated?",44,nothing,나는 원래 쇼핑 거리를 좋아하지 않는다. 쇼핑은 내 DNA가 아닙니다. 나에게 명동상가는 가게라기 보다는 노점상이 즐비한 먹자골목이었다. 나는 랍스터를 시험해 보았다. 건너뛸 수 있습니다. 계란빵 맛있었어요! 아이들은 소시지가 너무 맵다고 생각했습니다. 딸기는 엄청나게 달았다. 그러나 나는 거리에서 기어 다니는 장애인의 모습에 내 영혼이 약해졌다고 말해야 했습니다. 안타까운 광경이었는데 왜 기부하는 사람들이 더 없었을까.
45,45,45,2801,"If nothing else, come to Myeongdong for the street food. Walk through the streets and try them all!! If you are interested, try entering shops and they might give you free stuff. Just take them :)",45,nothing,그렇지 않다면 명동에 와서 길거리 음식을 먹으십시오. 거리를 걸어보고 그들 모두를 시도하십시오!! 관심이 있는 경우 상점에 들어가 보세요. 무료 물건을 제공할 수도 있습니다. 그냥 가져가세요 :)
46,46,46,2861,"To be honest?!? Nothing special. You see these places,shops ect hundreds of times next to each other. They have the same stuff.. so really nothing special.",46,nothing,"솔직히?!? 특별한 것은 없습니다. 당신은이 장소를 볼 수 있습니다, 상점은 서로 옆에 수백 번 행사합니다. 그들은 같은 물건을 가지고 있습니다. 그래서 정말로 특별한 것은 없습니다."
47,47,47,2891,Maybe I'm missing something but i don't understand the hype? This is simply another 'high street' in a different city/country. There is nothing unique. Its is extremely busy and to be frank offers nothing in the slightest bit unique...,47,nothing,어쩌면 내가 뭔가를 놓치고 있지만 과장된 내용을 이해하지 못합니까? 이것은 단순히 다른 도시/국가의 또 다른 '하이 스트리트'입니다. 독특한 것은 없습니다. 그것은 매우 바쁘고 솔직히 말해서 조금이라도 독특한 것을 제공하지 않습니다. . .
48,48,48,2915,"The shopping is really great, but since it's a tourist area it tends to be very crowded. Try to avoid going there on the weekends, also note that the restaurants are usually a bit more expensive there, but nothing major.",48,nothing,쇼핑은 정말 훌륭하지만 관광지이기 때문에 매우 붐비는 경향이 있습니다. 주말에 거기에 가지 않도록 노력하십시오. 또한 레스토랑은 일반적으로 그곳에서 약간 더 비싸지 만 중요한 것은 아닙니다.
49,49,49,3108,"I have been to many shopping streets such as in Japan, Hong Kong, Taiwan, Singapore... Not cheap, nothing good, and nothing extraordinary. Even for cosmetics, you probably could buy the same thing elsewhere with the same price.",49,nothing,"일본, 홍콩, 대만, 싱가폴 등 많은 쇼핑거리를 가봤지만... 싸지도, 좋지도, 특별하지도 않습니다. 화장품이라도 같은 가격이면 다른 곳에서 같은 물건을 살 수 있을 것입니다."
50,50,50,3149,"hello, nice to see, walk through but nothing special when you already visited classic Asian cities .. plenty of shops and small food vendors ... guess a nice spot for cosmetic purchase.",50,nothing,"안녕하세요, 반갑습니다. 그러나 이미 고전적인 아시아 도시를 방문했을 때 특별한 것은 없었습니다. .. 많은 상점과 작은 식품 공급업체... 화장품 구매를 위한 좋은 장소를 추측해 보세요."
51,51,51,3280,"...yet nothing I really wanted to buy. I was told ""if it's not in Myeongdong, it's not in Korea"". It gets a bit repetitive tending towards boring if you don't want to buy bags, hats, womens clothing or jewelery",51,nothing,"...하지만 정말 사고 싶은 것이 없었습니다. ""명동이 아니면 한국이 아니다""라는 말을 들었다. 가방, 모자, 여성 의류, 장신구 등을 사지 않으려면 지루해지는 경향이 약간 반복됩니다."
