,STAR,CONTENT,SCORE,COMPOUND,VADER
187,5.0, Aquarium and Seoul Sky in one day After riding the elevator that goes up to the 120th floor in 1 minute the groom and children say that they will not be able to see below ,Positive,0.0,Neutral
188,3.0, It was good at first but there hasnt been much change in several years and I feel sorry for the beluga ,Negative,0.128,Positive
189,5.0, If you want to feel a childlike feeling please come It is also the best as a date course ,Positive,0.8074,Positive
190,4.0, Much better than rumors  Routes can be a bit confusing ,Positive,0.25,Positive
191,3.0, It wasnt as good as COEX The fish arent as varied and out of 3 beluga fish are dead2 of them are dead and theres only one so it looks so lonely ,Negative,-0.8734,Negative
192,5.0, Its smaller than I thought but sometimes the kids like it ,Positive,0.5023,Positive
193,4.0, It is well organized so that you can have a good time indoors with your children ,Positive,0.6124,Positive
194,5.0,My son had a lovely time The exhibits were interesting and varied The facilities were clean and even during covid the rules were followed but you didnt feel it Go during the week for fewer crowds no ,Positive,0.3182,Positive
195,4.0, Cute and well decorated sorry for the space ,Positive,0.5859,Positive
196,3.0, It had the most fish species but it didnt feel grand and big The sea lion show was fun ,Negative,0.3027,Positive
197,5.0, My nephew liked it very much Best for traveling with children ,Positive,0.8062,Positive
198,5.0, I liked it very much 2 times as if for the first time  ,Positive,0.4215,Positive
199,5.0,Beautiful aquarium,Positive,0.5994,Positive
200,5.0, Lotte World Aquarium visited every two years I was able to visit at a low price through the card company event We issue a 4hour parking pass so it is not burdensome ,Positive,0.0598,Positive
201,5.0, I really enjoyed it There are many wonderful animals and I want to go there again ,Positive,0.8221,Positive
202,5.0, Its shorter than I thought but Im very satisfied if I go together on the way to Lotte Tower ,Positive,0.6297,Positive
203,5.0, Weekends are better than fish Lots of people but good facilities ,Positive,0.7003,Positive
204,5.0,Good to see with children,Positive,0.4404,Positive
205,5.0, Beluga dolphins will be returned to nature soon so hurry up to see them ,Positive,0.0,Neutral
206,4.0, It is said that the coex fire aquarium is better but the advantage of this place is that there is a lot of content to enjoy besides the fire aquarium and the underground restaurant is of good quality and cheap Our ,Positive,0.8316,Positive
207,2.0, The Ocean Pavilion is so lame There are not too many fish especially in the large tank ,Negative,-0.5598,Negative
208,4.0,Good place to meet Belluga,Positive,0.4404,Positive
209,5.0,I dont know how but all the fish love taking pics Beautiful place,Positive,0.9209,Positive
210,4.0, It was the most recent aquarium so it was nice to see a variety of fish species and the overall cleanliness of the facility It is recommended to purchase tickets online ,Positive,0.5945,Positive
211,4.0, Its not worth the money there are a lot of babies and its amazing haha ,Positive,0.7298,Positive
212,2.0,It is good for local aquarium but beluga should be freed  Not a suitable place for such animal,Negative,0.6705,Positive
213,5.0, Just looking at the beluga is good Parking discount honey ,Positive,0.4404,Positive
214,4.0, It has a fantastic atmosphere and is a space where people of all ages can enjoy Sadly three or two of the beluga died Its beautiful but its so friendly that its sad at the same time ,Positive,0.6339,Positive
215,5.0,Great place for kids and families Prefer on an afternoon at a weekday with limited crowd compared to weekend,Positive,0.4939,Positive
216,3.0, Due to the presence of Arabs and the overall revitalization of tourism every shopping mall must have a variety of halal foods ,Negative,0.0,Neutral
217,4.0, It will go in Busan we have a better oceanarium and much more ,Positive,0.4404,Positive
218,5.0,Maybe I was just in a bad mood but the aquarium cheered me up I loved it,Positive,0.8608,Positive
219,5.0,Nice Big with lots of animals,Positive,0.4215,Positive
220,5.0, Visited for a discount Its a bit difficult to go at my price but children like it but buying drinks for kids inside is very expensive I recommend buying drinks in advance and putting them in a bag And sooner or ,Positive,0.7325,Positive
221,5.0,Very fun,Positive,0.5563,Positive
222,3.0, Recommended for families with children who love aquariums ,Negative,0.7184,Positive
223,5.0,jwj,Positive,0.0,Neutral
224,3.0, Compared to other aquariums the overall number of individuals seems to be small It seemed pity that there was only one beluga alone in the large beluga aquarium ,Negative,-0.4404,Negative
225,3.0, A lot of fish are gone compared to before Maybe its because its a night ,Negative,0.0,Neutral
226,5.0, Aquarium I went to with my 10monthold baby Baby loved it ,Positive,0.5994,Positive
227,5.0, It was nice to be able to watch beluga with my son who wanted to see it ,Positive,0.4215,Positive
228,4.0, I think the beluga alone is worth seeing but each one has their own taste so I skip it I am thrilled to be able to communicate with people through eye contact through the glass of the aquarium so much ,Positive,0.5859,Positive
229,4.0, Lotte World Aquarium Review  Lotte World Aquarium has been with children so far ,Positive,0.0,Neutral
230,5.0, I got a Tmon discount and went there Im sorry I couldnt see Beluga because of Corona ,Positive,-0.0772,Negative
231,5.0, There are many things to show the child It seems like the route is convenient Parking is a bit disappointing ,Positive,-0.1779,Negative
232,5.0,Awesoooomeee,Positive,0.0,Neutral
233,4.0, There is a very good marine aquarium in the city center so I had a mysterious experience unlike usual It is a space for healing ,Positive,0.4927,Positive
234,1.0, I was sad because it was so small The aquarium was small and the big fish looked too difficult I paid the membership fee and refunded it ,Negative,-0.6808,Negative
235,5.0, Visited on holiday with a friend It wasnt as big as I thought because I went to an aquarium overseas but I think Ill like it if I go with the kids  I feel like Ive returned to my childhood after a long time ,Positive,0.6956,Positive
236,4.0, It is good to change the concept frequently Its a pity that the beluga part is difficult to improve Food and beverage intake zone in the middle is too narrow Many children wouldnt pass it by but its too small ,Positive,0.1406,Positive
237,5.0, I went with my 10monthold daughters and they really liked it  ,Positive,0.4754,Positive
238,4.0, Do something after paying the full price and use discounts coupons social commerce etc as much as possible ,Positive,0.0,Neutral
239,5.0,The penguins were cute,Positive,0.4588,Positive
240,4.0, I was thinking of going but I really enjoyed watching 50 of TDay because it was a weekday so there werent many people and it was good ,Positive,0.867,Positive
241,5.0, If you expect sharks you will be very disappointed There is no feeling of being wasted because there is a variety of papers If you have time we recommend Lotte Tower and package products ,Positive,-0.6997,Negative
242,5.0, I had good memories with my motherinlaw  It felt like a dolphin in the deep sea smiling and going ,Positive,0.8126,Positive
243,4.0, I had a great time with my child However there was a lot of disappointment because there were not many kinds of paper and the tank was not large ,Positive,0.2023,Positive
244,4.0, Perfect for spending time with your grandchildren There was plenty to see ,Positive,0.5719,Positive
245,4.0, It was nice to see the fish But its a pity that there are too many people on weekends and holidays ,Positive,0.3612,Positive
246,5.0, Better than Samsung Still it seems that the children who are imprisoned cannot do anything pitiful ,Positive,0.367,Positive
247,4.0, Parking fee is reduced for up to 4 hours Lots of people but lots to see ,Positive,0.0,Neutral
248,1.0,ANIMAL NEED FREE LIFE  NOT PRISON AQUARIUM  ITS SHAME ,Negative,0.4408,Positive
249,5.0, Visiting an aquarium is very cool the calmness of the fish is a little bit of the beauty that exists in the immensity of the sea fish of various species and colors I thought it was small but it was very well ,Positive,0.8057,Positive
250,5.0,Very attractive and awesome place in seoul,Positive,0.8204,Positive
251,5.0, Its a great place to go with kids in the suburbs of Seoul ,Positive,0.6249,Positive
252,4.0, Okay the beluga is also amazing but I wish it was a little bit bigger Its not as big as the newer aquarium hehehe ,Positive,0.7506,Positive
253,4.0, Located in front of Aqua Garden on the B1 of Lotte World Mall Jamsil Impressive clean and wellmaintained interior ,Positive,0.7184,Positive
254,4.0, There are many things to see but not long considering the parking fee ,Positive,0.0,Neutral
255,4.0, Its been a while since Ive visited the aquarium Try it out with your family ,Positive,0.0,Neutral
256,5.0,Beautiful place,Positive,0.5994,Positive
257,5.0, I go for a walk every time but I am satisfied every time However I wonder if the internal movement is a reasonable one ,Positive,0.5719,Positive
258,4.0, I only go there with my children Stingrays are impressive ,Positive,0.5106,Positive
259,4.0, Its fun and enjoyable but it looks like a large aquarium needs more maintenance If you buy a ticket online in advance you can use it at a cheaper price I ,Positive,0.7469,Positive
260,5.0,What a great experience! We have been already to some aquarium places but this is so far my favorite. This place is fun for the whole family.,Positive,0.9133,Positive
261,5.0,The Lotte aquarium has most of the fish that other aquariums have! Since the other aquarium is far away from the place where I live. So I think Lotte aquarium has a perfect location where many people can visit!,Positive,0.6467,Positive
262,3.0,"If there's anything that's really unique about this aquarium, that's the robot fish. Given that this is Korea, a high-tech country, the robot fish is an expected but welcome sight to see.  Captivating beluga exhibit. Quite nice underwater tunnel. Plenty of small sharks too. And quite diverse fish exhibits.",Negative,0.8458,Positive
263,3.0,"Having been to a number of more interesting aquariums in Asia, this one is not particularly interesting. Unless someone in the gang craves for it, can pass.",Negative,0.742,Positive
264,5.0,"We bought the package of the aquarium tickets together with the admission to Lotte World. We decided to visit the aquarium first as they do not allow rentry at the Lotte World. The aquarium was located at the other side of the Lotte mall. The aquarium was new and well space out onto two floors. As with all aquariums around the world, you get to see almost the same typical species of marine animals on display. However, they have the beluga whale that is our first seeing it up close in an aquarium. Interesting! You can also ""bottle"" feed the fishes on the second floor which is our first too. My boys had a fun times feeding the fishes through bottles. Is definitely a memorable experience for them.",Positive,0.8565,Positive
265,4.0,"It was nice to come see the beautiful fish and aquarium. It was pretty!! The inside is big, bigger than Busan aquarium. You can see many different types of fish and animals here. You can just walk through and look at the colorful species. I think I spend around 2 hours inside. Beautiful designs to take pictures, and have a good time with friends or family.",Positive,0.9656,Positive
266,4.0,"If you are going to the Gangnam area any way, apart from visiting the shopping mall, you may wish to reserve time for this aquarium. It is not a very big one and the advantage is that it is actually inside the Coex Mall and is wholly indoor. Though it is compact variety of fish is good. You can see shark, turtles, penguins, and many more. You can spend two hours there, and worth going even if you have one hour and are thinking what to do. Kids will enjoy.",Positive,0.8934,Positive
267,5.0,This is very modern. It is inside the Lotteworld Mall.The aquarium is massive.There are lots of species.You can walk through clear observation tunnels and see fish and Baluga whales swimming around you.If you love sealife you will love it.,Positive,0.9001,Positive
268,4.0,Very beautiful and you can tell they work very hard on maintenance. One of the nicer aquariums. Beluga whales. Unfortunately I will not go back probably. Very sad. Small tanks.,Positive,0.1548,Positive
269,4.0,"Located in Lotte World Mall, it's a popular spot for tourists and locals alike. I'd advise going early for a visit as when the crowd's build-up, the experience can be a little harrowing (jostling for space to view the exhibits). Good educational fun for all ages and it's wheelchair and stroller friendly.",Positive,0.9042,Positive
270,3.0,"This is a popular aquarium in Lotte World. We weren't impressed. But, it's good to visit with kids once.  - It is 10~15 min walk from Lotte World Mall Entrance. Not that close. - Entrance fee is quite expensive. There are various discount rules by the way. Some of them will be available for foreigners too. Check the website before purchasing tickets. - We waited 20~30 min to buy the ticket. I was disappointed because we didn't have many people before us and their kind work is not that quick. - It was very crowded on weekday afternoon. We waited for our turn to see tanks mostly. I don't know how it's going to be worse on weekend. - The inside was dark. Not easy to get good photos. - They allow big strollers and it was pretty annoying for others. Sometimes those are risky when people don't notice in a dark area. - This is very ENTERTAINMENT friendly aquarium. They seemed take much efforts to attract family visitors. As well as watching and touching, they have various experience programs like scuba diving. If you are more leaning on underwater sanctuary, you'll probably be disappointed seeing fishes and marine creatures looping in relatively small tanks for them. - Unlike other common aquariums having the souvenir shops at the end, they have so many shops and food stalls on the way. - They don't have giant sharks like above three meter long. Instead, they have penguins, otters, sealions, etc. Belluga whales are the highlight of this aquarium. - The scale is smaller than we thought. It will take 1~2 hours if you don't staty long at each tank.",Negative,0.9768,Positive
271,4.0,"Thanks to the ticketing counter staff that we got to enjoy discount on the entrance ticket following on their fb page. And we got to enjoy a free churos as well.  Not a bad choice to see a wide variety here and the penguins was so playful and engaging! Jelly fish was so beautiful, seeing it glow. Great for the kids to learn more of the marine life.  Cons: The place was a little bit of confusing of where to go next. Like, left or right kind.",Positive,0.9896,Positive
272,4.0,"I've been to several aquariums around the world-- this is one of the few that I would say is totally worth the ticket price. If you're a foreigner, Trazy has a great combo ticket price for both the Aquarium and Lotte Adventure.... The belugas made me a bit sad because they seemed so bored-- just swimming in the same circles over and over. But the rest of the exhibits-- especially the huge tank with the giant rays-- are pretty stunning.",Positive,0.9211,Positive
273,3.0,"A really big aquarium in a great central location, Lotte Tower. Unfortunately it did become very crowded with lots of children and impatient parents pushing through with prams.",Negative,0.128,Positive
274,4.0,"Went here because we grew tired of walking around shopping and it turned out to be a great place to spend 2h in.  The place offers a large variety of sea creatures. You can find belugas, penguins, seals, sting rays + other smaller creatures.  Went here during a weekday and there weren’t not many people at all. Very nice and calm atmosphere.",Positive,0.7818,Positive
275,5.0,"Went here with a couple of friends, all in our twenties. We all thought it was an amazing time. We paid 60.000 won (50€) each, for a package deal including the aquarium, lotte tower and lotte world. And even though all three are worth a visit, the aquarium was the best. Having some great displays of fish and other animals like penguins, otters and whales.  The aquarium is in the same building as the lotte tower, and mall. Which are both enormous, with tons of stores and restaurants.",Positive,0.9729,Positive
276,3.0,"Its a nice place. Located at the basement of Lotte Mall, it shows some of the wildlife found in Korea. What interest me the most was to see the Beluga Whale. Gentle and playful creatures. The Spider Crab was another species that surprised me.  Have you seen the Flashlight Fish? Small fish that actually lights up in the dark? You can see it here.  Highlight would be the full screen aquarium. It is smaller than the one in Singapore but still gives a sense of foreboding as you watch the sea creatures.  Probably due to the amount of space, the aquarium makes full use of what they have.  To get here... Jamsil Station. Go to Lotte Mall.",Negative,0.8079,Positive
277,4.0,"Beautiful aquarium.  Went to this aquarium as it is part of the ticket I purchased which is a Lotte World + Aquarium ticket.  It is a 10 min walk away from Lotte World. At the basement of Lotte Plaza.  Like many aquariums we have visited, it features many species of fish and marine creatures.  The most unique ones are the Beluga whale and the axolotl.",Positive,0.7506,Positive
278,5.0,"What an amazing aquarium. The tanks are so clean you can't even tell there is glass. Great exhibits. Beluga whales, penguins, octopus that was full on display, sea lions, and otters. Plus so many fish. Lots of underwater tunnels. Best aquarium I've ever been too!",Positive,0.9508,Positive
279,5.0,Prepare to be impressed. Much bigger than we thought. The Beluga Whales are a sight to behold. Ready for plenty of pictures and videos.,Positive,0.6808,Positive
280,5.0,"The fishes in the ocean now you can see in there tunnel. Stingrays, all big fishes, dolphins, penguins and B..... Forgot the name of the big white fish. A must see attraction.",Positive,0.4588,Positive
281,4.0,"Love the experience with the beluga and all other featured species in this aquarium. Also the glass are so clear, it looks as if you are already touching the fish in the aquarium. We just didn't catch any shows here since we first went to Lotte world (amuzement park), and re-entry was not allowed so we had to check out what's there before coming in the aquarium.",Positive,0.8208,Positive
282,5.0,"They had several different types of interesting sea animals to see. It is not a huge aquarium like in the states, but for here, I was impressed. They do offer a military discount at the counter. I went around the holidays so it was busier. I would go to lotte world if I had to choose, just because it is bigger. That reference is for the budget people, since both activities are close in price. About $30.",Positive,0.8108,Positive
283,5.0,"Situated just at the city of seoul. After enjoying lotte world we went to Lotte aquarium. We were not expecting too much as we already been to many Ocean parks but to our suprise. They have 2 “Beluga Whale” yes a whale! aside from sharks, rays, big fishes, seals, sea turtles and penguins. So amazing. it was not a huge as ocean parks but what you can find inside will definitely satisfy you.",Positive,0.9571,Positive
284,5.0,"I’ve been to a few other aquariums so I really considered carefully whether it was worth while going for this, especially on a national holiday when it was jam packed with people. I TOTALLY enjoyed myself and would say this is in fact the highlight of my entire Korea visit. I was there primarily to see the Beluga and it certainly didn’t disappoint. The Beluga seems trained to swim near to the side of the tank so it was really easy to take pictures/videos of them. Besides, I also enjoyed looking at the collection of strange frogs and extra large river fish, which I haven’t come across in other aquariums so far. Somehow I felt that the enclosures were really well built and gives you a feeling that the fishes are really near you, it is really quite different in a great way.",Positive,0.9783,Positive
285,2.0,"If you went to Singapore or US, this aquarium will be too small for you and a big disappointment. It is small and pricy. If you want to kill time with children and are very wealthy, please consider this place as an option.",Negative,-0.5153,Negative
286,4.0,"We visited the aquarium 2 hours before closure and its the best time to visit. There were not many people and we get to enjoy the aquarium to ourselves. The Beluga whale seemed to be camera ready. They did know when to move in to take photos! However, I found the tank too small for 2 whales. Nevertheless, it was still a nice aquarium. The seals were very entertaining too.",Positive,0.945,Positive
287,4.0,What I enjoyed the most in the aquarium was the beluga! It was my only close encounter with belugas and their size are just massive! The entire aquarium was very clean. There were lots of varieties of fish to see. The jellyfish section was closed though... not sure if it costs extra or just really closed on the day I visted. I appreciated that the aquariums were huge and can be seen at various angles like tunnels or different sides of the tanks. I just feel bad that all were enclosed... I do hope that the animals have an open environment somehow where they can take a break and not look so enclosed (especially for the sea creatures).,Positive,0.9084,Positive
288,5.0,I was pleasantly surprised to find that this aquarium offered so many different species! It is really well put together and the staff was very friendly.,Positive,0.8801,Positive
289,4.0,"It was an enjoyable visit to the aquarium with my family and we spent about 1.5hrs there. We get to touch the starfishes and sea squirts, my 5 yr old finds it interesting. Also the showcase of jellyfishes intrigues her. I was hoping to finish touring the aquarium fast but it’s actually pretty big. Be prepared to spend some time there if you have kids.",Positive,0.8957,Positive
290,5.0,Somehow the quality of the glass tunnel was superb. So clear that it really felt like you were in the water with the fishes. This quality may not be found in other aquariums.,Positive,0.868,Positive
291,4.0,"Went to the aquarium after visiting lotte world on the same ticket you can buy a combo ticket online, the aquarium is on the b1 and b2 level of the mall which is a 5 min walk from lotte world. There are a fair few species of aquatic animals and some spiders and lizards. The y also hold educational sessions on a fair few of them the sea lion were definitely the pick for us and some small sharks as well. Sting rays were aplenty and the sea horses were of beautiful color not ones I had seen before. The kids loved it a must if you have a couple of hours to kill.",Positive,0.8885,Positive
292,4.0,This was a small aquarium suitable for children. I would recommend it though. The price is okay. There were lots of families with small children there. There is a snack bar and a store to purchase souvenirs also.,Positive,0.5267,Positive
293,4.0,"Many people have said to skip this aquarium and that there are many better aquariums around. So why do I recommend it? For me personally it was a great experience. It was cool to finally get to see a Beluga, and Lotte Tower Aquarium is in a very easy to access location. However, it can be very crowded so be careful when you visit.",Positive,0.9445,Positive
294,5.0,It was so nice and beautiful to see the variety of sea life. I most enjoyed the Beluga exhibition and the feeding of the fish with bottles. Try to avoid times when there are field trips by elementary groups because it can be quite loud and the groups overtake each viewing area.,Positive,0.8799,Positive
295,5.0,Ive never been to aquarium like Lotte World Aquarium before. Its size is awesome and there are various fish and whales. I was very excited at that time like a child. The happiest thing was that I got discount like 20% off! I thought the admission fee is a bit expensive to me cause Im a student. I remember the original price is 31000 korean money but I paid just 24800 korean money thanks to Visit Korea Mastercard. I could enjoy the experience with discount admission fee.,Positive,0.9603,Positive
296,4.0,"Prefer the coex aquarium to this, since it felt as though the former was larger. However, among all stations in both aquariums, I am in love with lotte world aquarium's seals station the most, especially when the seals splashed water out of their tank. Apart from its size, there wasn't nothing else that I could think of to pick on - the staff were consistently wearing a smile, the place was really clean, the ambiance was good..",Positive,0.8655,Positive
297,5.0,"All the family members enjoyed the place, variety of sea and river creatures, with nice activities for the kids like feeding the fish, touching the sea stars and nice souvenirs shop at the end.",Positive,0.886,Positive
298,5.0,We went with our toddler and thoroughly enjoyed it. Very kids friendly with a great diversity of species. Highly recommended.,Positive,0.9226,Positive
