,STAR,CONTENT,SCORE,COMPOUND,VADER
0,5.0,Nice village,Positive,0.4215,Positive
1,3.0, free Good for a walk The parking lot right in front costs more than 5000 won per hour ,Negative,0.8797,Positive
2,5.0, Right outside Chungmuro Station This is a hanok village ,Positive,0.0,Neutral
3,4.0,That was clean village and you know like village,Positive,0.6369,Positive
4,5.0, It was my first time in a large mansion so I really liked the fresh grand and pretty old house ,Positive,0.9029,Positive
5,5.0,Beautiful by night You even can get in the buildings to see the traditional interior and a set of beautiful paints,Positive,0.8316,Positive
6,4.0, It was nice to have an exhibition of my work A place that allows you to enter a designated area so you can see the work People wearing shoes What are they doing ,Positive,0.4215,Positive
7,5.0,Very nice and peaceful walk around the village while learning about the history and culture,Positive,0.762,Positive
8,4.0,old village,Positive,0.0,Neutral
9,4.0,It was very quiet when I went Great to walk around at a leisurely pace and explore,Positive,0.6249,Positive
10,5.0, A beautiful replica village from the Joson period Furnished to the last detail ,Positive,0.5994,Positive
11,4.0, Located near Chungmuro Station easy access and a place where you can enjoy elegant hanok in peace ,Positive,0.9136,Positive
12,5.0, A trip to Seoul for vacation It is good to take the city tour bus After a bit of rain it is green and green ,Positive,0.4404,Positive
13,5.0,Restored hanok houses nice walk,Positive,0.6369,Positive
14,3.0, Rather than taking the time to come there is something like this while walking If you want to go and see it it is a suitable place to go for a walk ,Negative,0.4215,Positive
15,5.0,20110525 Visited good attractions,Positive,0.6908,Positive
16,5.0, Very nice Well done pretty great ride ,Positive,0.9148,Positive
17,4.0,Good,Positive,0.4404,Positive
18,5.0, The weather was nice and I was able to learn about history and it was so good ,Positive,0.7609,Positive
19,4.0, Its wider than I thought I come here from time to time for various events Great for a walk too ,Positive,0.6249,Positive
20,5.0,Loved it,Positive,0.5994,Positive
21,3.0,It looks like its more sloppy than before,Negative,0.3612,Positive
22,3.0, It feels strange to appreciate the traces of the proJapanese ,Negative,0.2263,Positive
23,5.0,Multiple traditional homes were moved here to make this village Beautiful to see and educational as well Activities for kids make it a great family experience,Positive,0.8779,Positive
24,5.0, There is a small hanok under Namsan Mountain in Seoul Its a good place to be ,Positive,0.4404,Positive
25,5.0,Amazing tradition village well worth a visit,Positive,0.7783,Positive
26,5.0, It is located near Namsan Mountain in the city center This is a hanok village It is located 1 minute away from the subway ,Positive,0.0,Neutral
27,4.0, Senior Model Contest It was an unusually hot day but it was very crowded ,Positive,0.0,Neutral
28,5.0,a must visit place,Positive,0.0,Neutral
29,2.0, Tuho is made of plastic Jegichagi and top are cheap the streets are dusty sand and the door of the house is padded with urethane ,Negative,0.2023,Positive
30,5.0,Beautiful place,Positive,0.5994,Positive
31,5.0, It is a quiet healing A relaxing place in the city center good ,Positive,0.7269,Positive
32,5.0,A very attractive area of yesteryear with lots of history look at those houses and they are all livedin While walking along there are art galleries historic sites snack bars restaurants and who would not like to dress up to ware traditional clothes for a day,Positive,0.2693,Positive
33,5.0, A place where you can enjoy some quiet time in the middle of the city Its not fancy but I like it ,Positive,-0.1444,Negative
34,4.0, Lets make fun memories with the kids Sorry about the parking ,Positive,0.4588,Positive
35,5.0, A place to experience the importance of hanok in the city ,Positive,0.3612,Positive
36,5.0, It is a hanok village that represents Korea Just happy to have a place like this in the city center ,Positive,0.7351,Positive
37,5.0, I visited as a traditional wedding guest and the atmosphere of the Hanok Village was very good ,Positive,0.4927,Positive
38,5.0,Clean sobre thoughtful spaces in traditional architecture with the bustling city in the distance,Positive,0.6486,Positive
39,5.0, Its a city center retreat There is no entrance fee It is good to take a walk slowly I pass by when I go up Namsan ,Positive,0.3612,Positive
40,3.0, I have lived in Seoul all my life but this is my first visit Below expectations ,Negative,0.0,Neutral
41,5.0,To do absolutely ,Positive,0.0,Neutral
42,5.0, The weather is nice and you can watch the wedding Experience traditional games and good ,Positive,0.6908,Positive
43,1.0, Namsangol in Chungmuro get off ,Negative,0.0,Neutral
44,5.0, I really like it  traditional village ,Positive,0.4201,Positive
45,4.0, Its wonderful to have a place like this in the city center Although it is not very spacious and there is not much to see there are quite a few people in Seoul who do not know that you can enjoy plants that change ,Positive,0.8555,Positive
46,5.0, Its a good course for a walk and its very elegant and wonderful to have a place like this in the middle of Seoul ,Positive,0.9145,Positive
47,5.0, It is a very good place to take a walk and you can feel the taste and taste of hanok Parking is difficult so we recommend using public transportation ,Positive,0.5379,Positive
48,5.0, I like to walk quietly and I like to walk with the smell of grass and trees ,Positive,0.6124,Positive
49,4.0, If you want to see a hanok in the middle of Seoul it was good to see and relax in the park above there are many places to sit and experience ,Positive,0.7269,Positive
50,5.0, I went to the back garden of Hanuk Village Dip in pine incense and pine powder It was a very nice wheeling ,Positive,0.4754,Positive
51,5.0, comfortable and good walking place ,Positive,0.7351,Positive
52,5.0, It is a resting place in the city center where azaleas are in full bloom The scenery from the small cafe is beautiful ,Positive,0.5994,Positive
53,5.0, There is a parking lot and it is good to feel the old atmosphere ,Positive,0.4404,Positive
54,5.0,When in SEOUL Korea and you have the opportunity to have a tour in this place pls do so Ticket  price is cheap Worth it,Positive,0.6124,Positive
55,5.0, The mere existence of a place like this in the middle of Seoul makes Seoul citizens wish it well I can feel the lilac scent so strongly in the wind A strange feeling as if drunk on flowers and space Spring is very ,Positive,0.7462,Positive
56,5.0, This season is a place where you can see a very blue appearance How about taking a walk in Namsan Hanok Village where the four seasons are beautiful ,Positive,0.5994,Positive
57,4.0, Wheeling space in the cityGood If you havent been definitely go Its very very good If you sit on the hanok floor feel very cool and feel the science of hanok anew ,Positive,0.5868,Positive
58,5.0, You can just go or you can go because you have something to do You can walk Its okay to just bruise ,Positive,0.2263,Positive
59,5.0, After going down to Namsan I went through the back gate of Namsangol Hanok Village and captured the wonderful night view around the hanoks and traditional gardens on 416 the first day of the night opening of the ,Positive,0.5719,Positive
60,4.0,Very quiet scenic and educational too Many great photo opportunities in this hanok village ,Positive,0.7717,Positive
61,4.0, A Hanok Village in the heart of the city I have collected 5 hanoks A mustsee freeentry promenade park The spring sun is warm Lets go for a walk ,Positive,0.2263,Positive
62,5.0, The monuments full of Chinese characters have a strong historical atmosphere ,Positive,0.5106,Positive
63,5.0, Namsan Hanok Village Pavilion spring outing It was fine ,Positive,0.2023,Positive
64,5.0, Cherry blossoms and our hanok are in harmony It was a feast of spring ,Positive,0.4019,Positive
65,5.0, On a spring day in April full of spring flowers a hanok valley that goes well with hanok ,Positive,0.2732,Positive
66,4.0, Although the hanok is well preserved there was a sense of distraction ,Positive,-0.128,Negative
67,5.0, I got off the Namsan loop bus at Jongno 5ga and went up The cherry blossoms havent bloomed yet but they will bloom this weekend It was cold with a lot of wind but it was nice because it was cool I went because ,Positive,0.7684,Positive
68,5.0, I had no idea there was such a place in Seoul It was an opportunity to see the inside of various hanok houses in detail I was able to see various spaces such as the kitchen and the main room and it was so nice and ,Positive,0.6389,Positive
69,4.0, Take a leisurely tour of the Hanok and take a walk in the garden You can sit on the bench and relax and there is also a cafe in the Kokugakudo ,Positive,0.4404,Positive
70,5.0, It is a hanok village where hanoks from each region have been moved and it is a place in Seoul where the landscape and Namsan view are harmonized and you can visit it calmly Great place for childrens education as ,Positive,0.8402,Positive
71,4.0, It is a place where the few remaining old houses in Seoul were moved and preserved One of the things that makes Seoul different from New York is how close the park is so it is easy to get to ,Positive,0.4877,Positive
72,4.0,Cool place,Positive,0.3182,Positive
73,4.0, It is a very nice old villa in the middle of the city it has paths to walk and enjoy the landscape ,Positive,0.7425,Positive
74,4.0, I love the soft and beautiful melody of hanok that you experience in Seoul and the harmonious appearance with Namsan Park ,Positive,0.9022,Positive
75,4.0, Sunflowers are good but there are a lot of people so its a little noisy ,Positive,-0.0145,Neutral
76,5.0, A good place to hang out with kids The only downside is parking is difficult ,Positive,-0.1531,Negative
77,5.0, My hometown friend and I went up to the top of Namsan Mountain and looked down at the bottom of Namsan Mountain We saw a huge hanok with a large tiled roof and a hanok village around it so we hurriedly boarded a ,Positive,0.743,Positive
78,5.0, If you go out from Exit 3 or 4 of Chungmuro Station you can go directly to the Hanok Village and admission is free As you enter the entrance there is an information desk and restrooms on the right ,Positive,0.5106,Positive
79,5.0, It is good for education in the field children of our ancestors lives ,Positive,0.4404,Positive
80,3.0, It is good to stop by as the beginning or the last course of the Namsan walk You can feel the peace of a hanok ,Negative,0.6369,Positive
81,5.0, Its nice to be able to take a walk and play traditional games on a Daeboreum day like today ,Positive,0.7717,Positive
82,5.0, I cant believe there is such a good resting place in the middle of downtown Seoul Except for the fact that the parking space is small there doesnt seem to be ,Positive,0.4404,Positive
83,4.0, Snowing Hanok Village cool ,Positive,0.3182,Positive
84,4.0, Surprisingly there isnt much to see but its nicely decorated ,Positive,0.6652,Positive
85,5.0, Gyeongbokgung and Changdeokgung are very cold in winter so I went to a place where I could get some fresh air but it was so good In particular unlike other palaces it was more realistic and good because ,Positive,0.9165,Positive
86,4.0, A child who lived a child Looking at the sky The old idea is   ,Positive,0.0,Neutral
87,5.0, I was expecting too much so by my standards it was okay ,Positive,0.2263,Positive
88,4.0, There is a dog trail and as the name suggests it is a good walking course that feels like a spacious hanok front yard There are two paid parking lots the parking lot right in front is cheap but the parking space ,Positive,0.4019,Positive
89,5.0, It was quiet and there were no people It must have been because of Corona and the cold weather ,Positive,-0.296,Negative
90,5.0,Not too crowded Theres a hanbok rental just beside the entrance next to a 711 Beautiful scenery,Positive,0.5994,Positive
91,5.0,A cultural heritage nicely maintained in centre of the modern Seoul Easy connectivity with metro,Positive,0.7003,Positive
92,3.0,Nothing much to do here Just a blast of history on how they lived But we are unable to go close Just from outside the house,Negative,0.0,Neutral
93,5.0,Cool place to have a walk,Positive,0.3182,Positive
94,4.0, Ive been to it once but for free its clean and you can experience traditional games so children like it ,Positive,0.913,Positive
95,5.0, Close to the station easy to access Sometimes they also exhibit ,Positive,0.4404,Positive
96,3.0, Its not a mustsee content but its not bad if youre spending time nearby ,Negative,0.5824,Positive
97,4.0, Convenient location in the city center The scenery is beautiful and Namsan is close ,Positive,0.5994,Positive
98,4.0, A small hanok village and garden that you will arrive at when you come out of exit 3 and 4 of Chungmuro Station under Namsan and enter the alley ,Positive,0.0,Neutral
99,3.0, An oldfashioned hanok village in the middle of Myeongdong A place worth visiting occasionally with the family ,Negative,0.2263,Positive
100,5.0, It is a small gardenlike performance but it is very good for a quiet atmosphere ,Positive,0.6474,Positive
101,5.0, Its free and the location is top notch It will be a good experience for foreigners ,Positive,0.7906,Positive
102,3.0,Not really old The houses have been rebuilt,Negative,0.0,Neutral
103,3.0, It is just about the significance of being in the city center ,Negative,0.2732,Positive
104,5.0, Its not very spacious but its a good place for a stroll in the city It was interesting to compare and compare the old houses of the Min and Yoon clan who were the masters of the late Joseon Dynasty ,Positive,0.8126,Positive
105,4.0, I visited Namsangol Hanok Village after walking around Namsan Maple Road It was a weekend so there were many events and weddings so it was complicated but it was almost 15 years since I went ,Positive,0.0,Neutral
106,4.0,Very beautiful place,Positive,0.6361,Positive
107,4.0, Its nice to be able to look around in a comfortable and leisurely way as there are no people these days ,Positive,0.5994,Positive
108,5.0,Dont go to Namsan Bay go here too,Positive,0.0,Neutral
109,3.0, I cant give it a high score because the autumn leaves in front of the house look prettier And weekend cars are jampacked ,Negative,0.4767,Positive
110,5.0, So good The promenade is good hanok Namsan view experience etc ,Positive,0.7496,Positive
111,2.0, a lot of old stuff More like a hanok exhibition hall than a hanok village ,Negative,0.4201,Positive
112,5.0,Beautiful place with a view to Namsan tower Visited this place for a traditional wedding and its palace vibe is so nice Especially surrounded by the turning color leaves,Positive,0.8184,Positive
113,5.0, A village where hanoks are preserved around Pildong Junggu Seoul ,Positive,0.0,Neutral
114,5.0, There is a hanok village in the city so it is healing and good ,Positive,0.4404,Positive
115,5.0,Place is clean and you can see some traditional asian architecture There is also a beautiful park where you can walk peacefully,Positive,0.875,Positive
116,5.0,Small but nice,Positive,0.5719,Positive
117,5.0, A place I havent been to in a long timeits complicated because there are a lot of office workers ,Positive,0.0,Neutral
118,5.0, A place where you can get a glimpse of Joseon Dynasty yangban houses ,Positive,0.0,Neutral
119,5.0, A hot spot where you can enjoy a hanok house in the middle of the city Namsan Dullegil is a gold medal ,Positive,0.743,Positive
120,5.0, Its worth a visit You can even go to Namsan Tower from here ,Positive,0.2263,Positive
121,4.0, Its cute I have experience with bow making Please note that 4pm is the last time ,Positive,0.6486,Positive
122,5.0, The public parking lot right in front fills up quickly because there are so few seats I like the route to Namsan Tower by parking nearby and taking the bus ,Positive,0.4144,Positive
123,5.0,Very nice every sunday I visited just sight seeing and relaxation and to feel the presence of Gods nature and made some pavillionthanks,Positive,0.7574,Positive
124,5.0, After a while the wind is gone and I like it I couldnt go on a holiday but I like it in my own way ,Positive,0.5221,Positive
125,3.0, It fell short of expectations but I think its worth going at least once ,Negative,0.3291,Positive
126,5.0,Beautiful place,Positive,0.5994,Positive
127,5.0, It is good enough to take pictures of tourist attractions worth visiting in Seoul The cafe menu is generally delicious ,Positive,0.8834,Positive
128,4.0, classic scenery It is a quiet and oldfashioned neat garden I like the promenade in the city center ,Positive,0.6705,Positive
129,5.0,I liked,Positive,0.4215,Positive
130,4.0, A place to visit in the city center Where I used to live I installed some shadethe chair ,Positive,0.0,Neutral
131,5.0,very nice atmosphere,Positive,0.4754,Positive
132,1.0, There is nothing to see and there are the most people Why dont you go because there are not many hanok houses ,Negative,0.0,Neutral
133,5.0, The best place to go out with kids There are several types of pavilions ponds and streams You can also play traditional games ,Positive,0.765,Positive
134,5.0, Take the road between Exits 3 and 4 of Seoul Subway Line 4 and Zhongbu Road Station for about 100 meters and you will find the entrance to Namsangol Hanok Village Its easy to move around in Seoul and you can see ,Positive,0.4404,Positive
135,3.0, Please visit without high expectations Its okay to take a walk on a weekday morning when its quiet ,Negative,0.4939,Positive
136,5.0, A play experience is possible In particular I really liked the Chuseok fourcut event where you can take a photo on Chuseok and cut the printed photo and put it in a paper frame ,Positive,0.5256,Positive
137,5.0, There is a paid parking lot right in front of the Hanok Village but it is convenient and a good place to go with children You can go anywhere in the stroller ,Positive,0.5927,Positive
138,5.0,there are many beautiful places,Positive,0.5994,Positive
139,5.0, My hometown But it looks so different from before I didnt feel comfortable But its been a long time since I was born and lived for 7 years ,Positive,-0.5504,Negative
140,5.0, Namsan and the blue sky the eaves and buildings of a hanok look strangely harmonious The 2021 Chuseok fourcut event is so good ,Positive,0.6748,Positive
141,4.0,Not bad,Positive,0.431,Positive
142,5.0, Happy to be able to enjoy such wonderful scenery in the city center ,Positive,0.891,Positive
143,5.0, If you go to Mins house No 3 on the map you can experience a fun traditional knot and its so much fun ,Positive,0.6597,Positive
144,4.0, There was a lot to see Sit on the pavilion and the cool breeze blows ,Positive,0.3182,Positive
145,5.0, There are many things to experience with your child You can do jegichagi yutnori and jigchigi for free and making a bow costs money but it was useful Advance reservation is required for bow making ,Positive,0.7184,Positive
146,5.0,Simply amazing Theres a 600 year time capsule there You should check it out,Positive,0.5859,Positive
147,5.0, Because the autumn sky is so beautiful we went to find ours at Namsan Hanok Village ,Positive,0.7177,Positive
148,5.0, It reminded me of the memories of living in the countryside and I was deeply moved The desire to come again is like a chimney ,Positive,0.6666,Positive
149,5.0, I was immersed in contemplation as I walked along the pine field ,Positive,0.0,Neutral
150,5.0, There are many trees the air is clear and the shade is good so it is easy to take a walk ,Positive,0.8255,Positive
151,4.0, Meeting the past in the middle of Seoul An optimal space for a quiet and slow walk Recommended if you want to leave a beautiful hanok shot ,Positive,0.8074,Positive
152,5.0,Miss this place so much,Positive,-0.1531,Negative
153,4.0, It is close to Chungmuro Station so it is easy to access There is no admission fee and it is recommended for a light walk after lunch ,Positive,0.4144,Positive
154,5.0, A Hanok Experience Venue representing Seoul Before Corona there was no time for Chinese people to set foot These days I can enjoy the beauty of hanok in a leisurely manner so I come to ,Positive,0.7003,Positive
155,5.0, It was my first time living in Seoul Having fun with friends while walking on Namsangil It was one day because the hanok village was Corona ,Positive,0.7506,Positive
156,5.0, It was nice to be able to feel the beauty of a hanok while sitting quietly and sweating Plus free entry ,Positive,0.872,Positive
157,5.0, The wind is blowing the air is good its the best way to go these days ,Positive,0.7964,Positive
158,3.0,A place to rest and to relax,Negative,0.4404,Positive
159,5.0, It was so good to be able to experience rest and take a walk here ,Positive,0.5777,Positive
160,4.0,Great little village in the middle of the city Perfect if you are there and want a little culture  Its FREE  Not a must see but it still is great Great views of the tower,Positive,0.9625,Positive
161,4.0,The place was not that crowded Theres literally almost no one while we were there around 5pm wc is really good since its level 4 on social distancing at the moment Great place I enjoyed looking around the Hanok Village There were interesting  things preserved in every hanok that were used during the ancient years,Positive,0.9079,Positive
162,4.0, A very good place to take pictures more interesting than other Hanok Village ,Positive,0.734,Positive
163,5.0, A quiet space in the city center A great place for a picnic with children or a walk with friends ,Positive,0.802,Positive
164,5.0,Im here on July 25 2021,Positive,0.0,Neutral
165,5.0, Its a good place to go out with kids on weekdays and weekends However parking is difficult in the late afternoon ,Positive,0.1027,Positive
166,5.0, Good Corona there are no people and there are no performances but it is good as a park ,Positive,0.5574,Positive
167,5.0, I went there with my friends and my sons The cable is also a round trip ride Namsan Tower went up and down It was so good The duck family at the pond ,Positive,0.7809,Positive
168,5.0, An ideal place for an accessible city walk It is also directly connected to Namsan ,Positive,0.5267,Positive
169,5.0, It was a clean and beautiful garden Its a place I want to visit again  ,Positive,0.7845,Positive
170,4.0, Time to relax and experience the hanok village in the green scenery ,Positive,0.4404,Positive
171,5.0,Beautiful pictures,Positive,0.5994,Positive
172,5.0, I went for a wedding and it was nice to have a quiet feeling unlike other wedding venues ,Positive,0.5106,Positive
173,4.0, It was good to understand the old architectural style and to preserve it well It was nice to have a place like this in the city center because the air was good because it was under Namsan Mountain ,Positive,0.9042,Positive
174,4.0,It has a great view and feel I thought its a old village but it looks like they have built in in only 1990s and only the belongings are from ancient times so that was disappointing but I respect the idea of reproducing an old village and maintaining it well,Positive,0.7848,Positive
175,5.0, Its been a while since Ive been to Namsangol Hanok Village It was clean and well maintained and it felt good  ,Positive,0.7717,Positive
176,5.0, A place where you can feel the various types of hanok in old Seoul ,Positive,0.0,Neutral
177,5.0, Hanbok experience and etiquette education is also good I also like to take a walk ,Positive,0.6597,Positive
178,5.0, Visited in May 2021  Although hanoks from other places have been relocated its still good There ,Positive,0.4404,Positive
179,4.0, A place to relax in the city center Good for walking and resting Come with your kids on the weekend ,Positive,0.7003,Positive
180,5.0, good Even though I went to work it was good ,Positive,0.7003,Positive
181,5.0, Its free to take a walk and theres a lot to see It seems like a good place for children to run around in the large square Couples stand out a lot and it is a very good date course to look at ,Positive,0.891,Positive
182,4.0, The environment is good but its a pity that the food cant keep up with it ,Positive,-0.2144,Negative
183,3.0, Minimal place for locals A place where you can taste pavilions and hanok in Seoul for free However it is not a very impressive place for tourists ,Negative,0.0979,Positive
184,5.0, It is a place where you can feel the atmosphere of hanok in downtown Seoul and it seems to have been built with the efforts and sweat of many people when you see that it was dismantled and moved here It seems to be ,Positive,0.0,Neutral
185,2.0,Nice place to relax and good for photography,Negative,0.8225,Positive
186,5.0, This is the beauty of a total of 5 hanok buildings You can enjoy folk games ,Positive,0.7906,Positive
187,5.0,Good to walk take pictures and  relax at night,Positive,0.7003,Positive
188,5.0, Young Gugak Bento is being performed free of charge during the lunch period until June 2nd Decent performance ,Positive,0.5106,Positive
189,5.0, A more beautiful place if you know the meaning of every nook and cranny ,Positive,0.6361,Positive
190,5.0, It is a place that feels like a small folk village As you walk along the winding road through the trees you wonder if there is any healing ,Positive,0.3612,Positive
191,4.0, I went to Childrens Day The overall program was good and good and there were many experiences such as traditional knots rice cake making and house making ,Positive,0.7003,Positive
192,5.0, It was a great place It was modestly small and simple but had traditional beauty and was beautiful ,Positive,0.9337,Positive
193,4.0, Its not like Seoul and I like it because its close to nature ,Positive,-0.4973,Negative
