,STAR,CONTENT,SCORE,COMPOUND,VADER
581,3.0,"I was there with my parents and my 9 month old daughter. Place was generally well kept but lack of any guides and the toilets were not heated and had cold air blowing in all the time. Still, nice to see some old buildings but don't bother going if not absolutely necessary.",Negative,0.5932,Positive
582,4.0,If you stay in the center of Seoul and don' t have the time to travel outside Seoul. Then make sure to come here!  Like everyone else says it's a time machine and it educates you about a time long lost.  Come here when it's not rainy and hopefully not chilly!,Positive,0.2612,Positive
583,3.0,"Nothings much here, just taking photos of the traditional building, houses.... Also can pay and try on traditional things...",Negative,-0.1027,Negative
584,5.0,"I think that visiting this village is good for newcomers. It is a little village, consisting of five traditional korean houses. I liked this place because of the atmosphere and nature around. By visiting this place I have learned a lot about Korean culture, how and where they used to live, what they used to do. Was lucky to see the traditional wedding ceremony with musical accomponiment and try Hanbok, korean traditional dress. It costs 10 000 won for 30 minutes. Even in the evening this place is opened, and my advice is to visit it when there are not so many tourists.",Positive,0.9042,Positive
585,3.0,"Traditional touristic place in Seoul. You must have visited Hanok Village, but that's it. There is so many to do in Seoul, that we did not spend too much time here. Also, a lot of people visiting this place, so it can be crowdy. Many school groups, tourists, ...",Negative,0.0,Neutral
586,5.0,"This reminded me of an ourdoor museum we visited in Hanoi where traditional houses were exhibited. The structures were in excellent condition and some of these were being used for cultural shows. During our visit, some areas were closed because of such shows and there were even some pictorials going on. We visited in the late afternoon and were not able to see some attractions becasue ticket selling was already closed.",Positive,0.7579,Positive
587,5.0,"This small village situated at the foot of Namsan, contains beautiful examples of yangban houses which are furnished in the period style. It is interesting just walking around and taking in the relaxed atmosphere.",Positive,0.8689,Positive
588,4.0,"Are you interested of traditional Korean houses and performance? You can experience traditional houses, traditional performance in a city for free! Taekwondo experience program for foreigners is held at 11 a.m., 2 p.m., and 5 p.m. on Wednesday and Saturday every week, and if you visit the village on weekend when the wedding reenactment is taking place, you can watch it.",Positive,0.7424,Positive
589,4.0,Always love to look back to times that can still be vividly remembered for some of the older people of the Peninsula. Sometimes the traditions of the past are too easily swallowed up by the thrusting assertion of the modern. Well worth a visit.,Positive,0.8625,Positive
590,5.0,The entrance is free. You can rent Korean Traditional Costume with variety of designs at 3500 won. Free herbal tea is available for all visitors. The traditional houses are well-maintained,Positive,0.8834,Positive
591,5.0,Love to walk thru the Village and enjoy the traditional Korean architecture. When you walk down the hill or before going up there are many good shops and restaurants in the area.,Positive,0.8834,Positive
592,4.0,"I went there by the time there was a festival gathering different schools from Seoul for local foods, drinks, costumes and so on; around the end of September. And it was such a great experience. Besides that, the village its self is really amazing. You can feel the millenarian traditions right in the middle of the bustling Seoul. However, the city is crowded with other villages and temples, so if you are in a hurry, I would recommend other attractions rather than Namsangol Hanok.",Positive,0.9493,Positive
593,5.0,Visitors can participate in traditional Korean activities such as archery and enjoy traditional Korean performances as well.,Positive,0.6486,Positive
594,5.0,"Whoever that wanted to experience the Korean Culture, you should go to this Village. Especially for ladies, you should try to wear their beautiful Hanbok ! it just cost few won for you to experience the culture. Its really cheap and worth it !",Positive,0.8846,Positive
595,5.0,"This is a must do when we have visitors in town. Free traditional homes to view, walk around beautiful park with a time capsule. Very neat. They have traditional hoop and stick as well as another game to try for kids. It is a close walk to shopping markets after with plenty of street food and shopping. Great, inexpensive cultural day.",Positive,0.9493,Positive
596,3.0,"This is a nice peaceful place to get away to, with a small lake and several Korean buildings. However, once you've seen one building you've seen them all. You can't go inside any of them so you don't get to see much really. Still, I think it's worth a visit.",Negative,0.7845,Positive
597,4.0,"We went to Namsangol Hanok Village in summer (June 2014). It was an amazing experience for me because I got the chance to see an old-fashioned Korean village in person, instead of watching them on tv (Korean Drama such as Iljimae, The Princess' Man, Arang & the Magistrate, etc). Yes, I'm a bit of Korean Drama fan especially the Sageuk kind ;)  More over, the entrance was free! Yes, free! You don't have to spend any won to enter the village. Even though, we walked a few km to reach it, but it was well worth my time. My hubby even got the chance to play one of the old-fashioned games there.",Positive,0.9748,Positive
598,5.0,"I love that place. I wore a hanbok - traditional korean costume and had my photos been taken by a nice korean lady. Also I took a lesson on korean handwriting. I think it`s called hangul, but not sure here. They`re worth it. Really. I tried words sara - love and happiness (but forgot the korean name for it)",Positive,0.9442,Positive
599,4.0,"This place is nice for taking pictures and learn the traditional Korean's visit. This is a big place with some hanok houses (that you can actually see what's on the inside!) as well as the cultural workshops. Nice park, there's a flock of tourists when I visit. But when you go inside, actually, it's not that crowded.  There's a Seven Eleven in front of the gate, also you can take pictures with Hanbok Traditional Costumes.  Worth a visit.",Positive,0.7177,Positive
600,5.0,"The village is lovely, traditional hanok houses and a nice park. It has good infrastructure with enough restrooms. We went there on a Sunday and school children volunteered as free English tour guides (about 1 hour, we didn't take one because we did not have enough time). I think they want to practice English, it seemed like a school program.  The best part for us was the Taekwondo foreigner experience program. You have to sign-up in advance via taekwonseoul.org and I think it costs around 35,000 KRW per person but it was really worth it. The trainer (from famous Kukkiwon) was great and made it a lot of fun. Still we got a good insight into Taekwondo.  Afterwards there is also a free Taekwondo show that is really really impressing. You can check the schedule at the above mentioned website.",Positive,0.9904,Positive
601,5.0,good place nad nice historical places at korea tradiytional must visit before 18.00 hrs good to visit,Positive,0.8225,Positive
602,4.0,"A little bit hard to find if you walk from N Seoul Tower because it's take like one or two hours to find it. Walking down the hill with no wifi (olleh egg wifi doesn't work here) is a little bit tough and some Korean doesn't know where it is. However, the minute when you walk in to this village it's totally worth! Breath-taking view and very beautiful village like any where else in Korea. Not only that but also free entrance! After visiting this place don't forget to find good Korean restaurants around subway. There is a few interesting restaurants there!",Positive,0.962,Positive
603,4.0,"We were lucky enough to visit when they presented a Taekwondo exhibition. An amazing half hour show. Free of charge. Don't miss it! The village itself is interesting and pretty, but it was a hot day and the walking is hilly.",Positive,0.8366,Positive
604,5.0,"One very interesting place to see, and the fact that you don't have to leave the city to see it is wonderful. To fully enjoy your visit, look for the volunteer group of guides next to the entrance - young men and women who give you a guided tour free of charge. We were guided by the wonderful Tom (that's his ""western given"" name), who was incredibly nice and new a loooot of the history of the village. A great experience indeed!",Positive,0.9772,Positive
605,5.0,The place showcase the traditional Korean houses and other traditional structures. The entrance is free but you may want to spend a little to tryout their traditional clothes (hanbok). There are very few tourist when I visited the place and so I find it peaceful and relaxing.,Positive,0.9117,Positive
606,3.0,It is an interesting place to know more about the old Korean village.But there are few empty spaces inside the building which is useless.,Negative,-0.2263,Negative
607,4.0,We only have a few hours before leaving to take our flight. Decided to go to the village as it is very near to our hotel.  The compound itself was a nice area to take a stroll. It is interesting to see the very well preserved houses. Can get a glimpse of the way of life of Koreans in the olden times.  There are areas where you can play some traditional games as well as watch folks doing handicrafts.,Positive,0.893,Positive
608,5.0,"You'd expect a village to be in the countryside, but not this one. The village isn't a ""natural"" village as the houses were moved there from elsewhere. Apparently the ""Han"" in Hanok refers to the Han people who are the Koreans (they are nothing to with the Chinese Han people). The ""ok"" of Hanok means house, so they are Korean houses. The houses are from the Joseon period and belonged to quite important people. One belonged to the parents of a Korean Queen. The houses are wooden and a little raised with a few steps up. Where there are wooden floors, this were the meeting parts of the houses. However where the families actually lived have covered stone floors which had heating underneath. Outside at ground level you can see holes in the side where the fires were lit, and around the corner you might find a large chimney. I wouldn't have wanted to clean those fires out; you'd need to be a horizontal chimney sweep. The doors can be lifted up out of the way in summer to let breezes through. At the Village there is also a meeting hall set very scenically with a little lake in front and hills behind. The hills must be granite as the rock outcrops look identical to the granite outcrops of Girraween National Park in Queensland, Australia. At the entrance to the Village are full-sized models of various dignitaries, in singles and pairs. There are holes where the faces should be and you can stand behind and stick your face up to the hole to look as though you are wearing traditional garb. The toilets are just a short way behind, should you need them. Newly married or about to be married couples have their photos taken there in traditional dress. A couple was there when we were and I asked the mother/mother-in-law if it would be possible to take their photo. She readily agreed and indicated I should be in the photo too, as did the couple, who moved apart for me to stand between them. So I have a photo of a very elegantly dressed Korean couple with an Aussie traveller in shorts and dusty walking shoes. How kind was that of them!",Positive,0.9634,Positive
609,4.0,"Namsangol Hanok Village is a traditional village set up with well-preserved Korean-style houses, called the hanok. Old household items are displayed in traditional houses to recreate a village of the Joseon Dynasty. There are also cultural experience activities organized in the village. The entrance to the Namsangol Hanok Village is free, but the activities come with a small chargeable fee.  Guests can tryout Korean traditional costumes too. The fee is KRW3,300 per person.  More on my blog: http://www.kenwooi.com/2013/10/namsangol-hanok-village.html",Positive,0.2846,Positive
610,4.0,"Namsangol was much better than I had expected, and also a lot more tourists than I had hoped for. I thought most people would go to Bukchon Hanok Village and leave Namsangol relatively quiet. How wrong I was. When I went around noon, there were many groups of foreign tourists and Koreans walking around. Nonetheless, I thought my walk around the village was an enjoyable one. I must say the village is well organized and clean. Once you go through the gate, the enclosure on the left drew my attention. Inside, I went around the houses that were immaculately preserved to show how life in the olden days was. Not only were the houses lovely, but they were so beautifully presented, allowing the visitor to look inside living quarters as though you were a house guest there. I actually spent a good deal of time admiring the architecture and even the smaller, quieter corners of the compound. I wish I had taken the guided tour, though, to enhance my understanding of what was there.There was a stage where some young performers were practicing for a martial arts show, which was captivating. Very near to Chungmuro Station, Namsangol is a wonderful place to visit if you are hard pressed for time like I was. This is an inner city attraction I would love to revisit.",Positive,0.9924,Positive
611,3.0,"Here there is a Tourist Information that we discovered that they have Hanbok for rentals and take a photo shoot inside. People there are very accommodating but just be careful of pulling and choosing Hanbok because some of them smells bad though if you want to try Hanbok, tourist centers in the Airport are giving out a try for free.",Negative,0.5346,Positive
612,4.0,This is a great way of seeing different Korean hanok traditional houses and architecture clustered in the same place. N-seoul tower also is visible from hear. It can get little crowded at time. I had truly enjoyed this place. The nearest subway station would be Chungmuro Subway Station. They also do have some performances if you came at the right time (unfortunately I was a little late).,Positive,0.8834,Positive
613,4.0,"This preserved traditional Korean village, complete with huts and common areas, is located in the middle of the world’s most technologically wired city. Tours are conducted in English several times per day. Check with the information hut just inside the traditional gate on the right side when you enter. The big bonus is that it is entirely free to enter.  It is well worth doing the free guided tours as the guides are able to fully explain what each little nuance of the houses. Eg the difference between male and female quarters, what the significance is of the number of levels of stones that the house is on, what the shape of each house signifies etc etc.  The centre also houses the time capsule which commemorated 600th yrs of Seoul in 1994, and is to be opened 400 yrs from then.  The centre is open free of charge and is very much well worth a visit. It is easy to get to, being located near Chungmuro Metro station.  If your time in Seoul is brief, then this is a must. I ceertainly found is fascinating, and I hope you will too.",Positive,0.9848,Positive
614,5.0,"Aside from Bukchon, you could also see Seoul's traditional houses in Namsangol. It's more of a village/palace type attraction and visiting here is free! It's also huge and you need maybe at least an hour to have your pictures taken in various spots in this village. Outside the village, you could find a boutique offering rental services for South Korea's traditional costumes where you could wear it for at least an hour while roaming around Namsangol. Inside the village, you could also find the same but you could only wear the costume in a particular spot.",Positive,0.6239,Positive
615,3.0,"If you are heading to Namsan, very close by at Chungmuro Station, Exit 3 is a collection of restored traditional houses and pavilions. Step back in time to see how the people of the time lived. Best of all, it's free! Note, it is closed on Tuesday.",Negative,0.8805,Positive
616,5.0,"I love this place, & was lucky that cherry blossoms were still blooming at the park during my visit. Good place to learn about cultural stuffs & there is also Hanbok costume wearing with a minimal fees. Best part it is free. My suggestion would be go to this village first & after you are done, go to the bus stop outside the hanok village & get on bus no 2 directly up to Namsan Tower",Positive,0.9325,Positive
617,4.0,"If you're planning to have a peaceful or romantic night, this is the place to be. The palaces are good too but they close at 6pm. We went to Hanok Village around 8pm. The place closes at 9pm. Hanok village is very serene and tranquil at night. I suggest you explore the villages first (turn left when you enter the main gate). You can either wind down inside the time capsule (top most part of the park) or at the pond near the main entrance. The place is really quiet and ambient at night.",Positive,0.876,Positive
618,3.0,"We went to the Hanok village as I thought we should have a feel of how the folk villages in Seoul were like. I was quite impressed by how the old villages were set out, but I suppose we saw a similar one while touring the secret garden of Changdeokgong. Once you've seen one, you've seen them all.",Negative,0.4491,Positive
619,4.0,This village showcases traditional Korean villages. There are a lot of well preserved hanoks (korean houses). We were able to try on Hanboks and have our pictures taken. Take Line 4 & get off at Chungmuro Station.,Positive,0.2732,Positive
620,4.0,This is a good walking trip and easily accessible by train. There is also no entrance fee. There are a lot of Korean traditional houses which are good for photo opportunities. It is also very near Gyeongbukgong palace.,Positive,0.8225,Positive
621,4.0,"Hanok village is a very interesting place to visit of you would like to know more about the life of the ancient Koreans. They have a few traditional houses preserved so tourists could see what it looked like. They also had a few activities for kids to try out (the olden days games) which we did as well! If you are looking for a place to try on a traditional hanbok, you can do it here! They have both male & dermal and it is pretty inexpensive.",Positive,0.9166,Positive
622,4.0,This was a fun little spot to take the kids. The walking paths led us up to a great view of Seoul Tower. The main area has a stage and place where tents are set up for local craftsmen. You can try out the traditional games and they do performances and ceremonies on a schedule.  The traditional hanok (houses) were open for viewing but you can't go inside them. Lots of opportunities for photos though. And best of all it is completely free!,Positive,0.9642,Positive
623,5.0,I was surprised to get to that lovely place for free. We visited ancient Korean houses. The village can be treated like a park. I guess it is even more beautiful in late spring or summer than in March.,Positive,0.9402,Positive
624,4.0,"This was a comforting place to stopover. The village had a distinct old-school feeling. Most of the architecture here was constructed way before the modernization swept the place. Nevertheless, if you don't like that kind of things, then this place isn't worth it. But I found it to be a comforting place in a busy city.",Positive,0.5806,Positive
625,4.0,This is the place to see if you are not traveling outside Séoul. The village is a perfect place to roam around and exploring the traditional Korean houses. The village also conducts a free demonstration of Taekwondo but not every day. You can also play games if you want to do some activity. I was lucky to witness a traditional Korean marriage ceremony which was wonderful. The place is good to stroll around and I had a great time.,Positive,0.9808,Positive
626,4.0,"Visited this place through the Jeonju free shuttle bus service.The Hanoks have a distinctive beauty about themselves.During the autums the shaded leaves were giving enchanting effect of nature and man made beauty about Korea.Deserves a one time visit.Through the free shuttle bus,A MUST .",Positive,0.9485,Positive
627,4.0,"We visited the day of Lunar New Year so it was busy, but had a lot of activities. We got to try traditional rice cake soup a Korean New Year's tradition. There we lots of arts and crafts for the kids to enjoy. They also had performances. I don't think the food, arts/crafts, and performances are normal, but a Lunar New Year event. They might do other events on regular days, but you will need to check. The village display was nice with multiple houses. There was no fee. It is easy to get to and see if in Seoul. If you would like to see a village or traditional houses without leaving the city this is a good choice. Ramps were available, but it was slightly muddy due to weather. It is also on the slope of Namsan Mountain.",Positive,0.9528,Positive
628,4.0,The place is a must visit during winter. The snow covered village is a sight to behold. It is like a view taken out of a postcard or painting. It is very beautiful. :-),Positive,0.8508,Positive
629,5.0,Quite a few traditional buildings. While we were there they had ice sculptures in the village. No entrance fee. You are free to wander around the village and look in the various houses they have on the site.,Positive,0.2732,Positive
630,4.0,"This is an uninhabited village that restored traditional Korean houses. It has pond, stage for frequent performances and a time capsule! You will find yourself, it just perfect place to stroll around. You can play some traditional Korean game in there if you feel like some activities. I would recommend you must see in there, Korean traditional marriage ceremony.",Positive,0.9151,Positive
631,5.0,Write you wishes for this year there  And you can enjoy the house of ancient people of korea Free fee also :),Positive,0.8779,Positive
632,5.0,"We stopped at Namsangol Hanok Village mainly to see the ice carving festival that is there until the middle of January 2014. As other reviewers have said, it is completely free to visit this hanok village, but we were surprised to have a student tour guide take us around the village. Stella, our 15 year old tour guide, spoke very good English and taught us so much more about what life was like in Korea in the early 1900's than what we would have picked up on if we walked through the village without her. We spent around an hour there walking through the houses and playing a few games.",Positive,0.9329,Positive
633,5.0,"It is hard to find attractions in Seoul that does not charge. While walking up the street, we saw a group of voluntary teenage guide (in orange coat) and we requested for their assistance. With the guide walking through the Hanok houses and explaining how the folks lived in the olden days was really interesting. The story of each house was also explained and we get to see the houses in a different light. Would highly recommend this place and also engaging the guide. There is no entrace fee and the guide's service is free too. The place is great for photo-taking.",Positive,0.9412,Positive
634,4.0,"Namsangol Hanok Village is situated right in downtown Seoul&just walking distance from our hotel in Myeongdong.Entrance is free and they only charge you for the activities(mostly for kids) that you want to join such as korean paper craft,bow decorating and mask colouring.Even though the place is small compared to the other Hanok&Korean Traditional Villages in Korea,it still offered visitors especially tourists good information&knowledge of traditional korean life.The place is clean&has the basic facilities like restrooms,information counter&resting areas.It also has a time capsule which requires a short hike up a hill to view.We enjoyed our visit there&the beautiful view really makes our visit more worthwhile.",Positive,0.9656,Positive
635,5.0,"JUst a minute walk from Chungmuro Station... this site is very cool and a glimpse of traditional Korea lifestyle. There is no charge to enter, just charges on the activities you may want to join in on. It's a perfect place for a shutterbug or anyone with small children that want to run around the massive park. It sits just below the iconic Seoul Tower.",Positive,0.6997,Positive
636,4.0,"I enjoyed Namsangol Hanok Village not just for the traditional architecture and buildings, but it is also decorated with what was once how Koreans lived. They have turned this village not just for tourists, but when I was there, there were local events being held, and school trips, and children playing. With all the local activities organized in this place, it gives the place far more life than one of the palaces which I visited. There are also demonstrations of some traditional arts and crafts.",Positive,0.5187,Positive
637,5.0,"We came very early, took some pictures then saw the sign that says wearing of Hanbok is available from 10 am for a price of 10K won and with 30 minutes to take pictures. It's a must try. For big person like me, the selection is not so many but for medium to small people, a lot of choices for Hanbok.",Positive,0.4767,Positive
638,3.0,"good reachable location , different aspect of korean traditions within a small area . it is great to have a walk in the garden and to see the kids doing some hands on activities .  if you are staying more than 3 days , check it out .",Negative,0.7906,Positive
