,STAR,CONTENT,SCORE,COMPOUND,VADER
304,4.0,"It is less crowded than Bukchon Hanok Village and the vibe is a bit different. It is also a nice place to try on the hanbok and take photos. If one cannot have time to visit the Korean Folk Village, this Hanok Village can be a substitute as it is in Myeongdong and there are some performances or activities that tourists can enjoy.",Positive,0.7184,Positive
305,4.0,"Very nice area with traditional Korean houses. The houses are well maintained and decorated. Nice garden yard area, which is very peaceful. Pleasant place to walk and spend a casual afternoon",Positive,0.9419,Positive
306,5.0,"The scenery is amazing. My favourite part was the pond in the back with swimming fish, where i could sit down and meditate. We even saw a cat running across a bridge.",Positive,0.5859,Positive
307,4.0,"If you like quiet and peaceful strolls whilst enjoying a good view, the NamSanGol Hanok Village is for you. There's not much going on here besides looking at traditional Korean homes (aristocratic) but the walk and sightseeing is quite quaint and serene.  But in all honesty, this place can easily be a hit or miss. I went to the Korean Folk Village a few days before I came here so I didn't enjoy this scenery much (even though it's just as beautiful here). So be sure to plan out which village scenes you attend first before going to several. One is usually enough, there's not much difference for two visits. I recommend the Korean Folk Village more.",Positive,0.9776,Positive
308,5.0,"5 mins walk from Chungmuro subway station (exit 4). Free admission but closed on Tuesday. Namsangol Hanok display Hanok (traditional Korean house) from several wealthy family.  Personally I prefer Namsangol Hanok compared to Bukchon Hanok because there are many activities in this place which opens to public, flatter walking path and we can ""peep"" the internal hanok.",Positive,0.7184,Positive
309,4.0,"In Korean, this means ""village of traditional houses in the Namsan Valley"". It's in the Pildong neighborhood in Junggu district of Seoul. They try to be authentic to the period, which adds to the charm. We saw many people coming in traditional attire and posing for photos. Very lovely garden to walk around with plenty of benches.",Positive,0.7778,Positive
310,3.0,Went in mid June close to noon time and it was a bit sunny. Temperature was still a cool 27 deg C so it was ok to walk around. The scenery is nice and is good for taking some photos but otherwise nothing very interesting.,Negative,0.4441,Positive
311,4.0,"If the weather is good, I'll recommend a visit to this place. The architecture is lovely and a lot of the houses have rooms decorated in traditional style, allowing you a peek into Korea's past. It's not a 'walk in and look' - you can stand outside the door and look in, craning your neck around the sometimes dark corners. But there are plenty of signs explaining what you're seeing so you don't have to be well-versed in any history beforehand (although it definitely makes the experience better).  We arrived towards the end of the day when everything was being packed up. I imagine it's more lively in the late morning/early afternoon when activities take place, stalls are open outside the main gate, and people walk around in traditional dress. But if you've been slowly walking the area like us, I'd still suggest to drop by. It's a very lovely area with a nice park just next door that makes for a nice stroll. There is also a gift shop which, surprisingly, has some nice and affordable souvenirs.  I am not sure if this is an attraction I would've gone out of my way to reach - which we definitely had. But if you have the time, and if you're interested in seeing what Korea looked like before, then do find a nice day and go.",Positive,0.9949,Positive
312,4.0,I have been in Seoul several times and never made it to this Traditional Garden and Hanok Village. A local Korean friend of mine discovered it with me on a nice Sunday afternoon. It is only about a ten minute walk from the Catholic Cathedral.,Positive,0.7184,Positive
313,3.0,"The weather was nice, so it was beautiful to walk around and take some pictures of the nearby garden and small river that runs through. Otherwise a bit boring, but if you pass by anyway have a look.",Negative,0.4276,Positive
314,4.0,The Hanok homes here are lovely but they are only a small part of the appeal of this village. There are some beautiful walking paths and picnic areas in the park around the Hanok. It is a great place for a stroll or picnic. I enjoyed seeing and listening to the babbling stream that winds throughout the village. It is a fabulous place for photos.,Positive,0.9762,Positive
315,5.0,"I thought this place was perfect for taking a walk. It was very quiet and peaceful when I was there. The hanoks are fun to see, but there aren't very many of them. It's free, so it's great to check out if you're in the area.",Positive,0.9535,Positive
316,4.0,"Beautiful place rich of history, better to be with a tour guide to know all the stories behind which will make your visit more enjoyable.",Positive,0.9273,Positive
317,4.0,"I walked down from N Seoul Tower and took a quick walk through before heading to my next activity. It was a cold day when I visited, but it was still beautiful. I have a hunch that it would be a little more interesting at night with lanterns and lights and Seoul Tower in the distance. I would say that if you are in the area stop by. If you are going to Bukchon Hanok Village, then I'm not sure that there is anything new here. Although there is a lovely photogenic pond, so it's not a waste of time if you want to see both.",Positive,0.9405,Positive
318,4.0,"Namsangol Hanok Village offers few things to the visitor to learn about Korean culture such as Hanbok fitting, archery making, rice cake making or tea ceremony experience by paying a bit of cash. There is no entrance fee if u just want to explore and see. The hanok setting is very nice and you can learn how the traditional Korean house back then. Fortunately if you go in Spring time, u may see a bit of Cherry Blossoms as well as the other pretty flowers.  If you go deep down to the center of the park you will find Seoul's Thousand Years Time Capsule which they burried in 1994 to celebrate Seoul's 600th years anniversary which contains cultural properties. It will be open in 2394 in celebration of Seoul's 1000 years anniversary.",Positive,0.8805,Positive
319,4.0,"Visited as part of a half-day, multi-site tour. It was a quick walk around and we were able to learn a bit about traditional Korean lifestyle and villages. Be sure to duck under the little walkways between buildings because you might hit your head (don't say I didn't warn ya!)",Positive,0.3341,Positive
320,4.0,Even a grey day could not influence the experience at this place. Two facts helped a lot. Paper lanterns with great figures brightened the impressions there. And there was a foto shooting for an egagement which gave life to this place :-),Positive,0.891,Positive
321,4.0,"This village is much better than I expected! I heard from other people it was pretty much traditional houses and nothing too special, but I have to say I really liked it and would visit again. The architecture is impressive and village is quite big. You can really have a feeling of how people used to live in the ancient times in Korea. They also have a nice gift shop with beautiful and original gifts.",Positive,0.9839,Positive
322,3.0,Very nice place you can see all traditional houses but unfortunately very small town you can finish it less than half hour,Negative,-0.2625,Negative
323,5.0,The village with traditional houses from different places of South Korea. There is the Time Capsule on the territory of that village. 600 hundred items from modern life are buried there in the ground so that 400 years later (when Seoul celebrates its 1000 years anniversary as the capital city) it could be opened by future generation. Amazing!,Positive,0.8313,Positive
324,5.0,"Beautiful area to walk around, it's very scenic with the traditional houses and the background of the Seoul industrialized city! Information/tourist booths can be found scattered around with maps and suggested directions to walk around the area. It is hilly, which I personally love, but could be hard on people who have any knee/leg/feet/etc. issues. There are tea shops scattered about and other stores as well. We had tea at a fantastic tea shop along the path!",Positive,0.9115,Positive
325,3.0,"I walk here from Namdaemun Market. This is such like small village with traditional Hanok Village. If you go to Or before go to Namdaemun, please have a visit at this area to take a photo. It will not take a long time.",Negative,0.5859,Positive
326,5.0,Enjoyed every side of it since we went there during spring. lots of flowers and cherry blossoms. there are also people and couples in hanbok who are also game to take picture with. good for family bonding too as we see lots of them having a picnic,Positive,0.7351,Positive
327,4.0,來南山谷韓屋村逛逛韓國老建築. This is a reserved village for traditional Korean houses. The outlook of the houses are very Chinese house like. But the inside is more Japanese oriented (this is my be due to that Korea was once the colony of Japan). It’s definitely a good spot to visit in Seoul.,Positive,0.8512,Positive
328,4.0,"Very cool attraction - also it’s free! The houses are very well preserved, and it’s cool to walk around and see.",Positive,0.9253,Positive
329,5.0,"We visited Namsangol Hanok Village on a weekday morning in summer. Beautiful garden with lots of ponds, pavillions and of course the traditional hanok village.  A big place to walk around and a good place to learn about Korean Seoul culture. Definitely should visit Seoul Millennium Time Capsule where they buried 600 items in 1994 and to be opened 400 years later. What a romantic idea!  We enjoyed walking around the Hanok village where there are different styles of traditional houses.Apparently, there are some ceremony, performances and hands-on activities for the visitors throughout the week. Be sure to check out their website before you visit if you like to experience more.  A perfect place to spend a peaceful day in Seoul.",Positive,0.9794,Positive
330,4.0,"First you don't have to pay to visit this nice place. You can see many Korean traditional home, and there are some performance you can enjoy in the evening. You can even dancing with the performers. There are also some spot where you can try some Korean traditional game here.",Positive,0.7748,Positive
331,5.0,"My take is this is a better bet for seeing Hanoks because Bukchon is a upperclass residential district set on a hill (people still live there, so you can't just walk in!) In Namsangol, it is a reconstructed village (mostly of old houses that were moved there, and 1 replica), so you can walk around all you like - the other nice part is that it is near Myeongdong (Chungmuro), so easily accessible, and not hilly (unlike Bukchon!)",Positive,0.8979,Positive
332,4.0,"Went during their taste of korea, that had samples of eats, drinks, and carving demos. Pretty neat experience. Got some goodies to try and take home.",Positive,0.7351,Positive
333,5.0,This is a great place to visit as historical house have been moved into this lovely park setting.There is a tea house and many places to admire the garden like setting. I loved having the time wandering among the ancient houses.,Positive,0.959,Positive
334,5.0,This is one place that i would highly recommend when you visit Seoul. Its like traveling back in time. Its very fascinating to see how Koreans lived during those Joseon/Shilla era and how they built the houses with those intricated designs. There's no entrance fee and you can ask for a guided tour as well free of charge. They also provide wheelchairs for seniors who cant walk too long which was really great since im traveling with 2 senior citizens.,Positive,0.9492,Positive
335,4.0,"It was fun and crowded with Korean to celebrate the mid autumn festival. Great experience, there was shows for the whole day, stalls for younger to participate in crafts, Korean families were picnicking, and food trucks selling Korean food. The houses were in good shapes with lots of interior details and we were able to understand how Korean lived before..my boys were learning and asking what were this, why and how. Overall it was great cultural experience to learn.",Positive,0.9694,Positive
336,2.0,Pretty empty in my opinion. Not much going on. Just drab and unexciting. Not really worth your time checking it out.  Free entry. Metro exit 3,Negative,0.5882,Positive
337,5.0,"This village is good for seeing historical Korean buildings. It offers free 40 minute tours in a range of languages (Chinese, English, Korean and Japanese). Check before you go what days and times have your language.",Positive,0.7351,Positive
338,3.0,"My friends and I stopped by this place on our way down from Seoul tower. Tranquil surroundings, but without activities or sufficient signboards in languages other than Korean, it is just a location with traditional houses",Negative,0.1779,Positive
339,3.0,"I enjoyed getting to see the traditional architecture at Namsangol Hanok Village (남산골한옥마을). I think this place is most suited for photographers and those with a strong interest in Korean culture. As a tourist, it was a little underwhelming as it is essentially just walking around and looking at the buildings. There is an area where you can watch martial arts or drink tea but it is otherwise a sight-seeing location only. If you are doing the Seoul City Bus Tour, it's worth taking 30 minutes to stop and look at it as it is free admission.",Negative,0.8519,Positive
340,4.0,Went on a day tour that included Namsan Hanok Village. Had a nice walk around this quaint traditional village with beautiful architecture. The guide provided interesting narratives.,Positive,0.8555,Positive
341,5.0,"We visited here using the subway and exited at Chungmuro station. Entrance was free and it was a beautiful place to visit. We had a nice look around. You can even see the N Seoul Tower from here. Plenty of tourists but the place was interesting nevertheless. Many well-preserved hanoks, pavilions etc.",Positive,0.8422,Positive
342,5.0,"Architecture is beautiful, this place is clean and it is free to get in.  This recreation of a traditional Korean village has free shows, plenty of refreshment stands, historic recreations and is also the home to many Korean TV shows.  There is a group of student offering free tour. They will answer your question about the village.",Positive,0.9477,Positive
343,4.0,This place is a replica of old traditional Korean villages. The entrance area is like a park and inside there is a ticket counter and a cafeteria. One can buy tickets for hiring traditional Korean dress and having a photo shoot in it for one complete hour. Overall a good place to spend time knowing abt the old Korean era and their lifestyle.,Positive,0.4588,Positive
344,4.0,"Beautiful, tranquil area in the midst of all the hectic of downtown Seoul. Gives a good understanding of the traditional Korean lifestyle. Try to find and catch the 1 hour Nap Experience for W2000!",Positive,0.807,Positive
345,5.0,"We thought it would be just a simple historical stroll through and head to namsan in the evening and end the night in Myeongdong. Well, the place is beautiful as you take in the gorgeous surrounding , landscape, historical structure and just the vibe on the place.  The small details was what interest hubby and i . Beside the pond there are batches of small strawberries growing in the flower beds, and we notice some herbs here and there too.. When you walk around you will see pine cones which the shape is something Ive never seen , some kind of berries (which i wasn't sure can be eaten or not) and just the flowers are beautiful. Take Ur time and breath in the fresh air and somehow the place exudes calmness.  I like that there will be a corner for anyone to try some local traditional games. The only setback is would be awesome if there was someone to explain the game to us or maybe they should put some multi-language boards on instructions of games . Lolz..  TIPS: its free to enter, Its a beautiful,place for a picnic soooo many places for some down time.. Theres a Gimbap store directly at the road leading to NamsanGol... Absolutely love their prawn kimbap and kinchi jigae... Yums!! We even take away 2sets of Gimbap for later... Enjoy!!1",Positive,0.9892,Positive
346,4.0,"Bring your camera because you are going back in time. The houses were replicate of old Korean houses. There are some demonstration of Korean craft. Hanbok experience is also available but it's not free. What I like most is the Taekwondo performance at 1pm. There was a booth outside the village which indicates ""free tour for foreigners"". I waited there, but nobody came to give tour, what a pity. I hope there can be more interactive activities in the village.",Positive,-0.8187,Negative
347,4.0,Walking along the streets and watching the architecture and life gives you better idea of understanding the life of Korean people.,Positive,0.4404,Positive
348,5.0,"Absolutely amazing place to discover Korean tradition. You do not pay any fee to enjoy this place, but the traditional green tea do not taste nice for many people...",Positive,0.2014,Positive
349,5.0,"Being situated at Chungmuro station exit 3, this place is very convenient. There are various activities to take part in each day (check out the schedule when you are there) eg archery. There is small cafe inside where you get a discount for the drinks if you are in hanbok. Much to explore inside which I have not finish despite the fact that it is not big. There's even a small temple at the entrance. This place is also near The KoreaHouse where traditional performances are held.",Positive,0.0,Neutral
350,3.0,This is a nice little replica of a traditional Korean Village but not something I would say is a must see. It would be better if there was more information about what you are seeing.,Negative,0.6956,Positive
351,3.0,"I gave this place a 3 star rating because we didn't get the full ambiance of this visit. Due to a holiday in Seoul, many of the venues were closed but we managed to walk around the grounds. If you're in Seoul for a very short visit this place would be good to visit because you can probably see it all of it within an hour or two. I wouldn't mind visiting this place again while it is in full operation.",Negative,0.6908,Positive
352,4.0,"I know that Bukchon Hanok Village is popular among toruist. But this is the place where you can see traditonal korean house and learn some korean history. It looked like an excellent place to do many traditional korean stuff like caligraphy and tea ceremony. When I went there, they provided us the opportunity to enter the house and 'take a nap'. Usually, you are bared from entering.  If I had the time, I would rent a Hanbok and take some pictures here. It's nicer to wear a hanbok here and take pictures compared to taking pictures at the palaces.",Positive,0.9682,Positive
353,3.0,"No one lives in this village anymore, but the buildings give you an insight on what life would have been like before the 20th century",Negative,0.3919,Positive
354,5.0,"Great place to visit for any type of traveller. I has lots of fun there, tried traditional costumes, have taken fantastic shots of traditional buildings, the parks are amazing.",Positive,0.9413,Positive
355,5.0,"This is a must see for a first timer in Seoul Korea. We went here first hour in the morning. Had our breakfast at a resto nearby. At the entrance we were greeted by a volunteer student tour guide, it was a free and good to learn more about the culture from a local. We were able to experience their games. It felt like we were in a Korean Drama featuring old Korean era. Overall, we had fun and highly recommended.",Positive,0.9348,Positive
356,5.0,"If you're an early riser, most malls will not open until 10:30. So this place is a place you might want to visit. Here you're find a few sample of one style houses. A stroll in an adjacent part is also a nice experience. Plus, this place is just next to a subway station.",Positive,0.4767,Positive
357,4.0,I came here in 2016 and it was much quieter. It has now been built upon and more houses added. This old hanok village is not its original site. It's a beautiful serene place though especially the stream and rockery. Ideal picnic place. Free city wifi can be picked up here if you cannot pull yourself away from Facebook 😂,Positive,0.9125,Positive
358,4.0,"We get there using Subway Line 4 and gett off from Changmuro Station Exit 3. We ask somebody here about the direction and here we are...we enter the gate of Namsangol Hanok Village. You can get brochure and card stamped beside the Tourist Information. we enjoy watching the buildings and park. we can sit and enjoy the ponds to relax or walking to the park. After enter the gate, you will get the ball with huge open building. this place is for meeting all the people who lives in this village. Beside the building there.s a bunch of traditional house of Korea. you can buy a ticket to learn Hangeul, or learn how to make the Korean traditional game, or how to make Hanbok, etc. You can walk around to see clearly from close the part of the house, such as living room, kitchen, bedroom, study room, work room, praying room, etc. you can see the pict i send. for me it's interesting one and grateful i found this awesome place.",Positive,0.9766,Positive
359,3.0,If you have lots of time in Seoul....see this places. But if you have few days and not much time...you can skip this village. It's a bit hard to find if you don't have a map on you mobile! It's a regular old village,Negative,-0.2244,Negative
360,4.0,"The buildings were beautiful and so were the surroundings. It's not a large area to visit, but I liked that it was not crowded and it was very enjoyable walking through the area. My sister, niece, and I rented hanbok from the rental place right outside. It was more expensive than the rental inside the village, but the hanbok were beautiful and the husband and wife running it were very nice. The woman even did our hair for us. I'm a korean drama fan so it was so fun - I felt like a character in a historical drama. Lol.",Positive,0.9899,Positive
361,4.0,I stumbled upon their tea house by chance and had an amazing experience. All by myself in a beautiful and peaceful tea room I had an amazing tea with blooming flowers. Very transcending experience.,Positive,0.9493,Positive
362,4.0,"Very interesting to visit thus village with traditional Korean living, a bit hard to find from our tour stop but defibately worth a visit.",Positive,0.3708,Positive
363,5.0,These are beautifully restored historical buildings that are mostly residential. Go there first thing in the morning when the sun is best for taking photographs and before the tour groups arrive.,Positive,0.8834,Positive
364,5.0,This place is walking distance from the train station. The traditional Korean garden will welcome you as well as the view of Namsan Tower. The Korean traditional houses have been restored to preserve the original atmosphere of the area. It is ncle to try hanbok and take pictures at different locations here. It is not tiring to go around unlike the other palaces and hanok villages.,Positive,0.8316,Positive
365,3.0,"This place is near to our accommodation so basically we just walk to go there. If you are using subway, stop at chungmuro station, exit not sure. The layout of this place is just ok for me. You can see a few hanok for a few different rank. We go there twice, the first time to visit, and the second time is to try their hanbok. After surveying for a few days at a few location, we figure out that at this hanok village, we can wear hanbok at krw 10,000 for 1 hour. Other places range around krw 18,000 to krw 20,000. The hanbok is beautiful enough so no complaint. Just that you need to be there early, if not - maybe you have to wait for quite some times before your can try it out. Just a reminder, before you enter this place, there will be a shop just outside this place that also rent hanbok. If you don't mind paying higher it is ok. But the krw10,000 per hour hanbok that I'm talking about is inside the hanok village",Negative,0.0215,Neutral
366,5.0,"The park was well situated right at the heart of the city. It was walking distance from our apartment. It gave us a taste of Korean culture. We were able to take lots of picture-perfect shots! What's more, no entrance fees and you can stroll around the park at your own sweet time.",Positive,0.4402,Positive
367,5.0,Full of atmosphere. Lots going on. Partipation in Korean games. The stream passing thru was very photogenic. Young ladies in costume made it for me.,Positive,0.0,Neutral
368,4.0,It's nice to see the older part of town but important to remember that people live here. We were informed that the locals are afraid to leave their doors open as tourists simply step inside not realizing these are private homes.,Positive,0.4215,Positive
369,5.0,"We had a wonderful guide who was in the eighth grade! Harry was his name! He volunteers once a month to help tourists navigate their way through the village. He was up on his history which made the village more enjoyable to visit!! He was very knowledgable and most courteous! Fabulous village, warm people, and a delight to visit!",Positive,0.9745,Positive
370,5.0,This is a great place. Peaceful and full of history. Located by Chungmuro Station. Nice view of the Seoul tower,Positive,0.8779,Positive
