,STAR,CONTENT,SCORE,COMPOUND,VADER
438,4.0,"It is a beautiful village that gives you a feel of what life was like back in the days. The structures are beautiful, the gardens are beautiful, there are quite a few fun and cheap activities to participate in. We tried the tea ceremony, which is a one on two experience where a staff member brewed you a pot of tea and offered you a couple of different sweet snacks inside one of the buildings. Ok, the snacks were that good but it was the experience I was buying. For a small fee, we also had the chance to put on traditional Korean clothing (quite a few selection to choose from) and posed for pictures inside another building. I recommend going there early so there are fewer people. We get to experience the above activities on our own without other people in the way. Just after we finish with our traditional clothing, a few groups of people were already there waiting and ""fighting"" over their preferred clothes. Another activity I wanted to try was the brush calligraphy session but for some reasons, it wasn't available until a couple of days later. I didn't realise there are seasons to calligraphy writing... Anyway, overall it was a great place to visit, I recommend this place over the Gyeongbokgung Palace.",Positive,0.981,Positive
439,4.0,We took the English tour given by a delightful woman. She explained each of the buildings and explained the traditional beliefs and culture of that time. Just outside the village you can take the number 2 bus up to the top of nearby Mt. Namson to visit the Namson Seoul Tower to save you time and a long walk up.,Positive,0.8442,Positive
440,3.0,"Visit this village in the morning and it wasn't crowded at all. Nice to see how the older generation lived but after awhile, they all seem similar. Suitable for a short visit. The whole place isn't that big so it won't take long to walk around.",Negative,0.2263,Positive
441,4.0,stroll and catch a glimpse into the old traditional village. nearby good find - kimbap store right at the entrance.,Positive,0.4404,Positive
442,4.0,"If you want to see a traditional Korean village, this is the place to be. We were lucky then that entrance fee is free. I think that was a Wednesday. The village is well maintained, clean and complete with traditional stuff.. They even have houses with the traditional bed, cooking materials and even the medicinal plants are also grown in the village.  A must visit when in Korea.",Positive,0.8807,Positive
443,5.0,"The historical buildings are set in a spacious and beautifully landscaped park. It can be accessed easily from Chungmuru subway station and entrance is free! I was there in the morning and it was not crowded at all. A really good way to start off the day before facing the crowds at other tourist attractions. I was able to admire the scenery and take pictures with no one at the background. My family took a tea appreciation experience workshop at the Hanok. It cost 4000 Won per person and it was a fun experience learning how to make tea with our pretty and gentle 'teacher'. We were served little snacks to go with our tea and we could take pictures inside the room with olden Korean decoration. There are other 'experiences' that you can take part in and they are generally not expensive. If you have no time to visit Korean Folk Village or Bukchon Hanok, take some time to visit Namsangol Hanok Village since it has a little of what both places have to offer. It is situated between Myeongdong and Dongdaemum and would be refreshing for the tired shoppers. We had a relaxing time just walking around the place and being away from the crowd.",Positive,0.985,Positive
444,4.0,"This hanok village is right near Myeong-dong at the base of Namsan mountain. You can wander around the small village to see how people lived in the past or even have your photo taken in Korean traditional dress. Then you can walk around the adjacent park. It makes a very pleasant respite from the frenetic pace of the nearby city. You only have to pay if you want to do the optional activites (eg; Hanok dress), otherwise it is free. Arrive early or at lunchtime when the tour groups are not around, to avoid crowds.",Positive,0.8263,Positive
445,5.0,This historical site consists of a group of hanoks that were moved to the park. The park is a peaceful respite at the north edge of Namsam Park. The hanoks are well-refurbished and furnished to give a real feel for the era. We greatly enjoyed are stroll through the place. It can easily be done in 1-2 hours.,Positive,0.8479,Positive
446,5.0,"The village looks very well maintained and it gives an insight of the way people live in the olden days in Korea. The complex is actually very big and it comprises not only the village, but also a large park. Definitely worth a visit.",Positive,0.7647,Positive
447,5.0,"Historical village in mid-city, great piece of architecture. It is open to the public. It is very nice walking in to this village and taking pictures.",Positive,0.8016,Positive
448,4.0,good walking streets. Preserved the tradition.close to the palace. It is very nice walking in to this place and taking pictures in the traditional attire,Positive,0.7178,Positive
449,4.0,"Namsangol Hanok Village is a Village of Traditional Houses in the Namsan Valley, it is a Korean village located in the area of Pil-dong neighborhood in Jung-gu, a central district of Seoul, South Korea where hanok or Korean traditional houses have been restored to preserve the original atmosphere of the area.  The Namsangol Hanok Village offers one the opportunity to experience a wide cross-section of Joseon-era citizenry and activities, from royalty to commoners. A great effort has been made to accurately furnish each dwelling with appropriate era and social status appointments.",Positive,0.8934,Positive
450,4.0,Visited here as part of a tour. It was very interesting but I've heard that the Bukchon village is better and has traditional crafts and tea shops. Overall interesting.,Positive,0.8701,Positive
451,3.0,A small part of retained village for tourists to see how koreans lived in village. Big spread. would have been useful if free guide is provided.,Negative,0.743,Positive
452,4.0,"very nice place, we walked there wearing hanbok clothes..very nice to take a picture and see how they lived years ago",Positive,0.734,Positive
453,5.0,"Historical sites of traditional village of old era. Seeing and experience the life with historical building and artifacts, beautiful scenic views and ponds. Social activities conducted here as well by school and other organizations. One way of introducing Korea to foreigners.",Positive,0.7184,Positive
454,3.0,"I only had an afternoon to spend freely, so I was debating between this place and the other Korean village place in Samcheongdong/Bukchon (more famous/popular), this place was closer to where I was staying so I decided to go. It is is free of entry, and there are activities (fees apply) related to Korean culture you could pay a reasonable fee to enjoy. But this place was actually smaller than I expected and I didn't find it too interesting.",Negative,0.8201,Positive
455,5.0,"After seeing 3 palaces it was nice to finally see how the regular people used to live. The village is free, close to metro and the N Tower cable car. It's best to see in the evening to catch it both in the day light and after susnest when all the lanterns are lit",Positive,0.8834,Positive
456,5.0,"If you want to get a sense of Korean home life before modernization, this is a great place to stop. Near the subway and Namsan mountain.",Positive,0.4939,Positive
457,5.0,Five houses remain in this village set in a large area within the busy city of Seoul. It is a major tourist attraction and gives a good idea of traditional architectural styles.,Positive,0.7096,Positive
458,5.0,"Must see place, right in center of the city of Seoul. Great scenery and authentic houses on the hills. Nice attraction to visit when in Seoul",Positive,0.872,Positive
459,4.0,"Treat it as a walk in the park but the bonus would be the opportunity to look inside authentic old houses and ponds at the same time. As this is a tourist attraction, buses with tourists would appear.",Positive,0.936,Positive
460,4.0,"Hanok means a traditional house. This historical village museum is a vast area housing 5 different types of Hanoks, ranging from a house of a carpenter to a King/ Statesman. A must visit for the beautiful houses, and a stroll through the history and culture.",Positive,0.5994,Positive
461,4.0,Peaceful glimpse into the history of South Korea. Had a great time seeing the arts and artifacts. Cool to see the architecture in the middle of Seoul. Bathrooms are not the best though,Positive,0.7377,Positive
462,3.0,Looking for a place to see how Koreans lived before? Check this place out. Some houses were that of nobles and influential people in their society. Traditional Korean houses and way of life are also displayed. There's a coffee and souvenir shop near the entrance in case you want one.,Negative,0.4939,Positive
463,5.0,"We decided to stay at one of the local Hanoks for a night just to experience it. The kids loved it, as did we, but the hard floor and thin mattresses an acquired taste for westerners! The traditional breakfast is a must, as is a wander around the entire are. The narrow streets are very atmospheric, very clean and tidy, and we felt safe at all times. Definitely worth a visit",Positive,0.9458,Positive
464,4.0,"I am not sure how authentic the village is (it is a model, there are no residents), but for a visitor it provides a useful sample of old Korean buildings. There are several activities throughout the day and the information was very good.",Positive,0.794,Positive
465,4.0,"nice view of the building architectures, the hanbok experience is no longer free, charges at 20,000KRW. surprise to feel that olden Koreans are small in size, the doors and stairs look tiny for the Koreans nowadays.",Positive,0.5994,Positive
466,5.0,This village is assembled from old houses around Seoul that needed to move. It's a lovely collection of best old architecture set up in a lovely garden. I particulary enjoyed the Korean games you can try in different places. Unfortunately the Taekwndo Show only starts in May so we missed that.,Positive,0.9047,Positive
467,5.0,A very peaceful place....it's a bit like the OK corral in Korea in places. Beautiful structures and serene music playing. ....free WiFi throughout!,Positive,0.951,Positive
468,4.0,I surprise they allow people to visit this place free. It's a nice place to visit and look at how the old houses in the village looks like. Pretty nice visit.,Positive,0.9485,Positive
469,5.0,"It has quite a lot to look around. It was well equipped and well maintained. It is free, and worth visiting.",Positive,0.8126,Positive
470,4.0,"If you would like to see how the (probably rich) Koreans lived back in the days, then this is the place to visit. The attraction is free, and you can roam around the 5 abodes. It was supposed to be a time filler but we were pleasantly surprised.",Positive,0.886,Positive
471,5.0,"Hanko is the Traditional House's name of Korea. You can enter this house and see the rooms, furniture. Also can experience the traditonal games. Sometimes you can see the traditional music performance at this place. You can go to the N Seoul Tower from hear.",Positive,0.0,Neutral
472,5.0,Just 3 mins walking distance from subway. Some tradition Korean games are provided in the middlr of the park. A place for chill...,Positive,0.0,Neutral
473,4.0,"Located in the middle of the city, close to myeong dong area, i found this place accidentally when i just back from myeong dong shopping area... Very nice and not to crowded, free entry when u come in the morning...",Positive,-0.2521,Negative
474,4.0,"To visit this place you can take bus 05 and stop at Namsangol Hanok Village. take a walk around 150m and you will find the gate to enter this village. This place is free of charge. Inside the village you could see traditional old Korean house, park, etc. It is a must visit place for people that like historical place",Positive,0.5574,Positive
475,2.0,"If you have time and want to see some traditional houses, then I suggest to visit the Bukchon village and not this sort of reconstruction which is only a turist attraction. The only positive thing is a park inside where families and children could play together in open air space.",Negative,0.8519,Positive
476,4.0,"This place is big! It's not just a good area to sight see but would also be a good place to hang out and just enjoy the view or go for a walk. Here, you can take a glimpse of how people in Korea used to live. You can see what the houses look like and what it has inside as well.",Positive,0.7704,Positive
477,2.0,"The Namsangol Hanok village features a few old (1880's) houses that have been reassembled on the site featuring jointed woodwork, hypocaust style heating and some typical furniture. The environment is one of concrete surfaces and a dried up stream - not very rural or green at all. The site also features the so called time-capsule buried in 1994 and due to be opened in 600 years time. Our future ancestors may struggle to 'read' the CD and DVD buried deep in the earth...but it won't be our concern! We took the one hour free guided tour but although the volunteer guide was lovely, with good English and clearly a genuine interest in the site....it was all a bit boring actually! Sorry to be so negative....but this place did little for me!",Negative,0.9483,Positive
478,2.0,There is a tourist office close to the Metro exit. Go in and get a map of the area. We found the lady in the Tourist office very helpful and her English was good.  Honestly the houses were very beautiful but not a lot to see or do. There are Hanok houses on two sides of the road. Once you walk around and take a few pictures then you are done.  When started on the same side as the tourist office and then cross over and finished on the higher ground. There are steps at the top which lead down to a street which is really arty and has lots of places to eat. We went to the first Korean place we met and had a great meal for small money.,Negative,0.9376,Positive
479,5.0,Forget about the boring and uninteresting Bukchon Village. This is the one you want to see. Many houses of the olden corean days. Very nice walk. Highly recommended.,Positive,0.3151,Positive
480,4.0,"The village is very quite and nice. I have experience in take picture with hanbok. The name of hanbok studio is Ariang, just the right side of village. You can rent the hanbok for 01 hour, the fee is 20.000won Or you can take picture in the studio (they will photoshop for you and print 03 pictures) with the fee is 10000won/person. It is very nice and tradiontional.",Positive,0.7707,Positive
481,5.0,"The Hanok Village is close to Chungmuro Metro Station and the admission is free, do pay a visit when you are around the area.",Positive,0.4404,Positive
482,4.0,"The village offers a lot of information that you can learn about Korea's rich culture and history. For someone doing a transit tour, the place is really amazing.",Positive,0.8268,Positive
483,5.0,A short walk from the Chungmuro subway stop on the #3 line. Take the #3 exit from the station.This is a collection of historic buildings many of which were moved from their original locations. Spent half a day enjoying the Village and the grounds.,Positive,0.5423,Positive
484,3.0,"Really let down by this place, my kids (6 & 8) were of the age where one could get on all the rides and the other couldn't, all the rides for the younger one was really baby'ish. The place is generally very tired",Negative,-0.0754,Negative
485,4.0,It's a lovely village but nothing to do that much. Nice place to take a photo and look at old village style of korea,Positive,0.7269,Positive
486,5.0,Two things you must do here 1. Rent hanbok to wear for photo taking (so pretty!) 2. Go to the tea house in the village and have a nice cool quencher in summer,Positive,0.6588,Positive
487,5.0,It was snowing and we immediately made our way here. It's so conveniently located near the station. Snow covered all trees n pavement. You would not believe this place is right in a city. It's beautiful and we were do engrossed in snow activities and picture taking that we forgot about the indoor tour around the house. There is this nice little eatery near the entrance that supposedly serve 'ugly but tasty gimbap'...We were too full to add that in our order but we saw that it was popular. Loved it!,Positive,0.9196,Positive
488,4.0,i discovered this place when i was walking to Myeong-dong.i quite this place and it just under the N Seoul tower.it has tea room and time capsule too.,Positive,0.0,Neutral
489,5.0,"This is a place everyone must go if you are in Seoul, you can see unique buildings and lots for shoppers. Enjoy the olden days of Seoul here.",Positive,0.4939,Positive
490,4.0,English and chinese free guided tour is available. Easily located at chungmuro exit 3/4. Pretty structure . They have a time capsule garden at the back which is worth a visit.,Positive,0.8689,Positive
491,5.0,A must visit place for tourists. It has a lot of tradition houses and the location is very clean. Great place for photos too.,Positive,0.8111,Positive
492,3.0,"After spending a wonderful afternoon at Lin An Tai historical house and museum in Taipei the previous year, I was looking for a similar experience. This was not it. Unlike Lin An Tai, there was very little information provided on site at Namsangol, and nearly nothing provided to explain the style, age, and architectural influences of the collected homes, nor what the individual rooms in the home would have been used for (other than an occasional note about a main room or a temple.) I suspect that this lack was not only in English, as the number of signs was very limited. It's a pretty area, surrounded by a very metro neighborhood, so might be nice for pictures, but I would have rather spent my time at something truly interesting and historically informative.",Negative,0.8838,Positive
493,5.0,"Peaceful beautiful. Autumn leaves were awesome. I sat by the pond for a long time just breathing in the air and scenery, wishing I never had to leave. Love love looking at the hanoks too.",Positive,0.9707,Positive
494,3.0,"Exit Chungmuro Subway Station and walk a few minutes to the village which is at the base of Nam mountain. It a little small compared to others around Korea but you can see many similar buildings and features. I recommend getting a drink and snacks before entering, I happened to go when they had a martial arts demo and there were many activities for children. I don't think they have these activities everyday. You can spend an hour or two walking around so if you need a break from myeongdong shopping, this is a nice spot.",Negative,0.7876,Positive
495,4.0,"A small village in the middle of Seoul,about a 10 minute walk from Myeongdong Station.Interesting Hanoks and you can participate in various activities if you wish to.We were very lucky as the Korean show Infinity Challenge was filming there and we were able to watch and see some of the celebrities.",Positive,0.7264,Positive
496,4.0,"Village may not the the biggest or the most authentic one, but it is located near Mt. Namsan and you can have a nice walk to Namsan Cable Car Station and to NTower, so it is good to put these attractions together if you are in the area.  You can't go inside buildings, but it gives you some idea how such traditional houses looked like.",Positive,0.9422,Positive
497,4.0,"I went there during winter and it was freaking cold, but the snowy view here was priceless. Ice houses were built during this season and you could take lot of good photographs. There were a lot of traditional houses that could be explored and they're well-maintained even those houses were built thousand years ago from Joseon Era, but I still could feel the original and the beautiful scene. Namsan Hanok Village can be accessed by taking metro Line 3 or Line 4 to Chungmuro Station Exit 3 or 4",Positive,0.9052,Positive
498,5.0,"the Hanok , living in One of them too is Something no to miss even if you are on a strict Budget, One night of treatment in a Hanok is worthed",Positive,-0.4215,Negative
499,5.0,"An old village which they have reserved well. I luckily was here when they held a traditional wedding so it was a unique experience. The landscape, the houses are beautiful. Can also wear hanbok, the professional photographer will shoot for you in one hour and you get two printed photos, plus they send all pictures by email to you a few days later. Love it :)",Positive,0.9337,Positive
500,5.0,"Original houses in near-original condition. You must have or join a (free) tour guide. The buildings represent the heart of Korea. Under-floor heating, for example, has influenced how they sit, eat and sleep, and socialise. Even the curve of the familiar curved roof ridges differentiate them from similar Chinese and Japanese buildings, in an idiosyncratically Korean way.",Positive,0.5423,Positive
501,3.0,"From Seoul station, take a bus to the village. It should be more fascinating as the name is , only very few Korean traditional houses so travelers could rent gowns & have pictures taken as a memory of their trip to Korea. Nothing exciting , just walk around the alleys, drop by to have tea, beverages or some little fast Korean food. Only if you have finished all the interesting attractions, drop by if you have time.",Negative,0.5369,Positive
502,3.0,"Another option in Seoul to see more examples of Korean architecture, especially if you don't want to navigate the alley ways and climb your way to the Bukcheon Hanok Village. This tourist attraction is usually quite busy, especially during the warm months. On weekends it's overrun with tourists and weekdays with school children as many school have picnics and field trips here. However, if you want a chance to take more pictures of Korean style houses, it's at least worth a stop by.",Negative,0.6619,Positive
503,3.0,"After visiting a lof of other Korean folk villages and the palace, I think this artificial Hanok village is a little bit boring.",Negative,-0.2551,Negative
504,3.0,There were few houses on display and getting inside the house is not allowed but you can still see the interior of the house for picture taking.,Negative,0.0,Neutral
505,3.0,The only reason why I'm going here because it is within walking distance from my hotel. Just an average experience. Nothing special.,Negative,-0.3089,Negative
506,4.0,"Alhough smaller and kinda replica compare to Bukchon, this small museum village is interesting to learn the way the korean lived.  The village range from low to mid level living quarter.  Recomended for kids, but dont forget also to visit the Bukchon version.",Positive,0.318,Positive
507,5.0,This is located in the center of Seoul and can feel the real old Korea style. It is good to walk,Positive,0.4404,Positive
508,5.0,"We went here from Namsan park, because our guesthouse was at the back of this village. All the scenery was beautiful. When we came, there was no event here, due to winter time. But our kids had so much fun to look around. I recommended this place for family, with young kids, who want to see hanok and inside the hanok. It is easy to walk here. And it's free.",Positive,0.9563,Positive
509,4.0,It covers quite a large area. Quite a number of interesting buildings and antique things to look at. An open area for traditional games. A good view of N Seoul Tower too. Easy access by public transport.,Positive,0.854,Positive
510,3.0,nice to know a hankok village sits in the center of Seoul. memorable but won't offer anything beyond imagination.,Negative,0.2263,Positive
511,4.0,I went there at night time around 6p.m and it was kind of scary because at that time there was no one there and there were just empty buildings all around you. My advice for you is to go there during day time.,Positive,-0.7574,Negative
512,3.0,"Not that attractive compared to Bukchon. More on a ""man-made"" Hanok Village. Nothing much to see. If you are pressed with time, you can actually let go of this.",Negative,-0.3412,Negative
513,4.0,"it's free admission, if you have a few hours to kill, make a visit. good for photos, and get to know how the Korean houses look in the past. Walking distance to Insadong.",Positive,0.128,Positive
514,4.0,It has 5 Joseon-era houses that have been restored. Volunteer guides are available during the weekends who can give more details about the houses. The park surrounding the area is a nice place to relax. One of the better free attractions in Seoul.,Positive,0.9442,Positive
515,5.0,To have a look at the traditional Koran architecture it is recommended to visit Namsangol Hanok village and enjoy in peace a stroll through nicely lined houses and a park.,Positive,0.886,Positive
516,5.0,Nice place with lot of ancient village. Good place for photography and it is free admission. It be easily access via public transport.,Positive,0.886,Positive
517,4.0,"Love the village. There's also food festival when I went there, and I get to try making some of their traditional sweets for free. There's demos for making traditional clothes and so much for. In all, there's a lot to see here.",Positive,0.9313,Positive
