,index,Unnamed: 0,서울대공원부정단어리뷰,index,단어
35,35,2245,The War Memorial of Korea is a great museum and one visit will probably not be enough to see mostall of it My fiance and I went on a nice autumn day and when we arrived we discovered that there is an exhibit outside of the museum displaying old USA South Korean North Korean and Chinese warplanes tanks submarines etc We walked around that part for about 12 hours and then had lunch at the cafeteria next door to the museum We decided we would check out some of the smaller exhibits and come back in the winter for the much larger the 625 War Korean War exhibit  It was a good choice because when we visited again a couple months later we spent a good three hours or so in the 625 War exhibit We didnt know much about the Korean War before entering but it was very informative and we both left with a much better understanding or the history of the Korean War I dont usually say this about museums but I definitely recommend this one and you should consider putting it on your mustdo list while visiting Seoul,35,probably
36,36,2313,After the nth battle where a small army of korean peasants defeated a foreign army composed of hundreds of thousands of cruel but well trained soldiers one starts to wonder if this is a history museum or just some fairy tales told to kids to make them like their country Seriously the whole museum is like that All countries do this but here is probably too blatant Youll learn something just not sure about what history or korean views of common stories,36,probably
37,37,2415,The Korea War Memorial is an enormous place with a large War Museum built around it  Pros 1 If you are at all interested in the Korean War or how it led to modern South Korea this is the ONE place you should visit There is a fascinating audiovisual exhibition on the Korean War just inside the main building on the left And simply put It will explain EVERYTHING you could possibly want to know about the Korean War Youll understand How it came to happen What happened And from first principles youll understand very clearly how this has led to the modern South Korea of today Furthermore by understanding the background youll understand very clearly the current context behind the NorthSouth Korean situation And possibly its future ramifications  2 There is a wonderful outdoor exhibition as well demonstrating US and ExUSSR and Chinese military hardware from the mid 1940s onwards If you can think of a tank missile helicopter aircraft antiaircraft gun its probably here This is probably the SINGLE and most COMPREHENSIVE collection of postworld war 2 hardware in Asia In my humble opinion the only place youre going to find better is probably the Smithsonian Washington DC USA or the Imperial War Museum London and Duxford Cambridgeshire England  3 If you are interested in middleages Korea the basement is quite interesting There is a lovely replica of a Turtle Ship Geobukseon in the basement Worth visiting  Cons 1 You need to walk a little bit to get to the museum It took me about 510 minutes to find it The nearest subway station is Samgakji or Namyeong Stations 2 The military hardware is outdoors It started raining when I visited Thus I suggest you bring an umbrella or appropriate waterproofoutdoor clothes if you intend to spend much time looking at the outdoors military collection  In summary The War Memorial of Korea is probably the BEST War Museum in the whole of Asia You will not find a larger or better collection of military hardware in Asia To find better youll have to go to Washington DC in the USA or Duxford Cambridgeshire England  I spent 3 hours at the Korean War Memorial And only saw 2530 of the exhibits on offer This place is VAST You could easily spend the whole day here  To conclude if you are a family And you have a boy in your group below the age of 21 Just GO TO THE WAR MEMORIAL of Korea Your son will have more fun that the REST of your trip to Korea put together,37,probably
38,38,2435,I can testify that in line with most other reviews on this this place is interesting and worth visiting It is probably built to remind the ordinary South Koreans of the need to defend themselves against the North  By reminding them of what happened in the past,38,probably
39,39,2454,Fantastic place Cant believe its free though we did give a donation Amazing place and something there for everyone When we visited in July they were in the process of building a separate museum for children in the grounds which will probably not be finished until 2015 but there is still loads of interest there for Adults and children alike from the different dynasty rooms with costumes a mini temple a childrens play area vintage cars and tanks planes and even a 3D theatre Hope to visit again in Oct when we go back to Seoul,39,probably
40,40,2665,Unless you were directly involved in the Korean War you probably dont know much about how and why it came about Even as a history buff and versed with the war itself I learned a lot here about the conditions that led to the war  the preWWII Japanese occupation the partitioning of Korea into the Soviet and US camps after the war and the factors that led to the North Korean invasion This is a huge place Not wanting to spend a whole day here I spent 2 hours in the three War rooms and felt I had gotten what I came her for There are many other displays inside and Korean War vintage aircraft to be seen outside Bottom line a very worthwhile visit for those who want and should have a better understanding of this time Even my wife who is not into museums of this type appreciated what she learned here and was glad she took the time for this,40,probably
41,41,2711,Now i know why this is ranked number 1 This memorial is more like a museum with massive ranges of history from all around the globe There are also amazing displays of weapons machinery and everything you can basically think of from rockets to battleships The outdoor part of the memorial is a football field sized area with tanks planes rockets and various artillery weapons This War Memorial would probably be number 1 in the world is amazing,41,probably
42,42,2742,Firstly there is no entrance fee so Id have gave a positive review even if it didnt live up to expectations But it really did and probably exceeded them given the size of the place and the quality of the exhibits Given Koreas war history over the last century there was so much to see many of which was quite sad to see but extremely interesting Dont miss the many memorials outside the museum itself as well as the area to the right of the museum with countless examples of war planes and tanks etc  plenty of photo opportunities,42,probably
43,43,2749,Gorgeous memorial Very well curated The War Memorial is a mustsee when youre in South KoreaIts seriously the biggest most awesome war museum Ive ever seen The giant reproduction of a turtle warship from the 1500s is probably their flagship piece but the extensive grounds full of tanks and planes and other engines of war vie for the top spot of most awesome thing to see there And thats not even taking into account the inside displays of all the canons and various firearms from I guess every military conflict ever to take place on the peninsula,43,probably
44,44,2752,I used to work at a museum I was a history major once I love war This place is completely awesome  Its seriously the biggest most awesome war museum Ive ever seen The giant reproduction of a turtle warship from the 1500s is probably their flagship piece but the extensive grounds full of tanks and planes and other engines of war vie for the top spot of most awesome thing to see there And thats not even taking into account the inside displays of all the canons and various firearms from I guess every military conflict ever to take place on the peninsula  Youd probably have to spend days to completely take in all they have to offer,44,probably
45,45,2920,This place is simply amazing and this is not because it is free admission From the look of the building it looks a bit like Capitol Hill or some advanced government building to the real life examples of various military equipment located in the lawn including real lifesized planes tanks and artiliary of both the US and Korean military one could spend at least one full day here if you care to look at all the exhibit both inside and outside One will definately be more appreciative of the deep military ties between US and South Korea and the Korean War We also saw school children visiting the place which is probably part of their school programme to learn more about the history of the country Definately worth the visit and you can take as many pictures as you want Note that the memorial is not located near any other mainstream tourist attractions and it is about a 5 minute walk from the subway station,45,probably
46,46,3026,This museum is huge so allow plenty of time to look around It is also highly interactive  a lot of displays have video or recreated scenes Kids will love it There is so much here that youll probably want to visit it over a couple of days with a few hours each day Highlights were the display of military hardware outside the museum which can be accessed even if the museum is closed and the section explaining the history and progress of the Korean War which was an eyeopener One tip  dont bother with the target shooting game it wasnt worth the wait,46,probably
47,47,3054,We went to the War memorial of Korea but found to our disappointment that it was closed because of fashion week This wasnt even announced on their website We were really excited to go there and the more the disappointment because of fashion week How could we know this since it wasnt on their website; what are they thinking The attaction itself is probably worth all 5 stars,47,probably
48,48,3079,Ill be the first to admit that Im probably not the one whos been to most museums but thats mostly because most museums Ive been at have failed to catch my true interest and attention When it first occurred to me Seoul had the War Memorial of Korea I thought to myself that it must at least be very informative when looking at Koreas huge history with war  And boy it didnt disappoint  Its easy to see its very influenced by USA lets ignore that and just appreciate the depth this museum has Not only is the museum huge it covers the older wars with their neighbors but also Vietnam it even had an exhibition about the Danish contribution to the Korean wars even though it wasnt a lot IN DANISH and whatever military struggle Koreas been in and theres a lot A lot of the displays are incredibly well made and most of it is in English so you dont have to be an expert in Hangul to appreciate it At the back of the museum theyve filled the yard with military vehicles tanks cannons helicopters and planes  Impressive museum And free,48,probably
49,49,3080,Really big need a few hours maybe 3 or 4 to really see the whole thing Loads of things to see inside as well as outside Gift shop and lockers I think free if you dont want to carry around your stuff Its a really nice memorial very moving and informative I have been here a few times and will probably go there again  Must do in Seoul Do it,49,probably
50,50,3115,Kinda creepy that they have a how to don a gas mask area for kids but probably necessary Great exhibits,50,probably
51,51,3144,It was a busy day when I visited but I would still probably bet I was the only person in the museum that had also visited the North Korean equivalent  The Victorious Fatherland Liberation War Museum in Pyongyang  It was interesting comparing the two and of course the Seoul version provides a much more rounded and historially accurate account However its possible to see propaganda from the South too  eg there are war crimes by the North documented here but the terrible atrocities committed by the South at the time are absent  Outside there are some large sculptures and quite an extensive display of military hardware from both sides as well as two of the massive loudspeaker systems used at the DMZ for psychological warfare until the operation was halted in 2004,51,probably
52,0,320,We visited this with a South Korean friend but missed the English tour  nevertheless its an absolute mustsee for you to understand the recent history and current climate of this land We would love to return and join the English tour but lots of the signs and videos are in English so Im guessing we probably didnt miss too much information Such a poignantly expressed display we were deeply moved and touched by the depth of emotion behind the presentations No spoilers just make it a point to go and spend a few hours there  well worth your time,52,guess
53,1,1119,Large and well worth visiting and provide substantial information on wars which have plagued Korea since the earliest recorded times It would be better named as a Museum than a Memorial I guess exhibits such as the Incheon Landing 4D ride are worthwhile for engaging teenagers but more emphasis should be on helping people to reflect what has caused war in the past and how to avoid future wars,53,guess
54,2,1150,It was ok but I have seen better memorials This one seemed lacking and was mediocre I guess it is worth seeing if you havent but dont have high expectations,54,guess
55,3,1275,Enjoyed this place tremendously The exhibits were very informative and gave me an idea of what it was like when Korea was at war Many pictures videos and relics  all of which provide new experiences of learning  The time you can spend here varies Personally I spent 4hrs here because Im the sort of person who reads and studies every single exhibit and stop to watch every show and video But there are some people who breeze and browse through quite quickly and could possibly finish everything in about an hour I guess it depends on what interests you  There was a 4D show in one of the exhibits on the 2nd level that illustrated the operations of the Incheon Landing That was rather impressive I thought By 4D I mean that you will be secured to your seat because the motion chairs move according to whether youre on a boat or a plane  Another thing that was really impressive was how you could use your smartphone to read more about the exhibits  either by NFC or QR scanning Beside the exhibits there would be a little panel for you to scan which would automatically open a page on your phone The page contained information about what you are seeing and would sometimes lead you to YouTube videos to illustrate it What a great way to learn  One of the must visit places if youre in to history,55,guess
56,4,2177,Came to this memorial as part of a tour as we only stopped briefly here I didnt really get to check out the different monuments carefully and get to really understand the history and meaning behind it I guess it would be a really interesting stop to visit if someones interested in history and eager to learn more about the Korean war,56,guess
57,5,2398,Ive been to this museum 5 times over 15 years It is not that good If you are an English speaker and Im guessing you are because you are on this website the translations are not good enough to keep your interest This place was great 15 years ago before the National Museum of Korea was built Now its a second rate military history museum,57,guess
58,6,2676,This place has some really good exhibits and is really well designed I guess its the first stop for most people doing the DMZ tour as it gives and intro and an insight into the war,58,guess
59,7,2749,Gorgeous memorial Very well curated The War Memorial is a mustsee when youre in South KoreaIts seriously the biggest most awesome war museum Ive ever seen The giant reproduction of a turtle warship from the 1500s is probably their flagship piece but the extensive grounds full of tanks and planes and other engines of war vie for the top spot of most awesome thing to see there And thats not even taking into account the inside displays of all the canons and various firearms from I guess every military conflict ever to take place on the peninsula,59,guess
60,8,2752,I used to work at a museum I was a history major once I love war This place is completely awesome  Its seriously the biggest most awesome war museum Ive ever seen The giant reproduction of a turtle warship from the 1500s is probably their flagship piece but the extensive grounds full of tanks and planes and other engines of war vie for the top spot of most awesome thing to see there And thats not even taking into account the inside displays of all the canons and various firearms from I guess every military conflict ever to take place on the peninsula  Youd probably have to spend days to completely take in all they have to offer,60,guess
61,9,2884,So off the bat the outdoor display of military hardware is most impressive and would Wow any little boys or grown men who are into that stuff We spent a little while perusing the tanks planes missiles etc Then we moved inside Huge building The huge open space in front of the building devoid of any greenery reminds me of the grounds of the palaces we had visited the previous days I think Koreans just seem to love that grand sweeping open space to show case the main act  the building itself Hence no trees shrubberies or flowers in the immediate front of the building to distract ones eyes The museum have exhibits of Korean military history that goes back very far  like to 900 AD or maybe even further back As far as they have records of I guess Of course back that far it wasnt Korea as we know it today The land mass that is modern day N  S Korea hosted various kingdoms and fiefdoms whose borders fluctuated and changed many times You also get the sense that the official narrative wants to put a very proud and positive spin on Korean military achievement As with the various other museums we went into prior to this one the Koreans are not so great with putting any of the accompanying texts displayed in English Which is frustrating and perplexing since one would think that they would jump at the chance to educate visitors on their rich history  culture Instead one is left feeling very blah about whatever potentially interesting things we might be viewing since we have no idea what it is or its significance The English when there is any would be like 2 sentences long and then the Korean part would be whole paragraphs long  erm I think theyre saying way more than the English translation here Surely they can hire someone who can translate this stuff Anyway this might have been 5 stars if it wasnt for the lack of English in the exhibits Same goes for all the museums in Seoul that we went to,61,guess
62,10,3068,The sanctuary of National Defense or the war memorial of Korea is located in the heart of the city We reached the by a subway This museum contains various records of the war and soldiers including remains of their forefathers who devoted their lives for their country  The war museum consists of 6 indoor exhibition rooms the memorial hall the war history room the Korean was room the expeditionary forces room the ROK armed forces room the large  defense equipment room and an outdoor exhibition area of military equipment  Honestly I got bored after a while though dont get me wrong the items are well kept and an audio guide is available for better understanding of the exhibit rental fee is 2000 won or approx 2 I guess too much information and seeing a lot of war items can be overwhelming but it is worth a visit  admission is free closed on mondays 09001800,62,guess
63,11,3110,This is far from the 1 place in Seoul that some people say visit the National Museum of Korea well before this in other words I was in Seoul for two weeks and only got there on my last day and edited the time down to one hour The encyclopaedic coverage on level 3 of every conflict that the ROK has been involved in means it was rather militaristic from my point of view  explains why so many armed forces personnel were on visits there I guess Level 2 which deals with the Korean war is obviously the most important as earlier Korean military history receives similar but not as detailed coverage in other Korean museums Given the 60 year stand off with the North and the virtual on alert status since then of the armed forces you can begin to understand how ingrained in the Korean mind potentialif not perhaps imminent conflict is,63,guess
