,STAR,CONTENT,DATE
223,5, This is a traditional market located near Namdaemun Junggu near Seoul Station Daily necessities glasses womens accessories adult clothes childrens clothes bags clothes shoes hats home appliances ,5 months ago
224,5,Great place for street shopping must visit along with dondaemun which is like 3 km from here,5 months ago
225,5, There is also a flower market There is also a childrens clothing store There are also stationery shops ,5 months ago
226,5, After checkin at LEscape I wandered around to take a look Its been a really long time since Ive visited but there are places that are the same as before some places that are cleaner and its nice to see the ,5 months ago
227,4, came to buy whiskey Products are cheap and varied ,5 months ago
228,4, If you go to Namdaemun Market you must stop by There are many things from domestic to overseas so I like it because there are many things to see and eat I hope that the corona situation will disappear soon ,5 months ago
229,3, The world knows the market What needs more explanation Just enjoy it ,5 months ago
230,5,Good,5 months ago
231,4, Kosiguk Just looking at it makes me feel good stuff is cheap ,5 months ago
232,3, Its a holiday and because of Corona it wasnt as noisy as it used to be ,5 months ago
233,5, How long have you been going Early morning visit to Namdaemun Market Lets make shopping fun ,5 months ago
234,5, I was upset that there werent many people I bought ballet clothes and childrens bobs cheap ,5 months ago
235,5, Its snowing Lots to see and lots to eat Two things to buy The price range is different Crowds are crowded because its Saturday Come hang out ,5 months ago
236,4, I went because of my glasses Lots to see and eat ,5 months ago
237,4, I ate it with grilled cutlassfish and stew and it tasted good and Snow Flower Bingsu made me feel the delicacy of winter ,5 months ago
238,4, I went to a liquor store and even if I looked at the Onnuri gift certificate and the price Anseong Sanghoe was the cheapest I bought the fiddik 15 balvenie double grenmorangie original dronak 12 years Visiting ,5 months ago
239,5,I could find all I wanted in this whole sales market,5 months ago
240,5, Lively and fun place every time I go Galchi Alley Kalguksu Alley is full of fun shopping such as American food and whiskey in the basement of Kalguksu Alley ,5 months ago
241,5,As you know,5 months ago
242,5, I go there often The atmosphere is dull but only hotteok restaurants are lined up ,5 months ago
243,3, It is convenient because there is a flower market where you can choose to shop during the daytime and at night ,5 months ago
244,4, Where everything is gathered in Korea A lot of places have recently been rented out due to the corona virus Even the importers say that the goods are not coming in well ,5 months ago
245,4, Koreas economy is good but domestic demand has been activated quickly Its good because its a weekday ,5 months ago
246,1, If the product is natural the price is always reasonable hahaha ,6 months ago
247,5,A little bit of everything a true cultural experience,6 months ago
248,5, A restaurant that will make you nod even if you eat in line ,6 months ago
249,5,Very good,6 months ago
250,5, I often go to the flower market You can buy a hat cheaply too ,6 months ago
251,4, Its such a cool place I went to buy a hat ,6 months ago
252,4, One million won per person Two people order 1 stewed 1 assorted grilled 1 Spicy braised cutlassfish and three types of grilled pork belly ,6 months ago
253,5, Its cheap delicious and lively so its the best for a change of mood ,6 months ago
254,5, Pretty flowers and I bought it much cheaper than the Port Merion department store ,6 months ago
255,2,Many shops were closed,6 months ago
256,4, Affordable and abundant Namdaemun Market Its the best ,6 months ago
257,4, I went to a flower wholesaler in Daedo and after purchasing the artificial flower I want to buy and shopping for children I feel so much better ,6 months ago
258,5,Wow i can find everything I need,6 months ago
259,5, They sell a lot of delicious things Feeling a bit small in Myeongdong ,6 months ago
260,5, I went to Calchi Alley A delicious stew of cuttlefish 10000 won per person My brother got lost and it became a better memory ,6 months ago
261,5,Eat see buy everything is fun,6 months ago
262,5, I like it because there are a lot of delicious things and a lot of fun things ,6 months ago
263,3, Long time no see I have visited due to corona ,6 months ago
264,3, Foreign solicitation can be seen even now with the corona virus Im going to Namdaemun Market ,6 months ago
265,5, Gamegol dumplings are delicious and there are many things you can buy on the market street ,6 months ago
266,4, I was sightseeing alone It s better to go with a few people I can eat a lot ,6 months ago
267,3,Its a good market to shop lot of variety products at reasonable rate but i had expected more food stalls which was disappointing for me,6 months ago
268,4, A place that everyone in Korea knows about Manmul market which is used by all the common people ,6 months ago
269,5, It is a very fun place to eat braised cutlassfish and buy imported goods ,6 months ago
270,5, Various sights and shopping at reasonable prices Rustic food was pleasant ,6 months ago
271,5, You can get cheap stuff there is nothing Its so nice to watch n walk around ,6 months ago
272,5, Seeing the bustling crowds at Namdaemun Market makes you feel a lively game I went after 10 years ,6 months ago
