,STAR,CONTENT
0,5.0, Always a good place to come 1000 won entrance fee Lunch time tickets are also available for nearby office workers 
1,5.0, It was a meaningful time to do the night tour with commentary 
2,5.0,It isnt a huge palace so in some areas you can feel quite cozy if it isnt crowded I recommend to not go there in a rush so you can enjoy it better the details make it special So dont be afraid to explore the alleys and narrow doors
3,5.0, Near Deoksugung for over 10 years I went to work but this was my first time going in It was spacious and quieter than I thought I thought there would be a space like this in the city center When I get a little 
4,5.0, Visit the city art museum to see works The works floating in the pond were special 
5,5.0, Deoksugung night tour It rained a lot but it was even more interesting with the detailed history explanation from the Hanyang guide It was difficult to visit Deoksugung on a rainy evening but it came with a 
6,4.0, Always a nice place I need some more shade benches 
7,5.0,A beautiful and peaceful palace right across the city hall You can even see the changing of the guards for free at certain times everyday
8,5.0, I recommend going in the morning I went around 11 oclock and it was so hot that I couldnt move You can watch the changing ceremony at the main gate at 11 oclock 
9,5.0,Very beautiful imperial palace very well maintained
10,5.0,It is beautiful and giant
11,5.0, Remembering the footsteps of the last emperor of Korea Gojong 
12,5.0, Worth seeing especially if you have time for more castles than the two mustsees in Seoul 
13,5.0,Recommend guided night tour  
14,5.0, Beautiful and little crowded temple in the center of Seoul It is worth coming to see it 
15,5.0, It is a place where you can feel the modern history of Korea together with Deoksugung Hear the story of King Gojong It was a proud and happy time to look back on our heartbreaking history At night the lights were 
16,5.0, Where can I find it at such a low price Sometimes its good to stop by when youre working nearby and take a look The price is good and it is not expensive 
17,5.0, The palace in the building is restored forever and left behind 
18,4.0, We just saw the changing of the guardit was very interesting 
19,5.0, A wonderful place where the past and the present coexist 
20,5.0, A place where you can rest comfortably even for a short time 
21,4.0,To do
22,5.0, An old palace walk in the city center But the palace special less shade If you are going in summer be sure to bring a parasol Take it with 
23,5.0, It is quiet and the visit to Seokjojeon is beneficial To visit Seokjojeon you must apply online in advance 
24,5.0, You must make a reservation in advance to visit Seokjojeon 
25,5.0, I had time before going to Incheon International Airport so I chose Deoksugung which is the closest to Seoul Station It was good except that it was a pity that the City Art Museum was closed 
26,5.0, comfortable atmosphere Coexistence of Eastern and Western Architecture coexistence of the present and the past 
27,5.0, Beautiful palace great for relaxing by visiting a magnificent place The employees are very nice and friendly 
28,5.0,I had an incredible day walking around the palace Its beautiful to see all the people in traditional dress to take pictures
29,5.0, A place to forget the midsummer heat where we can find our soul History teaches us a lot 
30,5.0, Its good to stop by the nearby city art museum The comfortable smell of wood the colors everywhere are attractive 
31,5.0, Since it has not been restored yet you may think that it is more flat than other palaces and lacks much to see It seemed to show the pain of our history in its own way 
32,4.0, I did not know that there were stone buildings in the Joseon Dynasty The fusion of East and West was unique 
33,5.0, Its cool and pretty when you come at night If you are a lover I would recommend wearing hanbok 
34,3.0,The entry tickets are only 1000 Won so its definitely worth a visit 1 Its open until late in the evening but if you get there past 1630 or 17 pm there are no english tour guides available And without a tour guide you cant 
35,4.0, Deep sympathy for the explanation of the path of King Gojong 
36,5.0, great If you go on a weekday it will be quiet and healing Free admission on the last Wednesday of every month 
37,5.0, I want our old couple to look friendly I think its funny that the daughter who takes pictures from behind the awkward comrade haha 
38,5.0, It is a place where you can feel calm and walk It is recommended to sit at a cafe in the palace and bruise 
39,5.0, After all visiting an old palace makes me feel like Im in a dream house Just imagining that I was possessed by a king in the past and spread my wings with my own thoughts hahahaha My son pretending to be a prince 
40,5.0,Unforgettable
41,4.0, Noise from various groups protesting around the adjacent Seoul City Hall Annex So there is no atmosphere of an old palace 
42,5.0, It is a good place for a short walk in the middle of the city center 
43,5.0, Another attraction from Gyeongbokgung Palace A place to relax in the city center 
44,5.0,Its such a beautiful palace with plenty of areas to walk around Its not as big as some other palaces but its definately a place i recommend I went Wednesday not realizing that the last Wednesday of every month is Culture Day which means its free admission day
45,5.0, It was more interesting to listen to the teachers story 
46,5.0, there was an orange ant I was really surprised A Japanese guy said he poisoned his coffee to kill King Gojong 
47,4.0, There are a lot of group tourists at Deoksugung Palace at night I like to bruise 
48,5.0,Good
49,5.0, our precious heritage A place where you can experience the present and the past at the same time 
50,5.0, Its nice that you can watch it for 1000 won You can sit and listen to the sound of the water 
51,5.0,Traditional and modern palace in South Korea Othoniel was been there 
52,4.0,You must go and see this beautiful palace
53,5.0,Mt trong nm cung in nht nh phi gh thm khi i du lch Hn Quc
54,5.0, Deoksugung Pond Rose Cell Othoniel Artwork Garden and Garden 
55,5.0, The teacher explained it in a fun way so it was fun and there was a time to take pictures so I took a lot of pictures 
56,5.0,Nice small with ample greenery
57,5.0, We recommend visiting with a cup of coffee at dusk Bring your garbage back 
58,5.0, The night program of Seokjojeon Hall is in progress and I was not able to attend because I had to make a reservation but I was happy that there is a wonderful historical palace in the middle of the city and that it 
59,5.0,"If you want to experience the aesthetics of modern architecture that permeates Seoul, it is a good place to take a walk.     "
60,5.0, It is a palace in the modernization period where you can see both Eastern and Western architecture at once and it is a suitable place to look around alone 
61,5.0,This place is so calm  peacefully I wanted to make meditation when i walking around
62,5.0,This is a must visit location stunning and so wellmaintained artifacts and buildings so homy they hadhave underfloor heating you would like you could live there
63,5.0, Although Daehanmun was under construction it was nice inside Deoksugung There are places to rest in the scorching sun and I definitely want to make a reservation for Seokjojeon someday 
64,4.0, Monuments preserved well maintained There are also performances that retain the old system the handover ceremony is very exciting and it also attracts tourists The parks ancient houses and 
65,5.0, It is a beautiful and friendly place in the middle of Seoul 
66,5.0,Peaceful place
67,4.0,The place is definitely worth visit You can sense the tradition there There is good information available for tourists about the history of the place
68,4.0, If you make a reservation to see the inside of Seokjojeon you can hear an informative commentary for free The interior of Seokjojeon is very pretty 
69,5.0, The palace is located near City Hall station exit 2 entrance fee 1000won The stone wall road next to the palace is so beautiful 
70,5.0,Another great cultural institution in Seoul Loads of beautiful and interesting buildings well maintained
71,5.0, It is a quiet palace Be sure to visit it The area around Deoksugung Doldamgil is also very pretty 
72,5.0, Its a beautiful place Especially in the evening on a clear day its quiet so its good to organize your mind 
73,4.0,Very nice palace in a huge space near center of Seoul Cheap entrance fee 1000 KRW Clean toilet
74,5.0, A space where you can take pictures of the present past and future in one picture 
75,4.0, places to visit I cant enter Seokjojeon because I go too late If you want to see the night view go 
76,5.0, Its nice to have such civic resting places and relics in Seoul 
77,5.0,Very nice palace well preserved in the middle of the city
78,5.0, Deoksugung Night Tour is so good The cool night breeze is nice and the palace is charming in the lights It was crowded but it was good If you havent done the docent tour I highly recommend it 
79,5.0, We came together for a reunion on Saturday and then came back for another gathering on Sunday I came here two days in a row to eat and I thought I would never get tired of coming here and eating all week 
80,5.0, After listening to a detailed explanation from a cultural commentator which took about 40 minutes I had a better understanding of our culture 
81,4.0, Deoksugung Palace is easily accessible as it is located in the city center but it is always difficult to see it in its own right due to construction Still its worth a look at the restoration 
82,5.0, The peaceful and quiet atmosphere of the palace is very good and the entrance fee is KRW 1000 so it is very good to enter without hesitation and feel the silence 
83,4.0,Would have put a five if the MMCA museum was opened But it was closed for renovations Overall a nice place to walk around and sit to enjoy the good weather we are having in Seoul now
84,4.0, Located opposite Seoul City Hall A palace with good access Although it is not large it is a space where modern and classical beauty are well harmonized 
85,5.0,If you come during the changing of the guard then you can watch the changing ceremony and take pictures with the soldiers in uniform from the Joseon era
86,4.0, After a while I looked around It doesnt take long and its okay to heal in the middle of the city 
87,5.0, An easytoreach attraction with important history Admission can be paid with T Money Card Information signs and free visitor brochures are available in English You can take photos anywhere The different flowers 
88,4.0,Historical area in the middle of modern architecture It was so amazing being there For me sunset is the best time to visit Deoksugung Be aware that the temple closes at 9 pm
89,5.0,A beautiful palace that is perfect if you do not have a ton of time but still want to see part of Koreas history
90,4.0, Its always a good place to go Today is Childrens Day so there are many people 
91,5.0, I liked the kind explanation and consideration until the last warm feeling thank you 
92,5.0, First time to explore Deoksugung Palace that I only heard from the lyrics  
93,4.0,Its a palace in the city so its quiet and elegant
94,5.0,Interesting palace Admission is cheap
95,5.0, Anyway Old ones are good Much better than that I like it 
96,4.0, It was so beautifully maintained that it was hard to believe that there was a palace in the city center In it not only the traces of the old palace but also the appearance of King 
97,5.0, A cultural commentator gave detailed explanations starting near the entrance and saw the changing of the guards ceremony 
98,4.0, Its been a while since Ive visited but I was disappointed because the cultural assets buildings were not well maintained Maintenance and cleaning of the exterior walls of the building is required What does the 
99,5.0,Definitely worth stopping by on your way through the city center Beautiful Westernstyled garden an ideal place to relax in this big and rushed city
100,4.0, The last Wednesday of every month is a cultural day so I went for a walk at lunchtime because admission to the four palaces is free but there are a lot of office workers 
101,5.0,Free entry on last Wednesday of every month
102,5.0, pretty and nice It is even more emotional to hear and learn about historical facts through the night tour 
103,4.0, Weekday spring day It was so beautiful to see the stamens flying 
104,5.0, A place to enjoy contemplation A great place to take a walk 
105,5.0, It was nice to see the flowers in full bloom and it was nice to have a cool rest because of the shade 
106,5.0, April 21st spring in the palace A feast of wind people and flowers 
107,5.0, Beautiful trees and colorful flowers are in full bloom every season so it is a great place to take a short break while enjoying the view of the neat palace in the city center 
108,4.0, It was small and nice but the art museum is under construction 
109,5.0,Good history place
110,5.0, A place with a painful history If you expect the building here to be a small version of Gyeongbokgung Palace you may be very surprised 
111,5.0, The explanation given by the interpreter helped me a lot to understand Deoksugung Palace Well done and thank you 
112,5.0, Its pretty and the size is just right so its good to take a walk and there are a lot of people sitting there 
113,5.0, The night view of Deoksugung is also very good until 9pm 
114,5.0, It is an old palace near Seoul City Hall You can experience the modern architecture of the Joseon dynasty and a museum and a landscape that harmonizes with old palaces Although it is not a very 
115,4.0, If you come to Seoul Korea you must visit Deoksugung Palace next to City Hall Spring and autumn are so beautiful 
116,5.0, Unlike other palaces some buildings were built within 100 years Thats why it has a modern feel so its colorful 
117,5.0, A place where you can know the history and cultural assets 
118,3.0, Dont go on spring weekends Im crazy about people taking pictures Seeing people standing in line under the cherry blossom trees to take pictures is heartbreaking 
119,4.0, Its quiet clean and quiet Unfortunately you cant eat food but I wish there was at least a kiosk or coffee shop where you can buy coffee or water 
120,5.0,This is a very beautiful place to see A blend of history and nature surrounded by a great modern city
121,5.0, This time of the year is very pretty I also enjoyed the commentary on Seokjojeon 
122,5.0, A good place for a walk and contemplation on a sunny spring day 
123,5.0, A place with a very beautiful scenery along with the nearby Jeongdong downtown The stone wall road towards the British Embassy is currently under construction 
124,5.0, The apricot tree in front of Seokeodang was in full bloom I took a picture with Deokhongjeon but I was satisfied 
125,5.0, A lot of people come to see spring flowers Weeping cherry and apricot trees are at their peak right now When the wind blows it rains flowers 
126,5.0, Gorgeous spring flowers highly recommended for foreign visitors Traditional and Westernstyle palaces 
127,5.0, Its not as spacious as Gyeongbokgung Palace and theres not much to see but the buildings where East and West meet are new and pretty 
128,4.0, It was so nice to go in good weather Be sure to visit 
129,5.0, Deoksugung Palaces Changing of the Guard Ceremony is at 11 oclock It would be good to see it at least once 
130,5.0, Its been a really long time since I visited I enjoyed watching it Flowers are blooming beautifully The spring breeze is also soft 
131,5.0, Deoksugung Palaces spring is more beautiful with flowers blooming 
132,5.0, The scenery is beautiful and there are so many things to see 
133,5.0, Ha Seonhwa the narrator was very good so I thought a lot about Deoksugung Palace and Emperor Gojong 
134,5.0, Deoksugung Palace in front of City Hall You can enter by paying KRW 1000 with a transportation card A mustvisit place 
135,5.0, walking is ok A place with history Recommended 
136,5.0, Its not too big and its great to take a walk and enjoy I am very much looking forward to the flowers that will bloom one after another such as cherry blossom peony wisteria and pear tree 
137,5.0,Very nice family outing place
138,5.0, It was nice to be able to turn around comfortably without a guide Its a pity that there was a lot of construction work 
139,5.0, The front of Daehanmun is under construction but I hope it will be completed soon Standing in front of Seokjojeon Hall makes you feel as if you are in a European city 
140,5.0, There is a charming old palace in the heart of the city and it shows an attractive scenery 
141,5.0, Best value for money Doldamgil is very pretty at night There are many restaurants around and it is a good date course 
142,5.0, A place where you can feel the traces of Joseon and Gojong Its good to go back late at night  
143,3.0, I just went in because I didnt have a place to go on a Sunday 
144,3.0, Fifty years ago Deoksugung was beautiful Museum installation pond garden cafe It should be more like the old Deoksugung Palace 
145,4.0, I went with my children especially the art museum Park Sugeunjeon it was so good 
146,5.0, The wind was chilly but the weather was nice At the Deoksugung Museum of Art I had a good time watching the exhibition of artist Park Soogeun and walking along the stone walls of Deoksugung Palace 
147,4.0, It is near Seoul City Hall On Sundays you can park your car at a nearby building at a discounted price 
148,5.0,One of the most symbolic historically meaningful palaces of the country Superb access by public transportation and highly walkfriendly Youll feel a hyperreal serenity at this place which magically fades out the citys bustle and takes you back to the time
149,5.0, Deoksugung stone wall path is well maintained It is a place that gives warmth to my heart every time I go Near Jeongdong Church inside the National Museum of Modern and Contemporary 
150,5.0, It is the place where Emperor Gojong passed away It is the starting point of the 31 day movement I think it is a painful history of changing the name from Gyeongungung Palace to 
151,5.0, It is so good to take a walk inside Deoksugung Palace visit an art museum and enjoy one stone and two birds 
152,4.0, I saw the exhibition at the palace museum but it was not suitable for viewing because the place was small and crowded There is no place to rest I would like to limit the number of people The palace was quiet so 
153,5.0, Pretty stone wall path I think it was possible to shoot at night 
154,5.0, Forbidden City in the city The exhibition is so beautiful 
155,4.0, A wellorganized cultural heritage Although the history is short the new and old associations are too buildings that fit well 
156,5.0, late Joseon Dynasty A piece of sad history 
157,5.0, After seeing the exhibition I came to enjoy the quiet and leisurely city life 
158,4.0, I remember going to a drawing contest when I was in public school 
159,5.0,in March the cherry blossom still not fully blooming
160,5.0, All museums are good but all are good but the old people are noisy at the Park Geunhye protest 
161,5.0, I went to the exhibition of artist Park Soogeun Its until March 1st so I recommend you to go 
162,5.0, A place to relax in the heart of the city always full of the scent of art Its really good 
163,1.0, Partitions at the construction site block the view and hinder walking I cant tell you how uncomfortable it is 
164,5.0, There is an old palace in the city center nearby but I dont visit often so I feel a little bit sad 
165,4.0, 3rd place after Gyeongbokgung Palace and Changdeokgung Palace 
166,4.0, Its pretty Now that Im old Im sad that I cant enter for free 
167,4.0,It was nice to learn more about the history of Korea It was cheap and a nice way to spend a few hours
168,4.0, There is an entrance fee of 1000 won To go to the National Museum of Modern and Contemporary Art Deoksugung you must use the main gate and you need to purchase a separate ticket to enter Deoksugung 
169,5.0, After the holidays I go for a walk with my juniors and study history 
170,5.0, Seeing the National Palace and feeling the breath of ancestors 
171,5.0, It was quiet and it was snowing during the holidays so it was nice to take a walk 
172,5.0,Cheap and cool historical place to visit
173,5.0, A place where you can find relaxation in the hustle and bustle of the city Like Gyeongbokgung Palace the precincts are not very large so it is good for a short walk You can also enjoy art exhibitions because 
174,5.0, It may not seem like much but once you step inside there is something unusual about the weight of history 
175,5.0, A look inside Deoksugung Palace during the Lunar New Year holiday 
176,5.0,CMMA museum has excellent history foe Art a must visit while in Korea
177,5.0, Free admission on the last Wednesday of every month Trees palaces and ample space make you sympathize beyond time You will be able to better understand the modern history and situation of Korea 
178,5.0, There is no one watching the work quietly and it is very noisy 
179,5.0, I havent been to Seoul in a long time There werent many people and it was really nice to walk around the palace leisurely 
180,5.0, I really like it I was able to get to know the beauty of Korea Hahaha 
181,5.0, It was the cutest and most beautiful palace Ive been to I want to go there right away 
182,4.0,palace in modern city
183,5.0, I like that there is an art museum in the old palace in the city center 
184,5.0, A nice place to take a look around Doldamgil  It is good to look around the promenade or enter the palace If you are using Seoul Station it is recommended to take a quick look around an hour before the train time 
185,5.0, Its always good every time I go depending on the season 
186,4.0, The snowy palace is very nice Also enjoy a special exhibition of Park Soogeun at the art museum 
187,5.0, I like to visit Deoksugung Palace and visit the art museum inside Deoksugung Palace 
188,5.0, It is nice to see Seokjojeon Hall and other palaces You must make a reservation to enter Seokjojeon Hall You dont have to make a reservation for the basement but there are few 
189,5.0, very good It is of great help in understanding the history of our country 
190,5.0, Deoksugung Doldamgil Night Tour and the source of ShinGyecheon Stream 
191,5.0, Perhaps because it was the second day of the three days when the exhibition poster was presented the line to enter was long even before the opening and down the stairs 
192,5.0, Everything was good except for the cold and cloudy weather Affordable admission Worth an outing with children and friends 
193,5.0, There was nothing special about Deoksugung Palace in winter but I went to Park Soogeun I see it all and go round and round but there is a mood just as written 
194,5.0, I went at night with the kids Its very good Admission is free if you bring your Dadongi card and mom and dad ID 
195,5.0, A park in the middle of Seoul the oldfashioned charm of the palace is a bonus 
196,5.0, Our old palace is always beautiful Despite the painful history I have been here for a long time and the pavilions and trees are beautiful 
197,5.0, An old palace that can be found in the 4 main gates a hot place in Seoul A place where you can relax like a park in the city center and have fun taking 
198,5.0, It is impressive that the stone pavilion was built by adopting the Western architectural style of the late Joseon Dynasty 
199,5.0, Its always a great place Its pretty at night 
200,5.0, A night view by chance It was so good that I didnt even feel the cold Its a quiet serene and warm atmosphere 
201,5.0, I took my bus card and entered I did it because the line to buy the tickets was long Autumn leaves are so pretty 
202,5.0, The stone wall road and the palace are beautiful The exhibition at the National Museum of Modern and Contemporary Art Park Soogeun is impressive  
203,5.0, A date in town with my wife after a long time I like Gyeongbokgung Palace in late autumn 
204,5.0, Deoksugung Stonewall Road still remains  It is good when you want to walk quietly  
205,5.0, A nice place to relax and taste no matter what season you go Photos are optional waffles are a must 
206,5.0, I met Park Soogeun through an exhibition of the artist Park Soogeun who learned the world of painting by a purely selfeducated artist It was nice to be able to see the modern architecture together with the 
207,4.0, Autumn is so beautiful here  If you can wear  thats great In the heart of the city there are 3 attractions Palace Duc Tho Museum of 
208,5.0, Deoksugung Art Museum after a long absence Park Soogeun exhibition Our lives are heavy but lets not give up hope 
209,5.0, I had the opportunity to see the work of artist Park Soogeun It was so good 
210,5.0, I went to the Park Soogeun exhibition Its pretty when you walk around Deoksugung Palace It is recommended as a date course 
211,4.0, Park Soogeun Expressing the sentiments of ordinary people in the 50s with a warm gaze Enduring with a strong will like a tree waiting for spring 
212,5.0, There are good things to go at night and there are some things that are a bit disappointing 
213,5.0, always a good place I took some pictures during magic hour 
214,5.0, It was great in the fall Take the entrance fee So I turned out It takes about 20 minutes to turn around 
215,5.0, It was nice to be able to use the cafe inside the palace after a long time When I went out to the back of the cafe building I was able to spend a wonderful time in harmony with the small pond and the scenery 
