,STAR,CONTENT
430,3.0,I went here to take photos nice place very quite and few people came in I took many of photos from different angles and you can take amazing photos
431,4.0,do your research and dont be like lazy tourist me after walking 1015 mnt from gyeongbokgung in hot scorching sun i arrive at deoksugung only to find out its close on monday _;
432,4.0,Deoksugung palace is also known as Gyeonhungung too It is a walled compound and was used as residence by Joseon periods royal family Its dates back to 1400s There is a changing of guards ceremony three times a day 1100 1400  1530 Inside is National Museum of Art too There is a elegant stonewall road on the back on place Admission to the palace is for 1000 won And outside its walls is national museum of contemporary art too  Great place to visit not only because of its history but many other places of interest nearby and also the city hall etc
433,4.0,Deoksogung Palace is a good palace near the City Hall Station on Line 1 of the Seoul Subway Its not as big as Gyeongbokgung but its still a nice place to visit They also have a changing of the guard ceremony and a great park within the palace grounds An added bonus is that theres a Dunkin Donuts right next to the palace which had a different variety of donuts that I dont see in the United States Its also a good place to rest since they have free Wifi
434,5.0,The Palace is a walled compound that was inhabited by members of Koreas royal family during the Joseon monarchy 13921910 until the colonial period around the turn of the 20th century It is one of 5 Grand Palaces built by kings of the Joseon Dynasty It is popular for its daily Changing of the Royal Guard ceremony and is an excellent opportunity to photograph native costumes
435,4.0,I kinda like visiting those palaces and stuff whenever I am travelling I have to say that although this might not be one of the best but still it was worth a visit  They had this changing guard ceremony everyday at 11am if I was not mistaken Probably you should not miss it as it might be the highlight of the place  But to keep those traditional palace surrounded by tall buildings and in the heart of the city was amazing
436,3.0,As with all the Seoul palaces this place is majestic and peaceful The only issue with this one compared to the others is that most of the information signs were only in Korean and this turned us off going to other museums
437,4.0,You can try on hanbok and take photos around 15 minutes for free However they have the timetable so be sure to check first
438,5.0,While not as large as Gyeongbokgung Changdeokgung or Changgyeonggung Palace Deoksugung Palace is the serene and beautifullycanopied seat of Koreas brief imperial power As it was originally constructed as a residence not designated for royalty Deoksugung possesses a humble quality enhanced by the beautiful foliage landscaping the premises It is historically significant as the only imperial palace and the place where Emperor Gojong died in 1919 It is a beautiful mix of eastern and western architecture a testament to Gojongs desire to lead Korea onto the world stage in the early 20th century The thricedaily changingoftheguard ceremony transports visitors back to the Joseon dynasty and is a mustsee if visiting this palace Admission is inexpensive and guided tours are free Our English tour guide was charming polite and wellversed to answer questions
439,5.0,Very close to city hall this palace is very peaceful We had a free tour which explained a lot and the changing of the guard ceremony was very colourful and interesting
440,5.0,I didnt expect much from this palace its small a third of its original size and gives an impression of a lessthankorean palace sibce there are modern buildings in it BUT It has difinitely exceeded my expectation Firstly it was considerably less crowded than Gyeongbukgung even in its peak time which is 11 am when the Changing of the Guard takes place Secondly the Changing of the guard is a wonderful experience you can follow the marching band around and watch the change comfortably and then even pause a few times to let you take photos with the guards Thirdly the history of the different buildings that compile the palace is very interesting One of the buildings is a fusion between traditional korean architecture and imperial architecture and to my opinion it was spectacular  For the meek price of 1000 won I recommend going I arrived around 920am so I even managed to get a free english tour with a guide before following the marching band  Overall I spent 3 hours exploring including the guard change and half a guided tour
441,4.0,Spent a very charming hour walking around the palace looking at the buildings and soaking up the history Its surprising quiet when you think it is just across from City Hall and has some lovely gardens to walk around in Great to pop into as it is not a big palace the smallest of the 5 in Seoul and has some interesting recent history  the site of the joint Soviet  American commission in 1946 where the USA tried to get the Soviets to accept a unified democratic Korea
442,4.0,After a long day and on my way to an evening flea market and some dinner I passed this nice little palace Open until 2100 hours and well lit it was little gem for a very little price
443,5.0,It is smaller now than the other palaces but relatively uncrowded so you can explore easily Great free English speaking guide and if you go to the main residence you may be able as a foreigner to book a time for entry It is worth it and the free English audio is excellent Not as grand as the Gyeongbokgung palace but rather restful If you had time Id do this first as the explained features are the same and the history of the murder of the Emperors wife takes on meaning
444,5.0,I love the grandiose Royal Changing of Guards here If I were you go at the entrance if they will be having the said ceremony See it up close and take a picture with the guards
445,5.0,What a deal People over the age of 65 gets in free Located right in the middle of the city Besides access to the spacious grounds there is a walking tour of the Edwardian style Palace Unfortunately it is conducted in Korean but one can rent the audio tour It is very comprehensive and takes over 75 minutes so be warned
446,4.0,The palace complex comprises of many buildings halls It is so close to the City Hall subway station The entrance fee is only KW1000 very minimal isnt it The place is like a mini park and it would be nice to just sit down and relax there The guards look interesting with their traditional dress Ask the information center about the time for change of guard Its unique and worth waiting for
447,5.0,Located in the middle of several touristic spots This palace gives you the opportunity of scape of the big city and see some beautiful buildings The entrance is very cheap Around 1 US dollar Theres the change of guard constantly going on And its a great opportunity to have a bit of the spirit of old Korea and take pictures with those characters Theres free wifi inside and its not allowed to smoke
448,5.0,The entrance to the Palace grounds is a canopy of cherry blossoms Allow at least an hour to visit the many buildings There is a separate art museum which charges an entrance fee We got to see the paintings of a Korean artist which were stunning There was a concert of popular Korean music given on the grass in front of the museum There is the possibility of visiting the Palace rooms This takes a special ticket for which the concierge at our hotel arranged It may be possible to arrange this per Internet There is no additional charge to visit the Palace but a reservation is essential
449,5.0,I had a nice stroll in this beautiful place Sat on one of the bench and idle with nice views of the surrounding and architecture Many walks of life visits this place  I noticed many school children in uniform here Elderly with their grand kids walk hand in hand enjoying the surrounding and time together At interval times there is The Changing of the Royal Guard is in front of Daehanmun Gate which lasts about 1hour A well preserve piece of history in a modern city  Consists of traditional palace buildings landscaped and forested gardens a statue of King Sejong the Great and the National Museum of Art which holds special exhibitionsLocated near City Hall Station
450,5.0,There is a great changing of the guards ceremony at around 11 AM it is absolutely worth it The palace grounds are beautiful with many nice areas to take pictures especially in the gardens Surrounded by skyscrapers its definitely a nice natural and historical haven right in the middle of the city
451,4.0,You cant help but notice when visiting this ancient Palace that you are surrounded by modern day high rises in the heart of the city  This was a very popular Palace for school children to visit as there had to be several hundred children on site  The grounds are very nice and much bigger than expected There is a mixture of Western and Korean architecture Make sure to grab the brochure expaling everything at the entrance way  Definitely worth a look Very cheap to get in only 1000 won but free if you are 65 or older
452,4.0,smaller than gyeongbukgong but the royal guard changing ceremony is more interesting theres a russian museum inside that apparently need advanced booking so we only get to see from the outside
453,4.0,The grounds and the palace are nice But the reason to go is to see the changing of the guards Very interesting and very colorfulvery tourist friendly Many photo opportunites
454,3.0,This palace was just 5min from our hotel so was able to visit in the morning before our departure They have a changing of the guards that we just happened to be lucky with our arrival time 11am or so The palace is not so large but there is an art museum inside some nice gardens with blossoms April
455,5.0,Webhad several hours to spend in seul and this place was great place to visit Spent there more than an hour It cost around 1 to enter and u get instructions in several languages If you have few hours free in the city this place can be very nice visit for you
456,4.0,I have been to Seoul in November 2015 in good weather although its cloudy and some time rainy however very enjoyable if you have fear to get wet by rain bring an umbrella with you  This Ancient Palace is located in Seoul city surrounded by the modern urban infrastructure it is near to the City Hall Station Subway The palace belong to the Joseon Dynasty You will feel very nice after entering inside most of the area is surrounded by the plantation and in Autumn seasons different shades of maples pleasing the viewers the nature lovers will definitely love this place  In a very big compound there are different types of building of 15th  16th century people who like to visit historical places  attraction this place is definitely worth to visit for close attention and details you should have sufficient time considering the opening and closing of the palace There is museum inside basement 1st and 2nd floor and to visit the place prior reservation is required via Deoksugung homepage
457,4.0,A nice example of the palaces but time your visit to watch the changing of the guard It is very colorful and adds to the ancient feel of the palace One of the buildings house the National Museum of Contemporary Art Worth a couple of hours
458,5.0,This Palace one of four major Palaces in the same vicinity in Seoul is pretty much directly opposite City Hall and theres a metro station at City Hall so its easy to get to and find This is a smaller Palace than some of the others and has a few more laterbuilt buildings so is quite distinct from the other Palaces The Palace guards are interesting to see and photograph and you dont have to buy a ticket to go into the Palace to see them as for obvious reasons they are on the outside of the gate They are used to having their photos taken As a consequence you can also see much of the changing of the guards from the street too free of charge much like Buckingham Palace And the changing of the guards at Deoksugung and at Gyeongbokgung not far up the road for that matter has just as much pomp and ceremony with colourful uniforms and a marching band as Buckingham Palace or Horseguards Well worth a look if you can time it right
459,5.0,We watched the full changing guard ceremony and got the chance to wear Korean hanbok free for tourist before entering the gate theres a booth on the right that provides Korean traditional clothes for tourist to wear just need to fill out your name and took a photo with the head of guards The booth closed around 2 or 3 pm Very memorable
460,4.0,I was glad to see this palace just wish it was in the day not night time even though the lighting was kind of nice at night
461,5.0,There are other main palaces that are closer to each other and make it easier for people to do palace tours at the same day and Deoksugung is often left out because it is a little far and in different direction But its right across Seoul city hall and very easy to find It has nice parks and very unique because it has museums within it too During weekends and holidays I think there are highschool student volunteers doing English guide I went in August 15th the Korean Independence Day and they opened for free There will be some other national holidays when they open for free so check it out before the visit
462,4.0,We stumbled on this palace on our way from Namsan Park to Gyeongbukgong Palace It costs about 2 USD to enter the palace and it is certainly worth it Spend about half an hour wandering the beautiful grounds
463,4.0,Easy to reach by metro Buy a combination ticket for all the palaces and jongmyo for 10000 KRW Ther is a small empire museum in the basement the larger palace museum is only open for guided tours The changing of the guard is a nice show to see Most of the action takes place outside the Palace ground in front of the main entrance so better try to be outside than inside to see the ceremony
464,4.0,Unfortunately we missed the changing of the guard but its a beautiful palace for sure Definitely worth going to even in the dead of winter I recommend it
465,5.0,The palace complex is a wonderful place to roam around The main throne room has a decorated ceiling that is really intricate detailed and colourful Many other buildings also add to the understanding of how court life must have functioned To see all of the buildings be prepared to spend the whole day
466,5.0,Exclusive and free experience that you can watch in front of the palaces gate Just curious that some performer are westerner dressing in an old traditional Korean guard uniform I found it a bit strange
467,4.0,I was there after visiting the Art Museum and I watched the changing of the guards at 11 am It was quite an experience with all the marching and drums performance
468,5.0,As it was quite near our hotel this was first We chanced upon a Changing of the Guards ceremony and it was quite interesting and the colors were fascinating We toured during the MERS scare and there were not a lot of tourists around Our photos were quite nice as it appeared like we were the only ones around its a small palace and its something you can quickly finish up in an hour or two
469,4.0,This palace is an ocean of serenity in the middle of a very busy part of Seoul and while the palace deserve a visit as it is the change of guards is a fantastic sight to see great and a fantastic recreation of Korean history
470,5.0,Stayed about 2 hours which about tested the limits of a 3yo Nice microcosm to see what a Korean palace is like without having to travel too far and having to feel obliged to walk the extensive grounds of a bigger palace like changdeokgung
471,4.0,We choose to visit Deoksugung because of its size We would like to be able to tour the ground and thought that Gyeongbok and Changdeok is too much for our group of elderly and small children to walk through and cover all  We arrive exactly as the changing of the guard ceremony is about to start at 11 am and lucky enough to find a booth in front of the main gate that offer services of young korean student for a free tour to tourist They were official and looked very professional with their orange uniform and obviously they get the support from the local govt The purpose is to practise their english with foreigners and to learn more of their own culture which I thought were very nice  Sara our guide was only 14 years old about the same age as my eldest daughter thus they were instantly having a girl talk  she showed us around the palace complex stopped every now and then to explain about the buildings and their history  The complex also has a museum but we choose not to go in so cant comment on that one
472,3.0,The guard changing was interesting tradition passed down though generations guards in traditional clothings martial art demostration Theres a carpenter outside the wall Need to buy tickets to enter premise More of preserved architectures for photography Not for wet weather
473,5.0,I recommend everyone to see the guard changing ceremony It is pretty fascinating They are actors but it is nice to see the tradition is still preserved There was yellow booth set up beside the entrance so you can try hanbok or traditional Korean clothes for free and get to take pictures with the guide while wearing it I recommend to get the free volunteer guide before you get in Ours was a high schooler with excellent English and he gave a lot of good explanation and insight of the palaces and Korean culture I love how the public restroom was warm and has heated water Got to escape the coldness outdoor for a little bit
474,4.0,located near the city hall good to walk around and see korean palace Convenient access but nothing much to do there
475,5.0,One of the Five Grand Palaces of Joseon Dynasty\xe2\x80\x9d is easy to access as it is located in the city centre in front of Seoul Plaza and City Hall  I really recommend to check out official information about time of changing guard ceremonies we saw one at 1400 and it was the biggest performance  took around 30 mina  with also music show and martial art show They are WORTH watching Tourists are also encouraged to take photos with the guards   For palace itself it is a big complex with both Western and Asian architecture Additional Westernstyle buildings were added during Korean modernization period in XIXXX century  Highly recommend to visit this palace
476,5.0,I never dreamed there were so many beautiful palaces in Korea This palace seemed smaller than Gyeongbokgung but equally as impressive
477,5.0,I got to witness the change of Guards and a terrific lady from HighSchool  who was volunteering to Guide Tourist around for free the entrence fees are nothing dont forget to bring your Hat and it takes more than one hour all rebuild after the fire  you need to learn about History there for sure
478,3.0,This palace is within walking distance from the City Hall Station Had I not visited Gyeongbokgung the next day I would have rated it very good Somehow the modern cityscape surrounding the palace ground spoils the flavor of the traditional palace architectures  The Royal Guards changing ceremony is a must watch if you do not plan to go to Gyeongbokgung Do check out the schedule in advance so that you can optimize your time Be at the entrance before time so that you can watch from a good spot The schedules during our visit in the last week of Oct15 were 11 am 2 pm and 330 pm The ceremony last for 30 minutes and I found it a bit lengthy at the end The colourful costumes of the Royal Guards make some of the otherwise plain photos stand out  It is also worth to pay a visit to the National Museum of Modern and Contemporary Art which is also inside the palace compound If youre here at the right time during autumn which we obviously were not you should be able to see a blaze of vibrant autumn colours
479,3.0,Should come if you are into history and stuff Im not one myself so just stepped by for landscape but it is nice
480,4.0,It might not be the most impressive of the palaces in Seoul but its still worth a visit and entry really doesnt cost much at all You probably dont need to spend much more than an hour there and definitely not more than two but the architecture alone is worth the price of admission even without taking into consideration the historical importance of the palace Signs are in English Korean Japanese and Chinese so almost any visitor can learn about the historical details
481,3.0,It was a very cold day  0 degrees so my walk around the grounds was brisk The entry fee is only 1000 won about 150 AUD so inexpensive  There are free tours leaving twice a day and there are brochures just inside the gates in English There are a number of plaques dotted about that have a short paragraph in English explaining the relevance which is very useful Overall it is a peaceful place that was largely empty in December and is was easy to stroll around and look at the gardens although they are pretty bare in winter  The grounds also house the Daehan Empire History museum which has tours of the 1st and second floors of the palace I peeked through the windows was worth a look if you like palaces and you can reserve your place in the free queue almost every hour  I didnt know this before I went so the tours were full Check it out before you go the rooms looked lovely In the ground level was a museum about the history of the dynasty Im not really sure there was an english brochure which didnt explain much and none of the displays had english translations so I am not sure what it was about Give it a miss if you are in a hurry although it is nice to get in outside from the cold  The changing of the guard was at 11am and I was able to see them marching from behind the hall all the way through the gardens to the outside gate Ignore the cheapskates who say to not pay go in and see it It was a good spectacle  Allow about an hour and there are plenty of toilets and drinking fountains throughout as well as a few vending machines if you want a quick drink or snack
482,3.0,My family visited the Deoksugung Palace after lunch at the Grilled Fish Street  The palace provided a glimpse into how the royalty lived  a feel of their architecture their residence ondolstyle sleeping quarters garden  and a little of their history  We arrived just before 2pm and managed to catch the changing of royal guard at the palaceto be more precise an reenactment  It added to the experience  On the whole the visit was educational but not inspiringa single visit will do
483,3.0,Not really that impressive Can cover the palace ground in less than an hour However the changing of the guard is quite interesting It can be viewed at the entrance of the palace and hence not necessary to pay the 1000 won fee Its done 3 time a day
484,4.0,Deoksugung is a nice palace that is surrounded by tall buildings and a bustling city This place is a quick walkthrough compared to other palaces in Seoul but its worth a visit if you have been to the other palaces
485,4.0,A bit smaller than Gyeongbukgung but still beautiful Perfect for those who want to see the historical era of Korean Kingdom but have limited time During autumn the palace garden looked very beautiful The changing of royal guard ceremony is also very interesting to watch
486,4.0,this is the place that u see what a gorgeous colourful tree what colour u wanna see u will see u will enjoy with step u walk through
487,4.0,We visited Deoksugang Palace on a recent visit to Seoul It makes a great stop if you have a limited amount of time to visit one of the four main palaces in Seoul It gives you a taste of what the palaces were like back in the time of the Joseon Dynasty This palace complex is compact all the sites are within easy walking distance of each other and the signs are in English as well as Korean It is easy to get to either by subway or via the Hop on Hop off city bus tour of Seoul Consider a visit here if your time in Seoul or interest in Korean palaces is limited It is worth a halfhour to an hour of your time
488,4.0,it was great walking along the stone wall side of deoksugung palace is beautifull  especially when autumn It is a famous destination for the domestic and foreign tourist
