,STAR,CONTENT
547,4.0,Deoksugung Palace and gardens is a mustsee in the middle of Seoul  just across from the City Hall  Seoul Plaza The entrance is via the impressive Sumumjang gate where a changing of the guard ceremony is regularly held Entrance is cheap  free if you are 65 or over and have a passport or driving license They sell a handy little guide book which will fit in your pocket and costs just 500 Won Over the years much restoration work has been needed reflecting Koreas troubled past and rather inconvenient neighbours But the various structures are well worth looking at and on a fine day with the trees in blossom it is a magical place to stroll round
548,3.0,Entrance fee is cheap so worth going in for a look although this palace is pretty small  We were lucky to witness the changing of the guards when we arrive  Take pictures with the 3 guards standing at the entrance They looked nice in their tradtional costume
549,5.0,This palace is one of the smallest but might be the best to go to It is right beside the City Hall It has a very elaborate changing of the guards ceremony at 1100 200 and 330pm It has a pond that turns into a skating rink during winter The National Museum of Art is inside The western style palace of the last emperor has an English audio tour that describes in detail the history and circumstances of the last Korean royal family All of these for just 1000 won per person
550,5.0,Well here is the main place in Seoul I recommend for a couple or family Here is much smaller than Gwanghwamun Gate near here Especially Seokjojeon Hall I love this place
551,3.0,Not the greatest place but when I saw it there was something like a play with made it a little more exciting but you can walk through it in half an hour
552,5.0,I went here around 930 AM and it was nearempty People say that you should wait till later to avoid to tour groups but there was probably 5 other people here when I visited This palace grounds is amazingly preserved and it shows the traditional architecture of the Joseon Dynasty I highly recommend buying the combination ticket for the other palaces if you are going to visit them as well It costs 10000 Won 10 USD
553,5.0,The changing of the guard ceremony is a great show to observe Colorful and musical military precision and expressionless execution by the guard
554,3.0,Situated in City Hall station exit1 Area An admission 1 Adult Fee it costs 1000 KRW ; The palace itself combined with Seoul National Museum building and the old Council parliamant which now transform a place to exhibit for Korean Kings Western Resident style; There are many complex elegants room display such as Main Lobby hall; Bedroom; LibraryDining room etc For Guide information service visitor must do letter for group permission tour Individual audio various languages provided at registration counter
555,5.0,I found this place better well during Autumn among others I guess each grand palaces has its own distinction Deoksugung Palaces during Autumn flows with warm colors both inside and out Though the place is not as big as Gyeongbokgung you can just sit and relax while having coffee or a Korean ice cream
556,4.0,This is a very nice park to sit and walk in and the added bonus are the palace buildings This part of Seoul has limited green space left over and it allows you even in the winter to sit in a bit of peace for as little as US 1  It has a number of nicer building to look at  one always wonders how much is really old and how much has been restored  And with respect to the ceremonial guards  checkout all the glued on moustaches and beards ;
557,4.0,Most hotels concierge will tell you theres nothing much to see here But this palace is quiet has a mix of architecture styles and is quite interesting Do not miss the changing of guards ceremony and check with hotel the timings especially during winter if too cold apparently there is no ceremony In the Seokjojeon hall theres an interesting guided tour foreigners follow the Korean group with audio guide about King Gojong and his son Sunjong the last monarch of Korea Sadly the Korean tour moves very quickly from room to room and those listening to audio guides are ushered out to another room before its finished The audio guide is very informative
558,4.0,It is a welcome experience to see the changing colors of autumn in parks and palaces and in areas surrounded by flowers and trees One beautiful place to visit is Deoksugung palace A very nice attraction in the middle of the city We wanted to see the trees and the leaves and walk around the whole place and feel the cold wind and the cozy ambience We werent disappoined We got what we came for We even played with the fallen leaves on the ground and took lots and lots of photos Its even more exciting because we got to wear a hanbok for free even for just a very limited time There was the usual changing of the guards ceremony which we didnt watch anymore because we saw them in another palace before Outside there are restaurants where you could eat and rest after hours of walking around the palace
559,5.0,Seoul is a city full of palaces and if you have limited time is not easy to decide which one to go Undoubtedly this was my favorite one  I felt this palace was the main intimate it wasnt the biggest or with the lost impressive constructions but seemed a comfy place To host modem buildings along with the historic sites was an interesting contrast which I enjoyed  The best of all is that at 1100 am we saw a show in the outside quite impressive and free even that we paid our entrance ticket They even allow you to take pictures with the characters for a long period Very sensitive
560,2.0,This late 16th century palace and its numerous reconstructions really fail to impress The park itself is lovely at best with a nice pond and fountain in its middle but the palace is anything but unique The National Museum of Modern and Contemporary Art lies within the park but it was being renovated while we visited in August so we could not visit it of course nobody bothers to tell you that when you buy the ticket to the park  apx 1US Skip it
561,4.0,Among all the palace this closed at 9pm the rest like GyeonbokkyungChangdeokgungChanggyeonggung Palace all closed at 430pm a tourism hot spot yet closed at 430pm unbelievable
562,4.0,There are many palaces in Seoul but none are as quaint as Deoksugung Its probably the smallest palace but they have a changing of the guard ceremony on the hour daily What I like the most about this place is that it is smack in the middle of the city so you can see Seouls skyline at night as a backdrop to the many buildings Also there is a westerndesigned structure that I believe has been converted to some art museum Dont forget that this any most other palaces are closed on Mondays and go on a clear night for one of the best palace experiences in Seoul
563,5.0,Cherry blossoms all around Seriously one of the most beautiful parksattractions Ive been to Its like a different world once you step into the gate its like in the middle of Seoul and it seems worlds apart with the serenity  Mustsee if you visit Seoul I think I paid something around 1520 for it but its worth it
564,4.0,After you pay a small fee you can enter this huge park during fall with nice yellow color of the leaves You can spend hours in this park but dont forget the watch the change of the guards This park is opposite city hall The Seoul city bus has a busstop here
565,4.0,Take the subway to City Hall Station line 12 the palace is just beside the station Nice to visit in the evening where the colors and breeze is wonderful
566,4.0,Definitely go visit and enjoy a pleasant couple of hours Well kept grounds and lovely castle buildings Beautiful autumn scenic views in the middle of the city
567,5.0,Beautiful grounds Had a very enjoyable time walking through Definitely worth a visit if you are in the area
568,4.0,Managed to catch the show and was really glad we made it It s something different and interesting The signs stated it would start at 2pm but the ceremony only started 230pmthere were photo opportunities with the guards in costumes before and after the ceremony
569,5.0,Right across the large square from City Hall Beautiful palace as usual in Korea very well maintained A popular place with school children So you get to see plenty of children apart from the impressive palace
570,5.0,Get off at metro called Town Hall and not very far is this Deoksugung Small entry fee and it like a big park and lot of old building to explore around Got cafe and WC on site Most building you cannot go in but they have left door open so you can see throughThe paintwork of assorted colour is beautiful and architecture design are amazing The roof have mini Gargoyles It was a perfect hot day and just lovely to walk around We were Lucky there were Cultural festival that day and all soldier wearing uniform and changing of the guard Big giant drum of gong were played and Korean Band in bright yellow and blue uniform played music As well as important men in their costumes Masses of people stood and watch and allowing to have photo taken with them It was a Great day for a little cost Took us over two hours
571,4.0,Chance upon this place while walking along the main road; I didnt know there were several palaces here in Seoul Its a nice place to visit to talk around enjoying the architecture and the garden The entrance fee was relatively low 1000won
572,5.0,Easy to find this not so big palace Just right in the city centre Subway station next to the gate You can also watch the changing guard ceremony  a few times a day The palace are very calm peaceful and clean There also some snack and coffee shops in front and back corner of the yard where we can sit and relax enjoying the palace surrounding scenery Beautiful
573,4.0,Very quick site to see They have some sort of changing of the guard ceremony daily Costs 1000 won about 1 USD to get in Mix of korean and strange Western buildings Theres also a small museum in the back thats included in the entrance fee
574,4.0,Just strolling around the area sightseeing and poof  out comes a palace out of nowhere Love how you can randomly find something like this out of nowhere and be in awe It was also good timing as they were doing the changing of the guard So relax and enjoy the show By the way  I was alone and kinda wandered into the exit side of the entrance and ended up inside the palaceSo if youre alone wink wink  not sure if theres a fee to get in but feel free to wander and explore that side of the entrance
575,4.0,When you visit this palace please make sure to time it with the guard changing Its really nice to see young men parading 
576,5.0,You really need to visit this amazing palace when you are traveling in Seoul It is one of the Five Royal Palaces in the city all of which are located in the district of Jongno District and Jung District so they are reasonably close on to the other and you can get a cumulative ticket to visit them all Do not miss it
577,3.0,Its nice to found such historical and cultural place in the middle of the city Here you can see the history of the place and found the museum inside the palace area Also theres a small pathway outside the palace that famous because of the view and the story behind it
578,5.0,This is the palace that you can and should see in the evening when the lights turn it into a kind of magic The best 1 admission ever And in a city where so much is rebuilt this has some original buildings
579,5.0,This beautiful historic palace sits in the very heart of downtown Seoul It is nearly directly across from the City Hall building which is an incredible mix of old and new itself  My husband myself and our Korean friend MeeKang spent a relaxing spring day here It is a wonderful respite from the hustle and bustle from one of the largest cities in the world The grounds are shaded and beautifully kept You can pay for a guide or follow along in a pamphlet or map We were lucky enough to have a personal friend guiding us  I am not for certain but I seem to recall her saying that a few historical KDramas had been filmed at this palace The classic Korean architecture has been very well maintained; and you can take a peak into the throne room and personal living chambers of the king and queen themselves  Toward the back of the palace was a small museum with artwork from several wellknown Korean artists Admission is free with your Changdeokgung Palace ticket and I highly recommend you take a moment to peruse the selection within  One of my favorite parts of this palace tour was visiting the first coffee shop in Korea Apparently one of the kings who inhabited the palace was a great coffee lover; so he created a little pavilion in which to enjoy his favorite beverage You can take off your shoes slip on some house shoes and walk around inside of it Its great fun to imagine what it would have been like to witness a real coffee ceremony with the king so long ago  I would recommend visiting this palace on an offday  a weekday thats not so busy perhaps Just remember that most Korean establishments are closed on Mondays I think it only cost 3 or 5 US dollars to gain entrance Im not sure how this would bode for those in wheelchairs pushing strollers or on crutches The outside gardens and walkways would be just fine but once you got to the main buildings and had to traverse the centuries old thresholds I think it would present a challenge  Also not so sure young children would have the attention span to fully enjoy this palace; but older children might have a lot of fun following along on the map and reading the place markers explaining what each building housed and what its purpose was
580,5.0,We visited it around 8pm Supposedly it closes at 9pm but you need to buy the ticket in advance because the ticket counter is closed after 6pm We got a combined ticket for several palaces The palace is beautiful at night There werent many people so it was a really nice visit
581,4.0,Really relaxing palace to visit its smaller and less crowded than Gyeongbokgung I found the combination of Eastern and Western style buildings to be interesting as well The throne hall and other buildings are small but very pleasing to the eye Its also quite easy to reach from the metro and a changing of the guards ceremony is done here I was lucky to arrive right at the beginning of one Admission is cheap and I would advise adding a visit to this palace along with Gyeongbokgung and Changdeokgung
582,5.0,Great relaxing stroll through Korean history Time your visit and make sure to see the changing of the guard It was pretty interesting You can see most of the grounds in about 30 minutes There is a free modern art museum at the end of the park The entire thing cost about 1 to get in
583,5.0,So peaceful and less busy than any of the other palaces we visited Came with the combination ticket that you can purchase for 10000KRW Really easy to get to using the metro Really Peaceful to sit and relax in if you have time while visiting Some western buildings also in the corner of this palace however these were not open when we went A must see
584,4.0,In the right middle of Seouls central business district you can feel the touches of old Korean royal palace Even though it is not a fullscale royal palace structure of Chosun dynasty you can feel the touches of royal palace buildings in about 30 minute walk Autumn season after lunch time will be the best timing This palace is very close to couple of hotels such as The Palace Lotte Westin Chosun Koreana
585,4.0,The palace is lovely  not as ostentasious as Changdoekgung but less busy and more accessible Try and download the virtual palace app before you get there  its really helpful in explaining the significance of the sites  The Mueseum of Art situated in the palace grounds is small but very well curated During my visit there was a retrospective of Korean art from the 1940s Take a moment on the steps of the gallery to look out over the top of the palace and the city scape behind it the effect of coexistence of old and new is awesome  The changing of the guard happens around 1400 daily  and really is a site to behold Get yourself out of the main gate a few minutes before the start for a good view I found that standing to the sides of the entrance gate provided me with some shade and a really good view There is an opportunity to take pictures with the guard directly after the changing  it makes for some really awesome shots as they stay in character
586,3.0,An opportunity to see how Western architecture sits with Eastern architecture Unlike other contributors I felt it looked out of place but it summarises Korean History A great change away from isolationist policy to the embracing of the West The palace was used by the King after the annexation of Korea by Japan whilst Gyeongbokgung was renovated and rebuilt after its destruction  Expansive grounds but yet again limited information Nothing particularly special with the rooms devoid of furnishings  There are three guards standing outside the museum where many people have there photo taken  I do think it is a real shame that these palaces are not showcasing Korean history as what little I have found on this trip has been very interesting  If you are visiting the main 4 palaces and shrine then get the combined ticket for 10000won It also includes the secret garden tour
587,4.0,I lucked in on Cultural Wednesday  free entry on the last Wednesday of each month Mind you the tickets are only 1000WON Large gardens and walkways buildings from several dynasties and the modern art museum has been installed in one of the modern palaces buildings Alas it was closed for renovations at the time If you are interested in history and architecture it is worth a visit It is not as large as some of the other palaces so an hour or two is probably ample  and be prepared to walk
588,4.0,According to various online resources visitkoreaorg the palace booklet etc you name it Deoksugung Palace was originally belonged to Wolsandaegun 14541488 the older brother of King Seongjong 14691494 of the Joseon Dynasty It became a proper palace when Gwanghaegun 15751641 ascended the throne and gave the palace the name Gyeongungung in 1611 Afterwards the name was then changed back to its original title of Deoksugung  Visitors can enjoy watching the ceremony of the changing of royal guards at 1100 1400 1530 It takes about 10 minutes to finish the show Personally I prefer the Gyeongbok Palaces ceremony better as the compound is bigger over there and the result of the pictures taken there came out way nicer  One interesting building within the palace is the Jeonggwanheon Pavilion  \xe9\x9d\x9c\xe8\xa7\x80\xe8\xbb\x92 Literally the name means \xe2\x80\x9cPalace from which to watch the garden silently\xe2\x80\x9d \xe2\x80\x94 a very zenlike name This building was renovated and reopened in 2006 It was the first western style building built in the palace in 1900 Widely known as the Kings Lounge it is said to be a place for the King Go Jong to enjoy coffee and snacks and hold various banquets here Influenced by the western culture and lifestyle Go Jong enjoyed drinking coffee and spending his leisure time here The back of the building had secret passageways to the Russian Emissary which still exist today  for more reviews check httppheurontaycomdeoksugungpalaceseoul
589,3.0,Heres a complete link to my review II Deoksugung means Palace of Virtuous Longevity It is actually one of the four main palaces of Korea during the Joseon Dynasty If you have been to the other four palaces \xe2\x80\x93 Gyeongbokgung Changdeokgung and Changgyeonggung you might feel like theres no need to visit this place anymore because it may look just the same But no It isnt In fact when I entered the area I was amazed how perfectly the Traditional Korean palace erect alongside a European structured museum  Since we just had our lunch around the area we just walked from KTO Headquarters to the palace However the fastest and easiest way to get here is through the subway You have to get off at City Hall  Exit no 2  httpsplurkwordpresscom20140517mission1triptodeoksugungEB8D95EC8898EAB681andstonewallwalkwayEB8F8CEB8BB4EAB8B8
590,4.0,Liked this palace  smaller more interesting layout and of course the impressive changing of the guard ceremony It also lies aside the new modern Western residence that the last King built in the early 1900s which we were told will be open to the public probably October this year What makes this palace so intersting is that mix of old and new What was once the garage is now a cafe This coffee habit started life in the Jeonggwanheon Hall where the King drunk his beloved brew  but got poisoned  which supposedly stopped him producing any heirs Great modern stories mixed in with the old history The changing of the guard ceremony a bit staged and a tiny bit off putting when you can see the velcro and the odd Nike trainer on the soldiers None the less a good spectacle and an even better photo opportunity
591,3.0,Since our kids are not really big fans of palace tours we opted to just time our visit to the Changing of the guards Its a delight to watch as we were almost brought back in time with the display of guards in uniforms marching in front of the palace gates There is also a tent across the gate which lends traditional Korean clothes to visitors Photos can be taken with the guards after the ceremony
592,3.0,A beautiful place to sit back and relax but if you are after Temples and dont have much time in seoul I would not suggest this to be the best out of the lot  Its a nice place to have a cold drink and read a book this temple is included in the 5 palaces in one ticket
593,2.0,This is the only attraction that had an admission feebut there was little seemost of the buildings had been demolishedand those that remained had nothing in themthere was an art gallery which I was in and out of in 5 minutespoor reward for a long walk on a hot day
594,3.0,I went here at night so I missed all the guided tour Comparing this palace to the other it is relative small If you are only going to one palace I recommended you to go to the others first
595,3.0,You will find almost nothing but empty palaces The pattern is nice but its can be seen in other places in Korea Ticket is cheap just 1000 KRW but really that cheap is not worth
596,3.0,This is a very small property since much of the original Palace land has been sold off for development The buildings that still exist are nice and there is an english brochure available for 500 won Admission is only 1000 won for adults The whole thing can be seen in under an hour Inside the walls it is very peaceful you can bring a lunch and enjoy a nice meal on one of the benches
597,5.0,Following our visit to Gyeongbokgung and Changdeokgung we had some time to visit Deoksugung The history of this palace is covered extensively elsewhere and all the practical information required is in the excellent KTO page httpenglishvisitkoreaorkrenuSISI_EN_3_1_1_1jspcid264316  We bought an Integrated Ticket of Palaces which covers Changdeokgung Changgyeonggung Deoksugung Gyeongbokgung and Jongmyo Shrine This was excellent value at 10000 won  After the history lessons at the first two much larger palaces we did not join a tour as the palace is small enough to wander around independently with notes from your guidebook It is situated in delightful gardens with many seats dotted around so you can bring a picnic or rest your weary feet if you have been shopping too much in the nearby area  There is also a Changing of the Guards ceremony at this palace and the National Museum of Contemporary Art is in the same compound  Although this palace is not as big as Gyeongbokgung and Changdeokgung I gave it a five star rating because of its convenient location right in the centre of a shopping area which means you can just pop in for a quick visit and get some history and culture along with some art as well
598,4.0,Small in size compared to the big and famous gyeongbokgung palace Situated right next to the city hall metro station Very convenient to reach Had the modern art exhibition when I visited But the guard changing ceremony is not to be missed In fact can be better appreciated here as crowd is less If you reach early can take photographs with the royal guards Very friendly But the palace complex itself is small in size and some parts are under renovation hence closed But can spend few hours here
599,5.0,Must visit place To get a feel for culture Just oposite to City Hall Entry 1000won If you lucky you will see parade too
600,4.0,Would highly recommend the changing of the guard ceremony in front of the entrance particularly if you have kids Guards and soldiers are dressed in full traditional costumes and regalia with traditional music playing the background  In the middle of the ceremony the audience is invited to take pictures with the soldiers  I saw tourists in traditional costumes  I think there is a tent near the front providing costumes to add to the experience  The palace grounds are well presented we had the extra bonus if cherry blossoms with the palace buildings here and there along the grounds We found an hour was sufficient to walk around
601,5.0,Situated in the center of the city right at the subway exit Not a very big one which makes it a good choice when you dont have much time but still want to do some sightseeing Entrance is only 1 but theres additional charge for entering the museum located inside Pretty crowded among netizens during lunch time Make sure to check the schedule of changing guards ceremony outside the main gate
