,STAR,CONTENT
214,5.0,"I have noticed that the food court at Lotte department store in Myeongdong has had a few mentions here. Well, you do have to experience it to know why. Almost the entire basement of this high class department store has been dedicated to food. There is a grocery section, stall after stall of kimchi sellers, a branch of Fauchon from Paris, and then there is the hot food section. Heaven...! For those of you, including, myself, who salivates over street food but can't quite work up the guts to indulge, the Lotte food court will satisfy your cravings. Our favourite were the deep fried fish cake sausages (I am sure the Korean name for these are much more romantic...), with variations including a sesame leaf or seaweed wrap. These were simply delicious. Table real estate is scarce for the number of people wanting to eat, but we always ended up with a table, and we aren't very aggressive about this. There are also non-street food options, such as sushi, fish, noodle, and rice bars. You will eventually want to explore other food options, but if you are in the area this is a definite must see (and eat!!!)."
215,4.0,"This is your regular department store with all the American brands. What we liked most was the Food Court. A must go for at least one meal. You can buy your food from anyone of the take out shops and eat in their lounge. That means, if you are traveling with people that have different tastes, everyone will be happy. During the weekday, we found they open at 10:00 a.m., the I went on a Saturday and they didn't open until 10:30 a.m. You can take the Line 2 Blue to Euljiro1, exit 8."
216,5.0,"I like to visit food courts,all over the world in department stores.I think that they offer great opportunities to discover food cultures.Lotte Food departmant was amazing.We took tasty foods from food section.There was a comfortable sitting area inside.I mostly like baked korean sweet patatoes.It is worth a visit for a lunch."
217,2.0,"I purchased a purse from the lotte duty free store had to wait till I got to the airport to pick up my purchase. Let's just say the boxed item they showed me at the store, the purse was in great form! The tissue was wrapped around the zipper pull, the protective bag was in the box. By the time I picked up the purchase at the airport, it was not the same exact purse the lady showed me. I remember details. The protective bag was missing and the purse didn't look as new as the one I was presented with at the store. So somewhere between the time I purchased the purse someone swapped out my purchase and taken out the simple protective bag? I will never buy from them again as I do think trust them. I emailed the specialty stores to make my complaint. A purse is not complete with missing parts!"
218,4.0,"Big and multileveled shopping mall with top designer brands such as rolex, louis vutton, prada and many more.  Be sure to grab a map when entering as this complex is not only big but also crowded with mainly china tourist.  Staff customer service is sometimes bad depending who serves you as well as how busy they are. Most of the staff can communicate in mandarins. Their English however is weak.  Do bring passport for prove entitlement of duty free. Platinum visa card holders are automatically given 15% discount on certain item."
219,3.0,good place to buy cosmetics or skincare without going onto the streets of myeongdong and escape the cold...but there are limited products that you can buy from each brand so i would still recommend you to take a stroll down myeongdong streets (Opposite Lotte young plaza)
220,4.0,"Anything you want, from the budget items to the highest level (they even had a section of Gucci for Kids), with a large variety of everything...  It was especially crowded on the sale floor, so best avoid that unless you really want something from there.  Good variety of gadgets and sunglasses despite this being a non-speciality store."
221,5.0,"This is a luxury department store in the center of Seoul downtown, but what we found to be most impressive and very special is the food court in the basement of the department store. You do not want to miss this experience! It was one of our best dining experiences in Seoul."
222,4.0,"sometimes, i prefer to go out to myeongdong and see the stuff they have to offer. I bought Sulwhasoo, moisturizer, that is only available in the big malls. My korean friend recommended it and i found very good reviews online."
223,4.0,"As it was just opposite our hotel, we were very lucky. We were delighted as there were many levels of international and korean designers. We find the korean design very nice.  As they were selling Winter wear rather than summer outfit, we do not find them suitable for our weather.  We chance upon a Oilily Store which was our favorite a sit is the most colourful store. It si on the third level if I recall. or you could check out at teh information. We bought 2 bags. there were clothings, bags, etc. Certain items were 30% to 40% off so it was a great buy.  We wish we had more time so we can shop more here.  Prices for some items like international brands may be steeper. As wejust ahd our Singapore Sale, we find the prices better in Singapore.  Also, better to get brands that we cannot find in Singapore.  We love this department store."
224,2.0,Was there on my last day to buy some side dishes back to Singapore .Alot of small counter sell the same things but all price are written in korean.We askhow much is the side dishes and ALL the aunties point to the most expensive price tag stated above the food .They let you try them but if you do not buy from them they will scold you in korean.You can even bargain for the price you wanted and those aunties claim they are giving you a discount. I will nver go there again...feel that I have been rip-off.
225,5.0,"Lotte dept store, lotte young store, and the surrounding neighborhood felt like Seoul does Tokyo. Best place for shopping in the city, and great people watching at night time."
226,2.0,"We were quite surprised with the range of goods on offer, everything is overpriced, and it was overcrowded not a nice shopping experience at all. It was a nice looking department store, but if you have the opportunity to shop elsewhere on holidays like Europe, UK, Australia, then wait till then for better shopping choices and prices."
227,4.0,"Lotte is a household name in Korea, like Hyundai and Samsung, etc. This is a huge departmental store with nearly everything under the sun, intergrated cinema, entertainment centre, restaurants, etc.  Good: Clean and modern. If you love malls then this is for you. Convenient to get to, directly underground connection to subway. All the major brands can be found here. Translators (for English/Mandarin/Jap) may be found on each floor (they wear a sash stating their language ability).  Hmmm: Many staff do not speak English (hence the translators). There are a few other interesting themed malls nearby. Or cross the road to the main Myeongdong shopping streets (I prefer these!)."
228,4.0,"The basement food hall is reminiscent of the ones found in Japanese department stores. Amazing variety, beautifully displayed. And there's a food court with great affordable food."
229,5.0,"My husband and I always like to see how does the departmental store in other countries. Not much different from Malaysia, lively supermarket during the weekend, and the best part is, you MUST get the Korean instant noodles to bring back as some of the brands were not found in Malaysia. ;)"
