,STAR,CONTENT
392,3.0,"The Myeongdong Cathedral is an active Roman Catholic church and seat of the Archbisop of Seoul. The cathedral as between 1892-1898 and is dedicated to Our Lady of the Immaculate Conception.  Interestingly, Myeongdong Cathedral is the first church built of bricks in Korea. It is a rare example of Gothic style architecture in Asia. Here you'll find expected narrow nave with high vaulted ceiling and window seals. The interior features attractive stained glass windows, paintings on both sides of the nave near the front of the church as well as images of the disciplines behind the altar.  The exterior of the building is a subtle design of various brick material, providing a simple and humble appearance, different to more ornate cathedrals you may have visited in Europe. There are religious sculpture figures in front of the church that you might want to see as well.  In the end, Myeongdong Cathedral is a good attraction to see in Seoul. It is out of place in the busy, lively Myeongdong district but makes for a good break from the lights, shops and dining of this area neighbourhood.  Note: Myeongdong Cathedral is open daily for visitations, you can also find the mass schedule available online."
393,4.0,"This is a catholic cathedral and it was a important symbol of Korean people fighting against the Dictatorship and in favor of Democracy in the 1970s, and 1980s. It is situated at the hearth of Myeong-dong. It is a place where you can find a serenity and to have some time for meditation."
394,4.0,"This cathedral, also known as The Cathedral Church of the Virgin Mary of the Immaculate Conception (1898) clearly represents the Catholicism of South Korea. Styled in Gothic Revival Architecture, its red and gray brick facade is actually atypical of its kind but more like a fusion with Korean style facade finish. The structure itself is quite outstanding (but not imposing) being built on a much higher ground than the rest of its adjoining structures. The grounds are well maintained and kept spotlessly ""immaculate"" despite the throngs of tourists that flock the area. The interior is equally magnificent with its high vaulted ceilings, pointed arches and stained glass windows. I missed attending the English mass but heard the Korean version just the same. It was quite solemn and very organized. I got to roam around the grounds afterwards and was impressed by how they incorporated the nearby structures to the style of the cathedral so everything blended together very well. The street where this is located comes alive especially during weekends so one can visit the shops and try the various street food that ply the alleyways. This is a great post-mass activity. Truly a great experience."
395,5.0,Found this to be the perfect place for some serenity after some mad shopping. It has beautiful grounds that lend itself to some quiet meditation. The church itself is beautiful and is an excellent place for prayer.
396,3.0,"The cathedral is very beautiful and is doesn't feel any Asian at all! I went in to the cathedral with a friend, because we wanted to see the inside of the building. It was very interesting and nice to see it and the people was very friendly. We sat down and watched some of the service. We also saw some nuns outside and inside the cathedral. The cathedral is located very close to the big shopping streets, and there's also a lot of restaurants in the area."
397,5.0,"peaceful and quiet. if you find yourself caught up with the busy streets in myeong dong, this is the perfect place for you to relax and pray for the opportunity having travelled seoul. :)"
398,1.0,"If you have been to Europe , then don't bother there is really nothing much to see. Just very peaceful and the area is small.  Not much write up as well."
399,4.0,Nice place to visit. Clam. You can get inside without entrance fee. Please keep quiet because it has Christians come here to pray.
400,4.0,"It feels good to come into this beautiful church to experience a bit of ""mindful relaxation"". It is like an oasis. The crypt contains the relics of nine Korean Church martyrs bringing the memories of times when Christianity was severely persecuted in Korea. Pope Francis said a mass here last year. Twenty years prior Pope John Paul II reaffirmed the Blessed Virgin as the patroness of the Cathedral and the Republic of Korea. A very special place to say a prayer."
401,4.0,The church was built in 1898 . The exterior was magnificent and the surrounding compound is huge and very clean. The interior stained glass windows is very beautiful and in the church is so solemnly silent peaceful.
402,1.0,The architecture is pretty average looking. There is nothing much here as well. You may like to pass-by but don't need to spend too much time here.
403,4.0,The outside of the cathedral does not adequately prepare you for the inside. If you are in Myeongdong then you should stop in for a visit.
404,4.0,"although it's quite too far from the subway or i just got confused by the direction in the map, probably one of the highlights of my short stint in Seoul when i attended a mass on a beautiful Sunday, it's a Korean mass, but it doesn't matter. it's a great place for worship, i am amazed on how they practice their worship, they are all quiet and focused"
405,2.0,This church is situated in Myeongdong with plenty of steps leading up to the church. It contrasts with most churches you would see in Korea.
406,5.0,"Grand view of the cathedral and it sounding of the modern building. Quiet and well kept building make you feel the sincerity of the worshiper. Don't miss this when in Myeongdong, both morning and night view is beautiful."
407,3.0,Located in Down Town and as it has many tourist attractions near by so if you visiting any of those you won’t miss the Cathedral. Hanok village the most popular is one of the nearby spot. Good for visiting!
408,5.0,We attended sunday mass service at Myeongdong Cathderal. The church is situated in busy Myeongdong shopping district yet the mass was very solemn. The doors of church were kept close so you have to check inside to see if there is on going mass. We are lucky enough to attend mass in English.  The church is very beautiful.
409,5.0,"Very interesting tour. Located near great shopping area of Myeong-dong. A Korean friend took us for a visit, sharing her memories of her wedding that was held here many years ago. As luck would have it when we visited a wedding was just finishing and we were able to see the bride and groom in hanbok and traditional attire. Cathedral is very beautiful."
410,5.0,"Didn't get a chance to go inside, there was a funeral going on. It is a nice walk from our hotel - a must stop for any visiting Catholic."
411,5.0,"Myeong-dong Cathedral offers peace and tranquillity among the noise and buzz of Myeong-dong hyper-shopping district. There are 10 masses on sunday, with only the 9am mass in English."
412,4.0,A quite place sitting down to admire the place which is very lovely. At the far end of Myeongdong shopping mall.
413,4.0,"One place I feel every catholic in Seoul should visit. This cathedral is located at the upper end of the myeong-dong shopping area. The staircase leading to the cathedral itself is beautiful, and one should take time climbing up to the cathedral. The cathedral is especially beautiful at night with many people, both locals and tourists."
414,3.0,"Though the cathedral itself is very samey and nothing too special compared to other cathedrals, the steeple is lit up nicely yet forebodingly at night, and the location next to the shopping district of Myeongdong and an underground area - which itself includes a pretty nice coffee place - is good. It was interesting to open up one of the books and read some of the song verses in Korean, though."
415,5.0,"We actually forgot to visit the cathedral until the last day at night, but even at night this place was open. The building itself is beautiful but it is peaceful inside. If you are Christian, I highly suggest you visit."
416,4.0,Pleasant location and a nice cathedral. Not as flash as some of the European ones but still a nice visit. The grotto has a Virgin Mary and the ability to light a candle also.
417,4.0,"For full disclosure, I didn't actually enter the building but remained outside. The cathedral itself is very nice, of course not to the scale of Notre Dame de Paris or similar European Cathedrals. What's great about the Cathedral is where it is located. In front of it, a rencently built splanade, with a nice walk up to the cathedral, lightning and vegetation, allows for a better view of the Cathedral. And once you've reached the Cathedral, turn back and look up North to see a sea of modern buildings that contrast with the Cathedral. And look West to see the neon lights of the Myeongdong Shopping district."
418,4.0,a nice and quiet place to pray for the catholic although located very near to the myeong dong shopping area.
419,4.0,"Beautiful cathedral. If you head underground at the entrance to the grounds, there is a bit of a coffee shop/restaurant complex. Coming up onto the main grounds of the cathedral you can see the building and the other smaller buildings of the grounds. We didn't get a chance to go in as mass was being held when we visited but it is a great place to photograph and pamphlets in various languages provide some history and insight into this landmark."
420,4.0,"It is located in one of the busiest shopping areas of Seoul. It could easily be missed. Although it is located in a busy area, it is somewhat secluded as the street in front it is not the same busy shopping street. It's a lot calmer than the area within the shopping district. It's on the hill and climbing up the stairs is not hard work at all as it was that far and high. I find it rather beautiful. If you like architecture travelling I think it is one to be in the list."
421,5.0,"Myeong-dong is easily my most favorite spot in Seoul, and Myeong-dong Cathedral is the cherry on top of my cake.  Personally, it came out as a sight to behold on the outside and a beautiful serene place on the inside. The mass celebration was straightforward and people were very disciplined and respectful.  I'm really glad I came across this Cathedral. It was a wonderful surprise at the end of a stroll around Myeong-dong. :)"
422,2.0,"The cathedral didn't do much for us, it was just another palatial building constructed for the religious. Unfortunately this one doesn't have the jam of most European structures."
423,5.0,"One of the most beautiful cathedrals I have seen. Visiting this cathedral located at the heart of the busy Myeong-dong is a nice experience, especially if you want to relax and unwind for a bit after shopping at Myeong-dong"
424,3.0,Busy shopping and need a pit stop? this cathedral is located just beside the Myeong-dong shopping with the castle style buildings in the horizon. Worth the stop for a nice photo shot!
425,5.0,"It's right outside Myeongdong shopping district, or taxis its 8 mins / 3000 won ride. Nice inside structure."
426,5.0,"After my first visiting to Seoul in 2004, it was my first time to step in the Cathedral area. The area was stunning with peaceful and worship by all faithfully Christian. Surrounding by fashion and business, you can find the peace in your life and make it slow as much as you want."
427,5.0,"visiting here at 4 PM, and there are really crowded. I realize that the church just in the middle of Myongdong shopping area. the buildings was amazing and it must visit place. if you're Catholic, you can pray at St Mary or inside the church. I buy some braclete from wood at the shop, and many things to buy for a gift."
428,5.0,"The brief history notes it was built on top of the hill so it was easily seen 100 years ago. Now it's more blocked by buildings, but our guidebook and human visitor guides posted at the street entrance of the nearby shopping district point the way easily. Great gothic architecture and appears well-maintained. So many nuns walking all about as well! There are at least two bookstores nearby. If you go in the summertime walk down the uneven steps through the garden and see the butterflies. Very peaceful place to visit."
429,4.0,"We visited at night and the church looks stunning. Built with bricks and high walls, the lights at night made it more spectacular. It was quiet and peaceful and it was a nice place to sit and simply stare at its beauty."
430,4.0,"I can't even begin the describe the beauty of this cathedral. Not too far away from Dr. Fish Cafe (where we got our fish pedicure), even if you aren't religious you'll appreciate seeing other culture embrace different religions."
431,4.0,"It was a challenge to find because the people we asked were not exactly church-going ones. Of course we understood - South Korea is not a Catholic country making catholic churches a challenge to find.  So it was super awesome when we finally found it! A score or so steps up a small hill was this Gothic church that reminded me so much of others just like it in Italy (the Duomo readily came to mind).  Being a Sunday, the church was almost full so we decided to head outside first and wait for the mass to finish - we didn't want to disturb worshippers as we took photos. Good idea because at the back of the church there was a garden and a huge statue of the Virgin Mary (of Lourdes). We prayed as we lighted multi-colored candles (available for around 100 won). It was nice to take photos of the church structure and the grounds that we almost forgot we still had to go back inside the church.  Once inside, we marvelled at the vaulted ceilings and rose windows that reminded me of ""Pillars of the Earth"" book of Echart Tolle - building a cathedral takes so much time and effort that I was mighty glad there were men and women in the middle ages (especially) who had so much passion and perseverance to surmount adversity (and drama) to make them a reality for future generations to marvel at.  Unlike most churches, the cathedral closes its doors at around 7 in the evening (I think). So we had to hurry to the souvenir shop - there we stayed for a lot longer than we planned because there were just too many interesting stuff to buy.  We headed back to our hotel with a happy experience (and bags of purchases). But first, we needed to find a resto serving fried rice dishes (we missed eating fried rice so much we were ready to walk until midnight trying to find one!). Fortunately, there was one rice resto right in front of the cathedral! Praying definitely helped!"
432,4.0,English mass was at 9 to 10 am . We were late so we attended the 10 am korean mass. They give out palms outside the church. In my country we have to pay for the palm. Some women wear veils and hanbok dress. In my country you rarely see women wearing veils. I admire the koreans with regards to their discipline during the offertory and the communion rites. To get to the cathedral get off myeongdong subway station exit 8 turn left at the first street just a few meters from the exit. You will pass by 2 narrow street.Along the way are lots of skin and cosmetic shops. The third and widest street turn right was where the cathedral was located.
433,3.0,I was accidentally passed by this church. I saw a lot of people went in during the evening. It's really beautiful especially with the light of the dawn on top of the church. From what korean friend told me is they are not happy with the tourists trying to take a picture inside while they are chanting. So privacy check first before you take any pictures and BTW Sunday is really crowded you should avoid that.
434,4.0,"I was there on a Sunday and it was packed to the limit, but I still got a good look inside and was there for 20 min, not so easy to find it's and the end of the Myeong-dong shopping street, but a very beautiful cathedral."
435,5.0,The cathedral grounds is lovely. Inside is beautiful with arched high ceilings. Don't forget to go behind the church & donate W1000 into a metal box & light a candle.
436,5.0,The cathedral itself located opposite on Myeongdong 11 gil (You can take right turn from Myeongdong 10 gil also if you come from station). The church itself in Gothic style; Tall high rooftop and ceiling; coloful stainglass windows; quiet echo hall with bible book provided for christian believer to visit.
437,5.0,"I stayed at a hotel a block away and I was fortunate to attend mass here. It's a majestic, awe inspiring church - the way a church should be. There is also a gift shop where you can purchase reasonably priced souvenirs. (As a side note, don't buy souvenirs at the airport as they are expensive. The airport charges 15 dollars for fan. At the church, they charge 7)"
438,5.0,"Attended Mass at 11am on Sunday during our visit. The Cathedral was full and more to our surprise, by mid-day as we were leaving it was full for the following service. We were told the other services held on Sunday were usually all full. Even more amazing was that each service was supported by its own choir and music unlike England where usually only one service has music of the standard we experienced in Seoul. The Cathedral itself is Gothic in style but built in brick which is interesting. The stained glass is well worth looking at during your visit. There are two ways to approach the building, You can walk around the road and walk up the steps. However if you find that a bit daunting, you can take the lift which is approached from round the side. This brings you out directly in front of the Cathedral entrance. We came this way having spotted a couple of nuns leaving the subway station and guessed they would know the way. As it was, since it was Sunday, we only had to follow them! (If you wish to attend Mass in English you need to be there at 9am)"
439,4.0,"Located on slope. Would considered in convenient place. Shops, shopping all near-by. Vast compound in the cathedral - several buildings. Love the sweet grotto. Attended the Sunday mass."
440,5.0,"It's a very majestic building with very high ceiling and tall stained glass windows of gothic architecture. The Cathedral stands on a hill and there're a few flights of steps to reach it at the top. We went there thrice; to attend a Korean Mass which was full to overflowing (so impressive); an English Christmas Mass at 0900 (which was not too crowded) and another Korean Mass on a Saturday evening (7 pm) with hymns sung in Latin. These Latin hymns were sung so beautifully that we were transported into heaven. Never have we heard such delightful singing before. (The toilet is located on the right side when you reach the top. There're signs to lead you. Myeongdong Cathedral is right in the midst of shops, easily to do shopping before or after attending Mass.)"
441,4.0,"Nice place to take a look with a gothic style. Oldest Cathedral. Most of the mass timings are in korean. If you would like to go for the english mass, please approach someone for the timing (e.g Korean tourism board). It is normally on Sundays 9am.  Went there for the Christmas mass and enjoyed it :D  Please do not miss the grotto just behind the main church building."
442,5.0,"Amazing that it hides from busy world - Myeongdong. My family went there on Sunday, weather was wonderful though it was around zero degree. It was realised that a lot of TV shooting teams were there to have Christmas programs!"
443,4.0,"You will be happy to took time to explore this wonderful cathedral. We arrived while services were already taking place, but it was breathtakingly beautiful both day and night."
444,5.0,"This was the recommendation of Sophia, a new Catholic woman who converted when she was 36. She works for tourism industry and I asked her what to do in 12 hours around Seoul. She gave me really good advice and in the middle of all she mentioned this Cathedral. I took my travel partners here first as this was the main place I wanted to visit. We arrived after night Mass, but the organ pipe player was still there. Practicing or just enjoying such fine sound, we were delighted to hear good music while we were visiting. We had a small anecdote here when he"
445,5.0,"It was a peaceful, spiritually-filled visit. The quiet snow outside added to the enchanting feel of the place."
446,4.0,"We arrived at Myeongdong station and decided to take Exit 9 (which was indicated as the exit to the Cathedral). It was a big mistake because the route will bring you pass exit 10, up a slope along the main road and down before turning left to the shopping street then you'll notice the Cathedral. The easier way would be to take Exit 8 then walk through the shopping street.  The Cathedral is beautiful and a nice contrast to the surroundings. There was a wedding ceremony during our visit so we didn't explore the interior much."
447,4.0,"This is a nice cathedral. Perhaps it can not hold a candle to some of the great cathedrals in Europe, but when you take into account the stark contrast of the ultra dense population of Seoul, the modern buildings of an Asian metropolis, and the fact that Korea (even till this day) is not heavily Christian, the beauty and majestic nature of this structure really hits you. Additionally it is a little green space in the middle of the city!"
448,5.0,"It's a beautiful Gothic Catholic cathedral in the city center located in an elevated portion, hence, there are several flights of stairs going up.Beautiful large flower pots line up the center of the stairs. It's also beautifully illuminated at night.Going down towards the left is already the Myeongdong shopping street."
449,4.0,"Right in the middle of Myeongdong area, this Cathedral and its adjacent convent dates back to the 19th century, and has coffee shops, souvenir stores just underneath the Cathedral. Inside the Cathedral the atmosphere is serene, and it is an easy sight to take it before you do shopping or have a meal in the area, which is in the centre of Seoul. It is not far from Insadong, just a few minutes taxi ride away, another nice area with characteristic shops and restaurants."
450,4.0,Place was small but still you could really feel calm and peaceful just going inside the premises. The glass panels were very elaborate and beautiful. Went there on a monday afternoon though so their was no mass during that time. We said our prayers and admired the serenity of the place.
451,5.0,The church looks awesome from the outside and even better from in inside. 9am Sunday mass in English is great.
452,4.0,It's a gorgeous church build in the late 1800. The church is well-maintained with passional congregation. This location should be in the list for a Catholic as you'll want to experience the Sunday mass.
453,4.0,If you want a break from the Myeongdong shopping madness this is the place to go. It's a bit touristy but if you go inside everyone is quiet and respectful. Very easily reached from Myeongdong and it's a great site to see. It's small but has an interesting history and I thought the architecture was very pleasing. Definitely worth it just for the moment of peace and quiet.
454,5.0,"I'm pretty impressed by the location of this church. it's surrounded with tons of shops and located on famous shopping area. I joined the Sunday Mass at 9 A.M, it's conducted with English language. it's very fast mass which was only 45 minutes. join the mass if you're Catholic. this church is very beautiful inside and outside, famous with their gothic architecture. the oldest Catholic church in Seoul. The church is open for public but please keep your voice so that it won't be disturb."
455,5.0,It' a beautiful church in the middle of the ultra modern Myeongdong area of Seoul. You can go inside and sit and soak in the tradition even if mass is not going on. Be quiet and respectful as it is a house of worship. Not too many people inside so it's a nice respite and quiet spot to think and pray if you wish.
456,4.0,"This is a beautifully serene church with its architecture so well intact. It is the oldest Catholic cathedral in Seoul and if you visit on a Sunday, there is a mass conducted in English. It is located in the centre of Myeongdong and conveniently accessible via the train. The compound surrounding the church is also well-kept and houses quite a few beautifully preserved buildings. Attending the service in such a beautiful building was touching experience."
457,3.0,It's the cathedral in Seoul so have a quick look while you're in Myeongdong. We went there on a Sunday so it was interesting to see how a mass is conducted in Seoul.
458,4.0,"When you come myeongdong, don't miss the night view at the Cathedral. Just go take a look you will see the beautiful sight. Since at myeongdong, why not take a look.  Downside: Outside the Cathedral is under construction."
459,5.0,as a Catholic I like to be able to include church visits on my trip. it gives me an opportunity to get to know the place based on the religious aspect.  The cathedral is on top of a small hill so there is a short walk. during our visit there was some construction outside for the expansion i think of some area in the church. so the facade was not so visible. it was very quiet inside the church and gives the opportunity to commune with God and reflect. its very close to the shopping district so its a very easy to incorporate with your other itineraries for the day.
460,5.0,"When we first got to Seoul, the first one on my list was to visit this Cathedral. When we went there there were a lot of construction going on so it was easy to locate. A wedding was taking place and the Cathedral was truly a romantic spot. The first thing we did before going around Seoul was to pray here and our trip was indeed so blessed and so memorable!"
