,STAR,CONTENT
0,5.0,GOOD
1,5.0,A beautiful cathedral that conveys the history of Christianity in Korea
2,3.0,Nothing that will blow your mind but it is interesting to see a European style church in the middle of modern Seoul They kind of trap you at the top courtyard and its hard to find the way out however
3,5.0,The recorded Christian music is a bit strange and the church loses authenticity as a result Apart from that its not a mustsee place for Europeans
4,3.0,There is a very big church in the center of Myeongdong There are quite a lot of sites and it seems that there are various facilities It was said that only believers should enter the shrine disappointing
5,5.0,Beautiful church and experience Be respectful and quiet when visiting as people are praying Go to TajIndian restaurant across the street for a meal after
6,5.0,We heard anticipated Sunday Mass at 6pm Saturday evening The mass was solemn But most importantly the choir sang beautifully during the mass Everyone was required to wear face masks while inside the church
7,5.0,Stunning cathedral
8,5.0,The church looks very beautiful and splendid
9,5.0,Truly devoted parishioners and pilgrims They seem like they live their faith to the scriptures Parishioners and some visitors seem they go with faith and hope and when they come from the church they look like transformed in a very positive way They seem faithfully committed The place is simple but it makes it majestical Bus and train accessible Lots of stairs for the one who come by the front  Wheelchair accessible by the side of church  Small Chapelle on the basement The best part is that Jesus Christ is present if you listen carefully with your heart   Point yourself towards the Altar English language Mass on Sundays Nuns and priests are welcoming Confession in English available every day
10,5.0,Largest cathedral in Korea
11,5.0,Holy danctuary
12,4.0,The time of the opening of the Grote Kerk is not well indicated unfortunately We have now been to small chapel Out of respect for the others no pictures were taken
13,5.0,Peaceful and quiet place in a busy city Beautiful cathedral and surroundings Recommended to visit
14,4.0,MyeongDong Cathedral is a real haven of peace in the heart of Seoul a bustling city par excellence And the presbytery will give the impression of being in the middle of Europe and not in Seoul An architecture that clashes but that soothes
15,5.0,Gorgeous
16,5.0,Beautiful place to 
17,5.0,English mass service at 9 am
18,5.0,You can find information about Mass times on the website There is one English mass on Sundays 900 am This Cathedral is so beautiful inside
19,5.0,Wonderful
20,5.0,Very welcoming and the locals make you feel at home
21,5.0,Beautiful Cathedral
22,5.0,Religious and historical place
23,5.0,Worth seeing Our Pope JP2 was also here
24,5.0,the most famous cathedral in Korea Located at the center of the Seoul city so you can easily get to the place
25,5.0,Lovely place with a lot of history Their holiday events are well worth the trip to see
26,5.0,It doesnt feel the same during the day and night and the church building is beautiful Every piece of glass is a work of art If you come here it is recommended to take a walk around the church But there are just too many people
27,5.0,Its a beautiful cathedral If you come to Myeongdong you should come there at least once Although its religious establishment it is a historic place that contains the modern and contemporary history of Korea
28,5.0,It was cold but the visit was worth it
29,5.0,A beautiful place of historical and spiritual significance in Korea By far my favorite church in the whole country The staff were very welcoming and friendly The Christmas decor was breathtaking I will visit whenever I can
30,5.0,Nice church suitable to visit at night to take pictures in front of the church with the lights on Its also strategically located in the middle of Myeongdong easy to find
31,5.0,One of the best place to feel christmas   seasons
32,5.0,There is a large number of Catholic Community in Korea And the center for its congregation is the Myeongdong Cathedral Inside is a glass tinted The Church was built in honor of Our Lady of Immaculate Conception Very Solemn inside if you want to say a prayer
33,5.0,ok
34,4.0,It is a very beautiful church
35,5.0,Amen
36,5.0,nice place
37,5.0,Place to visit in Myoungdong
38,5.0,Any body know this place
39,5.0,Its always nice to visit local churches when abroad This cathedral is in Myeongdong so make sure to visit it as well They also hold English masses during a certain daytime Read more on my blog at sophiaorlanesblogwordpresscom  Went here in December 2019
40,5.0,Peaceful
41,5.0,Small quiet but different atmosphere in the center of Seoul
42,3.0,Average cathedral
43,5.0,Sanctuary of my heart
44,3.0,Ive been there many times but Ive never been inside
45,5.0,GBU
46,5.0,Organ plays at Catholic services
47,3.0,Its a nice cathedral and if you are Catholic then its a must see in Seoul  As cathedrals go its fairly new and doesnt compare to the cathedrals of Europe  Still a neat place with interesting history
48,5.0,Good
49,5.0,Very important historic place of Seoul Korea equality and democracy
50,5.0,In a word its a holy place
51,5.0,I am Italian and in fact the flamboyant neogothic structure is very reminiscent of the churches of Northern Italy with the beautiful polychrome stained glass windows and gothic statues It is to say the least mystical and welcoming Very nice are also the shops that sell souvenirs ointments and lotions and beauty creams  very advantageous prices and they are almost medicinal this is a very bewitching thing for an Italian like me find FUNCTIONAL cosmetics at an affordable price
52,5.0,The Cathedral Church of Virgin Mary of the immaculate Conception simply called The Myeongdong Cathedral Holds the cathedra of the Archbishop of Seoul and there are many related institutes near the church Dedicated to the Blessed Virgin Mary it has two statues of Virgin Mary The church is a holy site for Democratization  of South Korea
53,5.0,Good
54,5.0,The embodiment of the Catholic church in Korea
55,5.0,very nice and beautiful
56,5.0,Beautiful piece of history
57,5.0,Peaceful A great place to pray
58,5.0,Classy Cathedral at the center of Seoul
59,5.0,Beautiful cathedral in Seoul
60,5.0,peaceful Cathedral visited during Christmas there are so many lights decorated and music
61,5.0,Very beautiful the Cathedral
62,5.0,Peaceful place in Seoul
63,4.0,I go shopping during the day and night I feel more solemn during the day Pay attention to the time when you go at night Will pull the cordon so you can only shoot from a distance
64,5.0,Landmark of skorea catholic French style structure  under which historic sacrifice of people believe in freedom and democracy
65,4.0,Beautiful church
66,5.0,Best of South Korea
67,5.0,Beautiful calm sitting at the top of Myeongdong hill Love the brick patterns and the calm of the place
68,5.0,Somebody knows souvenir shop name of this cathedral or can I buy online ? I like some piece in there. Thx
69,4.0,The most beautiful cathedral in Seoul and a popular tourist spot. The choir sings beautifully at the daily masses.
70,5.0,"Myeongdong Cathedral or Cathedral Church of the Virgin Mary of the Immaculate Conception is one of the oldest catholic churches built in Seoul, South Korea. It was completed in the year 1898 and has a gothic design. The highest Roman Catholic prelate resides here. The church has high towers which was controversial during the construction.  It is located at a walking distance of Myeongdong metro & Euljiro 3 ga metro stations."
71,5.0,Here lies history from centuries to far more recent. It's a reverent retrieve from the hustle and bustle just outside.
72,4.0,The view was really pretty at night while we were there as the the church was lighted up and the surroundings were illuminated with a field of LED roses. The church is located beside the myeongdong shopping street so it is convenient to drop by and have a quick tour before or after shopping.
73,5.0,This was a must see of sights on our list. We attended mass in English and were also able to participate in reconciliation just before mass started. The alter servers were very friendly and everyone spoke English. They also have a store on the grounds and a museum. Definitely worth seeing even if you’re not Catholic.
74,5.0,I attended a friend's wedding at this awesome Church in the heart of MyeongDong a large tourist area with many stores and restaurants nearby
75,4.0,"Very nice church on the hill, it is simple and beautiful inside. It was a Sunday so a lot of people were inside praying. Unfortunately becuase of the coronavirus, there was no holy water but that is understandable. If you are into religious sites, definitely worth a visit."
76,5.0,We went there at sunset on a Friday afternoon. Church was open even though there was no service. A very solemn place to reflect and say some prayers. The surrounding grounds was also a great place to take pictures. Will visit again. Highly recommended especially for Catholics.
77,4.0,The cathedral was lighted up with exhibit and display during Christmas season.  And it’s all free. It is located in Central Myeongdong.
78,5.0,We went inside and there happened to be a wedding on. The cathedral is so beautiful and worth a visit.
79,5.0,A beautiful church perch up the hill. Conveniently located near the popular Myeongdong shopping area. Very peaceful. Well decorated during the Christmas season. A must go to see place when you are at Myeongdong
80,5.0,"This is another in my list of itineraries.  We got to the Cathedral almost night time. It was breath-taking to see the lights lit up. It was BEST to get there at night time. Inside the Cathedral was a mass on-going and it was in the Korean language. The only time there was an English mass is 9:00 in the morning on a Sunday.  The facade of the Cathedral is a pure Gothic style with no architectural adornments. The interior, however, shows aesthetic beauty with arched side aisles, stained glass, and other artworks.  The Grotto of Our Lady of Lourdes was beautiful with all the lights lit! So is the statue of Our Lady of the Immaculate Conception, which is located at the back of the Cathedral. Both were a lovely sight to see! I was overwhelmed!  The only place we did not get to see was The Crypt because it was already closed."
81,5.0,"Worth the trip to find this place, recommend to visit this place during evening. It's really beautiful"
82,4.0,"Finally got here on my 5th visit to Seoul, beautiful architecture within the cathedral and there was a couple taking wedding photos in winter!"
83,4.0,"We happened to pass by this particular cathedral when we were visiting the Myeong-dong area. Surprisingly, the structure is rather at odds with the modern contemporary buildings surrounding it. We discovered that this stately Roman Catholic cathedral was built in the Gothic style in 1892 and was the first structure of this nature in Korea. This church also holds the remains of the saints and martyrs who were sacrificed for their believes. The structure is a stately simplistic contemporary Gothic cathedral with stain glass windows around the main altar. It cannot be compared with older cathedrals in Europe. It is situated on an elevated area and there are two levels of stairs to climb to reach the church. In the evening it is most enchanting as it is lite up for evening services. At the base is a small sanctuary area with the statute of our Lady of Immaculate Conception. A very unique and dignify structure situated in modern Korea."
84,4.0,"We visited here in the evening so there weren't any services. The Cathedral was the first Roman Catholic Cathedral in Korea, was built of red brick and consecrated in 1898. At its construction, it was the largest building in Seoul. Very peaceful inside away from the busy streets, especially in the evening."
85,4.0,"Located in the middle of Myeong Dong bustling area, this Roman Catholic cathedral it’s a peaceful place but nothing extraordinary."
86,5.0,After the hustle and bustle of Mydeong shopping street is the red bricked solemn cathedral. The structure is very well preserved in midst of office buildings. A place of spiritual cleansing and Korean contemporary history with foreign countries. Very worth visiting.
87,4.0,Nice place to visit. The interior is very impressive. Was a bit different to attend Mass in another language. Also a nice surprise to meet someone here who was also from my country. Nice and close to Myeong-dong.
88,5.0,"I'm elated that the Cathedral was full when the mass started. People cannot go in the church once the mass has started. There were mostly old people and their responses during the mass were simultaneous and synchronized. Though the mass was in Korean, my head felt lighter after the one hour solemn celebration.  In terms of the Cathedral structure, one should see the gothic facade of the church if you're touring, shopping or trying street food around Myeongdong for the first time. It's located at the back end of the long street full of people from Myeongdong Station near the highway."
89,5.0,"Everytime I visit Seoul, I always dropby to say my prayers.  Its a gothic cathedral near the Myeong-dong Street. Also its beautiful during autumn as the trees and plants changes their colors."
90,4.0,While you visit this busy shopping area take a few minutes to check out this fine traditional church. Many Seoul churches inside are more like theatres but this is the real thing.
91,5.0,The Cathedral sits on top of a Long flight of steps. Whenever i’m In Seoul i’ll Attend service there.
92,3.0,"Because the mayority of korean people deos the hinduisum of muslims and very But very little the catholic, near the su way sistem"
93,5.0,Very nice and quiet place in the center of Seoul. We discovered it during a Hop-On-Hopp-Off bus tour in the city - which we recommend very much - as you will see all major attractions during the tour. The cathedral is different to European ones but very nice!
94,5.0,"So nice to walk in on a Sunday evening.. An interesting and attractive building, over 100 years old, very close to the hubub of the street markets and shopping area. An oasis of tranquility that is well worth a visit"
95,5.0,"love this cathedral. the facade is lovely and is clean. One thing is not easy to find the cathedral...you have to go through a parking lot and through a mall, then take a lift up to the cathedral."
96,5.0,it was an amazing old worship building. the other need church complex is very modern and well maintained. could get inside almost anytime. good place for taking picture for its european ambience. breathtaking places. likes to be there.and easy to find for its bell tower...
97,3.0,"This cathedral is huge in the middle of Myeong-dong. It is very quiet and peaceful. There is not much to see but if you are religious and want to say a prayer, please visit this place."
98,5.0,"This is the very first place we visited when we arrived in Seoul first thing in the morning. Just a walking distance from our hotel, first we got lost but we were able to find it going thru the Myeong-dong shopping streets, there you will see the monumental cathedral in the center of the city. It was a very solemn place of worship, stayed for a while and pray. Nice architectural design. It is worth visiting this place."
99,4.0,Myeongdong Cathedral is located in the heart of Myeongdong. It is very near the shopping street also.
100,3.0,"Nice little cathedral in Seoul - beautiful to look at, but otherwise not much to do. Free, but not worth much of a detour unless you're really into this sort of thing."
101,5.0,"It was a surprise after the bustle of Mendong shopping streets to go to the majestic Catholic Cathedral. Very beautiful building, well-groomed area. Calm and quiet. A good place."
102,5.0,The cathedral is beautiful during day but even more beatiful during night. Easy to find as it is located in the center of Myeongdong
103,5.0,Majestically located in the heart of Myeongdong. The ambiance is unbelievably serene. The picturesque landscape outside the cathedral made me took lots of selfies✌🏻. This is one of the best place to see when you are in Myeongdong area.
104,5.0,"The Myeongdong Cathedral is located in Seoul's Myeongdong shopping street. The grounds were abuzz with tourists and locals alike. Since it was Christmas month, the cathedral was beautifully decorated with lights and a gorgeous manger. Baby Jesus had yet to make an arrival since it wasn't the 25th yet. The inside was serenely beautiful and a good place to sit and contemplate. There is a shop with quite a selection of religious items are jewellery."
105,5.0,"This place is near Myeong-dong shopping streets. I love its beautiful architecture. I wish tourists who come to South Korea will find the time to glorify God, the Creator of all the things they see and admire in this country. This place is great for photo shoot but a sacred place as well. Everyone is encouraged to be respectful of the place especially when the mass is going on."
106,4.0,"I wandered into the compound of Myeong-dong Catholic Church as I moved out from the shopping alley, looking for my way back to the hotel. It was a Saturday afternoon, the church compound was quite busy with tourists looking for photo spots and some local families and worshippers.  As I entered the sanctuary I could sense a peace and calm expected of a place of worship.  The cathedral was completed in 1898, built in the Romanesque style, it was quite understated in my opinion compared to the European churches. It is also one of the monuments protected by the conservation law. At the time it was completed, Myeongdong Cathedral was the tallest structure in the neighbourhood and a prominent landmark in Seoul.  There is a English service on Sunday morning for non Korean speakers.  It was a relaxing moment for me as I took a stroll around the cathedral, reading about the history and people watch."
107,5.0,"It was a Sunday and our schedule for the day is the English mass at 9 o'clock in the morning and Breakfast. I was really very happy to find out that there was an English mass in South Korea in this beautiful cathedral. It was just walking distance from where we were staying and the best part is, below the cathedral is an area where you can eat."
108,5.0,This is the birthplace of the Catholic community in Korea and the National Cathedral of the Archdiocese of Seoul. Built in the late 1800's in a Gothic style but of bricks not stone. There is a small grotto off to the side before going up to the church itself and a great place to light a candle and pray for peace for the Korean Peninsula.
109,5.0,Made sure that I visited this church both times that I've been to Seoul. A very solemn place in the midst of the hustle and bustle of busy Myeongdong.
110,5.0,We were met by a Korean nun/doctor in our hotel and toured us the beautiful Myeondong Cathedral. It was a Friday and found the church service very solemn. Went back again Saturday to attend the 6:00 p.m. mass. A must to visit to Christian Catholics.
111,5.0,There's much history in this Cathedral. Lovely cathedral in the midst of a bustling shopping area in Myeongdong. Quiet sanctuary inside for everyone. The Gothic architectural design is great and the stained glass windows depict stories of the Bible and the Mysteries of the Rosary. . Enjoyed the compound and the surroundings.
112,4.0,"This cathedral stands in the busy shopping district downtown. The cathedral is beautfiul and solemn, but somehow its ambience is rather different (auditorily and olfactorily) from those old churches in Europe."
113,4.0,The church owns a great spacious area & it is very pleasant break away from the crazy shopping alleys. Very large & pleasant inside.
114,4.0,"extremely clean, calm and quaint on the inside. we went for the 9pm mass and it was beautiful (in korean though)"
115,3.0,"To stroll through the Myeongdong Shopping Street, climb a short hill to find this cathedral is very special. An oasis of calm in the midst of the hustle and bustle of commerce."
116,5.0,"My wife and I are on a month long visit to South Korea. We planed to visit the Cathedral for Easter Mass. Great place to visit, easy to find and lots to see. There are Masses in English, German, French and I believe in Spanish too. You really don’t need to dress up for the visit (The Koreans don’t). We went to a Korean Language mass and I had no problems in following it along. You won’t feel out of place if you are not catholic, everyone is always welcome. It is worth a 1/2 hour visit anytime I am in Seoul."
117,4.0,"Just a few minute walk from our hotel , we went there for a short prayer. We can't catch the English language mass on a Sunday since we are on a tour group which departs at 8:30 in the morning , yet we arrived late at night as well . Beautiful infrastructure , it can be used for photo taking , and it looks different at night , with the striking lights adorning the church."
118,4.0,"This is a lovely cathedral, landmark for us when navigating Myeongdong market (its easy to get disoriented)"
119,5.0,"The Cathedral of the Good Shepherd in Singapore has an important connection to Myeong-dong Cathedral in Seoul, so it was our calling to finally visit this. There is so much history in this Church, and offers a quiet sanctuary inside for anyone regardless of religions to enter. There is Korean Mass daily but also offers an English Mass every Sunday at 9am. Do also check out the Catholic gift shop inside which offers many items at reasonable prices."
120,5.0,"For those who wish to pray and attend Roman Catholic ceremonies, this is the place to go. There is also a shop for those who just want souvenirs. The surrounding area is photograph worthy."
121,5.0,I was surprised to find a Catholic Cathedral in the centre of Seoul . Towering . I really appreciated silence inside : you can stop and make a prayer in absolute silence that is really appreciable .
122,5.0,"We last visited the Cathedral four years ago, in a warm summer when the streets around it, famed for their proliferation of cosmetic stores, were full to bursting and the people even seemed to have spilled over into the grounds of the cathedral.  This time, in February, everything was much quieter; more serene and more fitting with the feeling of the building itself.  Reading in the information leaflet - available from a stand outside the cathedral and also inside, and in a number of languages - when built, the cathedral stood high above the city and could be seen for miles. These days of course, modern skyscrapers have rather dwarfed it, but you still get a sense that it is imposing and confident. The church also has a considerable 'campus' around it, of medical centre, hostels etc, which mean that there is space where modernity has been unable to invade.  When you consider the average time it takes to build a cathedral and then see that Myeongdong is constructed of standard brick, you have to marvel at the dedication involved in bringing this building to fruition. It is very attractive, solidly built and looks as if it will be there for centuries to come.  You can walk around the whole exterior. Don't be put off by the main door being shut, you can gain access to the interior by one of the side doors, although this is an active church and you may be interrupting a service or prayer time.  Inside the central section is roped off for those who wish to sit quietly in contemplation or prayer. The usual stations of the cross (quite modern in design, reminiscent of Coventry Cathedral), font etc, although we didn't find the usual place where we could have lit a candle.  The interior is simple and beautiful in its simplicity.  Well worth a visit, whether you have a faith or not, as this is a real contrast to the bustling, busyness of the rest of the city."
123,5.0,"The Cathedral for the diocese of South Korea is one of the must-sees in Seoul. Nestled downtown by the famous Myeong-dong market, several Masses are held on Sunday and all are filled with devout Catholics who seem to fill the air with spiritual warmth."
124,5.0,We love the serenity and peace in the church. You can have a quiet rest and say our prayers There are many gift shops inside the church as well. Good location at Myeong dong.
125,5.0,"English mass at 9am. You csn still feel the coldess even if the doors are closed. The have PWD access, gives away free calendar during Christmas season til supplies last."
126,4.0,"I went shopping around Myongdong and got lost. I came upon this beautiful church. Outside, it is so beautiful at night time. I went inside, and inside was nice too. Beautiful place to go see and pray, and get in touch with God."
127,5.0,A stone's throw from the pedestrianised area at Myeong-dong. A good place to make a stop for a quiet moment of reflection.
128,5.0,This is a serene place of worship. The architectural design of the cathedral is magnificent. We stayed inside for some time and it was very relaxing to be in such a place.
129,5.0,Beautiful place for photostop especially at night. You can see the beautiful lights of white rose around the church. Only 10min walking distance from Metro Hotel Myeongdong and 2min from Royal Hotel Myeongdong. Must visit in Myeongdong
130,4.0,"Since I was celebrating my birthday on a Sunday, we decided to check how to get there. Below the cathedral is LED roses and it was stunning and this is another Kdrama site!  We went to an 11am Mass. There were lots of people attending mass (I was surprised, actually)."
