,STAR,CONTENT
269,5.0,"Very nice and big zoo, we were there for 5 hours and did not get to see everything. Even though it was quite busy on a Sunday, the park is big enough to not feel trapped in the masses. Some very nice pavilions (especially the tiger part), but also unfortunately some very small cages for certain animals. End of March is still a bit cold and some animals were thus still kept inside (which is good for them, no complaints on that as an animal lover), and the grass and flowers still have to set in. I certainly recommend the place, it's a must visit, but would advice to go mid April or later. Also very cheap (3000 WON for an adult)"
270,4.0,"You got to be well rested before you visit this place, wear comfortable shoes and pack some drinks and snack for it will take you the whole day to see this place. The seoul grand park is 3 parks in one. You have the Zoo, Seoul land theme park and Science museum. So all ages is covered! there is something for everyone! Different admission fees, For the zoo it is around W3,000 a bargain if you ask me. There is so much to see, just be prepared to walk since its a big zoo. Bigger than the one in Singapore. Although the design is an open/fenceless zoo, since it was winter, some of the animals were in their enclosures. You got to plan which animals you would like to see since there are trails (color coordinated painted on the floor). For the Seoul land theme park, I just took a look. Looks good from where i was standing. It is also big with rides for both adult and kids. Across the grand park is a new building which is the science museum. It closes around 5 pm so if you like to see this place, make it a priority before the other 2. Its a nice museum for kids."
271,5.0,"We took the chair lift into the zoo top end, to save on up slope walking. After getting off the chair lift, most of the animals can be seen up close thanks to the glass enclosures. Most animals can be seen fairly active and not hidden sleeping in their holes. Toilets are plenty in the whole zoo and kept clean. As it is not peak season, the kiosk selling snack food are close, which is alright as there are still indoor eating house to be found. I would high recommend this zoo for the opportunity to see the animals up close safely."
272,4.0,"I went to Seoul Grand Park in early November, and its a right time to visit the park if you wanna see the beautiful leafs change color into red or yellow.. Its a big and beautiful park in Seoul!"
273,4.0,"Lots of different animals, huge pavilons, especially bird pavilons, where you can pet your cockoo if it lets you :)) Dont miss the dolphin show! And probably you will be surprised how Koreans are obssesed with tigers :)) Tickets are very cheap. Recommend you to buy tickets to rose garden!!"
274,3.0,"Right outside the metro station, around 30 min by metro from meyongdong.  Has a zoo and amusement part section and rose garden. charges separately for each section, so you can just choose where u want to go. The park itself is free of charge, only need to pay for transport within the park: e.g. elephant train that circulates around the park stopping at the various sections and the 3 different ""sky line"" (its actually like ski lifts that goes across diff areas of the park). the scenery is quite nice as there's a pond and river with red leaves, many Koreans take a picnic there and families visit the amusement park and zoo."
275,4.0,"It is a nice place to see the nature inside the downtown of Seoul. Even we move around only at the Zoo, it took one day. When we arrived at the park, buy tickets to take the elephant shaped bus, cable car and entrace fees. Can see different kinds of lovely animals at there. The only thing is the taste of the food are not delicious at the restaurants and are expensive comparing with the taste. Street food of fried potatos and BBQ are okay. Also you can enjoy one cup beer with 2,500 Won. After one day trip in the zoo, we felt so tired of walking. Anyhow it is such a good place especially if you love animals."
276,5.0,"Even though it's located in the mountain, it's close to the city and it's a very nice place to spend a day. Recommended seasons are summer and autumn and in order to take advantage of the resources, you better take the cable car from the very beggining and go to the top of the park and then you start from the top to the bottom, otherwise you will have to take a walk up to the mountain and in consequence be more tired..."
277,5.0,"1. Very approachable, directly connected with subway, then short elephant or skyline journey to enter in. With 1 year old we preferred train. However the skyline are quite safe with netting beneath the path all the way so we returned through skyline. It is around 30 min with two changing stations. The mountainous surrounding are worth watch. A lovely sightseeing if that is your interest.  2. Very neat and organised. Follow orange, yellow, blue, brown line to have one particular tour like deer park, birds, African safari. dolphin route etc. We did dolphin and birds. Because the bird one is mostly within building with cooling that kept my baby comfortable. Dolphin show and seal show were 10 min or so. No extra payment.  3. Food outlets, toilets, nursing rooms are available all over for very cheap. Just carry picnic mat and buy food from there. They have burger king, cafe tiamo, c4u, Korean food restaurant and street food for cheap.  4. Hiring stroller is excellent idea. The stroller is very comfortable with enough room and shade. Do not carry your bulky ones. 2000 won for it whole day.  5. Forest bathing needs trekking and time. We skipped it for next visit.  6. Definitely one visit is not enough, too much walking, too much to see. If your kids are zoo lovers or you are bird watcher it is very very worth.  7. One day trip for 2 adults and a baby was covered in less than 40 000 won. This makes it all the more awesome. I am sure for a second visit. And, oh. ...It is ranked in top five zoo in the world 😊"
278,4.0,it is just zoo. can you take a train. and it so nomal if you vist spring or fall it's good but winter and summer is bed
279,2.0,"This was probably our least favorite of all tourist sites we visited while in Seoul. But I will admit that is probably clouded a bit by it being the last day of a 9 day visit and we were exhausted. We arrived by subway and the walk to the entrance to the zoo should have been our tip-off..it was so very loooong. A long walking avenue of sorts. Street vendors on both sides was the positive part. We enjoyed seeing and easting their wares. From there a walk across a huge entrance area to the loooong line for the ski lift to the entrance to the zoo. It is suggested you take the ski lift all the way up the side of the mountain and walk down the mountain through the zoo. This is a very wise suggestion. However, there is one lift that goes 1/2 way up, then you must switch to another to go the rest of the way. There was again a huge, sloooow line for the 2nd lift, so we opted to just go ahead and visit the zoo starting there. The zoo itself was very disappointing. It is billed as one of the largest zoos in Asia, and it may be as i haven't visited any others. But this is not a good zoo. There is a not a large variety of animals and their enclosures are extremely dated. The whole place felt kind of run down to me. We have visited, many zoos in the U.S. and each zoo always seems to have at least one exhibit that is special or unique...not here. It was fun to visit as a way to mingle with all the Korean families out of for day and to be outside, but not worth all the walking."
280,5.0,"Recently I conducted a photo workshop focused on photographing wild animals. Rather than trying to stalk and photograph the critters, we ramped up our odds of finding subjecs by heading off to the Seoul Zoo. Yeah, a zoo - a place that I had thought to be a rather lame place to take photos.  Well, I was wrong in so many ways. First, the Seoul Zoo is no longer that third class park with dingy animal exhibits and less than optimally cared for animals. The place is simply amazing. It's huge, clean, beautiful and a real joy to be during a fine spring day. The exhibits include many walk-ins, including a massive enclosure of cranes, storks and other waterfowl where the public can see birds wading, swimming and flying without any barriers other than a hand rail. There are other walk-ins for tropical birds where the birds literally flutter around you. And the tiger exhibit is really exceptional - but naturally not a walk-in exhibit!  Second, it's a great place to take photographs. Sometimes it's almost as easy as shooting fish in a barrel; but other times, such as trying to catch cranes in mid flight, one can appreciate what goes into quality wildlife photography in the field. Also, there were many young couples courting there with their ubiquitous selfie-sticks. Naturally, the place had more than its fair share of kids, but because the place is truly spacious, they were not underfoot as they could have easily been in a smaller park.  It's been decades since I've had such a good time at a zoo. The last time was the San Diego Zoo. The Seoul Zoo is not (yet) on the same level as the San Diego Zoo, but it is coming up close to that level. For W3,000 admission, the Seoul Zoo has to be one of the hidden gems of Korea.  Seoul Zoo at Seoul Grand Park is located in Gyeonggi-do, just south of Seoul. The Seoul Zoo is 1.5 km walk (or tram ride) from the subway station. There is also a 1 Km lift available about 0.5 km from exit 2 of the subway.  Opening Hours: 09:00 am ~ 19:00 pm (depending on season, some walk-in exhibits close at 5 pm)  Admission: Adult (19+): 3,000 won Youth (13 – 18): 2,000 won Child (6 – 12): 1,000 won. Under 6 is free. Botanical Gardens and Dolphin show cost extra.  How to get to Seoul Zoo: Take line 4 to Seoul Grand Park station and leave exit 2. Follow the map: View a map at http://www.exploringkorea.com/seoul-zoo-seoul-grand-park/"
281,3.0,"I visited the Gwacheon-located Seoul Grand Park and it was overall a positive experience. I only visited the zoo section, and not Seoul Land, the amusement park. For what it's worth my friends have told me that Seoul Land isn't really worth it, compared to Lotte World or Everland. The zoo features many animals, of all kinds and species and from all continents. There's pretty much everything you can think of : reptiles, big mammals, seals, éléphants, lions... The park is also perfectly located in between mountains and offers a stunning view. It also has a fairly large choice of dining and snack options. My bigger complaint with the park is that it feels a bit run down. Enclosures are fairly stale, and a some animals seemed a bit unhealthy. It also lacks some kind of a theme (safari, themes for different clades or cintinents), special events allowing greater interaction with animals or staff, as well as a session dedicated to children for example)"
282,5.0,Its is most amazing and entertaining place in Seoul. The place is full of exciting rides and even the most adventurous place. its lush green landscaping is one of the most unique.
283,4.0,"if u don't have your own car, u need to walk a lot from the near station.  seoul grand park has some attractions inside, amusement park, rose park, animal park. and then u can use a bus to move there in reasonable ticket."
284,5.0,"A great place to spend the day away from the City. We went early in the morning and had the zoo almost to ourselves for the first hour, before the school groups arrived. Not that they were a problem, quite the opposite. It was nice to see how well behaved and attentive they were as the learned about the different animals. The skyway was fun and saved us a walk and the plants and flowers both in the zoo and the park were beautiful."
285,4.0,"My in laws took me and my wife to the Seoul Grand Park. We only went to the zoo but it was well worth it . The spring blooms were popping all over the area despite the cool temperature. My mother in law needed a wheelchair to get around so we rented one from the park. Only problem was some steep hills but we all pushed her. Cost was minimal. Due to the sparse crowd were able to park near the entrance . The elephant train was also nice about a dollar per rider. Lot of coffee and food places were every where . They have canceled the dolphin show . But all other exhibits were available . The park is accessible by car and the metro. So there is also a carnival of rides for those who want to do it . Announcements were in Korean and English . If you have an afternoon you want to go, by all means go. They also have guide books in various languages to assist you."
286,4.0,"I love it! We went to the zoo, ride the sky lift and watched the animals. Botanical park are so lovely. The zoo itself is really pretty."
287,4.0,"The park in itself is a welcome break from the hustle and bustle of Gangnam. Entrance is free and you have the option to either walk all the way up or take a scenic tour via the cable car service. We visited on a Sunday; here, I observed how Koreans really value quality time with the family. There are benches an wide open spaces where you can go for picnics, drinking fountains are everywhere. Walking trails ranging from easy to difficult can be found all over the park."
288,4.0,"This is a lovely green park, south of Seoul. While most people come here to visit the zoo or the theme park, the park itself can be enjoyed for a long 1-2 hours of a peaceful stroll. The park is easily accessed by a nearby Metro (Seoul Grand Park station on line 4), but be prepared to walk some distances, as the park is huge."
289,2.0,"Perhaps I am just spoiled having recently visited a few zoological facilities in the United States and being from Columbus, Ohio where noted animal expert, Jack Hannah was the Zoo Director for many years and remains Director Emeritus. The things that I really liked about the Seoul Grand Park Zoo is it's ease of access. It is very easy to find and very easy to get to. That says a lot for a Korean city like Gwacheon, which is part of metropolitan Seoul. The grounds of Seoul Grand Park are expansive. It is a great place just to go and hike and you can see many locals who go there to do just that. The walk-ways double as access roads for shuttle busses and service vehicles, so they are very wide. The park is full of beautiful sprawling hardwoods and little island of green grass where you can sit and relax. Many have Korean-style wooden decks that are covered with aesthetic local-flavored covering and there are some places that are African themed with covered pavilions suitable for groups to relax. Seoul Grand Park is not ALL Zoo, but it has many different parts to it. At the parking lot you can find wide walking avenues lined with trees leading to the entrance to the general park. There are adequate western-style restroom facilities throughout the park. You have the option of taking a lift into the park or taking the ""Elephant Train"" which is just a Tow vehicle pulling several passenger platforms. Hold on to your children though--the driver only has two speeds, stop and escape velocity. The Elephant Train costs about 600 won each time you use it and it only takes you to the entrance of the Zoo and the other parks. I think there were three or four stops in all. Once at the entrance of the Zoo, the admission for adults is 3,000 won. They will only give you one ticket for your entire party and it will have the number of people on the ticket, so don't get separated before you go through the Zoo entrance. All that being said, once inside the zoo I was really disappointed at the obvious wear on the infrastructure. Everywhere you looked facilities cried out for a coat of paint and rust treatment. We came upon so many of the different ""herd"" animals and they were in vast outdoor enclosures. That's great for the animals I think, but they were so far away most of the time that you couldn't really observe them. Fortunately the park is loaded with casted replicas of the animals. It presents a lot of photo opportunities for the kids I guess. One of the things we really wanted to see was the Dolphin Show advertised on the English Web Page for the Seoul Grand Park Zoo. When we finally found the Marine Pavilion, the ticket windows had shutters pulled down inside. There were no signs showing the performance schedule or the admission price for the Dolphin show and we couldn't fined anyone around to ask. There were several marine habitats built around the perimeter of the Marine Pavilion, but they were not well kept. The water was dirty with a dark green tint and the walls of the habitat had not been repainted in years and there was a lot of places where paint had either worn away over years of neglect or chipped off the surface. I wouldn't be surprised if the Marine mammals had died over the years because of the poor conditions. After all, there was only one or two of each of the varieties of sea lions per habitat and they didn't seem too healthy. They rarely came out of the water and because it was so dirty it was nearly impossible to see them. I later asked an information attendant about the Dolphin show and she told me they hadn't had a Dolphin show in over two years despite being advertised on the English Web Page. From the looks of the outside of the Marine Pavilion I'd bet they are hoping to eliminate the marine exhibits by attrition as the animals die off. No I can't verify that, but the generally lacking upkeep of the Marine Pavilion and surrounding marine habitats, the lack of performances, and failure to care for the animals by just cleaning the scum out of the habitats or changing the water is highly suspect. I will give high marks to the Mountain Goat exhibit area. They have a manufactured rock cliff mountain that is really high and there was a huge herd of goats spread out on practically every available ledge and plateau and they were actively climbing up and down, passing each other on narrow pathways of rock--all looking quite natural. It was awesome to see how sure-footed they were and I felt this exhibit really captured the essence of the animals. The Giraffe habitat was also well done. There were three out in the open when I was there and they have a second-story platform where you can look at the eye-to-eye if they ever come that close. I really enjoyed the Meerkats too. There were only three in the exhibit, but it looked somewhat small. The interesting thing is that the pen was relatively small and they were only separated from patrons by a short Plexiglas wall. It would be easy for unsupervised children to feed them junk. I did notice that one child was eating something while I was there and one of the little Meerkats scurried over beside him and stood up just inside the Plexiglas waiting to see if there was anything edible coming his way. But it was fun to be able to see these little guys up close. They are adorable! The brochure that you get when you enter the Zoo says there are shuttle busses running around the park that will take you between venues or to the exit, but we were at all of the venues listed as stops in the brochure and we never saw a bus run. When I asked the information attendant as I was leaving she said the busses were running earlier in the day, but we were there for about 4 hours and never saw the bus once. If you want to go get some good exercise and be bathed by the sprawling hardwoods as you hike the hills throughout the Zoo and surrounding hills, this is a great place to go. After all, it costs only 3,000 won to enter. Perhaps that is the difference between the cleanliness and better upkeep in the Zoos I have visited in the United States--all of them have a much higher entrance fee. You'd pay $3 dollars or more for just a bottle of water in a US Zoo too, but here at Seoul Grand Park bottled water is only 1,000 won and they have free water fountains, food and souvenir/toy shops throughout the park. They have stroller rentals available as you enter the Zoo and there are also some coin-operated lockers available and I think they cost 500 won."
290,4.0,"I've read a couple other reviews here and I share generally the same sentiment. The zoo itself is incredible, there are tons of animals from all over the world to see. The rose gardens are amazing as well. I took a gondola ride that goes over everything and provides you with amazing views. I am however slightly concerned for the animals. You can literally put your hands about 3 feet from the cages and feed the animals food. I saw people giving the Gibbons cheetos. It was sort of funny, but I felt guilty watching it. Different country, different views on how a zoo should be run, but overall I had a great time."
291,4.0,"I am big fan of ZOO's in general and I was looking forward to see this ZOO. You have direct subway line to get there. ZOO was really cheap, like 3USD to enter for whole day. A lot of animals to look at. I loved it.  But, there is one point to mention: I do have worries about taking care of the animals there. You can see that animals are not in the best shape and not happy as well... Especially the cage for jaguars is very(!) small... So this fact was a dark side of my visit :(  But ZOO is in the beautiful environment, so you really feel escaped from the city."
292,4.0,"I like to visit zoos whenever I go on holidays. It rained a bit on the day of my visit though.  The zoo is actually within a huge park. To go around the zoo itself is similar to going on a nature walk due to its size. Some of the buildings were a bit old and run down though. The bird exhibits were all closed off to visitors although the birds were there (couldn't read the Korean signs saying why). Tiger exhibit was being renovated in new area. Other animals seemed to be relatively ""happy"" (compared to the animals in Tokyo Ueno Zoo which seem to have gone neurotic, i.e. walking in circles etc.)  Was very quite when I went, which was good."
293,5.0,"My honey and I spent a lovely day at the zoo in May. This place is huge, so comfortable shoes is a must. The lions and snake pit were by far my favorite. However I will say the food selection wasn't so great; just my opinion. Make sure to purchase the three part package deal."
294,5.0,"This place was amazing and so big we couldn't even do it all before we got tired and a little too hot for the day. There are many animals and they have nicely done enclosures. The guide map was in English but we found very few of the staff spoke English. However this wasn't too important as we wanted to just see the animals. They had an amazing dolphin and seal lion show that was included with the entrance fee. There was an impressive green house with many many different species of lovely plants. We also took the sky lift to get a birds eye view (and return to the front) and it wasn't very expensive. The zoo is non-smoking which was nice. There were several food options and one had a lot of good Korean food options with a serve yourself kimchi bar. There were colored lines along paths if you wanted to do a particular loop with each taking about two hours to complete. We didn't use these, but it was a nice option. Overall this zoo was enormous and very nicely done. We were glad we were able to visit and little sad we didn't get to see the whole place (or have time to to return again on another day)."
295,4.0,"We went to the zoo as well as Rose Garden. The Zoo is huge and we spent more than half a day there, taking our time to explore the whole park. Rose Garden is beautiful and there was a performance going on when we were there."
296,4.0,We went to Seoul Grand Park to go to the zoo. We had not realised just how gigantic this place is! There is a LOT to do there and we really could have spent more than a day and done more things.  The zoo is good generally although some of the exhibits were a little disappointing. I was a bit concerned about the welfare of some of the animals. But they are doing some things up so hopefully that will improve.  The surrounding area is fabulous. Lots of gorgeous views of the forest. Apparently there are lots of hiking trails too.  There is also a cable car option which we might do next time to get a better view!
297,5.0,Came here specially to see cherry blossoms and not going to the zoo. Love the entire park as the cherry trees were in full bloom and the crowd was not as much as Yeuido Park.
298,4.0,"Children's park, zoo, children's museum and more and most stuff is free. Wear good walking shoes and keep yourself warm!!!! Went in jan and March and will go back again"
299,3.0,went there in january really cold buts was a nice experience anyway I was well prepared for the cold and would not recommend going there in winter
300,4.0,"Nice BIG park, but avoid going in winter! There isamusement park but super expensive! Also an Art Museum but close on Mondays The Science park is opp this place so u can plan to visit both on same day."
301,2.0,"the weather was v cold yesterday and there were hardly any visitors. the area was huge, and it's difficult to tour the place with young kids due to the unbearable cold.  if you must visit, then here's what I would recommend. exit from the subway and walk straight ahead for 5-10mins, there is a building right in front. buy you tram ticks here. do not attempt to walk to the zoo with young children, it's a very long walk. 15mins at least.  the tram goes to seoul zoo and seoul land. alight at the zoo and proceed to buy zoo ticks and sky lift ticks. they are sold at different counters.  take the sky lift right to the top of the zoo and make a leisurely walk downhill. the sky lift is about 10mins, gives you a great elevated view of the entire area. worth the money in my opinion."
