,STAR,CONTENT
226,5.0,The Seoul Grand Park has a good zoo and rose garden. I did not see roses in past visits but this time (late Oct.) the rose garden was filled with roses. In autumn the autumn colours are fascinating. However this year was dry and the summer was unusually long so the ginkgo and maple trees were much less attractive than last year. I like the park because it has a bird house where one could see various birds face to face ie not caged. The zoo is very large and has a wide range of animals.
227,4.0,"The zoo is big and nice, better you buy the package ticket wich incl elephant tram and sky lift. The only minus thing is there is not much option for food. Mostly sell sausage, teokkebi, and other korean food. So, if you want to eat other cuisine, bring it from home/ buy it before get in to the zoo. Oh, there is also 1 kfc outlet wich always full and dunkin doughnut before the ticket counter."
228,5.0,"We went there to visit the Zoo, we ended up visiting the whole place and spend the whole day there. The zoo is big and there is a lot to see. There is a sky lift that goes over a huge distance with amazing views. We did not expect something so nice - we were also lucky to go there in autumn when all the leaves were changing and the views were incredible. Definitely go even just for the sky lift ride - it was amazing!"
229,5.0,"To access this area I would recommend using the lift as it provides an aerial view of the zoo. Within the zoo there are many animals on display from giraffes, elephant, lion, etc. The zoo is well- kept and the grounds are so pleasant to walk through. There are even some activity areas such as a rock wall and elephant trunk slide."
230,5.0,"We drove. Traffic was pretty backed up getting to and from the parking lot and Waze was directing us away from the parking we needed, beyond the ""Seoul Zoo"" parking sign, so we ignored Waze. We were able to pay for parking using our debit card, didn't need a Korean bank card or won. 5,000 won for a smaller vehicle and 10,000 won for a larger. From the parking lot, follow the crowds to get tickets for the Elephant Tram or walk 1km to the main entrance of the zoo. At the zoo entrance, buy tickets to enter the zoo. There are stroller rentals available, we were also able to use our debit card for this. 3,000 won, but had to leave ID there until we returned. Strollers were nice. The zoo grounds are beautiful. It was hot out, but I bet a trip in the fall would have been perfect. I was expecting to see a lot of sad exhibits based on other comments, but they seemed pretty typical compared to any other zoo I've been to. I thought the spacing was good and yes, there's a lot of walking, but it didn't feel like too much. My kids had a lot of fun. I thought the food/drink choices were good, too. You can also bring your own food and drink in if you wanted. When leaving, you have to buy a return trip for the Elephant Tram or make the 1 km trek back to the parking area (which is also the same as the entrance to the subway)... I recommend going, especially if you have kids! It was fun!"
231,4.0,"Easter weekend travel to Seoul Korea and we knew we would have to visit the Seoul Zoo during April, my daughter loves animals and zoo's, we came here in Dec 2018 and it was too cold and the animals were all housed inside so it wasnt fun last time but this time it was amazing.  The weather was very nice, sunny and cool, no icy floor, the cherry blossoms were still in effect so lots of people were still taking pictures, all the animals were out and about instead of locked in large rooms.  Kids get in free so when we went there was many school children which was very nice to see them enjoy the park."
232,5.0,"The park has been one of my favorites in Seoul. It had been under renovation for many months but fortunately the renovation was completed when I went there in early Nov., 2018. The aviary was extensively altered. Now the visitors are isolated from the birds by glass panels. However some new species have been added. I like to go there in late Oct. or early Nov. as the maples and ginkgo trees create a beautiful mix of red, orange and yellow colors. The park is very large and I like the zoo most. To save walking, it is better to take the chair lift to the top and then walk down the hill. Once back to the zoo entrance I usually take the chair lift back to the main entrance, around sunset time. The view (from the chair lift) of the lake at sunset is fascinating."
233,2.0,"I love visiting zoo’s and seeing different animals. However, I recommend not visiting this zoo. I travelled 1.5 hours to get here, and I feel like my time travelling and visiting was wasted. There were many different animals, which was probably the best point. Each enclosure was small, dirty, and there was no sign of a zookeeper anywhere. Usually on my visits to the zoo I see many zookeepers tending and feeding the animals, but during my visit here I didn’t see any. Many animals looked sad and hungry, often eating dry leaves. The monkeys were also acting out at each other, probably because the cages were so small. As I mentioned, I love to visit the zoo, just not this one."
234,5.0,"About an hour bus ride from Seoul is the Seoul Grand Park with Zoo. It is a fun place for friends and families. The place is huge and so many animals to see. You will see bears, elephants, birds and a lot more. The entrance fee is not that expensive which comes with a free ride to the zoo bus and skylift. It goes uphill so you will get tired going up so be sure to bring some water and snacks to replenish."
235,4.0,"It is a place where you can touch, see, and enjoy animals. Especially, in spring and fall season, you can see flower, rose,chrysanthemum and use the elephant train to get to the entrance quickly and the family can go on a picnic."
236,5.0,Almost everyone goes to Seorak Mountain on autumn season and we head from a Korean friend to visit the Seoul Grand Park for autumn and it was really beautiful. Worth to visit on autumn!
237,4.0,"This is a park in massive area which includes multiple different attractions. The zoo has most visitors and is a pretty good place to any ages.  Facilities: Zoo, Garden, Camping Zone, Seoul Land(Amusement Park), Contemporary Museum, etc. We only entered the zoo. But, there was a rose garden as a season special and it looked nice, too.  Location: This is in Gwacheon City. But, only 4 stops away from Metro Sadang Station (line #4). Accessibility is great from Seoul. From the metro station, it's a short walk to the park. There are some food stalls in the way. It's fun to watch and I recommend having foods here because foods inside the park are much more expensive.  Zoo: - We bought combined ticket of 10,500 won for a lift, a elephant bus and an entrance. After buying the ticket, go to the lift station on the right and take the lift until the highest area of the zoo. Walk around the zoo and take the bus when it's done. This seems to be the best way to save money.  - The zoo was fine. Food stands, bathrooms, benches are everywhere. Bird Zone is like a Jurassic Park. If you are lucky, you'll be able to see parrots very closely. We were very amused to see apes. I think Ape Zone is the best part in this zoo.  - I was a bit disappointed not to see lions. There were MANY constructions and some animals aren't staying at where they are supposed to be. Bat cages were empty.  - It's a lot of walking anyway. Be ready to get tired.  - There's A-Zoo tour on the website to travel comfortably riding on a cart for children or seniors. It's not available at the ticket office. I think they should fix that.  - Even though there are animals of many kinds, there are still many this zoo doesn't have. So, don't expect to see every one you can imagine.  - There's an arboretum in the zoo. It was just okay level.  - There are a number of visitors in the zoo. But, this is a huge zoo and there's no chance to wait to see something. We liked it.  - Some of them close at 18:00. You'd better enter before that if you wish to see everything."
238,4.0,"Most of our visit was in the Zoo Park, many animals of all types, we did not see what some may think as abuse, Great walking self guided tour, getting up the hill you ride a Ski Chairlift, safety netting below. we were 4 adults and all of us enjoyed the 3 hrs or so we were there, quick lunch spots throughout. A tip we did not have our Passports with us a discount would have been applied, not sure of amount. Not far from Downtown Seoul, we would visit again in 2 years when we go back"
239,3.0,The park was one of my favourites but unfortunately it was under renovation during my last two visits (April 2017 and April 2018). Not a great deal to see during renovation as many of the major attractions were closed. Hope to see it again next year.
240,1.0,"I came here on an a Korean language class trip and was appalled by the living conditions of the animals. The enclosures were too small and the animals looked absolutely miserable. Some of them were acting out obviously because they were going crazy in their enclosures. I couldn't believe the beautiful animals they had that were being kept prison. They care more about having different types of animals (there must have been at least 15 different types of monkeys) than the welfare of the animals. One monkey was kept in a large, empty concrete box with just a swing to keep it entertained and it broke my heart to see the monkey sitting in the corner, baring its teeth fiercely at us. Do not visit this animal prison, you are only contributing to the problem!"
241,4.0,"Seoul Grand Park is actually quite close to Gangnam, a quick trip through the mountain, just about 15 min from Seoul Arts Center. It is a huge aerial that has hiking routes, a lift, a museum and a zoo. So definitely a destination where one can spend a lot of time. Once there it feels like it is hours from Seoul although it is very close, completely different scenery and environment there, quite relaxing. The zoo is quite large and has a large variety of animals. Grand Park is a great destination for a getaway."
242,4.0,"Public transport to and from Seoul Grand Park is easy; several buses are available and there is a subway station that leads directly to the park entry.  You can either walk, take the lift, or ride the miniature train(?) to the zoo or the theme park.  Entry prices are reasonable as are the lift and train prices."
243,3.0,"Primarily came for the zoo. It's a bit overwhelming in term of the size. The place is so huge and be prepared to do a lot of walking.  In term of animals, a bit disappointed. The only marine I saw was sea lion. No more dolphin. Didn't get to see many animals.  The only nice thing I like is the sky lift. If you visit must try sky lift."
244,5.0,"Among all zoos I visited in my life, I think this is the best! Environment is clean and animals seen are all appear healthy and happy! Many different animals/reptiles there and you would not be bored. Only thing is, do not go during Winter. It is quite cold. One more reminder - it is a non-smoking park."
245,3.0,"My kid loves animals so it was her 1st time in Seoul so I thought lets go and visit the Zoo, The entrance to the zoo is very far so once you get off from the Metro you arrive at 1 entrance from there you can buy a ticket on the elephant train and then get off at the zoo entrance. Once you get of the elephant train, you have to pay again to get back on it lol  The actual zoo is very large but due to winter most of the animals are kept inside, you can still see them but it would be better if you visit the Zoo after spring. The paths are slippery with ice so be careful.  Next to the zoo is Seoul Land an amusement park, it was too cold to go there so didnt bother."
246,3.0,"Good for long walk and if you have time.  Also a nice place for picnic.  Each area has separate entrance fees.  Sky lift is a must to see the scenery from above.  We did see much, some animals are not there during our visit. But we enjoyed walking due to cool breeze and autumn colors."
247,5.0,I love animals so Seoul Grand Park was great place for me. Place was clean and there were many animals. You can also cable car and see the beautiful view.
248,5.0,"A larger area with a museum, zoo and amusement park in it. Separat entrances and fees. Just a short subway ride out from Seoul and in a nice setting with mountain back drops."
249,5.0,"I went to the zoo and it was great all kind of animals were there. My advise to the people who wanna participate in activities like feeding the animals or playing with the dolphins to come after midday cause almost, all the activities starts in the afternoon starting 2.30 pm and also later. The attractions park is pretty big and the views are just beautiful you got the mountain and a huge forest it was perfect.  Ps: if you are planning to go to the zoo and to the attractions park it s better to free the full day cause just for the zoo it takes min 4 hours to see all kinds of animals. And its better to wear some comfortable shoes cause you walk a looot."
250,3.0,"Seoul's Zoo, the Grand Park, is located by easy metro ride from the city. Has lions, tigers, wolves, bears, and a good primate selection. Unfortunately all the bird exhibits are currently closed for health reasons and the dolphins have been returned to the ocean, so there are not any substantial marine life displays aside from seals. Animals seem generally well-read for, with some species benefiting from better habitats than others. Some of the wolves seemed a little sad, elephants seemed to have a very small space, and seals appeared cramped too. The zoo is in process of building some new enclosures and will hopefully improve those living conditions. Minimal English signage but enough to find one's way around. We visited on a Wednesday afternoon and the park was virtually empty, which made for a very pleasant time. Plenty of clean public restrooms and at least one convenience store in addition to numerous snack food vendors. Food prices not marked up. 0900-1900. $5 entry, $10 2-part skylift one-way. Take exit 2 from Grand Park metro, walk toward main building then turn right at building and walk 300m to the Sky lift. Recommend taking sky lift out to end of park and walking back to metro. We didn't think there was enough to see to merit buying more skylift passes."
251,4.0,"We went together with 2 other families and there are a total of 6 children (aged 2 to 8) and 6 adults. We only manage to go to the zoo though we bought the package price.  Generally, I am pleased to go there as my girl (aged 8) is the only child who is interested in seeing those animals (except that she is disappointed that she did not get to see dolphin there as the dolphins have gone back to nature.)  My younger daughter aged 6 did not enjoy seeing the animals as much as like the playground there ( similar as the rest of the other kids)  Good to allow the children to explore and see the real animals out there."
252,4.0,"We visited this Park in the night after 7pm, having taken around 50-min subway ride from central Seoul. The subway station nearest to the Park is named after the Grand Park itself.  We were there primarily to see the cherry blossoms. There were of course much fewer cherry blossom trees compared to Yeouido or Seokchon Lake, nevertheless, this Park is much more spacious and bigger and with fewer people as compared to the ever crowded Yeouido or Seokchon Lake.  The cherry blossom trees are to the left of the entrance to the Park. It was still a nice sight to behold even in the night, due to the brightly lit night lights. For the cherry blossom season especially, there was some nice, romantic decorations and also a row of 5-6 pianos freely available for visitors to play a nice melody to accompany the romantic ambience of the place. Could see many couples and families with children being enthralled by the place, taking we-fies and photos.  Overall, a nice place to visit in the evenings, after the main crowd visiting the zoo and other themed-attractions have left."
253,5.0,"One of the most picturesque autumn sceneries in Seoul! We had a grand time in this huge park! It was a very long walk from Exit 2 of Seoul Grand Park subway station to the park's ticket office. But it was a pleasant walk as the weather was just a bit nippy. We bought tickets for the elephant ride so as not to take a further hike to the park entrance. At the same time, we bought Sky Lift tickets (one way) for our ride back from the park to the main ticketing area. I highly recommend riding the sky lift! A fun and exciting way to see the park from above! The park is very well maintained. There is a bus that goes around the park with designated stops should you wish to ride while visiting different areas. Take a map at the reception area to serve as your guide."
254,5.0,"This park complex is accessible by train so easy to get to. This massive area consists of a park, gardens, zoo, amusement park and eateries, as all as a large contemporary gallery. There is also a chair lift system in two sections (which is VERY long and has beautiful views) as well as ground transport taking you from one attraction to the other (or back to the train station). Great for a half day out from the city or (especially if you have kids) you will need a whole day or more."
255,4.0,"For all flower lovers. Festival runs from May 27 - 12 June. Beautiful varieties of roses in different hues and decorations. Gorgeous for photographs, enjoy the beautiful flora or just relax and gossip/picnic in the shade like the locals. Probably much less crowded during weekdays, and some jostling with couples, young girls and ajummas for the best shots. Tis the season of love and as Robert Burns would say: My love is like a red, red rose That’s newly sprung in June My love is like the melody That’s sweetly played in tune. Opens from 9 am to 7 pm. Entrance fee KRW2000/head. Directions: Subway Line 4 to Seoul Grand Park station, exit 2. Walk straight till you reach the big fountain. Continue to the right for 15 mins walk to the Rose Festival or you can take the KRW1000 elephant shuttle and disembark at the first stop."
256,4.0,"If you have a day , in a good weather you may have fun with your children who loves to walk and explore animals . It's fun with young children. Suggest to load your food and fruits and enjoy ."
257,5.0,"The Grand Park is very big and for half a day I could not finish seeing just its zoo. The zoo requires a separate ticket and has a separate entrance far from the main park building. The zoo entrance is a good 15-20 minutes' walk from the main entrance and it is better to go firstly into the main entrance/ building and to buy a ticket (1000 KRW) for the elephant train to take you to the zoo entrance. The zoo has various animals, birds and insects. There is also an elevated bushland at the rear, but there is nothing much to see in there except some occasional fungi/ mushrooms. I like the bird aviary where one can find red crowned cranes; the aviary is quite large. On the weekend there are numerous children and the atmosphere is great. I would think that it takes more than one day to see the whole grand park."
258,4.0,"Had a great day at Seoul Zoo last week with two couples and three children. We love the ski lift that slowly takes you to the top of the zoo and lets you walk downhill all day! I thought the leopard , lion, tiger, and bear exhibits were great and now that the temperatures are dropping, they were much more active. Everyone loved the dolphin show which was the perfect length and featured both dolphins and sea lions doing neat tricks in an indoor amphitheater. We also enjoyed a nice picnic at one of the many picnic tables throughout the park. This zoo could use a little modernization and some of the exhibits were a bit tired, but it remains an overall great experience. Oh yeah, they have a baby elephant!"
259,5.0,"I had an Amazing time there. I've been there twice and that's because of how beautiful it is. And specially when you are an animal lover. It's perfect for couples, friends, families. I recommend going there when weather is nice. Not too cold not too hot. The view up there was absolutely breathtaking. It was like painting. قضيت وقت ممتع هناك وكان أجمل يوم قضيته في كوريا الجنوبية. ذهبت لهناك يومين متتاليين لشدة جمال المكان. انصح به بشدة لمحبي الحيوانات. المكان جيد للأزواج للأصدقاء والعوائل. انصح بزيارته عندما يكون الجو ربيعي. ليس حارا جدا ولا باردا جدا. المنظر عندما ارتفعنا على الكرسي المعلق كان أخاذاً.. كان وكأنه لوحة مرسومة وليس حقيقة."
260,5.0,We visited with a 3 year old and a 7 year old and we had a lot of fun. There is quite a bit of walking but there are trams and gondolas to ride. Quite a bit of animals to see and even a small amusement park area. We had great weather in Oct. Worth a visit if you have an entire day to spend.
261,5.0,"Great outdoor time with family and kids of all ages. There is a nice zoo, a fun amusement park and a museum. Easily reachable on subway line 4. A much better experience than Lotte World as far as the amusement park is concerned. Sometimes they have discounts for foreigners."
262,4.0,"Huge place. Very nice view of mountains behind it. The Zoo is pretty big and they have a lot of animals but the facilities needs to be improved. I don't mind going back tho, must see place if you're an animal lover."
263,5.0,"If you're ever in country and you want to experience the ""Big City Park"" you must definitely visit Seoul Grand Park, it has so much to offer from Sightseeing, Attractions, Rides(for children too), Archery, Ski Lift, Zoo and so many restaurants and snack bars its the perfect place to go for fun with the family or with your friends."
264,2.0,"We went there in August and it's too hot for us. We could only walked for half an hour and decided to leave. The zoo is pretty old. The staff is not good at providing information (as we walk along the way to the zoo from cable car station, we just realized that there a shuttle bus to the zoo but the woman at the information didnt tell us. So we have to walk under really hot weather)."
265,4.0,"The zoo is vast. Lot of animals. The chimps entertain. Take the skylift, sit and relax. Best thing is the dolphin and seal show. Ask for timings of the show at ticket counter. Sit near the front if you want to get wet. You can use the subway to reach there."
266,4.0,"The zoo is a part of Seoul Grand Park outside Seoul Grand Park station line 4.On weekends, take the subway...it's not worth all the traffic driving there.As you exit the station there is a long walk to the grand park main entrance. There will be some (imo) offputting smells, mostly form the boiling bundegi (silkworm pupae) Theres even a KFC and a convenience store...recommend you get some water as the zoo is big. You can get water and ddrinks inside as well. At the entrance of the park you can walk further to the zoo but that isn't recommended. Go to the booth and pay 1000won for a ride on the elephant tram. The tram hits all the sites at the park and drops you off infront of the zoo. You can also ride the skylift for about 5000won. The zoo is big. Frankly too big. What I mean is there are many of the different animal pavilions are separated by long stretches of trees and grass. So you're walking uphill a lot and seeing nothing for that time. It's nice if that's what you want to see but it seemed like a lot of wasted space. Some(many) of the animal pens were rather small. The monkey and ape sections were tiny. The park is relatively clean and there are plenty of food stall along the different paths. Unfortunately they all sell the same things like sausage, ""corndogs"", and fishcakes-on a stick. And coffee. Bad tasting coffee. The ""meats"" on sticks were pretty bad. Don't use the bathrooms here. Use at the subway or, if you have the time, go to the museum across the road...wonderfully clean there. You can take the skylift from the rear of the zoo and save yourself the walk. It's fun and you get a really wonderful view. Expect long lines when people are starting to leave. FYI, be aware of your clothes on the skylift. Adjust miniskirts when you sit. If this is your first trip to Korea you'll see people all over the place camped out on blankets and mats. They're not homeless. Don't give them change. The zoo is a very nice park to spend the day with friends or family. wear comfortable shoes. Bring snacks and water. Bring wet tissues."
267,5.0,"애들데리고 가기 너무 좋은곳, 가격싸고 볼거리 많고, 약간 많이 걸어야하는 경우가 있지만 약간의 운동은 모두에게 좋을듯. 입장료는 싸지만 케이블카는 싸지 않네요. 다양한 동물들을 볼 수있어 좋네요. If you want to visit a zoo that's not too pricey but has lots of things to see would be this place. It is really big place so get ready to walk for a bit. The zoo entrance fee itself is quite cheap but the cable lift is pricey. My kids love this place."
268,4.0,though it is publish that the zoo is 10th largest in the world there are some places that is a bit poorly maintained and no more animal display. i dont know if it is just for the start of spring. this is still inside the metro but a but far from where we stay in Myeongdong. though it is still connected to the Subway
