,CONTENT,VADER
732,"The market is a great place to explore. We walked there for dinner. Many of the merchants in the market had already closed for the day, but the food stalls were buzzing with activity. Interesting food stalls featuring Korean food... however if you do not like Korean food, this might not be the place to try for dinner. However the varieties of kimchi, seafood and traditional Korean foods make for a very photogenic market. We tried dotorimuk (acorn jelly) salad and bindaetteok (mung bean fried pancakes). Delicious!",Positive
733,This is more a stop for Korean bites than shopping. Try out the local snacks like the Korean Spicy Rice Cake which is a common fare in almost every stall. Casual sitting here so dress light in Summer. There are still plenty of shops selling your daily wares and sometimes Korean souvenirs.,Neutral
734,I didn't buy anything from the market... But the small alleys close by were really cool. The market sells so many types of different items it's unbelievable. Definitely worth a see :),Positive
735,"We make it a must to visit Gwangjang Market every trip to Seoul. We love the buckwheat husk pillows and Korean blankets and would cart off several every time we come to Seoul.  There are so many small eateries/shops here that sell great food! My siblings aren't about to try the food from the stalls here, so we settle for the eateries/shops that sell food. How to find a good one? Look inside and see if there are many locals in there. Yup. These serve better food.  Incidentally, my sibling bought a dozen sets of chopsticks, spoons and metal bowls from here. Cheapest, compared to Daiso, Insadong etc. I bought lots of souvenirs here. Cheaper than Insadong and Myeongdong.  One drawback: avoid the toilets.",Positive
736,"i had some nice korean food here, like the traditional pancake 8delicious) and some other weird stuff. cheap eats and lots of flavours!",Positive
737,"This place is huge!!! And so clean to be a street market that it is not even real!. I have been in places like that in mainland China and there is nothing to compare, on that (and many others) regard.  This is a world in itself, self contained, I would say it comprised many blocks, everything that you want to see is there. I find it reasonably priced, a magic universe of food, ingredients, sewing notions (amazing, it is the sewer paradise), electronics, people offering any kind of services, even the ones that are not longer offered in the west. We have seen a guy squatting on the floor repairing an old iron, for example. It is also Fabric Wonderland, every type of fabric is offered there, plus very good clothing, very well priced. Everybody is friendly and no one hassles you, type of Chinese style. A great place, totally worthy.",Positive
738,Fun market in the fact that the almonds that we bought at the market were outstanding and seemed crunchy and really fresh (even though they were imported from CA)...? The upstairs Hanbok (traditional Korean dress) area had numerous stores (abt 100) to observe and take pics of.,Positive
739,"There are a lot of shop n food there, my friend told me to buy some ginseng there n I found out is really cheap there buy more get more discounts",Positive
740,"You will find this kind of market is everywhere in Seoul. But Gwangjang Market is worth to go as here is one-stop marketplace for everything you can put into your mouth. From the wetmarket, you can buy the seafood and have the restaurant there to cook for you. There are plenty of food stalls selling all kind of Korean delicacies, from ginseng soup to kimchi dumplings, korean pancake, bibimbab, and even the rice barley drinks. I give a 10/10 for this spot from the assessment of one who craves for foods in Seoul. The prices are also very competitive!",Positive
741,"It's smaller than I have expected. The food stalls are all selling similar stuff, crammed together, so the market gets very hot.",Neutral
742,"If you're in Korea, you need to try authentic market food and Gwangjung markets is the biggest. This market is famous for it's Potato Jeon which is a must try along with a bottle of Makeolli. Other dishes are not particularly unique to this market however I would try the raw beef (Yukhwe) which is the korean version of steak tartare. A great way to experience Korean culture and cuisine in a market setting which is very different to the restaurants.",Positive
743,"We went to the market to see more about traditional Korean food and I was confused a bit because they have so many stalls selling the same food at one of each alley. Too many vendors to be chosen and those ahjumas will keep calling you to eat at their place. This is one of the problem I see in South Korea that they really compete to each other with the same stuffs just to see which stall more popular by the crowd. We eat the traditional Bimbimbap, tteokbokki, hand cut noodles and dumpling and it was pretty good. They rarely speak English but they speak Chinese due to the growing of Chinese tourists to South Korea but most of them have English menu so you can just ask to see the price before you eat at their stall. The price range on every stall pretty much the same and eating at the market doesn't mean cheap price (KRW 5000-10,000) depends on what you eat. Anyway it always a good experience to see a traditional market in every country to feel more about the culture and their food and I feel that Korea has the best street food so far.",Positive
744,Lots of street food vendors and you can find a lot of seafood related dishes around if you like and is not allergic to seafood.,Positive
745,Lots of beautiful and colourful hanboks. The food were cheap and delicous as well. I really enjoyed the rice cake soup and pancakes.,Positive
746,"Despite having been to Seoul several times, I've never ventured beyond the Namdaemun traditional market. This place is not hard to find and it's pretty clean and sheltered. The most famous item in this market has to be the bintaettok (mung bean pancakes). Many people raved about them but I frankly did not enjoy them that much. It's an acquired taste, I think. There are many food stalls to sample local food and you can even buy banchan (small side dishes) back to your hotel to slowly savour them. I didn't see much for shopping though there are so many shops selling pretty hanboks. I'm glad I came for the experience but I'm not sure if I will be back a second time.",Positive
747,"몇몇 음식점 특히 마약김밥 및 빈대떡, 순대 등이 유명하여 굳이 줄 서서 먹었으나 너무너무 실망했다. 마약 김밥 같은 경우는 비싸지 않지만 줄 서서 먹을 것도 아니고 이름 하나 잘 지어서 (""마약""이란 이름이 우리나라 사람에게 흥미로와서) 대박 난 듯... 너무 상업화 되었고 교통이 편한 편도 아니니 굳이 갈 필요는 없을 듯. 차라리 망원 시장이나 경복궁역 근처의 통인 시장이 더 좋을 듯 하다.  I queued long time to have those so called ""the must eat"" things among locals such as Mayak Kimbab (drug kimbab) ,Bin-dae-dduck (korean pan cake) and Squid Soon-dae (korean sort of black pudding or sausage) but they were all not that worthy. I recommend other markets like Mangone market or Tong-In market nearby Kyung Bok palace.",Negative
748,A large selection of food vendors throughout as well as non-food things on offer. We visited at sunset/evening on a Monday and it was bustling with energy.,Positive
749,"Look more like a market selling cooked food and street food. If you like these food, you will love this market. Vendors do not speak English. But most of the food is 1000 won or 2000 won. So they will gesture by showing 1 finger or 2 fingers.",Positive
750,"Love going to Gwangjang market for breakfast, you will be spoilt for choices. Pumpkin and red bean porridge, kimchi pancake, barley rice, spicy rice cake and so much more your tummy will be more than satisfied. Go to the alleys to look at the huge range of kimchi and other raw foods available for sale.",Positive
751,"A great place to buy souvenirs and taste local food. You'll see it will get crowded once local people have done working and eat at those local food vendors. Recommend to stop by at one of those food vendors. There's a roof over the market, so rain won't spoil the mood.",Positive
752,"very close to metro station!! Compared to many traditional markets, this market is surprisingly clean. You can find a lot famous and traditional food there. Good for breakfast or lunch. Lots of vendors can also speak Chinese, but take it easy, they are friendly, and body language works anytime! Besides, you can also find some small stuffs as gifts, such as Hanbok book marks and so on. 比想像中乾淨很多, 大多的攤飯也會說中文, 這裡你可以嘗到各種美食, 當成早餐或午餐都很棒, 此市場離地鐵站非常近! 在這裡不只食物, 還可以買到一些小紀念品或者伴手禮",Positive
753,"Not a big scale market, but you will be amazed by the number of watering foods they served. Kimchi, seaweed, noodles, Korean pancake etc. Highly recommended place to visit if you're Korean food lover! They serve mainly traditional preserved Korean foods, if you're opting something like barbecue or fried chicken, this is not the place.",Positive
754,"For local goodies and food like seaweed, chocolates, almonds, ginseng, blood sausage, dumplings, fish cake, gimbap, tokkboki, etc. Gwangjang market is the place to visit.  Food and goodies here are way cheaper compare to other market they range from 500-4000 won. You can also haggle with peddlers. Expect that the place is crowded with locals.  A must place to visit :)",Positive
755,"If you have a wild streak and you are very adventurous, you can try authentic Korean cuisine. There is dog meat and dog meat soups available as well as live octopus to enjoy if you can. The sights and the smells are equally worth experiencing.",Positive
756,This is a very traditional market known for its variety of food. There are also different sections selling fabrics and other stuffs. But what stand out is the food section that sells all kind of Korean food. Come here for your meals and you won't be disappointed. They are cheap and good and a cultural experience too!,Positive
757,"it can be a little difficult to find the place, but once you are there, you must eat there! try their barley bibimbap, mayak kimbap, mungbean pancake & red bean porridge. its really good! it is a traditional market, and they sell all sorts of things. seafood to hanbok. it's a must go!",Positive
758,"Gwangjang Market, previously Dongdaemun Market, is a traditional street market in Jongno-gu, Seoul. The market is one of the oldest and largest traditional markets in South Korea, with more than 5000 shops and 20,000 employees in an area of 42,000 square metres. Approximately 65,000 people visit the market each day. Get your ginseng here, get your breakfast here, various of home made food. The best place to be!",Positive
759,"Easy to go there and lots of delicious foods and traditional foods, you must go there for try it. And have too many stalls on the market.",Positive
760,"If you want to see the real Seoul, this is the place. The stalls are amazing, the variety immense, and the senses are overwhelmed by the sheer buzz of the place. Well worth a visit.",Positive
761,"Whilst in Korea, I came to really like their traditional markets, it just reminds me so much of things when I was abit younger. And Gwangjang Market is no exception. It’s huge and you can find lots of things here that you typically wouldn’t find outside of a traditional market. So, fabrics, dried food produce etc. Fruit here is fresh and pretty affordable and there are also lots of food stalls in the center of the area. We tried Bindaetteok, which is a kind of pancake only found in that area of Seoul (that’s what I heard). However, it gets super crowded by 11am, so if you are looking to browse around at a more leisurely pace, do arrive earlier. A lot of the stalls open really early (earliest opening 830am).",Positive
762,"Stayed in Seoul for a few days, and found this market so satisfying for healthy, cheap dinners. Our favourite was the handmade noodle stand near to one of the entrances - so fresh!! And the salad/rice bowls were at other stalls near by were also very nice. Meals worked out to be about $5 Aud from memory and were sooo filling. ...always finished off our night at the markets with a donut mmm!",Positive
763,"a lot of food variety, must come and try. also selling many other stuff but we did not look into as we can't speak korean",Neutral
764,"You don't even have to come to shop if you don't want to. What this place should be known for is the street food. Open early afternoon to late at night, there are always people here eating and shopping. Truly the best place in Seoul to get a taste of all of the street food under a roofed place. You'll be able to find local favorites such as mandoo, ramyun, pancakes, and sausages here all in one convenient place.",Positive
765,"The market covers almost everything you would want to experience in one place in one day! There are rows of kim chi, preserved veg, dried fish etc etc There are stalls selling bed linens table cloths etc etc There are stalls selling clothes, souvenirs ""silk"" pouches bags etc many sit down stalls for freshly ground mung-bean pancakes, stewed pork, intestines and offals, pumpkin/redbean/abalone congee. best of all, the dumplings and hand-made noodles The best time to try street/stall food is 11am to 2pm, just pick you little space, squeeze between other diners and sit on the heated wooden stools and enjoy! hot tea is usually self serviced at the stall Watch out for the little ladies who balance two or three trays of food (small dishes of kim chi included) on their heads to be delivered to a hungry stall owner who is stuck, sometimes alone, manning their little stalls making a living. This is what travelling is about! mix and eat with the locals side by side, elbow to elbow, and remember the experience, I still miss it.",Positive
766,"We arrived around 4pm, some ladies we setting up food stalls, so maybe this can be a different experience later in the day. However, the shops are really one dimensional, bolt after bolt of cloth and pre-made clothing. Worth a miss in my book.",Positive
767,A great selection of foods here. Make sure to try their mung bean pancake and also the bibimbap. Price wise is reasonable,Positive
768,"While living in Seoul for a year I spent my time looking for the best places to eat. This place by far exceeded my expectations. Lots of little food stalls and ajummas and ajashis wandering around. Most of the time I'd head there by myself about mid day to sit and have a snack. I'd always end up sitting next to an old man eating japchae, sundae, and boribap with mini kimbap while sharing makgeolli and soju together while I'd throw the few random korean I knew into the mix and he'd just chat away. It was wonderful! There's something so wonderful about sharing food yet being lost in translation. Lived there 2011-2012",Positive
769,"This is a traditional market in Seoul. If you plan to go this place I recommend that you also can go to Dongdaemun, these two place are really close. You also can have breakfast in this market and get some tradition stuff, everything is very cheap. Anyway we had a great time in this market.",Positive
770,"I love this place!! It's bustling with people and food!!! Exotic food that I did not want to try ^^!  The market are lined with souvenirs, clothes and bedding stores. They are cheaper here compared to all the other tourists places I have been to.  There are aunts with their food ready to be cooked in the middle of the street and they are all so fresh and good!  For adventurous, you can try the octopus sashimi and the sea squirt. For the non adventurous, like me, it's safe to try the pancake, oden, mandoo and kimbab.",Positive
771,"We stayed in Dongdaemun. The first time, we walked to the market. It took us about 45 minutes but then we stopped at various stalls/shops along the way. The second time, we took the metro and the market was less than a 5 minute walk from the station.  We loved the mung bean pancakes and the mayak kimbap. We could have eaten them everyday...",Positive
772,Walking through this market is a treat for the eyes. Sitting at the tables and eating with the locals is a treat for your stomach and your mind. Everyone is friendly and will help you get what you want. Wonderful food. Never a bad dish.,Positive
773,LOVE LOVE LOVE! Being Korean and returning to my home country- a visit to this place fills my soul in a way that is beyond words. The dduk-bbok-ggi! The soon-dae! The o-deng! Everything there screams KOREA to me. Not to be missed.,Positive
774,"Easily accessible as it's not far from the Seoul Canal walk, you can pop up from approx 1/3rd the way along and visit.  Tons of stalls selling a variety of typical korean street food and even if not planning to buy anything worth going just for the atmosphere. Truly only described as bustling.",Positive
775,"We went for the food reviews online. It was Sunday and a lot of the shops were closed, but the food was definitely an adventure. It was very crowded, and if you have picky eaters they will not enjoy this!",Positive
776,"This is located near Insadong and both places can be visited on the same morning. Stopped by here to have some kimchi pancakes as well as steamed crab. Food stalls abound on the ground floor, as well as bed linens, bolsters and Korean souvenirs.  In the huge covered area, on the second floor, you can find lots of clothes stalls, with apparel that are mostly made in China. It's more expensive than what I have seen for the same stuff in Shanghai, but there is great variety here, from jeans to blouses and jackets. Some of the staircases can be steep and slippery, especially if they are wet, so be careful.  The third floor is devoted to hanbuk shops, selling the traditional Korean dress, for both children and adults. Do haggle though if you are interested in getting one.  Also bought a box of lovely strawberries from an eldery lady on the ground floor. Do also check out the toy store in one corner - it was selling a light sabre for S$55 and stormtroppers for S$150 - as well as the gardening and fish stalls near the outside. There are also a row of pharmacies at the far end.",Positive
777,"The food market is a must do. The layout is like an octopus with little streets extending out of a centre point all under one roof. It feels like each little street specializes in certain kinds of food, too many to mention, look out for the suggestions in the various Seoul must eat lists online.",Positive
778,"This place was huge, only downfall it seemed most of the vendors had the exact same stuff in each store. Its definitely an experience though!",Positive
779,"This is a place I wanted to go so bad, after watching a video blog from Mark Wiens on YouTube, and it did not disappoint. I had kimbap, korean pancakes and dumpling soup there spending around 10000 KRW (10 USD) in total, which was great for a lunch. Lots of food stalls where you can find a variety of Korean food, as you may be able to find some Korean souvenirs to buy. Conveniently located near the metro station, which is a plus.  If you would like to experience a traditional Korea shopping and food experience, definitely go here!",Positive
780,"This place near Dongdaemun area, which is many grocery for stationery, fashion, shoes, etc. I take lunch here for some Korean ""snack"" but it is quite cheap and make me full. But many others stall selling foods like noodle seafood, etc",Positive
781,"There is nothing not to like here! This Korean grand marche is simply mesmerizing to me. From the freshly made food to the heated seating in the middle of the winter, to the abundant produce, seafood on display, the alleys filled with Korean traditional apparels, and so much more, Gwangjang holds a special appeal to me on this and many more trips to Seoul. Love it there!",Positive
782,"It is good to walk around the market and look at their culture. You can buy some food to try as well, but it is a little over priced to me, overall is okay, the market is very clean.",Positive
783,"i love love the food here. been here twice for the lunch/dinner just cause i couldn't get enough of the mayak kimbap! this place is pretty big they have food section, clothes, accessories etc. totally worth a visit",Positive
784,Nice for a local experience. Lotsa traditional local food to try. Also can find traditional Korean clothing here. Best for travelers who would like to try the local food! Go with empty tummy!,Positive
785,what i really love about this place is their food. you will be able to eat different types of authentic Korean food.  Live Octopus? you can eat them here. I haven't tried i am not that adventurous yet. but they said it's good with beer,Positive
786,"The market is full of eateries, stalks, small restaurants, grocery shops, clothes shops and many more. Prepare to spend half a day there to experience the local delicacies. Gwangjang Market is very popular among locals and foreigners.",Positive
787,This place is just a huge old market in Seoul. Street food here isn't great and things aren't hygiene. Honestly there isn't much to look at or to do. I only go if I want to look for vintage/ old/ cheap clothes on the second floor. Anyway I don't recommend this place for tourists!,Negative
788,"we are a little dissappointed with the food stalls in this market. not that sanitary and delicious and very very crowded. however, there are lots of dried goods and clothing for sale.",Positive
789,"This market is not as I expected since the food section is only for a small section in the market (from Exit 2 of Subway). The rest is for hanbok tailors or fabrics. The food section is quite crowded with some similar cuisine. However, for travelers, it is a good place to explore Korean culture through cuisine. The price (for sure) is for tourists. Haha.",Positive
790,"Still a bustling local market, this is a great place to try street food (if you can find a seat among the locals and if you can figure out how to order!). Food prices are cheap and it’s a great place to soak in local culture. One tip: remember what gate/door you entered by (esp if you’re meeting a group or guide later). It’s easy to lose your orientation. Also, try the bindaetteok (mung bean pancake), it was our fav and we wish we had got more instead of sharing one.",Positive
791,"We came here twice during our 5 day trip to Seoul and loved it. The atmosphere is great ! It's always super busy and you can barely move but it just adds to the experience. I recommend come on an empty stomach and try lots from the different stalls. We tried the bindaetteok (fried mung bean pancake), ddeokbokki, kimbap, kimchi mandu and a selection of jeon. Everything was great, but I would mention that if you're not a huge meat eater, the smell of the blood sausage and pig trotters can be very strong. Highly recommend to come here, especially if you're on a budget.",Positive
792,"Visited this place cause lots of variety show goes to their traditional market. Lots of eatery,counted as big compare to other market. Easily located outside the metro exit.",Positive
793,Came across a few friendly seller & love the foods there. Very near to subway station. It's a local morning market with all kind of foods,Positive
794,"The market is buzzing with activity, very colourful shops and stalls and had some great street food. lots of locals at the market - so you have a great vibe, not just a tourist site",Positive
795,"The stretch from the subway station to the Gwangjang market 광장시장, is lined with stores such as hanbok tailors (not the typical shopping stretch for tourists). The market has the grocery part as well as the food street part. there is a nice Samgyetang shop which I didn't try - I shall try the next time I go to Korea. I took away 김밥 kimbap for dinner, and it was surprisingly very oily.. it cost only SGD 3 for 2 rolls.",Positive
796,"Gwangjang market is a fun place to shop and eat. Though we reached there and the stores we closing, we found really pretty hanbok accessories and souvenirs and loved them so much. It is a popular place to make hanbok and every piece looked so pretty! The food section closes much later and you can basically find everything. The kimbap was addictive and tastes different from the ones sold outside. The seaweed that wraps the kimbap was more crispy and tasty. I would go back again. Oh the underground mall at the subway station has more hanbok accessories and I found them a bit cheaper there. Walk around first!",Positive
797,"Gwangjang Market was really fun. There were a lot of street food, and quite a lot of people there so it was really lively! If you want to get some good Korean food, this is the place to come. The food stalls sell bindaetteok (Apparently, a store called Soon E Nae , 순이네 is popular among the locals), mayak kimbab (Translation: drug Kimbab, because it's addicting), sannakji (cut octopus legs that is still 'alive' while you eat them. My mom and I ate all of them, but the 3 people from China sitting beside us, didn't even eat one, they just kept looking in wonder), Ddeokbokki and more! They also sell banchan, (Korean dishes eaten with rice) so if you want to eat something that Koreans would usually eat, you could buy some, cook or buy some rice and eat it where you're staying at. And last but not least, I got to see some amazing hanbok here. I'm a fan of Hanbok, so it was really nice seeing all the hanbok stores.",Positive
