,CONTENT,VADER
403,"I'd rather say traditional food market cause I'm not a big fan of traditional stuff except for FOOD! If you happen to come here, please try the Bindaetteok (Mung Bean Pancake), it's quite oily but worth it. The crispiness and the texture, omg and the sauce (onion and soy sauce i think), I CANNOT. Besides, there's this raw seafood plater which is incredibly good! I would eat San nakji (Raw minor Octopus). A lot of people couldn't stand looking at it cause it's cut into smaller pieces and because they are raw, they're still wriggling and jiggling HAHAHA. But I love it. Go and try for yourselves.",Positive
404,"Great beef tartare as well as some raw seafood and sashimi. They have other stuff like Korean sushi and pancakes, etc. Overall a very traditional market and definitely a must visit if you are looking for something a bit more original and traditional. I scored two kid hanboks for 30 bucks total and that price cannot be beat!",Positive
405,"Get your eyes full and stomach full of Korean food craving fulfilled here.  Experience the madness of a traditional market with colorful kimchi, food wares and cheap stuff.",Neutral
406,"This is the place to go to eat like the locals. There are stalls everywhere mainly set up through the middle of each long corridor with restaurants along the side.  Each ""stall"" will cook their specialty for you. Price ranges between 5000 - 10000 won. It's communal seating and if you are there during winter, the seats are heated too!  So many options that you won't know what to order. Best order and share from one stall and then move on to another.  There are also other stalls which sells their side dishes, seafood, dried foods, cakes etc. Quite a good place to walk around.",Positive
407,"Walking around in this area gives you an understanding of Seoul traditions. People are nice and not aggressive. Its a busy area, but a must see",Positive
408,"We came here on our 12 hour layover from LAX to Chiang Mai. I've never been to South Korea so I figured it would be a good chance to see a little of it for free. We took a 5 hour free tour from ICN which took us to a village and the market. I wanted to try Bulgogi in Korea so we found a place but it was just ok. Next we tried the dumplings and dumpling soup. These were better than the bulgogi, but we were full and couldn't try anything else.",Positive
409,Love the bad set. Very sweet and comfy. The cotton were very cheap and affordable. here is where to get cheap souveniors,Positive
410,"This place is always a delight to visit! I have gone three times now. Once in the summer, fall, and even winter. When the heat is too much to bear it's nice to get a cold bowl of Namyeong and when's it's freezing in Korea hot tteokbokki always hits the spot. They even warm the benches for you in the winter. All in all the food is amazing and the atmosphere is fascinating. This is a must see and experience in Seoul!",Positive
411,"This is a great place to add to the itinerary during your stay in Seoul. It was very busy and a bit chaotic but a sign of a very good place when it comes to eating there. The food on offer was impeccable. We had the chance to try 'raw octopus' for 15,000 Won. Be prepared for crowds but well worth it",Positive
412,This is one of my favorite place to go every year when I visit to Korea. It is like time square in New York but all shopping center. There has many things to eat and buy. Specially night time is perfect time to visit. Highly recommend to stop by.,Positive
413,"It used to be an interesting place but it was too exposed on media. Different kinds of food may look nice on t.v. but the taste wasnt that good. If it is on the way, it is ok to drop by, but no need to plan to visit.",Negative
414,"Come hungry. We had a one day stopover in Seoul and chose this market for lunch. So glad we did. Fortunately we had taken in a historical morning walk and palace tour before we arrived because we were ready for lunch. Note: Walk the whole food sections before you sit down to eat. There is a wide variety of stalls and types of food. Pick the one, two or more that appeal to you most, then try something you have no idea what it is!. Ddeokbokki, bibimbap, kimchi, bindaetteok, pajeon, kimbap, jasaek goguma to name just a few. Some of the portions can be overwhelming so bring a friend, order a variety and share. After you have had your fill, finish walking the multiple lanes of stalls of local made wares, household goods, fabrics and anything else you could think of. Then grab some cookies and candies to take home for later after you have recovered. Be prepared for the crowds, it is a popular place and seats can be few.",Positive
415,"I've had foreign friends visit this place multiple times and they have told me that nothing beat this experience. Especially the food here is very authentic as it is humble and can be a quite unique dining experience. It tends to get crowded and even for a person who hates being in crowded places can enjoy this place as it is a unique scene to see hundreds eat and drink during late nights. I recommend that no one neglects this special gem, it is truly a Korean dining and cultural attraction that will give you the first foot into this city.  My personal recommendation is: Eating Nok Do Pancakes and Soju and Makguli at SooENae, which is located in the center of the market.",Positive
416,"I had some street food at Gwangjang Market in which I don't normally do because I have a bad stomach. The street food at Gwangjang was so tempting, I just couldn't say NO.",Negative
417,"Market was easy to locate and took my family to try some mung bean pancake. As the only person in tm family to understand and speak korean (even though I am not korean) we then went to some stalls as I took my family to try market food. Went to a stall that served spicy rice cakes, japchae, odeng and various foods. I ordered the spicy rice cakes but the women gave me odeng instead and wouldn't take back the odeng even though we hadn't touched it. Was not impressed but had to have it and ordered the spicy rice cake elsewhere.",Negative
418,This is the place to be if you are feeling hungry near Dongdaemun. You will find lots of authentic korean food to fill your tummy.,Positive
419,"Great place to try street style korean food. Many options, some are delicious. Cultural. Worth visiting at night time.",Positive
420,"Went to the clothes section first and the stalls were already starting to close even though it was only around 6pm. Maybe it was because it was eve of Seollal. However, when we arrived at the market at ground floor, the place was bustling with activity. We enjoyed the street food and even sat down twice to enjoy pajeon and other various seafood with japchae at another stall. There were also many shops selling similar snacks and health foods such as ginseng. Their prices differ so don't buy at the first stall.",Positive
421,"I stumbled on this market quite by coincidence while just roaming. I tried the Kyoja here. This place was interesting enough to come twice - once by chance, and the other time by design. The second time, I looked at the other wares sold there and bought a neck pillow that had a case made from traditional fabric. This place is interesting, the storekeepers are very friendly, and it's a good place to just be.",Positive
422,came to gwangjang market to eat and there are literally lots of food to eat. And they are all delicious! I tried tobboki (not sure how to write it) and gimbab.,Positive
423,"Ugh! As a Korean, I feel so bad foreigners come here and have to eat fake, dirty, over-priced food. The market seems big, but when you look around you will realize most sellers sell similar food with same price.  If I must recommend one market for you, i will guide you to either Tongin Market near by Gyeongbok palace or Mangwon Market near Hongdae.  If you really really want to see what Gwangjang market looks like, just look. Don't try food here :( especially if you are trying street food for the first time.",Negative
424,"I come here for breakfast every time I go to Seoul. Amazing street food guaranteed to fuel your whole day activities. Very friendly ahjummas if you speak Korean, but even if you don't, it's not very hard to explain to them what you want. The market is very neat and clean, not your typical Asian wet market.",Positive
425,Majority of the food stores sells the same food. So there's not much variety of food to choose. Not that fantastic for me as the stores are half opened when i was there during lunch time. Would go back only when i don't have other place to go.,Negative
426,"Gwangjang market is one of the oldest and the largest functioning market in South Korea with around 5000 vendors selling different things like food, textile, etc.Seriously, Gwangjang market is the culmination of the diverse and delicious flavors of Korean street food. There are plethora of food to choose from but don't miss their gimbap and tteokboki (rice cake in spicy sauce). With 20 USD worth of Korean money, you can get a nice lunch of your choice.  Gwanjang market offered some of the best street food I have eaten so far. It's a mix of old and new, modern and traditional, all under one roof. As long as you keep your mind open to new flavor and taste, you will likely to enjoy your visit in this market.  The market is clean and there are paid toilets (clean as well). Other than food, you can also find textile shops, even traditional medicine ingredients shops. Perfect place to get authentic Korean souvenirs with bargain price.",Positive
427,"We came here twice in our visit just because the food is really good, although it does get busy and a little noisy.",Positive
428,"Good food, Good exprience. A lot of food to choose. It is a big market. A market in Seoul which you should NOT missed.",Positive
429,Went there to see local food and look around and ate a delicious dumpling soup with Kimchi with locals at stand #3 where they spoke enough english to help me and teach me how to eat things properly!,Positive
430,"When there for lunch. Street food - fish cake, red bean bun, green bean pancake, pork pancake etc. Lots of stalls selling dumpling soup. Walkable from the subway station. Lots of traditional shops selling pots & pans, mattress etc",Positive
431,"Interesting to visit but don't bother eating here. 99% of people eating there are tourists with about 95% tourists from PRC. We tried one stall and had fish cake in soup (KW3000) , pig intestines (KW10,000), rice cake in spicy sauce (KW2000), fried glass noodle (KW3000) and one bowl of rice. We were charged KW22.000. We couldn't figure out how it came to KW22,000. Did the bowl of rice cost KW4000!? We could have eaten better food in a proper restaurant for the same price. Definitely not worth the money for street food.",Positive
432,"We loved our foodie excursion at this market. There are different kinds of food to choose from. This is also the market that was featured in different variety shows like Running Man. This is a great place to eat local korean food, cheap and delicious! Of course be prepared to speak Korean as they don't speak english here!",Positive
433,This is a really good place to have your meal and taste local food. Some of the recommended food to try here are the pancakes and the dumpling which is located almost end of the street. This is also a good place to purchase food products and local tidbits.,Positive
434,Easily accessible from the subway. Good place to eat but the much hyped tekbokki and pancakes are so so only and expensive. The mungbean pancakes are good. Some stores are very friendly. A must go place in Seoul.,Positive
435,"We went only at night, when majority of the shops were closed. But the food street was open, many stalls selling similar foods. But it all tasted good. Helped that the food looked good as well!",Positive
436,Place of full visitors looking to try out the local food. Visited a stall which sold local food and Noddle soup was fantastic. There was never ending of customers who came and ate the stall especially for the vegetables pancake and bimbap. It was strange seating on a hot bench. There was another stall selling fresh seafood stew/soup (I think). The customers was given stools to seat outside the shop. It must be good as the local Koreans was not queuing for it.,Positive
437,"Main purpose for coming to this market - dinner. At this place, one can sit down in the many stalls in front of the cooks, order and eat on the spot. The only reference that I got is to go for the stalls with the largest number of people. We bought the pancake and brought it with us as we sat down for the mandu (dumplings) - the stall owner said ""OK"".  After dinner, we just walked around the various stalls selling souvenirs - bought the honey butter almonds and fresh pomegranate juice.",Positive
438,"Got off at the wrong subway station but that's how fun adventures come about. We hit the almost empty market at around 10pm and followed the laughter and shouting and came across a whole range of stalls selling food (the happy sounds were from Koreans drinking soju, the national drink - gotta say, the Koreans do like a drink!). I tried food that I hadn't even hear of before: sea pineapple (an edible sea squirt - believe me, its more of a squirt than a pineapple; think slippery and slimy, and looking like an ugly squat alien cucumber, served as sashimi; only for the brave), sundae (made by boiling or steaming cow or pig's intestines that are stuffed with rice), tteokbokki: thick dumplings in a spicy sauce; boiled big heart, spongy and tart. And off we went into the night.",Positive
439,"Gwangjang Market is one of my favourite places to explore in Seoul, also one of the oldest traditional markets in South Korea. At Gwangjang Market, you must try the Bindaetteok (Mung Bean Pancakes), a snack that's greatly loved by the locals. It goes down really well with Makgeolli (rice wine)!",Positive
440,"Local Korean food in the street food atmosphere. Various type of Foods, seafood, steaming, hotpot or fried. Don't expect that you will sit in a nice restaurant because it will be just a bar seat, eat and go. Just pick one, the most long queue. There are also clothing and tourists stuffs available in the market.",Positive
441,Spent 2 hours there.  Tried ahujma pancake and live octopus.  Local fruits distribution - grapes and strawberries 👍🏻,Neutral
442,"visited there to try yuk-hoi(uncooked beef), but it's far too hyped and not worth it especially with that much of people and hassle.",Negative
443,"Its a huge covered market with everything from street food to souvenir to fabric and more. If you can fit it in your schedule, its worth an hour or so strolling in it.",Positive
444,This market is in the middle of the oldest part of Seoul. There are many indoor and outdoor restaurants. The pancakes are the specialty. You can also browse the flea market type stalls selling anything from food to clothing.,Neutral
445,"Heaps of stalls, cheap food. It ranges from the confrontational live octopus kind to straightforward vegetarian friendly options. Its cooked fresh, the locals are happy to squeeze up and make room for you, nobody minds if you don't speak Korean. I had a ball.",Positive
446,"In the three-month summer holiday vacation, I travelled to Seoul, which is the capital of Korea. Korea is a country that gathers different kinds of snacks and food. This time my friend takes me to a traditional market of Korea which called Gwangjang Market. We go there by subway. Gwangjang Market is a local market for people to seek the delicious and naïve food. Actually, we know this place through a very famous television programme called Running Man. The television programme also visits the market before. As we all know, most of the Korean food are spicy. There are all kinds of traditional snacks in the market for you to have a try, like rice cake, breaded fish stick, fried chicken and so on. The most unforgettable food for me is eating the raw octopus, the feeling is really special. I advise the tourists can take it as a lunch or supper as there are many choices to choose.",Positive
447,"We came to Korea from tropical Saipan in December, inconveniently lacking winter clothes. Hit up the secondhand market area and got ourselves some warm, funky clothes on the cheap, followed up with a great little lunch. Much better prices here than in the more touristy areas.",Positive
448,"Metro stop for Gwangjang market is Euljiro 4. Once you enter street level, head N. After one block, you'll be crossing an intersection which is a bridge across a narrow stream below. Before the next major intersection, there will be entrances to the market on the E side of the street. For the food zone entrance, head E (right) at the major intersection.  The mungbean pancakes & the gimbap are vegetarian delights. The bibimbap can be. If not, have the meat 86ed. Herbivores won't be disappointed if you're into cabbage, fresh herbs, grains, sprouts, & red peppers.",Positive
449,"This market gives you a taste of the local culture in Seoul. For a unique local experience, have your lunch or dinner here. Avoid weekends at nights as it can get extremely crowded.",Negative
450,"There were many food stands, household items, and clothing. Almost anything can be found here. The food stands looked really good as they cooked much of the food in front of you.",Positive
451,"weird when shopping here but worth. what i mean shopping at here is you can buy a lot snacks from here with retail price ! believe me, cheaper than other places. regret never buy a lot. Great food here and crowded !",Negative
452,"This food stall market is a nice attraction for an hour or so. There is plenty of food to buy, but you'll see the same food being sold in stall after stall, e.g. rice cakes, mung bean pancakes (I bought one from the stall with the longest line - and wasn't impressed at all), etc. I also tried the dumplings and noodles in a popular stall - and wasn't impressed by the dumpling or noodles either. There are also places for people to sit within a stall, although you will have to be buying the food from that particular stall.  The market also seemed to be a little less clean than some of the other markets I've seen, so you should take that into account. I would also suggest going to other markets like Myeongdong if you desire a greater variety of food as Gwangjang serves the same stuff in many stalls... It did seem to be a place where locals went so even if you do not eat the food, it's an interesting place to visit.",Positive
453,"We came here via metro line 1 (Jongno 5-ga station) and walked a short while to the market. So it is quite accessible. Its southern side is flanked by the Cheongyecheon river, so a nice place for a walk after eating & exploring in the market.  It is a very busy place.  There is a wet and dry section of the market. The ""dry"" side retailed all manner of daily necessities such as textiles, apparel, shoes etc. The wet side has a stretch of hawkers selling seafood, vegetables etc.  Probably the highlight is the food section where there are many many cart stalls set in the middle of the alley ways. There are seating places in front of these stalls. Most, if not all of the visitors eating there seemed to be tourists!",Positive
454,"An average market. Plenty of local food available. However, personally I don't like the taste. If you have limited time in Seoul, you may skip this place.",Negative
455,Try the gimbap and pig trotters. Beware! Portions are huge! My personal favourite was the kalguksu (knife cut noodles) with pieces of zucchini and gim (seaweed). The mung bean pancake seemed to the draw for both local and tourists but I found it to be too heavy and oily for my liking. I had a nice piping bowl of red bean porridge which was a savory alternative to the usual sweet dessert we are so used to in Singapore. Get your kimchi here too!  I bought plain canvas tote bags for 2000 to 3000 won each from the traditional stores and some Korean knick knacks (much cheaper than Insadong). The bags were of good and sturdy material.  Plus there is a hidden second-hand market on the second floor.,Positive
456,"One of the best shopping destination for tourists looking for local products. Also there are a lot of store selling colorful Hanbok. There are Goods, accessories clothes in very inexpensive price.",Positive
457,"In this crowd and popular traditional market offer a good selection of Korean Street Food with a reasonable price such as Korean pan cake, sticky rice cake etc. So it is a one stop shop for Korean street food",Positive
458,"Said to be the biggest market, this place sells everything from clothing through traditional medicines to food. The place is known for traditional mung bean pancakes. It is not touristy and the majority of visitors seem to be locals. Worth a visit in the evenings.",Positive
459,"2nd visit here. It is a mixed of wet market with other stuffs. You can get clothes, blankets, daily essential, fruits & vegetables, and lots of seafood here.  What make it famous is the street food in the market. You can just sit down at the stalls & enjoy the freshly prepare food. As vegetarian, there choices are quite limited. But I like the Original Gwangjang toast by the old grandma at the end of the market & the red bean cake near the middle cross junction inside the market.  But my main purpose to be here is for the raw Korean Ginseng & the dried seaweed. We also bought a set of Korean cutlery, dried persimmon, nuts & snacks. We ended up with so much stuffs (enough to fill in 2 XL sized Longchamp bag) that we have to go back straight to our hotel:)",Positive
460,"We stopped by to have a quick browse of the market while walking past along cheongye stream to Dongdaemum. Should have saved my stomach to have our meal here as there was so much food to try. In the centre of the market there are heaps of little food stalls where they sell various korean food- street food. Dokbokki, soondae, gimbap, bindaeteok (mung bean pancake - a must try), bibimbap, savoury pancakes, noodles etc. Each stall has some seats surrounding it so you can sit down to eat or you can buy your food to take away.  I didn't get the chance to walk around the other areas of the market but i did walk past an area where they sold lots of fabric/ material and also saw quite a few stores selling packaged korean snacks",Negative
461,"good local foods with many choices, buy small portion so you can taste as much type of food, wet and dry market with clean environment, buy snack, traditional food pack, cloth material as souvenir",Positive
462,"This is a place for inexpensive shopping for fabrics, clothes etc with a section dedicated to a whole bunch of food outlets. The shopping is nothing extravagant but prices a were cheaper than in big shops. We went in late afternoon for a stroll in the shopping area (browsed stuff) and in the end, enjoyed a wide variety of Korean food complemented with a bottle of 'rice wine', which is a low alcohol drink (like beer). We got a combination plate that had about 8 different items. It was a great way to sample the wide spectrum of Korean street food. Though inside a busy market, the food outlets had space to sit inside. It is also good for people-watching as the locals teem for shopping and eating. Great to watch how the food is made then-and-there. However, the walking spaces are narrow and can be difficult to maneuver when crowded.",Positive
463,Went to this place for breakfast and many stalls sell korean food. We can eat there as they provide stools to sit and can take away also. You can buy many korean snacks and food also here. Price is cheaper than supermarket or others sold at Namdaemun market.,Neutral
464,"I came here for the second time to buy banchan (Korean side dishes) to bring back home. The first time we came, we brought back some fermented squid side dish but in small quantity. We regretted it then since it was very delicious. This time round, we couldn't buy much too since my sister had just given birth and was not allowed to have seafood for a few months. There's even marinated raw crab which we loved when we bought it the first time round. Just tell the person that you need to take it back home on flight and they will be willing to seal-wrapped the food with no additional cost.",Positive
465,"It's one of the best places to try all the wonderful street food you've seen on TV or vlogs. A food lover and a photographer's paradise. Many of the stalls/vendors are famous, so you can be sure you're eating the best food.  It's a must-do experience. The atmosphere is amazing. The food is not only delicious, but cheap, as well.",Positive
