,Unnamed: 0.1,index,Unnamed: 0,경복궁부정단어리뷰,index.1,단어,번역
169,169,64,876,It was an amazing view to visit this palace and to admire the historical story behind was really mesmerizing. The building was neatly maintained and clean. There is a museum inside which is very much interesting to see.,169,much,이 궁전을 방문하고 그 뒤에 숨겨진 역사적 이야기를 감상하는 것은 정말 놀라운 광경이었습니다. 건물은 깨끗하게 관리되고 있었습니다. 내부에 박물관이 있어 매우 흥미롭게 볼 수 있습니다.
170,170,65,879,"We were fortunate to visit here while the guards were being changed and the ceremony exceeds any other such ceremony that one typically can witness. Much grander of a scale, much more pageantry.  But even if you don't get to see that take place, the Palace grounds and buildings are impressive enough to warrant a visit here for sure.",170,much,우리는 운 좋게 경비원들이 교대하는 동안 이곳을 방문할 수 있었고 예식은 일반적으로 목격할 수 있는 다른 어떤 예식보다 뛰어났습니다. 훨씬 더 웅장하고 훨씬 더 화려합니다. 그러나 그것이 일어나는 것을 보지 못하더라도 궁전 부지와 건물은 여기를 방문해야 할 정도로 인상적입니다.
171,171,66,881,"A beautiful palace, which unfortunately got caught in a fire in the 1800’s then was ruled by the Japanese for about 50 years. The Japanese tore it all down but fortunately stored a lot of the structures. They have spent the last 30 years, restoring and repair the palace, so not much of it looks very old but it is amazing when you read the history. The changing of the guard is a nice ceremony to watch. It is great to visit during cherry blossom as it all looks so pretty.",171,much,불행하게도 1800년대에 화재가 발생한 아름다운 궁전은 약 50년 동안 일본의 지배를 받았습니다. 일본인들은 그것을 모두 무너뜨렸지만 다행히도 많은 구조물을 보관했습니다. 지난 30년 동안 궁궐을 복원하고 수리하는 데 시간을 보냈기 때문에 많이 낡아 보이지는 않지만 역사를 읽어보면 놀랍습니다. 근위병 교대식은 보기 좋은 예식입니다. 벚꽃이 만발하는 시기에는 모든 것이 너무 예뻐서 방문하는 것이 좋습니다.
172,172,67,896,"I have visited Gyeongbukgung twice, once in the summer and once in the winter time. I personally hate cold weather, but, Gyeongbukgung is so much better in the winter time. With less tourist and less heat, you can wear the Korean traditional clothes comfortably during the winter time.",172,much,"나는 여름에 한 번, 겨울에 한 번 경북궁을 두 번 방문했습니다. 저는 개인적으로 추운 날씨를 싫어하는데 겨울에 경북궁이 훨씬 좋습니다. 관광객이 적고 더위가 적어 겨울철에도 편안하게 한복을 입을 수 있습니다."
173,173,68,901,"This is my second visit. Once in summer (no shade and very hot so I didn’t walk around much). This time in winter, I was able to walk around more. The changing of the guards is every hour, on the hour and is worth seeing. It’s free. The costumes are colourful and the drums are cool. The palace entrance is 3000 won. The grounds are expansive and besides the pavilions and buildings, it’s pretty sparse. There were plenty of people in traditional costumes taking photos. There is a folk museum too but I didn’t go in.",173,much,"이번이 두 번째 방문입니다. 여름에 한 번(그늘이 없고 너무 더워서 많이 걷지 못했습니다). 이번에는 겨울에 더 많이 걸을 수 있었습니다. 경비원의 교체는 매시간, 정시에 이루어지며 볼 가치가 있습니다. 무료입니다. 의상은 화려하고 드럼은 시원합니다. 궁전 입장료는 3000원입니다. 부지는 광대하고 정자와 건물 외에는 매우 희소합니다. 전통 의상을 입고 사진을 찍는 사람들이 많았습니다. 민속박물관도 있는데 들어가보지는 않았어요."
174,174,69,905,"My wife and I love attending palaces, museums etc in the countries we visit. We attended the palace and partook in the free tour. It was extremely informative and we really enjoyed it. Further more there was no request for tips or any form of payment. As the tour ended our guide thanked us for our time, wished us all the best on our holiday and then walked off. She was extremely polite and informative the entire tour and I actually felt like I wanted to tip her given how brilliant she was.  I would highly recommend taking the free tour as you get so much more out of it that just walking around yourself",174,much,"제 아내와 저는 우리가 방문하는 국가의 궁전, 박물관 등을 방문하는 것을 좋아합니다. 우리는 궁전에 참석하고 무료 투어에 참여했습니다. 그것은 매우 유익했고 우리는 정말로 즐겼습니다. 게다가 팁이나 어떤 형태의 지불도 요구하지 않았습니다. 여행이 끝났을 때 우리 가이드는 우리 시간에 대해 감사를 표하고 휴가에 최선을 다하기를 빌며 자리를 떠났습니다. 그녀는 여행 내내 매우 정중하고 유익했으며 그녀가 얼마나 똑똑한지를 감안할 때 실제로 팁을 주고 싶다고 느꼈습니다. 나는 당신이 스스로 걷는 것보다 훨씬 더 많은 것을 얻을 수 있기 때문에 무료 여행을하는 것이 좋습니다."
175,175,70,909,"Definitely worth while to visit, staff very friendly to answer any question. Unfortunately lot of the pavilions are closed, so not much tonsee, other palace is better for this, bit nice grounds to walk around. Changing of the guards is not authentic and very touristic unfortunately.",175,much,방문하는 동안 확실히 가치가 있으며 직원들은 모든 질문에 매우 친절합니다. 불행히도 많은 파빌리온이 닫혀있어 톤시가 많지 않으며 다른 궁전이 더 좋습니다. 경비원의 변경은 유감스럽게도 정통하지 않고 매우 관광지입니다.
176,176,71,913,"Simply, you are not visiting Seoul if you do not visit Gyeongbukgung Palace together with Gwanghwamun Gate. This palace carries so much history that it is a must for all visitors to visit. Make sure you catch the guard changing ceremony.",176,much,광화문과 함께 경북궁을 방문하지 않으면 서울을 방문한 것이 아니다. 이 궁전은 매우 많은 역사를 지니고 있어 모든 방문객이 반드시 방문해야 합니다. 경비원 교대식을 꼭 잡으세요.
177,177,72,919,"Nothing much except that’s it’s really big. Went during winter, lots of space to walk around but nothing really fascinating",177,much,정말 크다는 것 외에는 별거 없습니다. 겨울에 갔고 걸을 공간이 많았지 만 정말 매력적이지는 않았습니다.
178,178,73,922,We arrived Gyeongbokgung Palace around 11am and the ticket can be purchased easily when arrived. The ticket queue seems much longer in the afternoon when we're about to leave so start early if you can. Most of the visitors were dressed up in Hanbok costume (traditional Korean dress) where you can rent it. Do note that the guard changing ceremony is at 10am and 2pm. There's a free English Guided tour at 11am but I believe there're other timings in the afternoon as well.,178,much,우리는 오전 11시경 경복궁에 도착했고 티켓은 도착하자마자 쉽게 구입할 수 있습니다. 우리가 출발하려고 하는 오후에는 티켓 대기열이 훨씬 더 긴 것 같으니 가능하면 일찍 시작하세요. 대부분의 방문객들은 한복을 입고 대여할 수 있는 한복을 입고 있었습니다. 근위병 교대식은 오전 10시와 오후 2시에 있으니 참고하세요. 오전 11시에 무료 영어 가이드 투어가 있지만 오후에도 다른 시간이 있다고 생각합니다.
179,179,74,936,"I would suggest to go early. So that you can get your insta-worthy shots without too much background distractions. We reached the palace around 10am-11am and it is already packed. It might be due to that I visited the palace on Sunday. Such a shame that I didn't get to watch the guard changing ceremony. Good thing that our tour guide is well versed with the history of the palace, so we don't have to use the tour provided by the palace.",179,much,나는 일찍가는 것이 좋습니다. 너무 많은 배경 방해 없이 인스타급 사진을 찍을 수 있습니다. 우리는 오전 10시-11시에 궁전에 도착했고 이미 포장되었습니다. 일요일에 궁을 방문한 탓인지도 모르겠다. 근위병 교대식을 못본게 너무 아쉽네요. 우리 투어 가이드가 궁전의 역사에 대해 잘 알고 있으므로 궁전에서 제공하는 투어를 사용할 필요가 없다는 것이 좋습니다.
180,180,75,944,"We enjoyed visiting Gyeongbokgung Palace very much. We were, unfortunately, there during a rainy patch. It would have been a lot more fun on a sunny day. Many visitors show up in traditional Korean dress and take photographs, which adds to the ambiance.",180,much,우리는 경복궁을 방문하는 것을 매우 즐겼습니다. 우리는 불행히도 비가 오는 패치 동안 거기에있었습니다. 화창한 날이면 훨씬 더 재미있었을 것입니다. 많은 관람객들이 한복을 입고 사진을 찍어 분위기를 더한다.
181,181,76,951,"We took the train and came out on the opposite end and hence we didnt know there was another exit where you will see rows of rentals of hanbok. We went into the palace expecting to rent hanbok for the children and realized they were outside (we saw many of them when we left). Would be nice if there is a notice board or something where they can inform us where to go for the rental. If you are coming out of the palace, turn to your left towards the station. when you hit the first traffic light, you will see lots of rental shops opposite. That's the place to rent your hanbok for photo taking. The palace itself was nice but probably I was expecting more. The palaces look pretty much alike and nothing much to see for us. Probably they do not have a richer and older history as China. We practically walk everywhere in the compound and our last stop was the library where you will have to take your shoes off and be real quiet! I don't think I enjoyed unless there was an event there. If not, I think its worth to skip it unless you really want to dress in your hanbok and walk under the hot sun (yes we went in June)!",181,much,"우리는 기차를 타고 반대편 끝으로 나왔기 때문에 한복 대여 줄을 볼 수있는 또 다른 출구가 있다는 것을 몰랐습니다. 우리는 아이들을 위해 한복을 빌릴 것을 기대하고 궁전에 들어갔고 그들이 밖에 있다는 것을 깨달았습니다 (우리는 떠날 때 많은 것을 보았습니다). 게시판이나 대여 장소를 알려줄 수 있는 것이 있으면 좋을 것입니다. 궁전에서 나오실 경우 역 방향으로 좌회전하세요. 첫 번째 신호등에 부딪히면 맞은편에 렌탈샵이 많이 보입니다. 사진 촬영을 위해 한복을 빌릴 수 있는 곳입니다. 궁전 자체는 좋았지 만 아마도 더 많은 것을 기대했을 것입니다. 궁전은 거의 비슷하게 생겼고 우리에게는 그다지 볼 것이 없습니다. 아마도 그들은 중국만큼 더 풍부하고 오래된 역사를 가지고 있지 않을 것입니다. 우리는 실제로 화합물의 모든 곳을 걸어 다니고 마지막 중지는 신발을 벗고 정말 조용해야 할 도서관이었습니다! 거기에 이벤트가 없다면 나는 즐기지 않았다고 생각합니다. 그렇지 않다면 한복을 입고 뜨거운 태양 아래서 걷고 싶지 않다면 건너뛸 가치가 있다고 생각합니다(예, 우리는 6월에 갔습니다)!"
182,182,77,1000,We spent a few hours walking around the palace grounds. It was much bigger than we expected but the architecture was beautiful and well kept. We had a 3 year old with us and he loved exploring the countless pathways until he got tired and opted to ride in the stroller. They had many ramps around the palace so the stroller was not a problem. Overall a very worthwhile place to tour in Seoul for a step back in to history.,182,much,우리는 궁전 경내를 산책하는 데 몇 시간을 보냈습니다. 우리가 예상했던 것보다 훨씬 컸지만 건축물이 아름답고 잘 보존되어 있었습니다. 우리는 우리와 함께 3살짜리 아이를 데리고 있었고 그는 지쳐서 유모차를 타기로 선택할 때까지 수많은 길을 탐험하는 것을 좋아했습니다. 그들은 궁전 주변에 많은 경사로가 있었기 때문에 유모차가 문제가되지 않았습니다. 전반적으로 역사로 되돌아가기 위해 서울을 여행하기에 매우 가치 있는 곳입니다.
183,183,78,1002,"Compared to most our palace visit, this was uninspiring. I thought it would be much bigger, but the King's palace is very small. I don't get the barrier around the pond with windows to peek through to see the Pagoda, looks abandon.  Aside from the entrance guards, there are nothing to interact with after the guards, just a few old buildings, you can walk through this in about an hour, will be bored after the palace.  The most interesting thing was seeing all the Chinese tourists dressed in traditional attire walking around, we took pictures with a few.  Need signage to describe what we are looking at, I rented the audio guide, without that, one would be clueless on what they are looking at.",183,much,대부분의 궁전 방문과 비교할 때 이것은 고무적이지 않았습니다. 훨씬 클 줄 알았는데 왕궁이 너무 작아요. 나는 탑을 보기 위해 엿보는 창문이 있는 연못 주위의 장벽을 얻지 못한다. 입구 경비원을 제외하고 경비원 이후에는 상호 작용할 것이 없으며 몇 개의 오래된 건물 만 약 1 시간 안에 걸을 수 있으며 궁전 후에 지루할 것입니다. 가장 흥미로운 것은 전통 의상을 입은 모든 중국인 관광객이 걸어 다니는 것을 보는 것이었습니다. 우리는 몇 명과 사진을 찍었습니다. 우리가보고있는 것을 설명하기 위해 간판이 필요합니다. 나는 오디오 가이드를 빌 렸습니다. 그것이 없으면 그들이보고있는 것에 대해 단서가 없을 것입니다.
184,184,79,1006,"The Royal palace in Seoul is a great attraction to visit, much has been written about the palace on TA. This is a huge complex of buildings and outdoor areas to explore, that is why I highly recommend taking one of the free guided tours which are offered daily in four languages, English, Korean, Japanese and Chinese, then after the tour wander around on your own. The tour lasts between 1-1.5 hours depending on the size of the group and the guide. Our guide was most informative as she lead our group of about twenty five around the complex. We were told many interesting stories and facts about the life in the Royal Palace, about family members, details of the architecture and general life in the palace. The Palace is inexpensive to visit, 3000 won/adult, but I believe if you come dressed in traditional Korean costume you can get in for free.",184,much,"서울의 왕궁은 방문하기 좋은 곳으로 TA에 왕궁에 대해 많이 기록되어 있습니다. 이것은 탐험할 거대한 건물과 야외 공간입니다. 그래서 영어, 한국어, 일본어, 중국어의 4개 언어로 매일 제공되는 무료 가이드 투어 중 하나를 선택하고 투어가 끝난 후 원하는 대로 돌아다닐 것을 강력히 추천합니다. 소유하다. 투어는 그룹과 가이드의 규모에 따라 1-1.5시간 동안 진행됩니다. 그녀가 단지 주변에서 약 25명의 우리 그룹을 이끌면서 우리 가이드는 가장 유익했습니다. 우리는 왕궁에서의 생활, 가족 구성원, 건축의 세부 사항 및 궁전에서의 일반적인 생활에 대한 많은 흥미로운 이야기와 사실을 들었습니다. 궁궐은 입장료가 성인 3000원으로 저렴하지만 한복을 입고 오시면 무료로 입장할 수 있다고 생각합니다."
185,185,80,1009,"Many of the historical sites in S. Korea are rebuilt or refurbished, but they are beautiful all the same. They have a strong cultural tradition, much like their food traditions -- that are interesting and rich.",185,much,한국의 많은 유적지는 재건되거나 개조되었지만 모두 아름답습니다. 그들은 음식 전통과 마찬가지로 흥미롭고 풍부한 강력한 문화적 전통을 가지고 있습니다.
186,186,81,1020,"This place is huge and a lot of walking. There was a ceremony for about 10 mins and it was nice. I don’t know how much would it cost for the entrance, since our tour guide got it for us. A lot of people, but since the place so big that people were at diff places. Overall, great place to visit if you’re in Seoul.",186,much,이 곳은 거대하고 많이 걸어야 합니다. 약 10분 동안 행사가 있었고 좋았습니다. 우리 투어 가이드가 우리를 위해 그것을 가져 갔기 때문에 입장료가 얼마인지 모르겠습니다. 많은 사람들이 있지만 장소가 너무 커서 사람들이 다른 장소에있었습니다. 전반적으로 서울에 있다면 방문하기 좋은 곳입니다.
187,187,82,1030,"Since the japanese destroyed all,it was rebuild.Notting much left inside but fancy woodwork.frankly i wasnt impressed much! If you skip it you wont miss much",187,much,일본인이 모든 것을 파괴했기 때문에 재건되었습니다. 내부에 많이 남아 있지 않지만 멋진 목공. 솔직히 나는별로 감동하지 않았습니다! 건너 뛰면 많이 놓칠 것입니다.
188,188,83,1052,"Nice to see a palace from Joseon Dynasty, I watched Korean drama and Joseon Era is always shown. Nothing much to see inside, the fee was $3; some people dressed up in hanbok dresses and walked around the palace and take pictures. The change of guards was great to see, they do it every half hour.",188,much,조선시대 궁궐을 보니 반갑고 한국 드라마를 보니 항상 조선시대가 나온다. 내부는 별로 볼 것이 없었고 수수료는 $3였습니다. 한복을 입고 궁궐을 산책하며 사진을 찍는 사람들도 있었다. 경비원의 변화는 보는 것이 좋았습니다. 그들은 30 분마다 그것을합니다.
189,189,84,1063,"If you have been to the Forbidden City in Beijing, you will be more tolerant of this rebuilt collection of buildings that is the Gyeongbokgung Palace. Some reviewers complain there isn't much to see here. But I guess it depends upon what your goals are.Yes, the buildings are mostly closed or empty. But the way the palace is built with exposure to weather with unheated buildings, it is understandable why they won't be full of ancient artifacts. You'll find those in museums nearby. I have been here probably five times going back over 30 years, and I never cease to find it a place to calmly reflect on Korea's ancient and interesting history as a keystone located in the heart of East Asia. Additionally, you will find two great museums within its boundary. A great place for leisurely walks and quiet thinking (except on Korean holidays!).",189,much,"베이징의 자금성에 가본 적이 있다면 경복궁인 이 재건된 건물 모음에 더 관대할 것입니다. 일부 평론가들은 여기에 볼 것이 별로 없다고 불평합니다. 하지만 그것은 당신의 목표가 무엇인지에 달려 있다고 생각합니다.네, 건물은 대부분 폐쇄되거나 비어 있습니다. 그러나 난방이 되지 않는 건물로 날씨에 노출되어 궁전을 지은 방식을 보면 고대 유물로 가득 차 있지 않은 이유를 이해할 수 있습니다. 가까운 박물관에서 찾을 수 있습니다. 30여 년 전으로 거슬러 올라가면 아마 다섯 번은 갔을 텐데, 동아시아의 한복판에 위치한 종석으로서 한국의 고대 역사와 흥미로운 역사를 차분히 반성할 수 있는 곳을 끊임없이 찾고 있습니다. 또한 경계 내에 두 개의 훌륭한 박물관이 있습니다. 여유롭게 산책하고 조용히 생각하기에 좋은 곳입니다(한국 공휴일 제외!)."
190,190,85,1073,It is worth the visit if you go early morning to catch the 1st changing guard ceremony. If not there is not much to see inside just many buildings and they are all the same.,190,much,1차 교대식을 보기 위해 이른 아침에 가신다면 한번쯤 가볼만한 곳입니다. 그렇지 않다면 많은 건물 내부에 볼 것이 많지 않으며 모두 동일합니다.
191,191,86,1083,Great to visit if you do the guided tour. It is a large compound and you do not get as much out of it walking around on your own without the guide.,191,much,가이드 투어를 한다면 방문하기 좋습니다. 그것은 큰 복합물이며 가이드 없이는 혼자서 걷는 것만큼 많은 것을 얻지 못합니다.
192,192,87,1087,"Enjoy the palace on snowy days, I think it is more beautiful that way. Atleast what my family & I did!  Only 4- because there is not much to see. When you are inside there may be a second museum which holds different event for different seasons. There you have to pay aswell, nothing is free in this world my sons.",192,much,눈 오는 날 궁궐을 즐기면 더욱 아름다운 것 같아요. 적어도 내 가족과 내가 한 일! 4- 볼 것이 별로 없기 때문입니다. 당신이 안에있을 때 다른 계절에 다른 이벤트를 개최하는 두 번째 박물관이있을 수 있습니다. 거기에서도 돈을 지불해야 합니다. 이 세상에 공짜는 없습니다.
193,193,88,1093,"There is so much history in this palace. Take the audio tour and if you get the chance, watch the changing of the guards!",193,much,이 궁전에는 많은 역사가 있습니다. 오디오 투어를 하고 기회가 된다면 근위병 교대식을 지켜보세요!
194,194,89,1118,"The Guards change ceremony was much better than the one at Deoksugung palace. We bought the royal pass (10,000 won for adult, 5000 won for kids) which includes admission tickets for Deoksugung palace, Gyeongbokgung palace, Changdeokgung palace (inclusive of secret garden admission), Changgyeonggung palace and Jongmyo Shrine. If you have time for only one palace, go to Gyeongbokgung palace if you would like to see the Guards exchange ceremony and experience a traditional Korean tea and snacks served the royal style.",194,much,"근위병 교대식은 덕수궁보다 훨씬 좋았다. 덕수궁, 경복궁, 창덕궁(비밀정원 입장료 포함), 창경궁, 종묘 입장권이 포함된 로얄패스(어른 10,000원, 소인 5000원)를 구매했습니다. 궁궐 하나만 구경할 시간이 있다면 경복궁에 가셔서 근위병 교대식을 보고 궁중식으로 제공되는 한국의 전통 차와 과자를 맛보고 싶으시다면."
195,195,90,1131,"This in some ways has some of the strengths of the forbidden city, without the traffic and air quality woes. Unfortunately they do not have the nice displays of palace furniture, art objects and treasures that the forbidden city has. Still impressive, but could be so much more. Perhaps these items are in other museums? If so they should be repatriated for the Korean people",195,much,"이것은 어떤 면에서 교통과 대기 질 문제가 없는 자금성의 장점을 가지고 있습니다. 불행히도 그들은 자금성에서 가지고 있는 궁전 가구, 예술품 및 보물의 멋진 전시를 갖고 있지 않습니다. 여전히 인상적이지만 훨씬 더 많을 수 있습니다. 아마 이 물건들이 다른 박물관에 있지 않을까요? 그렇다면 그들은 조선인을 위해 송환되어야 한다."
196,196,91,1138,"Similar in style to other Seoul palaces, Gyeongbokgung differs in size and the extensive complex of palace buildings and compounds. There is much to see here so it is best to allow at least two hours to explore. I recommend entering through the main gate and exiting at the rear of the grounds to ensure you don't miss the beautiful book room and final home complex of the revered empress. The walk back from the rear of the grounds takes you past a number of small art galleries. Avoid the weekend if possible as there are many tour groups.",196,much,서울의 다른 궁궐과 스타일이 비슷하지만 경복궁은 크기가 다르고 궁궐 건물과 복합 단지가 광범위합니다. 이곳은 볼거리가 많기 때문에 최소 2시간 이상 둘러보는 것이 가장 좋습니다. 아름다운 책방과 존경하는 황후의 마지막 집 단지를 놓치지 않으려면 정문으로 들어갔다가 경내 뒤쪽으로 나가는 것이 좋습니다. 경내 뒤쪽에서 다시 걸어가면 여러 개의 작은 미술관을 지나게 됩니다. 단체관광객이 많으니 가급적 주말은 피하세요.
