,Unnamed: 0.1,index,Unnamed: 0,경복궁부정단어리뷰,index.1,단어,번역
354,354,249,2625,"If you rent the traditional costume (hanbok) for the nearby shop (just check with the staff at the entrance), you get to go into the palace for free. If not, entrance fee will have to be paid after the first courtyard.  Palace is really big and you will get an idea of the various functions of the different buildings if you have a local guide with you. If not, just listen in to the various guides who are shouting commentaries.  As for photo opportunities, there are heaps and it just multiplies if you come dressed in their traditional costumes which a lot of the visitors do anyway, so you will not be the odd one out.  There is not much shade beyond the buildings so bring some headdress as it is quite hot from noon onwards. In summer anyway.",354,much,"근처 가게에서 한복을 대여하면(입구에서 직원에게 확인만 하면 됨) 궁에 무료로 입장할 수 있다. 그렇지 않은 경우 첫 번째 안뜰 이후에 입장료를 지불해야 합니다. 궁전은 정말 크며 현지 가이드가 있으면 다른 건물의 다양한 기능에 대한 아이디어를 얻을 수 있습니다. 그렇지 않다면 코멘터리를 외치는 다양한 가이드의 말을 들어보세요. 사진 촬영 기회에 관해서는, 많은 방문객들이 어쨌든 하는 전통 의상을 입고 온다면 더할 나위 없이 많아질 것입니다. 그래서 당신은 이상한 사람이 아닐 것입니다. 건물 너머로 그늘이 많지 않으니 정오부터 꽤 덥기 때문에 머리 장식을 챙기세요. 어쨌든 여름에."
355,355,250,2632,I would go on a weekend so you can see everyone wearing beautiful traditional clothing. There isn't much to do when you get there but its nice to walk around just take a few hours to yourself.,355,much,나는 주말에 가서 아름다운 전통 의상을 입은 모든 사람들을 볼 수 있습니다. 거기에 도착하면 할 일이별로 없지만 몇 시간 정도 걸으면 좋습니다.
356,356,251,2652,It’s beautiful lovely place so many thing to see and amazing garden and you can see a blue house where is the Korean President live !! Very clean good place to visit and relax !! You can shop and have coffee shop too !! You can walk or take MRT or bus if you stay in the center of city ! I do love Seoul very much will come back next week June 5,356,much,볼 것도 많고 멋진 정원도 있고 한국 대통령이 살고 있는 청와대도 볼 수 있는 아름다운 곳!! 매우 깨끗하고 방문하고 휴식을 취하기에 좋은 곳!! 쇼핑도 하고 커피숍도 할 수 있어요!! 시내 중심에 있으면 걷거나 MRT 또는 버스를 탈 수 있습니다! 나는 서울을 매우 사랑한다 다음주 6월 5일에 돌아올 것이다
357,357,252,2663,"To visit a country so proud of its cultural heritage is pleasant. So much time has been taken to not only rebuild a nation so recently devastated by war, but to rebuild a historical journey of a country that has been in the middle of conflict since ancient times. Gyeongbokgung was the primary Palace and stronghold of the King and when you see it you will understand why. The skill to build such a place without the technology of today is breathe taking. Don't just look at the walls and the buildings, take the time to look at how they were constructed and how they fit in with the other palaces, shrines and protective walls that were built to repel invasions. When you sit and take in the sheer expanse of these sites and the amount of people it took to make them run it is mind blowing. To see early ducted underground heating in these ancient sites is stunning. Sit in the gardens, take photos and enjoy everything the site has to offer.",357,much,"문화 유산을 자랑스럽게 여기는 나라를 방문하는 것은 즐거운 일입니다. 최근 전쟁으로 황폐해진 나라를 재건하는 것뿐만 아니라, 예로부터 갈등 속에 있었던 나라의 역사적 여정을 재건하는 데도 많은 시간이 걸렸습니다. 경복궁은 왕의 궁궐이자 요새였으며, 그것을 보면 그 이유를 알게 될 것입니다. 오늘날의 기술 없이 그런 곳을 지을 수 있는 기술은 숨을 쉬는 것입니다. 벽과 건물만 보지 말고 시간을 내어 그들이 어떻게 구성되었는지, 침략을 막기 위해 지어진 다른 궁전, 신사 및 보호 벽과 어떻게 조화를 이루는지 살펴보세요. 앉아서 이러한 사이트의 순전한 광활함과 그것을 운영하는 데 필요한 사람들의 양을 보면 마음이 뭉클합니다. 이 고대 유적지에서 초기에 덕트가 연결된 지하 난방을 보는 것은 놀랍습니다. 정원에 앉아 사진을 찍고 사이트가 제공하는 모든 것을 즐기십시오."
358,358,253,2675,"One of the biggest palace in Seoul that we were recommended to visit. However after heading over, we realised there was not much to see. However, it proves as a good spot for photo-taking if in Hanbok as it matches the theme. Luckily for us, it wasn't overly crowded and photo-taking was a breeze. However depending on the locations of the hanbok rental shop, the journey to the palace may take up to 30min!",358,much,"우리가 방문하도록 추천 된 서울에서 가장 큰 궁전 중 하나입니다. 그러나 향하고 나서 우리는 볼 것이 별로 없다는 것을 깨달았습니다. 하지만 테마에 맞게 한복을 입으면 사진 찍기 좋은 장소임이 증명된다. 다행히 우리는 너무 붐비지 않고 사진을 찍는 것이 산들 ??바람이었습니다. 단, 한복대여점 위치에 따라 최대 30분까지 소요될 수 있습니다!"
359,359,254,2690,A great spot to take a pics or vlogging! Although i was here when it was winter (its suuuuper cold) but i really like the palace :( i havent explore this place much bcs of the bad weather. But this palace is so great ok recommended,359,much,사진을 찍거나 블로그를 하기 좋은 곳! 나는 겨울 (그 suuuuper 추운) 때 여기에 있었지만 궁전을 정말 좋아합니다.
360,360,255,2704,"Very nice palace, with a beautiful lake, but very crowded and not much to see inside. People seem to go there mostly to take pictures in hanboks and not to experience the place itself. Entrance is very cheap.",360,much,"아름다운 호수가 있는 매우 멋진 궁전이지만 매우 붐비고 내부는 볼 것이 많지 않습니다. 사람들은 대부분 한복을 입고 사진을 찍기 위해 가는 곳이지, 그 자체를 경험하기 위해 가는 것 같다. 입장료가 매우 저렴합니다."
361,361,256,2714,You can reach here by seoul metro and stop at Gwa ghamun station. The palace is great and have much instagramable spots to take.,361,much,서울 지하철을 타고 여기까지 가실 수 있으며 과가문역에서 하차하세요. 궁전은 위대하고 많은 인스 타 그램 명소를 가지고 있습니다.
362,362,257,2722,"I think is the best historic place in Seoul, but there are better shrines in other Asian countries. If you are not a history gig and don't understand much about these places , so it would like all others shrines. Only thing makes it little different is the size. Is really big.",362,much,서울에서 가장 역사가 깊은 곳이라고 생각하지만 다른 아시아 국가에는 더 좋은 신사가 있습니다. 당신이 역사 공연이 아니고 이러한 장소에 대해 많이 이해하지 못한다면 다른 모든 신사를 원할 것입니다. 조금 다른 점은 크기뿐입니다. 정말 큽니다.
363,363,258,2726,"If you want a full on memorable experience here, rental a hanbok before you go. The girls wearing them were so cute that I regretted not getting one. This place is great for photo ops and roaming around the entire place to learn about how they lived centuries ago. It’s huge so you could spend at least 2 hours here. Not recommended on a hot summer day because you’re pretty much out out in the open. This one is larger than the UNESCO palace and better in my opinion. If you’re visiting Seoul, Myeongdong this is highly recommended. It’s walking distance to the cute Bukchon Village where people roam around in their hanboks as well. Great experience, I’d do it again but this time wearing a hanbok.",363,much,"이곳에서 잊지 못할 경험을 하고 싶다면 출발 전에 한복을 대여하세요. 입은 소녀들이 너무 귀여워서 하나 못 사서 아쉬웠습니다. 이 장소는 사진 촬영을 하고 수세기 전에 그들이 어떻게 살았는지 배우기 위해 전체 장소를 로밍하기에 좋습니다. 여기에서 최소 2시간을 보낼 수 있을 정도로 거대합니다. 야외 활동이 많기 때문에 더운 여름날에는 권장하지 않습니다. 이것은 유네스코 궁전보다 크고 내 의견으로는 더 좋습니다. 서울, 명동을 방문하신다면 이곳을 적극 추천합니다. 사람들이 한복을 입고 돌아 다니는 귀여운 북촌 마을까지 도보 거리입니다. 좋은 경험, 다시하고 싶지만 이번에는 한복을 입고 있습니다."
364,364,259,2730,This was the first palace I went to and I'm not sure if I find it that amazing... Probably if I have more time to go around and explore the entire compound. There were many tourists around that was probably why I did not enjoy it that much. It's great for experience purposes if you want to get exposed to Korean culture. There are a lot of things to do outside as well so you need not worry where to eat and stuff. It's also near other famous palaces and Insadong.,364,much,이것은 내가 처음으로 가본 궁전이었고 그것이 그렇게 훌륭하다고 생각하는지 확신할 수 없습니다... 아마도 내가 전체 화합물을 둘러보고 탐험할 더 많은 시간이 있다면. 주변에 관광객이 많아서 그런지 별로 즐기지 못한 것 같다. 한국 문화에 노출되고 싶다면 체험 목적으로 좋습니다. 야외에서도 즐길거리가 많으니 먹을거리와 먹거리 걱정은 하지 않으셔도 됩니다. 그것은 또한 다른 유명한 궁전과 인사동과도 가깝습니다.
365,365,260,2746,"Admission ticket is 3000 won, palace closed at 6pm, and last admission is at 5pm. A very huge compound, lotsa walking but nothing much to see except if its sakura else you see many people taking photos, young couples strolling (and more photos taking). Basically this is a paid admission to walk around the big compound. There is of course guards changing performance else I can't convince myself what else to see. The museum across is another different story.",365,much,"입장료는 3000원, 궁궐은 오후 6시 폐장, 마지막 입장은 오후 5시이다. 매우 거대한 복합물, 많이 걷고 있지만 그 사쿠라 외에는 많은 사람들이 사진을 찍고 있고 젊은 커플이 산책하는 것을 볼 수 있습니다. 기본적으로 이것은 큰 화합물을 돌아 다니는 유료 입장입니다. 물론 성능을 변경하는 경비원이 있습니다. 다른 것을 볼 수는 없습니다. 건너편에 있는 박물관은 또 다른 이야기입니다."
366,366,261,2751,"We went on a free Seoul airport tour to see this palace and did not get to see everything. It is a massive place where one should set aside a few hours to explore. We also went in the winter, when it was cold. I imagine in the summer it's a lot better. With that said, I really enjoyed walking and taking pictures of the various buildings. There wasn't too many places to go inside, but one could look into some of the main buildings, such as the throne room of the king.  This is pretty much a ""must see"" if you are going to Seoul and it is located right near the center of the city, so there's no excuse to miss it unless such things bore you.",366,much,"우리는이 궁전을보기 위해 무료 서울 공항 투어를 갔고 모든 것을 보지 못했습니다. 탐험하기 위해 몇 시간을 따로 떼어 놓아야 하는 방대한 장소입니다. 우리도 추운 겨울에 갔다. 여름에 가면 훨씬 좋을 것 같아요. 그런 의미에서 다양한 건물을 걸으며 사진을 찍는 것을 정말 즐겼습니다. 내부에 들어갈 곳이 많지는 않았지만 왕의 옥좌와 같은 주요 건물의 일부를 볼 수 있었습니다. 이것은 당신이 서울에 간다면 거의 ""필수""이고 도시의 중심 바로 근처에 위치하고 있으므로 그러한 것들이 지루하지 않는 한 그것을 놓칠 변명의 여지가 없습니다."
367,367,262,2757,"The Gyeongbokgung Palace was the main royal palace of the Joseon dynasty and was definitely a must-visit on our Seoul bucket list.. Built in 1395, it is located in northern part of Seoul and with that said, it was a rather gobsmacking experience to observe how much Seoul has modernised over the years just by standing at the entrance of the palace. The colours, design and interior of the palace was remarkable and well-preserved over the years.  I visited the place at 1pm, just in time for their change-of-guard ceremony which lasted for about 10 minutes. It was an interesting performance to witness and thank goodness for perfect timing. Expect a lot of tourists dressed up in hanboks (traditional Korean garments) lining up to take a photo with the palace guards or posing everywhere along the palace grounds (and I mean it, EVERY WHERE). I visited the palace on a Tuesday (mind you it was a non-holiday season) and it was packed. I can't imagine what it would be like on a weekend!  There are free tours of the palace grounds in English but I did not follow the crowd as I started getting annoyed at the number of tourists mindlessly carrying their selfie sticks and swinging them around everywhere. It was just me though, I dislike crowded places and flocks of tourists. Worth a visit, nevertheless!",367,much,"경복궁은 조선 왕조의 주요 왕궁이었고 서울 버킷리스트에 꼭 방문해야 할 곳이었습니다. 1395년에 지어진 서울 북부에 위치한 경복궁은 궁궐 입구에 서면 서울이 얼마나 현대화되었는지 알 수 있습니다. 궁전의 색상, 디자인 및 내부는 훌륭하고 수년에 걸쳐 잘 보존되어 있습니다. 약 10분간 진행된 교대식에 딱 맞춰 오후 1시에 현장을 찾았다. 완벽한 타이밍을 목격하고 감사하는 흥미로운 공연이었습니다. 한복을 입은 많은 관광객들이 궁궐 경비병과 사진을 찍기 위해 줄을 서거나 궁궐을 따라 도처에서 포즈를 취할 것으로 예상됩니다. 나는 화요일에 궁전을 방문했습니다. (공휴일이 아닌 것을 염두에 두십시오) 그것은 포장되었습니다. 주말에는 어떨지 상상이 안되네요! 영어로 궁궐 경내를 무료로 둘러볼 수 있는 투어가 있지만, 무심코 셀카봉을 들고 여기저기 휘둘러대는 관광객들의 숫자에 짜증이 나기 시작해서 나는 군중을 따라가지 않았다. 저만 그랬는데 사람이 많은 곳과 관광객이 많은 곳은 싫어요. 그럼에도 불구하고 방문할 가치가 있습니다!"
368,368,263,2777,This palace reminded me so much of the Forbidden City of Beijing except Gyeongbokgung had way more signs explaining the historical context. It's definitely worth a visit!,368,much,이 궁전은 경복궁을 제외하고는 베이징의 자금성을 많이 생각 나게했습니다. 역사적 맥락을 설명하는 표지판이 훨씬 많았습니다. 확실히 방문할 가치가 있습니다!
369,369,264,2786,"I was pretty excited to visit this palace actually. We reached there early in the morning by subway. Once there, people are gathering to watch changing guard ceremony. I thought it's gonna be awesome but it was just average and nothing special about it. We purchased tickets and was asked if I wanted to purchase entrance tickets for all palace. We purchased tickets for Gyeongbokgung Palace only and was glad we did not purchase ticket for all. Nothing much to see inside, not too big or too small. All building are closed. Even if it's open, there's nothing much to see. Nice place to take pictures though. There's a exit gate in the middle of the palace. Exit that way and turn left. You may walk to Bukchon Hanok Village which is just around the corner. 10 minutes walk is required.",369,much,실제로 이 궁전을 방문하게 되어 매우 기뻤습니다. 아침 일찍 지하철을 타고 그곳에 도착했다. 그곳에는 사람들이 근위병 교대식을 보기 위해 모여 있습니다. 굉장할 거라고 생각했는데 그냥 평범하고 특별한 건 없었어요. 우리는 표를 샀고 모든 궁전의 입장권을 사고 싶은지 물었습니다. 우리는 경복궁 입장권만 구매했고 모두 입장권을 구매하지 않아 기뻤습니다. 너무 크지도 작지도 않은 내부에 볼거리는 별로 없습니다. 모든 건물이 폐쇄되었습니다. 열려 있어도 볼 것이 별로 없습니다. 그래도 사진찍기 좋은 곳. 궁전 중앙에 출구가 있습니다. 그쪽으로 나가서 좌회전. 모퉁이만 돌면 북촌 한옥마을까지 걸어갈 수 있습니다. 도보 10분이 소요됩니다.
370,370,265,2790,"Gyeongbokgung Palace is one of the five palaces in Seoul area. This is the main palace of the Joseon Dynasty. Although the palace was restored after suffering damages in 1592 and during the Japanese occupation, the palace was restored beautifully by the Koreans. The palace ground is vast and houses many buildings and halls, all having their own use and purpose.  We made use of the free guided tour in English, provided by the Palace Management Office. The guided tour explains in detail the purpose and history behind each building in the palace. After the guided tour, we had a much better understanding of Korean history.  We also managed to catch the Changing of Palace Guard Ceremony. The ceremony was a reenactment based on historical documents and records.  For seniors(over 65 y/o), admission is free (make sure you bring your passport). Would recommend a visit if you are interested in history and ancient architecture. If we had more time in Seoul, we would like to visit few more of the other four palaces.",370,much,경복궁은 서울의 5대 궁궐 중 하나입니다. 조선왕조의 궁궐이다. 일제강점기인 1592년 피해를 입고 궁궐을 복원했지만 조선인들이 아름답게 복원했다. 궁전 부지는 광대하며 모두 고유한 용도와 목적을 가진 많은 건물과 홀이 있습니다. 우리는 Palace Management Office에서 제공하는 영어로 된 무료 가이드 투어를 이용했습니다. 가이드 투어는 궁전의 각 건물 뒤에 숨겨진 목적과 역사를 자세히 설명합니다. 가이드 투어가 끝난 후 우리는 한국 역사를 훨씬 더 잘 이해할 수 있었습니다. 우리도 그럭저럭 궁전 수비대 교대식을 잡을 수 있었습니다. 의식은 역사적 문서와 기록을 바탕으로 재연되었습니다. 고령자(65세 이상)는 무료입장(여권 지참 필수). 역사와 고대 건축물에 관심이 있다면 방문을 추천합니다. 서울에 시간이 더 있다면 다른 4곳 중 몇 곳을 더 방문하고 싶습니다.
371,371,266,2800,"Walking distance from our hotel, we visited the palace in the morning where there is not much people yet around. Good for taking photos and nice to see Korean architecture. You have to see the changing of guards that takes place at certain hours of the day. You can also rent traditional Korean attire at a few places around the palace to capture awesome memorable pictures.",371,much,"우리 호텔에서 도보 거리, 우리는 아직 사람들이 많지 않은 아침에 궁전을 방문했습니다. 사진찍기좋고 한국건축물보기좋음. 하루 중 특정 시간에 진행되는 경비원 교대식을 봐야 합니다. 또한 궁전 주변의 몇 곳에서 한국 전통 의상을 대여하여 기억에 남는 멋진 사진을 찍을 수 있습니다."
372,372,267,2810,"The Royal Palace is a must-see attraction if you want to appreciate the life style in the old Korean kingdom. The actual palace is rather large, with a lot of empty spaces. The actual living quarter for the residences are very small. There are simple buildings with several rooms and courtyards. In comparison, I found this Palace more formal than the Japanese. The design is similar the one in Beijing; but in a much much smaller scale.",372,much,왕궁은 옛 한국의 생활 방식을 감상하고 싶다면 꼭 봐야 할 명소입니다. 실제 궁전은 상당히 크고 빈 공간이 많습니다. 거주지의 실제 거주 구역은 매우 작습니다. 여러 개의 방과 안뜰이 있는 단순한 건물이 있습니다. 그에 비해 나는 이 궁전이 일본보다 더 형식적이라는 것을 알았습니다. 디자인은 베이징과 비슷합니다. 그러나 훨씬 더 작은 규모로.
373,373,268,2814,"I've been to this palace twice now, once in winter and the other in June and both times were so much fun. Attend the free tours and take your time walking around the grounds. Rent a hannok too!",373,much,"나는 지금 이 궁전에 두 번 갔다. 한 번은 겨울에, 다른 한 번은 6월에 갔고 두 번 모두 너무 재미있었다. 무료 투어에 참여하고 경내를 산책하는 시간을 가져보세요. 한옥도 빌려줘!"
374,374,269,2815,"While it’s sort of pretty with what there is, the palace grounds are really small and doesn’t really have much grandiosity to it. If compared to the forbidden palace, it pales greatly in comparison. Most (if not all) of the palace is reconstructed from a fire before being abandoned for a few centuries, so it doesn’t look or feel how an ancient structure would typically be. At the end of the palace, beyond it, there are some weird prison like structures that absolutely destroys the beauty of the mountain as a backdrop to the palace. Entry fee isn’t expensive though, at US$3, so it’s worth a visit if you’re exploring the area. Not really worth a detour.",374,much,"있는 것만으로도 꽤 아름답지만, 궁전 부지는 정말 작고 웅장하지 않습니다. 금단의 궁전에 비하면 크게 창백하다. 궁전의 대부분(전부는 아닐지라도)은 몇 세기 동안 버려지기 전에 화재로 재건되었으므로 고대 건축물이 일반적으로 어떻게 생겼는지 느껴지거나 느껴지지 않습니다. 궁의 끝자락, 그 너머에는 궁을 배경으로 하는 산의 아름다움을 절대적으로 파괴하는 기이한 감옥과 같은 구조물이 있습니다. 입장료가 미화 3달러로 비싸지 않기 때문에 이 지역을 탐험할 때 방문할 가치가 있습니다. 우회할 가치가 없습니다."
