,Unnamed: 0.1,index,Unnamed: 0,서울대공원부정단어리뷰,index.1,단어,번역
0,0,0,10,Not much to see here all buildings are empty and look the same,0,much,여기에서 볼 것이 많지 않습니다 모든 건물이 비어 있고 똑같이 보입니다.
1,1,1,20,A cultural landmark that needs to be visited when in Seoul I havent been to any of the other royal palaces in Seoul so I cant compare but we thought this place was great and not crowded we visited a weekday in May Ive been here before and then it was much more crowded but even then it felt like there were plenty of space for everyone You should probably combine this with the Secret Garden but unfortunately we didnt have the time I recommend this place,1,much,서울에있을 때 방문해야 할 문화 랜드 마크 나는 서울의 다른 왕궁에 가본 적이 없어서 비교할 수 없지만 우리는이 장소가 훌륭하고 혼잡하지 않다고 생각했습니다. 우리는 5 월 평일에 방문했습니다. 훨씬 더 혼잡했지만 모든 사람들을위한 충분한 공간이있는 것처럼 느껴졌습니다. 이것을 Secret Garden과 결합해야하지만 불행히도 시간이 없었습니다.이 장소를 추천합니다.
2,2,2,30,A wonderful palace to visit when you come to Seoul It is a lot less busy than Gyeongbokgung Palace which makes your visit to it seem a lot more personal and intimate Whilst here you can marvel at the architecture of the palace and its surrounding buildings or take a stroll through the many gardens and paths or relax at the lake There is so much to do in this place and I recommend you spend a minimum 2 hours here to fully appreciate it Would love to come back here,2,much,서울에 오면 방문하기 좋은 궁궐 경복궁보다 훨씬 덜 붐비므로 방문하는 것이 훨씬 더 개인적이고 친밀해 보입니다. 이곳에서 궁궐과 주변 건물의 건축 양식에 감탄하거나 사진을 찍을 수 있습니다. 많은 정원과 길을 산책하거나 호수에서 휴식
3,3,3,57,It was a really nice afternoon sadly the secret garden was closed apparently you had to prebook tickets which we were unaware of the sign said for covid but I met a person the next day who said she went the same day and possibly time as us so prebook those tickets if you want to see the gardens For the rest of it I thought is was much more beautiful than Gyeongbokgun Palace but it did seem a bit smaller Well worth the visit if youre in Seoul,3,much,슬프게도 비밀 정원이 문을 닫은 것은 정말 좋은 오후였습니다. 분명히 당신은 우리가 covid에 대해 말한 표시를 알지 못하는 티켓을 사전 예약해야했지만 다음 날 그녀가 우리와 같은 날 그리고 아마도 우리와 같은 시간에 갔다고 말한 사람을 만났습니다. 정원을보고 싶다면 그 티켓을 나머지는 경복궁보다 훨씬 더 아름답다고 생각했지만 조금 작아 보였습니다. 서울에 있다면 방문할만한 가치가 있습니다.
4,4,4,90,"Stunning palace. I have a lot of time in Seoul and Korea so going to see all the palaces. If your time is limited, definitely do this one. Time your visit accordingly with the mandatory guided tour of the Secret Garden. Annoyingly they appear to change timings so check online the day before your visit. I got there at 09:00 when they opened. I was the first person inside. I walked around the palace grounds myself for just over an hour and then did the English guided Secret Garden tour at 10:30 which finished around noon. Lasts about one and a half hours. You can leave the tour after fifty minutes as the last part is quite a bit of walking including uphill. For most of us it is fine but others were struggling with the heat even though it was early and parts of it are uphill so be mindful. I spent in total three hours there. Separate ticket for the palace and Secret Garden. They do have guided tours of the palace itself but to be honest, you can easily do this yourself. They give you a booklet plus there are information boards. Suggest going early as soon as it opens. It was beautiful and peaceful and you could freely walk around and enjoy the setting, also getting some good photographs. When I left at noon, it was much busier. Grounds are clean and well laid out. The palace was stunning. I loved the details of the doors and the architecture. There is a cafe and what appeared to be an art or souvenir shop on the premises. I didn't bother with it. Take water with especially if you are there for three hours like me. There are restrooms too. My thoughts. The Secret Garden is apparently the highlight. Whilst this was nice, I think the weather will contribute towards your experience. We had a lovely day and the sun shining with the reflection on the water and the colours of the leaves made the gardens look very pretty. However, we can't control the weather and I would suggest thinking about this if you have a day with bad weather. Parts of the garden were nice but other parts started to look the same. I started to get bored as did a lot of the group. I was glad I went though. The guide was difficult to understand (although the tour was in English) but there are information boards as well along the route which also provide useful facts. They limit the number of people on the tour so purchase a ticket as soon as you arrive.",4,much,"멋진 궁전. 나는 서울과 한국에 시간이 많아서 모든 궁궐을 보러 갑니다. 시간이 제한되어 있다면 반드시 이 작업을 수행하십시오. Secret Garden의 필수 가이드 투어에 따라 방문 시간을 정하십시오. 짜증나게도 그들은 시간을 변경하는 것처럼 보이므로 방문 전날 온라인으로 확인하십시오. 오픈시간인 09:00에 도착했어요. 나는 그 안에 있는 첫 번째 사람이었다. 나는 1시간 조금 넘게 궁궐 주변을 걷다가 정오쯤 끝난 10시 30분에 영국식 시크릿 가든 투어를 했다. 약 1시간 30분 동안 지속됩니다. 마지막 부분은 오르막을 포함하여 꽤 걸어야 하므로 50분 후에 투어를 떠날 수 있습니다. 우리 대부분은 괜찮지만 다른 사람들은 이른 시간임에도 불구하고 더위와 고군분투하고 있습니다. 나는 거기에서 총 3시간을 보냈다. 궁전과 시크릿 가든은 별도의 티켓입니다. 그들은 궁전 자체에 대한 가이드 투어를 제공하지만 솔직히 말해서 혼자서 쉽게 할 수 있습니다. 그들은 당신에게 소책자와 정보 게시판을 제공합니다. 열리면 일찍 가시는 것이 좋습니다. 그것은 아름답고 평화로웠고 자유롭게 걸으며 배경을 즐기고 좋은 사진을 찍을 수 있었습니다. 정오에 출발했을 때는 훨씬 더 바빴다. 부지가 깨끗하고 잘 정돈되어 있습니다. 궁전은 충격적이었다. 나는 문과 건축물의 세부 사항을 좋아했습니다. 구내에는 카페와 예술품이나 기념품 가게로 보이는 것이 있습니다. 나는 그것을 귀찮게하지 않았다. 특히 나처럼 3시간 동안 그곳에 있다면 물을 가지고 가십시오. 화장실도 있습니다. 내 생각. 시크릿 가든이 하이라이트인 것 같습니다. 이것은 좋았지 만 날씨가 당신의 경험에 기여할 것이라고 생각합니다. 우리는 멋진 하루를 보냈고 태양은 물에 반사되어 빛나고 나뭇잎의 색은 정원을 매우 아름답게 만듭니다. 하지만 우리는 날씨를 제어할 수 없으며, 날씨가 좋지 않은 날이라면 이 점을 고려하는 것이 좋습니다. 정원의 일부는 멋졌지만 다른 부분은 똑같이 보이기 시작했습니다. 나는 많은 그룹이 그랬던 것처럼 지루해지기 시작했다. 그래도 가길 잘했다. 가이드는 이해하기 어려웠지만(투어는 영어로 진행되었지만) 경로를 따라 유용한 정보를 제공하는 정보 게시판도 있습니다. 투어 인원이 제한되어 있으므로 도착하자마자 티켓을 구매하세요."
5,5,5,91,"In this park is a large collection of, mostly repaired and rebuild ancient historical buildings, excellent to learn about Korea's history, Very much worth the visit!",5,much,이 공원에는 한국의 역사에 대해 배울 수 있는 훌륭한 고대 역사적 건물이 대부분 수리 및 재건된 대규모 컬렉션이 있습니다. 방문할 가치가 있습니다!
6,6,6,108,"Set within a large park, accessible by subway, bus or tour, this Prospering Virtue Palace was built during the Joseon Dynasty. It served as the main palace for nearly 270 years following its destruction during the Japanese invasion and its subsequent rebuilding. A visitor may note that one building in particular, the Seonjeongjeon Hall is the only building featuring a tiled blue roof. There indeed is a love story to the history of this exquisite and beautiful palace, yet I shall leave that for the visitor to enjoy on their visit.  One detail in particular that distinguishes this palace from other palaces of the Joseon Dynasty is the palace gardens, and I am already planning my return trip to behold the “Quintessence of Joseon-era Landscaping” in spring or summer, to step where Kings and Queens strolled, relaxed, and perhaps engaged in sericulture. To truly savor visiting the Changdeokgung Palace I need to walk its gardens, valleys, pavilions and behold the lotus ponds and then see the Palace from otherwise hidden views. The Secret Garden occupies more than half of the entirety of Changdeokgung Palace, and I am delighted to plan my return to see the views from the Buyongji Pond and Juhamnu Pavilion, Aeryeonji Pond and Uiduhap, the New Seonwonjeon (New Royal Shrine) and so much more.  In the meantime I hope you enjoy my photographs of Changdeokgung Palace.  Please note that the admission to the Changdeokgung Palace is separate from the admission to the Secret Garden and, at least as of this writing, there is (but verify this) a Royal Palace Pass valid for 3 months from the purchase date, which includes admission to the Changdeokgung Palace and the Secret Garden; the Gyeongbokgung Palace; the Changgyeonggung Palace; the Deoksugung Palace; and the Jongmyo Shrine.",6,much,"지하철, 버스 또는 투어로 갈 수 있는 큰 공원 내에 위치한 이 번영하는 미덕은 조선 왕조 시대에 지어졌습니다. 임진왜란 때 파괴되고 재건된 후 거의 270년 동안 본궁으로 사용되었습니다. 방문객들은 특히 한 건물인 선정전이 유일한 파란색 기와지붕이라는 사실을 알 수 있습니다. 이 절묘하고 아름다운 궁전의 역사에는 참으로 사랑 이야기가 있지만 방문객이 방문할 때 즐길 수 있도록 남겨 두겠습니다. 특히 이 궁궐을 다른 조선 궁궐과 구별짓는 부분은 궁궐 정원인데, 벌써 봄이나 여름에 '조선조경의 정수'를 보고 왕과 왕비가 있는 곳으로 돌아오는 여행을 계획하고 있다. 산책하고, 편안하게 쉬며, 아마도 양잠에 종사했을 것입니다. 창덕궁 방문을 진정으로 즐기려면 정원, 계곡, 정자를 거닐고 연꽃 연못을 본 다음 숨겨진 전망에서 궁전을 봐야 합니다. 비밀정원은 창덕궁 전체 면적의 절반 이상을 차지하고 있으며, 부용지와 주함루, 애련지와 의두합, 신선원전 등 많은 전망을 보기 위해 다시 돌아오도록 계획하게 되어 기쁩니다. 더. 그동안 창덕궁에서 찍은 사진을 즐겨주시기 바랍니다. 창덕궁 입장은 비밀의 정원 입장과 별개이며, 최소한 이 글을 쓰는 시점에는 구매일로부터 3개월 동안 유효한 왕궁 패스(입장 포함)가 있습니다. 창덕궁과 비밀의 정원으로; 경복궁; 창경궁; 덕수궁; 그리고 종묘."
7,7,7,111,"From Anguk subway station, head east from Exit 3, and you will find the entrance to the palace. Admission was reasonable at 3,000 won. You get to see the Throne Hall, with the impressive king's chair. Other than that, a lot was under repair, and you don't get to access the King's residence building, so not much to see. We didn't know how or if you could access the Queen's residence building (behind the King's residence building)... so overall, we didn't get to see much; however, the ones we saw were well preserved.",7,much,"지하철 안국역 3번출구에서 동쪽으로 가면 궁궐 입구가 나옵니다. 입장료는 3,000원으로 합리적이었습니다. 인상적인 왕의 의자가 있는 왕좌의 홀이 보입니다. 그 외에 많은 부분이 수리 중이었고 왕의 거주 건물에 액세스 할 수 없으므로 볼 것이 많지 않습니다. 우리는 어떻게 또는 당신이 여왕의 거주 건물(왕의 거주 건물 뒤)에 접근할 수 있는지 몰랐습니다... 그래서 전반적으로 우리는 많이 볼 수 없었습니다. 그러나 우리가 본 것들은 잘 보존되었습니다."
8,8,8,121,"Historically palace, if you wearing hanbok , you get to enter for free because Koreans care much about their traditions. Very impressed.",8,much,역사적으로 궁궐은 한복을 입으면 무료로 입장할 수 있는 한국인들이 전통을 중시하기 때문입니다. 매우 감동.
9,9,9,131,"Visited the palace first before Gyeongbokgung. Read reviews that this palace was designed to be in harmony with the environment and after arriving there, it can be observed as to how it is. For a Palace, it is certainly not imposing as the Gyeongbokgung one and certainly no surprise why many princes chose to have their palace here. Unfortunately, I did not follow any guided tour for the front part if the palace, thus may have missed much interesting snippets.  However the guided tour to the ""Secret Garden"" is a must. Only entered with a guided tour, they are conducted at different times for different languages. I say it's a must so when you visit, u can imagine how the palace designers have made much effort to be a environmentally harmonious building. Do make a point to visit it.",9,much,"경복궁보다 먼저 궁궐을 찾았다. 이 궁전은 환경과 조화를 이루도록 설계되었다는 리뷰를 읽고 그곳에 도착하면 어떤 모습인지 관찰할 수 있습니다. 궁의 경우 경복궁처럼 위풍당당하지 않으며 많은 왕자들이 이곳을 궁궐로 선택한 것도 놀라운 일이 아닙니다. 불행히도 궁전의 경우 앞 부분에 대한 가이드 투어를 따르지 않았기 때문에 많은 흥미로운 스니펫을 놓쳤을 수 있습니다. 그러나 ""비밀의 정원""으로의 가이드 투어는 필수입니다. 가이드 투어로만 입장하며 언어별로 다른 시간에 진행됩니다. 꼭 가봐야 하는 곳이라 궁전 디자이너들이 환경적으로 조화로운 건물이 되기 위해 얼마나 많은 노력을 했는지 상상이 가실 겁니다. 그것을 방문하는 포인트를 만드십시오."
10,10,10,137,"A much often overlooked attraction compared to its more renowned 'sister' palace, the Gyeongbokgong.  The palace grounds are larger and the palace was used as a residence for the royal family back in the old days. Recommend to visit during the autumn due to sights of the structures complemented by the bright colors of the autumn foliage",10,much,더 유명한 '자매' 궁인 경복궁에 비해 많이 간과되는 명소입니다. 궁궐은 규모가 더 크고 궁궐은 옛날에 왕실의 거처로 사용되었던 곳입니다. 알록달록 단풍이 물들인 건축물들과 어우러져 가을철에 방문하는 것을 추천합니다.
11,11,11,144,This tour includes a guided tour of the palace grounds at night plus a performance at the end if the tour. We were served hot Korean tea in a disposable cup and given a goodie bag containing a purse and a bar of soap. It would have been nice if we were given some traditional Korean sweets instead of the soap. Try the moonlight tour if you want a different experience but do note the price is much higher than the day ticket.,11,much,이 투어에는 야간 가이드 투어와 투어가 끝나면 마지막 공연이 포함됩니다. 우리는 일회용 컵에 뜨거운 한국 차를 제공 받았고 지갑과 비누 한 개가 들어있는 과자 가방을 받았습니다. 비누 대신 한국 전통 과자를 줬다면 좋았을 텐데. 색다른 경험을 원하신다면 달빛 투어를 시도해 보세요. 그러나 가격은 당일 티켓보다 훨씬 비싸다는 점에 유의하세요.
12,12,12,152,I went to Changdeokgung Palace on a Sunday afternoon. It has less much people than Gyeongbokgung Palace. But I was not disappointed. I had opportunity to take many beautiful photos with interruption from other tourists. Don't expect grand buildings here as well as other palaces in Seoul. It offers a different kind of beauty and experience comparing to palaces in Beijing.,12,much,일요일 오후 창덕궁에 다녀왔습니다. 경복궁보다 사람이 적습니다. 그러나 나는 실망하지 않았다. 다른 관광객들의 방해를 받으며 아름다운 사진을 많이 찍을 수 있는 기회가 있었습니다. 서울의 다른 궁전과 마찬가지로 이곳의 웅장한 건물을 기대하지 마십시오. 베이징의 궁궐과는 또 다른 아름다움과 경험을 선사합니다.
13,13,13,170,I hired the traditional “hanbok” dress to wear to the palace and get nice photos. This place is perfect for photos and the architecture and history is beautiful. Wearing the traditional dress made it more surreal and it really felt like you were there. It is a huge place so bring water and get as much photos as you can.,13,much,"나는 궁전에 입고 멋진 사진을 찍기 위해 전통적인 ""한복""드레스를 고용했습니다. 이곳은 사진을 찍기에 완벽하고 건축물과 역사가 아름답습니다. 전통의상을 입으니 더욱 초현실적이고 마치 그곳에 있는 것 같은 기분이 들었습니다. 그것은 거대한 장소이므로 물을 가져 와서 가능한 한 많은 사진을 찍으십시오."
14,14,14,176,Very much enjoyed wandering around this UNESCO site. Now regret that we didn’t do the Secret Gardens but we were tiring.,14,much,이 유네스코 사이트를 돌아 다니는 것을 매우 즐겼습니다. 지금은 시크릿가든을 안 해서 아쉬웠는데 피곤했다.
15,15,15,192,"The palaces are beautiful and the grounds are well-landscaped. The original buildings were burned by the Japanese during their occupation of Korea, so these are recreations, but feel ancient. The guides at the library are very kind and helpful providing very interesting information. Take your time, there is a lot to see. It is also common to see people dressed in the garb of that time period which really adds to the atmosphere as you wander the grounds. There is so much history here. And if you are there in the summer, bring the sun umbrellas. It is hot and rain is frequent at that time of year. The little cafe has limited offerings, so you may want to bring food. Note of caution: If you take the Hop On Hop Off bus, they drop you off a quite a ways from the entrance. It is better to get off at the stop prior; it is much closer to the entrance.",15,much,궁전은 아름답고 경내는 조경이 잘 되어 있습니다. 원래 건물은 일제에 의해 한국에 의해 불탔기 때문에 레크리에이션이지만 고대 느낌이납니다. 도서관의 가이드는 매우 친절하고 매우 흥미로운 정보를 제공하는 데 도움이 됩니다. 시간을 내어 보세요. 볼거리가 많습니다. 또한 그 시대의 복장을 한 사람들을 흔히 볼 수 있어 경내를 돌아다닐 때 분위기를 더해줍니다. 여기에는 많은 역사가 있습니다. 그리고 여름에 거기에 있다면 우산을 가져 오십시오. 덥고 비가 자주 내리는 시기입니다. 작은 카페에는 제한된 상품이 있으므로 음식을 가져오는 것이 좋습니다. 주의 사항: Hop On Hop Off 버스를 타면 입구에서 꽤 멀리 내려줍니다. 미리 정류장에서 내리는 것이 좋습니다. 입구에서 훨씬 가깝습니다.
16,16,16,193,Lovely place filled with history. There is so much to see. We did t have time to do the secret gardens. It was a very good visit.,16,much,역사가 가득한 아름다운 곳. 볼 것이 너무 많습니다. 우리는 비밀 정원을 할 시간이 없었습니다. 아주 좋은 방문이었습니다.
17,17,17,210,"This is the most special of all the palaces and probably the one to visit in case you plan on doing one only. The palace is spacious with large open places. Tourists are not allowed inside much of the covered areas and most of the time you are out in the open. So it can be harsh during summers. But still if you are touring seoul this is one of the must do activities. Just be prepared for the walk and the sun. The secret garden tour is amazing and can only be taken as a guided tour of roughly 70 min duration in summers and 90 during other times. Most of cultural heritage sites including this palace in seoul are free to enter from Aug 10 -25, due to National Liberation Day celebrations...however secret garden tour is paid and needs to be booked atleast a day prior. There is a souvenir and refreshment shop inside for the tourists. From the inside one can also tour the Changgyeonggung palace since the two are connected. The entire tour including the palaces and secret garden can take from 2-3 hours.",17,much,"이것은 모든 궁전 중에서 가장 특별하며 아마도 하나만 할 계획이라면 방문해야 할 궁전입니다. 궁전은 넓고 개방된 장소가 있습니다. 관광객은 지붕이 있는 대부분의 지역 내부에 들어갈 수 없으며 대부분의 시간은 야외에 있습니다. 따라서 여름에는 가혹할 수 있습니다. 그러나 여전히 서울을 여행한다면 이것은 꼭해야 할 활동 중 하나입니다. 산책과 태양을 위한 준비만 하면 됩니다. 비밀 정원 투어는 놀랍고 여름에는 약 70분, 다른 시간에는 90분의 가이드 투어로만 진행할 수 있습니다. 서울에 있는 이 궁전을 포함한 대부분의 문화 유산은 광복절 기념으로 8월 10일부터 25일까지 무료로 입장할 수 있습니다. 그러나 비밀 정원 투어는 유료이며 최소 하루 전에 예약해야 합니다. 내부에는 관광객들을 위한 기념품과 다과 가게가 있습니다. 창경궁과 궁궐이 연결되어 있기 때문에 내부에서도 창경궁을 견학할 수 있습니다. 궁전과 비밀 정원을 포함한 전체 투어는 2-3시간이 소요됩니다."
18,18,18,227,"Absolutely magnificent palace complex. I spent about 5 hours wandering around the inner and outer court before exploring the palace itself and the secret gardens. I was mesmerised by it to be honest. I intended to spend a couple of hours, a half day at most, but ended up spending pretty much a whole day here. The gardens are extra, 5000 won, but are well worth it. The place is stunning obviously but don't rush through the inner and outer courtyards as they are just as enchanting. One of the best days I've had on tour in a long, longt ime and definitely the best and most beautiful attraction in Seoul. An absolute must-do in my opinion.",18,much,"절대적으로 웅장한 궁전 단지. 나는 궁전 자체와 비밀 정원을 탐험하기 전에 약 5 시간을 안뜰과 바깥뜰을 돌아 다니며 보냈습니다. 나는 그것에 매료되어 정직했다. 나는 기껏해야 반나절, 두 시간을 보낼 생각이었지만 결국 여기에서 거의 하루 종일을 보냈다. 정원은 추가 5000원이지만 그만한 가치가 있습니다. 장소는 분명히 놀랍지만 매혹적인 것처럼 내부 및 외부 안뜰을 서두르지 마십시오. 길고 긴 시간 동안 내가 서울에서 가장 아름답고 가장 아름다운 명소로 여행을 다녀온 최고의 날 중 하나입니다. 제 생각에는 절대적으로 해야 할 일입니다."
19,19,19,236,"I’d premise this with the fact it was an exceptionally hot and humid day we visited Changdeokgung palace which definitely impacted our enjoyment. The gardens are the main reason to visit and they are lovely (no flowers, all trees and greenery when we went in June - well maintained) but I would say beyond walking around the gardens, there wasn’t much to do. The entry price was only 1,000 won which is cheap but for that you can’t get inside any of the buildings and when it is hot, it’s a bit relentless.  So in short I’d recommend a short visit but not on a hot day.",19,much,"나는 우리가 창덕궁을 방문한 매우 덥고 습한 날이라는 사실을 전제로 하여 우리의 즐거움에 확실히 영향을 미쳤습니다. 정원은 방문해야 하는 주된 이유이며 아름답습니다(6월에 갔을 때 꽃이 없고 모든 나무와 녹지가 잘 관리됨). 하지만 정원을 산책하는 것 외에는 할 일이별로 없었습니다. 입장료는 1,000원으로 저렴하지만 건물 안으로 들어갈 수 없고 더울 땐 조금 가차다. 그래서 간단히 말해서 짧은 방문을 추천하지만 더운 날은 아닙니다."
