,Unnamed: 0.1,index,Unnamed: 0,서울대공원부정단어리뷰,index.1,단어,번역
537,537,164,1742,"I find the Changdeokgung Palace complex much more beautiful than Gyeongbokgung Palace, as the former has a lot of beautiful trees and ponds, and different types of buildings, giving visitors a sense of a living space. Gyeongbokgung Palace has just buildings.",537,much,"나는 창덕궁이 경복궁보다 훨씬 더 아름답다고 생각한다. 창덕궁에는 아름다운 나무와 연못, 다양한 건물이 있어 방문객들에게 생활 공간의 느낌을 주기 때문이다. 경복궁은 건물만 있다."
538,538,165,1745,"It is worth doing a guided tour. They are included in admission price, and you get much more out of it",538,much,가이드 투어를 할 가치가 있습니다. 그들은 입장료에 포함되어 있으며 훨씬 더 많은 것을 얻을 수 있습니다.
539,539,166,1754,"I only visited the Secret garden, it needs reservation so I did it in my home country. Paid 5000 KW. A guided tour will be provided. Took 1 hr 15 minutes. It's claimed to be one of the palace that was most often visited by the emperor due to its beauty. It's a nice, serene place surrounded by greenery, blossoming flowers. Ancient pavilions with chinese poem on it could be found. But it's not too much of a surprise to us. Perhaps we were already awestruck by Gyeongbokgung palace a day earlier =)",539,much,시크릿가든만 가봤는데 예약이 필요해서 모국에서 했어요. 5000KW를 지불했습니다. 가이드 투어가 제공됩니다. 1시간 15분 걸렸다. 그 아름다움 때문에 황제가 가장 자주 방문했던 궁전 중 하나라고 합니다. 싱그러운 풀과 만개한 꽃으로 둘러싸인 조용하고 아름다운 곳입니다. 중국 시가 있는 고대 정자를 찾을 수 있습니다. 그러나 우리에게는 그다지 놀라운 일이 아닙니다. 아마도 우리는 하루 전에 이미 경복궁에 경외감을 느꼈을 것입니다 =)
540,540,167,1755,"Since we are staying in a guesthouse near the palace we went there early as it is very humid that day. The Guided tour in English started at 10:00hrs but we were there by 9:00hrs and we already look around and took photos. This is recommended if you like to focus on the interesting history talks of the tour guide wearing Traditional Korean Hanbok while showing you around the palace. It will take an hour till your next tour to the Secret Garden. That's why you don't have time to take much photos because there's a lot of places you will be visiting with the group (in fast pace) then next going uphill to the garden. You must wear running shoes, enough sunblock, insect repellent, water and eye shades as you are going to do some hiking. We visited the area during summer (June 2015). The tour in the secret garden and the admission fee are separate purchase at the ticket booth. But since you are already there, you might be up to doing some adventure while discovering the King's hide out when he needs to be alone and relax. Definitely a must visit!",540,much,"우리는 궁전 근처의 게스트 하우스에 머물기 때문에 그날 매우 습하여 일찍 거기에갔습니다. 영어 가이드 투어는 10:00에 시작되었지만 우리는 9:00에 거기에 있었고 이미 주위를 둘러보고 사진을 찍었습니다. 한복을 입고 궁궐을 둘러보는 가이드의 흥미로운 역사 이야기에 집중하고 싶다면 이곳을 추천합니다. 다음 시크릿 가든 투어까지는 1시간이 소요됩니다. 그래서 사진을 많이 찍을 시간이 없는 이유는 그룹과 함께(빠른 속도로) 방문하고 다음에 정원으로 오르막으로 올라가야 할 장소가 많기 때문입니다. 하이킹을 할 때 운동화, 충분한 자외선 차단제, 방충제, 물 및 눈가리개를 착용해야 합니다. 우리는 여름(2015년 6월)에 이 지역을 방문했습니다. 비밀정원 투어와 입장료는 매표소에서 별도 구매합니다. 그러나 당신은 이미 그곳에 있기 때문에 왕이 혼자 있고 휴식을 취해야 할 때 왕의 은신처를 발견하면서 모험을 할 수도 있습니다. 반드시 방문해야합니다!"
541,541,168,1766,This is definitely one of the most beautiful places in Seoul. The carefully curved and colorfully decorated buildings look really marvelous. When walking along I had a chance to admire the old builders' effort. That gave me the chance to imagine how much the Koreans respected the emperor's authority. The buildings are perfectly set inside the peaceful park. This is very Asian style which philosophy is to cooperate not interfere with nature. Walking along the gardens was a very relaxing experience for me after the hustle and bustle of contemporary Seoul. To sum up this place is one of Your must see list when in Korea.,541,much,이것은 확실히 서울에서 가장 아름다운 장소 중 하나입니다. 세심하게 곡선을 그리며 형형색색으로 장식된 건물들이 정말 멋져 보입니다. 길을 걷다 보니 옛 건축가들의 노고에 감탄할 수 밖에 없었습니다. 한국인들이 황제의 권위를 얼마나 존경했는지 짐작할 수 있는 기회였다. 건물은 평화로운 공원 안에 완벽하게 자리 잡고 있습니다. 자연을 거스르지 않고 협력하는 것이 철학인 매우 아시아적인 스타일입니다. 현대 서울의 분주함을 뒤로하고 정원을 따라 걷는 것은 나에게 매우 편안한 경험이었습니다. 이 장소를 요약하면 한국에있을 때 반드시보아야 할 목록 중 하나입니다.
542,542,169,1771,"Changdeokgung Palace is not all that different from Deoksegung (Toksegung) or Duksoo Palace or even Kyongbokkung (Gyeongbukgung) Palace (minus the National Palace Museum) except for the Piwon (Biwon), the Secret Garden that's really more of a large wood and that makes a visit to Changdeokgung really worthwhile. But note that the Piwon is only open to guided tours that are alternatively in Korean, Japanese and English, so make sure to check the schedule and get there early because the tour of the Piwon is very popular. Also, be prepared for a long walk uphill and downhill through the Secret Garden, which must be as large as the gardens at Versailles but is much more rugged terrain. There's a fee for the Secret Garden, but it's only about $5 and it's worth it. I went with a friend on a very hot day in July and it was exhausting but worthwhile. The gift shop has a little cafe and is air conditioned; they also have expensive but nice souvenirs as well as wi-fi (the only place on the grounds of the palace with wi-fi). When you leave, walk out the main gate to the right and walk just a few blocks and you'll be in Bukchon Village, which is also really worthwhile; it's also a good place to eat lunch or dinner.",542,much,"창덕궁은 덕세궁(Toksegung)이나 덕수궁(Duksoo Palace), 경복궁(경북궁)(국립고궁박물원 빼기)과 별반 다르지 않지만, 비원(비원)은 정말 큰 나무에 가깝고 창덕궁 방문은 정말 가치가 있습니다. 단, 피원은 한국어, 일본어, 영어로 번갈아 진행되는 가이드 투어만 가능하니, 피원 투어가 인기가 많은 만큼 일정을 잘 확인하고 일찍 가세요. 또한 베르사유의 정원만큼 커야 하지만 훨씬 더 험준한 지형인 Secret Garden을 통해 오르막과 내리막 긴 산책을 할 준비를 하세요. 시크릿 가든은 유료이지만 5달러 정도에 그만한 가치가 있습니다. 나는 7 월의 매우 더운 날에 친구와 함께 갔고 피곤했지만 가치가있었습니다. 선물 가게에는 작은 카페가 있으며 에어컨이 있습니다. 그들은 또한 비싸지 만 멋진 기념품과 Wi-Fi (와이파이가있는 궁전 부지의 유일한 장소)를 가지고 있습니다. 나올 때 정문을 나와 오른쪽으로 몇 블록만 걸어가면 북촌 마을이 나옵니다. 역시 볼 만한 곳입니다. 점심이나 저녁을 먹기에도 좋은 곳입니다."
543,543,170,1774,"We visited the palace with our kids and spent an hour on the English speaking tour. Out tour guide was very good, although she reminded me a little too much of JuDee (tour guide from the Avatar cartoons). Beatiful grounds and. Interesting history made this a very worth while location.",543,much,우리는 아이들과 함께 궁전을 방문했고 영어 말하기 투어에 1시간을 보냈습니다. 그녀가 JuDee (Avatar 만화의 여행 가이드)를 너무 많이 생각 나게했지만 아웃 투어 가이드는 매우 좋았습니다. 아름다운 근거와. 흥미로운 역사는 이것을 매우 가치있는 위치로 만들었습니다.
544,544,171,1776,"I wouldn't call this a must see, but I must say that I really enjoyed it despite the biting cold. One thing I love about Seoul's historical attractions is that they include free English tours, you just have to make sure you have the times right and that you are on time. Unfortunately I missed the last secret garden tour, which is said the be the highlight. Nevertheless, I found the tour to be fun, interesting, and very informative. Really, don't miss the tour, it is 70% of the experience. I found it more interesting than the main palace, Gyeongbukgong, equally beautiful, and much less crowded.",544,much,"이것을 꼭 봐야한다고 말할 수는 없지만 매서운 추위에도 불구하고 나는 그것을 정말로 즐겼다고 말해야합니다. 서울의 역사적 명소에 대해 제가 좋아하는 것 중 하나는 무료 영어 투어가 포함되어 있다는 것입니다. 아쉽게도 하이라이트라고 하는 마지막 비밀정원 투어를 놓쳤습니다. 그럼에도 불구하고 나는 여행이 재미있고 흥미롭고 유익하다는 것을 알았습니다. 정말, 투어를 놓치지 마세요. 경험의 70%입니다. 나는 그것이 똑같이 아름답고 훨씬 덜 붐비는 본궁인 경북궁보다 더 흥미롭다는 것을 알았습니다."
545,545,172,1781,We were able to catch the english tour which was so much more informative and interestinf then just walking around by yourself. I found this palace to be much more beautiful and scenic although the buildings itself were much smaller as the gardens and trees were more elaborate then the other palaces. Free admission for the month of july!,545,much,우리는 훨씬 더 유익하고 흥미로운 영어 여행을 잡을 수있었습니다. 정원과 나무가 다른 궁전보다 더 정교했기 때문에 건물 자체는 훨씬 작았지만이 궁전이 훨씬 아름답고 경치가 좋다는 것을 알았습니다. 7월 한달간 무료입장!
546,546,173,1787,"A nice palace with the usual decorated roofs, and pleasing complexes of interconnected buildings. The secret garden was fine, but not especially beautiful, and a long organised walk in a large group is not the best way to enjoy it. Maybe at just the right cherry moment it would be worth it (I was a week and a storm or two too late), but otherwise don't worry too much if you miss it.",546,much,"일반적으로 장식된 지붕이 있는 멋진 궁전과 상호 연결된 건물의 쾌적한 단지입니다. 비밀의 정원은 괜찮았지만 특별히 아름답지는 않았고, 단체로 길게 조직된 산책을 즐기는 것이 가장 좋은 방법은 아닙니다. 아마도 적절한 체리 순간에 그것은 그만한 가치가있을 것입니다 (나는 일주일과 폭풍우가 너무 늦었습니다). 그렇지 않으면 당신이 그것을 놓치더라도 너무 걱정하지 마십시오."
547,547,174,1812,"We visited this palace because it seems to be the prettier palace of Seoul. It is a large area that would require much walking. Luckily, the palace is beautiful and has a distinctive style so it is easy to explore. If you visit, do spare time to join the back garden tour. I'd say the back garden is the prettiest of the place and I understand why it is open only by tours for preservation.",547,much,서울의 궁궐이 더 예쁜 것 같아서 방문했습니다. 많은 걷기가 필요한 넓은 지역입니다. 운 좋게도 궁전은 아름답고 독특한 스타일을 가지고 있어 둘러보기 쉽습니다. 방문하신다면 여유 시간을 내어 뒷정원 투어에 참여하세요. 뒷정원이 제일 예쁘다고 하는데 왜 보존을 위한 투어로만 개방하는지 이해가 갑니다.
548,548,175,1833,"In case you are a business traveller, and have very little time to see through the rich Korean history in Seoul, this place (Changdoekgung) along with the other one in heart of city (Gyeongbukgung) would be an ideal place for an afternoon short trip - it's well possible to squeeze any of these palaces between your morning meetings and evening drinking sessions...  Changdeokgung is the only UNESCO World Heritage site out of the Five Grand Palaces built by Joseon dynasty which ruled Korea. Magnificent piece of authentic ancient Korean architecture.  There are many tour operators who offers a package of Changdoekgung with night markets etc., but you will need to enquire first whether they will take you into the 'Secret Garden'... you SHOULD NOT miss it. I booked with an operator, and upon learning that they will only provide entry to the palace and not the 'Secret Garden', I decided to abandon the tour midway and be on my own.  The palace and 'Secret Garden' tickets are sold separately, and 'Secret Garden' is opened to a batch of tourists with a Palace guide guiding you on the trail once every 15-30 mins. So, you may have to get in there, and plan for a secret garden ticket with a slot an hour at least from when you reach (sometimes there is quite a rush, and number of tickets per slot is limited to a maximum 30 ish). I spent the hour seeing the palace, and then went for the Secret Garden tour, which is technically 70% of the palace area.  It was worth a wait. Lush-green tree-rows with beautifully crafted lake-houses .... the flora was just amazing. ... I wonder if I liked the whole trail so much in summer, how good it will be during the spring season..  The only flip-side which I will regret - taking a Korean tour of 'Secret Garden' [every slot of Secret Garden tour is in a specific language and only few were in English] since the next English tour available was still couple of hours more of wait. so couldn't make much out of the context. But hey.. you always have a Wikipedia, it's the visual and other sensory experiences that matter...",548,much,"당신이 출장이고 서울에서 풍부한 한국 역사를 볼 시간이 거의 없다면, 이 곳(창덕궁)과 함께 도심의 다른 곳(경북궁)은 오후의 짧은 여행을 위한 이상적인 장소가 될 것입니다. - 아침 모임과 저녁 술자리 사이에 이 궁궐 중 하나를 짜내는 것이 가능합니다... 창덕궁은 한국을 통치한 조선 왕조에 의해 지어진 5개의 궁궐 중 유일한 유네스코 세계 문화 유산입니다. 정통 한국 고대 건축의 장엄한 조각. 야시장 등의 창덕궁 패키지를 제공하는 여행사가 많이 있지만 먼저 '시크릿 가든'으로 데려다 줄 것인지 여부를 문의해야 합니다. 절대 놓치지 마세요. 교환원에게 예약했는데 '시크릿 가든'이 아닌 궁전 입장만 가능하다는 사실을 알고 투어를 도중에 포기하고 혼자 하기로 했습니다. 궁전과 '비밀정원' 입장권은 별도로 판매되며, '비밀정원'은 15~30분 간격으로 궁의 가이드와 함께 산책로를 안내해 많은 관광객들에게 개방된다. 그래서, 당신은 거기에 들어가야 할 수도 있고 적어도 도착한 시간으로부터 슬롯이 있는 비밀 정원 티켓을 계획해야 할 수도 있습니다(때로는 꽤 붐비고 슬롯당 티켓 수는 최대 30개로 제한됨) . 나는 궁전을 보는 데 한 시간을 보내고 엄밀히 말하면 궁전 면적의 70%인 Secret Garden 투어에 갔다. 기다릴만한 가치가있었습니다. 아름답게 만들어진 레이크 하우스와 함께 무성한 녹색 나무 줄 .... 식물상은 정말 훌륭했습니다. ... 여름에 온통 맘에 들었는지 봄이 되면 얼마나 좋을까.. 유일하게 아쉬운 점은 '시크릿가든' 한국투어 [모든 슬롯머신] Secret Garden 투어는 특정 언어로 진행되며 영어로 진행되는 투어는 소수에 불과합니다.] 다음 영어 투어가 아직 몇 시간 더 기다려야 했기 때문에. 그래서 문맥에서 많은 것을 만들 수 없었습니다. 하지만 이봐.. 당신은 항상 Wikipedia를 가지고 있습니다. 중요한 것은 시각적 및 기타 감각적 경험입니다..."
549,549,176,1848,"With Huwon (Secret Garden) at the back, this is a great Palace to explore. If only the bridge to Jungmyo was still there, it would be even better. This Palace has lots of history than Gyeongbukgong. if I remembered correctly from the guided tour. And the story about the last Prince (or was it King?), who rebuilt a quarter especially for his lover, was so romantic. If you are not travelling with kids, I really recommend that you have to follow the guided tour as the guide knows so much.",549,much,후원(비밀정원)이 뒤에 있는 이곳은 탐험하기에 좋은 궁전입니다. 중묘로 가는 다리만 있었다면 더 좋았을 텐데. 이 궁은 경북궁보다 역사가 많다. 가이드 투어에서 올바르게 기억한다면. 그리고 특히 그의 연인을 위해 4분의 1을 재건한 마지막 왕자(아니면 왕이었나?)에 대한 이야기는 너무 낭만적이었습니다. 아이들과 함께 여행하지 않는다면 가이드가 너무 많이 알고 있기 때문에 가이드 투어를 따라야한다는 것을 정말로 추천합니다.
550,550,177,1850,"In my opinion, this palace is much more worth visiting compared to Gyeongbokgung Palace. The minute I stepped onto the palace ground, the palace seems to reach out to you, eager to share its history with you. The palace is of a considerable size and you need to take your time to appreciate each and every building. As the halls and living quarters are built apart from each other, every time I looked into a hall or a living quarter, I try to imagine how life was like for a royalty back in the Joseon period. It would be great if you can hire a guide or get an audio guide to help better understand the rich history of the palace. As I went to the palace after mid-noon, we missed the guided tour to the Secret Garden located just beside the palace. Make sure you check the timing for the English tour and head down early to book a spot. I really enjoyed this palace and since I didn't get to visit the Secret Garden, I definitely have a valid reason to revisit again!",550,much,제 생각에는 이 궁은 경복궁보다 훨씬 더 가볼만한 곳입니다. 궁궐 땅에 발을 딛는 순간 궁은 당신에게 그 역사를 공유하고자 하는 열망으로 당신에게 손을 뻗는 것 같습니다. 궁전은 상당한 규모이며 시간을 들여 건물 하나하나를 감상해야 합니다. 홀과 숙소가 따로 떨어져 있어 홀이나 숙소를 들여다볼 때마다 조선시대 왕족의 삶이 어땠을까 상상해본다. 가이드를 고용하거나 궁전의 풍부한 역사를 더 잘 이해할 수 있도록 오디오 가이드를 얻을 수 있다면 좋을 것입니다. 정오 이후에 궁에 가다 보니 궁 바로 옆에 있는 시크릿 가든 가이드 투어를 놓쳤습니다. 영어 투어 시간을 확인하고 일찍 자리를 예약하십시오. 나는이 궁전을 정말로 즐겼고 Secret Garden을 방문하지 않았기 때문에 다시 방문 할 타당한 이유가 있습니다!
551,551,178,1851,"If you have the time, it is good to visit this place. But if you have visited china and Beijing, specially Forbidden City, this place will not excite you much. But it is good to visit and find out the difference between chines and Korean culture.",551,much,"시간이 되시면 이 곳을 한번 방문해보시면 좋을 것 같습니다. 그러나 중국과 베이징, 특히 자금성을 방문한 적이 있다면 이곳은 그다지 흥미롭지 않을 것입니다. 그러나 방문하여 중국 문화와 한국 문화의 차이점을 알아보는 것이 좋습니다."
552,552,179,1863,"Went in with the free English guided tour. I think this is a must for them to explained the history, culture and the meanings. Probably in general it is the same for the others palaces as well -- Gyeongbukgung, Deoksukgung. The only difference will be in the details. The secret garden is ok but truly a very long walk and especially not for those too tired after visiting other areas in Seoul. Its a series of walk up and down small hills. And I have visited much more beautiful gardens in Kyoto.",552,much,"무료 영어 가이드 투어에 들어갔다. 역사와 문화, 의미를 설명하기 위해 꼭 필요한 부분이라고 생각합니다. 경북궁, 덕숙궁 등 다른 궁궐들도 대체로 마찬가지일 것이다. 유일한 차이점은 세부 사항에 있습니다. 비밀의 정원은 괜찮지 만 진정으로 매우 긴 산책이며 특히 서울의 다른 지역을 방문한 후 너무 피곤한 사람들에게는 적합하지 않습니다. 작은 언덕을 오르락내리락 하는 일련의 과정입니다. 그리고 교토에서 훨씬 더 아름다운 정원을 방문했습니다."
553,553,180,1866,"So cheap to get in and we loved the guided tour of the Secret Garden. So much to see and explore. Not only foreigners, but there were also plenty of locals exploring the palace, which was a delight to see (since some even wore Hanbok). The area surrounding the palace also had some hanuks and local artisan shops you can explore.",553,much,들어가기에 너무 싸고 우리는 Secret Garden의 가이드 투어를 좋아했습니다. 보고 탐험할 것이 너무 많습니다. 외국인 뿐만 아니라 현지인들도 궁궐을 둘러보는 사람들이 많아 구경하는 재미도 쏠쏠했다. 궁전 주변에는 하누크와 현지 장인 상점이 있어 둘러볼 수 있습니다.
554,554,181,1869,"If you've ever been to Kyoto or Beijing, this palace might not do much for you.  If you've never seen a place like this in Asia, I suppose it would be quite impressive.  The gardens are well maintained and it was clean.  Lots of obnoxious high schoolers running around unsupervised, making noise, etc.  If you're in Seoul you should go, but compared to some of the other places in Asia I have been, it wasn't that great.  Just my opinion.",554,much,교토나 베이징에 가본 적이 있다면 이 궁전이 별로 도움이 되지 않을 수도 있습니다. 아시아에서 이런 곳을 본 적이 없다면 꽤 인상적일 것 같아요. 정원이 잘 관리되어 있고 깨끗합니다. 무심코 돌아다니고 시끄럽게 떠드는 몹쓸 고등학생들이 많다. 서울에 있다면 꼭 가봐야 할 곳이지만 내가 가본 아시아의 다른 곳과 비교하면 그렇게 좋지는 않았다. 그냥 내 의견입니다.
555,555,182,1895,"I went to Gyeongbokgung palace before going to this palace, and boy, what a difference. Changdeokgung is beautiful, has much more English information, and the Secret Garden is amazing. I was especially amazed by the ancient trees and the different styles of the buildings. Too bad there was no audio guide!",555,much,"나는 이 궁에 가기 전에 경복궁에 갔고, 소년, 얼마나 차이가 나는지. 창덕궁은 아름답고, 훨씬 더 많은 영어 정보가 있으며, 시크릿 가든은 놀랍습니다. 나는 특히 고대 나무와 건물의 다양한 스타일에 놀랐습니다. 오디오 가이드가 없어서 아쉬웠어요!"
556,556,183,1899,The palace grounds are much smaller and more intimate than Gyeongbokgung Palace - and definitely not as crowded. We took a guided tour of The Secret Garden but in the pouring rain which made it a little difficult to enjoy the scenery. Still worth the time and money to see - a nice contrast from the bigger palace.,556,much,궁전 부지는 경복궁보다 훨씬 작고 친밀하며 확실히 붐비지 않습니다. 우리는 시크릿 가든 가이드 투어를 했으나 쏟아지는 비로 인해 경치를 즐기기에는 조금 어려웠습니다. 여전히 볼 시간과 돈의 가치가 있습니다 - 더 큰 궁전과의 멋진 대조.
557,557,184,1903,"I did the Secret Garden tour. The tour guide was rude to me and did not attempt to control our group. There was a very loud family with our group and at times would drown out our tour guide's voice. Some of us on the tour wanted to hear the history of the palace, but could not because of the constant talking and noise from this large family.  I went in the spring, so probably not as lovely as the summer. The trees were bare and not much green foliage.",557,much,시크릿 가든 투어를 다녀왔습니다. 여행 가이드는 나에게 무례했고 우리 그룹을 통제하려고 시도하지 않았습니다. 우리 그룹에는 매우 시끄러운 가족이 있었고 때때로 우리 여행 가이드의 목소리를 익사시킬 것입니다. 투어에 참가한 우리 중 일부는 궁전의 역사를 듣고 싶었지만 이 대가족의 끊임없는 대화와 소음 때문에 그럴 수 없었습니다. 나는 봄에 갔으므로 아마도 여름만큼 아름답지는 않을 것입니다. 나무는 헐벗고 녹색 잎이 많지 않았습니다.
