,Unnamed: 0.1,index,Unnamed: 0,경복궁부정단어리뷰,index.1,단어,번역
595,595,490,5372,"I and my family were so excited to visit to Korea. I got strong impression when I had company trip to Korea several years ago. At that time, I decided to be with my parents. Especially I was comfy with strong security in Korea and Korean were quite kind and warmhearted. Anyway it is very recommendable to visit Korea with your family.... I went to two palaces as my guide's recommendation... actually she preferred 2nd palace named Changdeokgung palace.Gyeongbokgung palace is representative, I was told it is the biggest one... it looks like forbidden city but it was built up around 30 years later than Gyeongbokgung palace. I went to Chankdeokgung palace as well. it is 2nd palace... there are 5palaces in Korea. the second palace was completely different.. it is also recommendable with many interesting history.SEEING IS BELIEVING.My tour guide was very enthusiastic and her story telling was so helpful to understand ,catched our concentration and touched us.. it was one of my strong impressing in Korea until the end day.. My collegue let me know one tour agent in Korea. We stayed for 5days, except for one day, we joined guided tour with her. she was very proud of their company(tour agent).. she was professional. When you travel to Korea, I want you to be with a good tour guide with very forsure agent. The agent name was very unique.. Anneonghaseyo Tour.. haha..It was available to have costomised tour with very reasonable budget...I was told it was handled by family that's why I could trust much more than other contries for trip. If you have any plan to travel to Korea, contact here.. I have business card of that agent.. Everyone will be satisfied with ...",595,much,"나와 내 가족은 한국을 방문하게 되어 매우 기뻤습니다. 몇 년 전 한국에 회사 출장을 갔을 때 강한 인상을 받았습니다. 그 때 나는 부모님과 함께하기로 결정했습니다. 특히 한국에서 보안이 강화되어 편안했고 한국인들은 상당히 친절하고 따뜻했습니다. 어쨌든 가족과 함께 한국을 방문하는 것은 매우 추천합니다.... 가이드의 추천으로 두 개의 궁에 갔다. 실제로 그녀는 창덕궁이라는 두 번째 궁을 선호했습니다. 대표적으로 경복궁이 가장 큰 궁전이라고 들었습니다. .. 자금성처럼 보이지만 경복궁보다 30년 정도 늦게 축성.. 창덕궁에도 다녀왔습니다. 제2의 궁이다.. 한국에는 5개의 궁이 있다. 두 번째 궁전은 완전히 달랐습니다.. 그것은 또한 많은 흥미로운 역사로 추천할 만합니다. SEEING IS BELIEVING. 나의 여행 가이드는 매우 열성적이었고 그녀의 이야기는 이해하는 데 매우 도움이 되었고, 우리의 집중을 사로잡고 우리를 감동시켰습니다. 한국에서 마지막날까지 강렬한 인상을 남겼습니다.. 제 동료가 한국에 있는 한 여행사를 알려줬습니다. 우리는 하루를 제외하고 5 일 동안 머물렀고 그녀와 함께 가이드 투어에 참여했습니다. 그녀는 그들의 회사(여행사)에 대해 매우 자랑스러워했습니다. 그녀는 전문적이었습니다. 한국에 여행을 가실 때 아주 든든한 에이전트와 함께 좋은 여행가이드와 함께 하시길 바랍니다. 에이전시 이름이 참 독특하네요..안녕하세요 투어..하하..저렴한 비용으로 코스비 투어가 가능했어요..가족이 진행한다고 해서 다른 여행사보다 훨씬 믿고 여행갈 수 있었습니다. 한국여행 계획이 있으시면 여기로 연락주세요.. 그 대리인의 명함이 있어요.. 다들 만족하실꺼에요..."
596,596,491,5383,It is definatly worth a visit but don't expect too much. Korea is still rebuilding and getting their sites back to their former glory after the Japanese occupation. It was good and it is worth a visit but I would recommend a walk around changdeokgung palace and it's secret garden if you only have time for one,596,much,방문할 가치가 있지만 너무 많이 기대하지 마십시오. 한국은 여전히 ??일제강점기 이후의 과거의 영광을 되찾고 재건하고 있습니다. 좋았고 방문할 가치가 있지만 시간만 있다면 창덕궁과 비밀의 정원을 산책하는 것을 추천합니다
597,597,492,5400,Nothing much to see. The guards are unusually dressed in red and blue and are worth a look. The palace is a series of bulidings in a large walled compound with gardens and plenty of gravel.,597,much,별로 볼 것이 없습니다. 경비원은 비정상적으로 빨간색과 파란색 옷을 입고 있으며 볼 가치가 있습니다. 궁전은 정원과 많은 자갈이 있는 큰 벽으로 둘러싸인 복합 건물에 있는 일련의 건물입니다.
598,598,493,5404,"interesting and indeed a must-visit place but at the same time there's nothing too much to see. the palace complex is huge and beautiful, though.",598,much,흥미롭고 실제로 꼭 방문해야 할 곳이지만 동시에 볼 것이 너무 많습니다. 궁전 단지는 거대하고 아름답습니다.
599,599,494,5422,we went to see this place with my daughter and worth the trip. we are there early morning not much people so we have a good view of the place,599,much,우리는 딸과 함께 이곳을 갔고 여행의 가치가 있습니다. 우리는 이른 아침에 사람이 많지 않아 장소를 잘 볼 수 있습니다.
600,600,495,5423,Highly recommend it.. Best time to go early AM because much less tourists around. Very good place to see and experience Korean history,600,much,적극 추천합니다. 주변에 관광객이 훨씬 적기 때문에 이른 오전에 가는 것이 가장 좋습니다. 한국의 역사를 보고 경험할 수 있는 아주 좋은 곳
601,601,496,5427,"The complex was great to see and explore. Most things have an english translation, so it is very US tourist friendly. I did the audio tour and there was a good bit of history, but not as much information about how the buildings were used as I would have liked.",601,much,단지는보고 탐험하기에 좋았습니다. 대부분의 물건이 영어로 번역되어 있어 매우 미국 관광객에게 친숙합니다. 나는 오디오 투어를 했고 약간의 역사가 있었지만 건물이 어떻게 사용되었는지에 대한 정보는 내가 원하는 만큼 많지 않았습니다.
602,602,497,5438,"Went there during winter and it's quite good for taking pictures. But other than that, there's nothing much you can do there",602,much,겨울에 갔더니 사진찍기 좋은 곳입니다. 하지만 그것 말고는 할 수 있는 게 별로 없어요.
603,603,498,5442,"It is a huge palace but basically looks the same after awhile. Interesting to see the guard change ceremony. Probably the only one that worth seeing, the rest would pretty much be smaller scale than this one.",603,much,"그것은 거대한 궁전이지만 시간이 지나면 기본적으로 똑같아 보입니다. 근위병 교대식을 보는 것이 흥미 롭습니다. 아마도 볼 가치가 있는 유일한 것, 나머지는 이 것보다 훨씬 작은 규모일 것입니다."
604,604,499,5461,"Since this is the biggest palace in Seoul, of course you should see it. Lots to see and photograph, even though it is much reconstructed.",604,much,서울에서 가장 큰 궁궐이기 때문에 당연히 보셔야 합니다. 많이 재건되었지만 많이보고 사진을 찍을 수 있습니다.
605,605,500,5463,"Whether you have 36 hours or a more extended stay in Seoul, you should definitely stop by Gyeongbokgung (gung = palace). There are several palaces in Seoul but this one has the largest compound. If you don't much about Korean history, I would recommend the guided tour (which I think is free) and is offered in several languages and throughout the day. It's interesting hearing about the function of the different buildings and getting a sense of Koreas's imperial history. Definitely must see/do.",605,much,서울에서 36시간 이상 장기 체류가 있더라도 반드시 경복궁에 들러야 합니다. 서울에는 여러 궁궐이 있지만 이곳이 가장 큰 궁궐입니다. 한국 역사에 대해 별로 관심이 없다면 하루 종일 여러 언어로 제공되는 가이드 투어(무료라고 생각함)를 추천합니다. 다양한 건물의 기능에 대해 듣고 한국의 제국 역사를 이해하는 것은 흥미롭습니다. 반드시 보거나 해야 합니다.
606,606,501,5469,"The site is huge, and there are so many aspects of the property that the best thing is to join a free tour so that you can learn as much as possible about life in the palace. Certainly worthy of a visit. Plan at least 2 hours.",606,much,부지는 거대하고 재산의 많은 측면이 있으므로 가장 좋은 것은 궁전에서의 생활에 대해 가능한 한 많이 배울 수 있도록 무료 투어에 참여하는 것입니다. 확실히 방문할만한 가치가 있습니다. 최소 2시간을 계획하세요.
607,607,502,5473,"clearly one of the things not to be missed in SEOUL, if you are into monuments. I have lived 5 years next to the palace to know it quite well under many different seasons, Winter can be quite nice with SUN and SNOW. Expect people but the palace is big, however not as big as the FORBIDDEN City in BEIJING. There is a FOLKS museum inside that is worth visiting (you need 1.5 h) and you can have a lunch there, quite nice to take a break from the busy city. Dont expect to see much furniture into the buildings, Korean Palaces are always very barren...the whole thing makes an enjoyable experience for a half day.",607,much,기념물에 관심이 있다면 서울에서 놓쳐서는 안 될 것 중 하나입니다. 나는 궁전 옆에 5년 동안 살았고 여러 계절에 아주 잘 알고 있습니다. 겨울은 태양과 눈이 있으면 아주 좋을 수 있습니다. 사람들을 기대하지만 궁전은 크지만 베이징의 자금성만큼 크지는 않습니다. 내부에는 방문할 가치가 있는 FOLKS 박물관이 있으며(1.5시간 소요) 점심을 먹을 수 있으며 바쁜 도시에서 휴식을 취하기에 아주 좋습니다. 건물에 많은 가구가 들어갈 것으로 기대하지 마십시오. 한국의 궁전은 항상 매우 황량합니다. 이 모든 것이 반나절 동안 즐거운 경험이 됩니다.
608,608,503,5480,"Not much info onsite, so I focused on architectural details instead. In this part of the world, there are truly grand examples of this style.",608,much,현장에 정보가 많지 않으므로 대신 건축 세부 사항에 중점을 두었습니다. 세계의 이 지역에는 이 스타일의 진정으로 웅장한 예가 있습니다.
609,609,504,5481,"this is 1 of the 2 palaces you can visit in Seoul, it's probably the main one people visit, it's truly magical and picture perfect. it gives you a great sense of how the royalties lived and there's so much history in this place, even though a lot of the buildings were not the original as some of them have been destroyed by fire, but they did a great job of reconstruct them to their initial appearance. I enjoyed it a lot and spent about 2-3 hours there :)",609,much,이것은 서울에서 방문할 수 있는 2개의 궁전 중 하나입니다. 아마도 사람들이 가장 많이 방문하는 궁전일 것입니다. 정말 마법과도 같으며 그림도 완벽합니다. 로열티가 어떻게 살았는지에 대한 훌륭한 감각을 제공하고 이곳에는 많은 역사가 있습니다. 많은 건물이 원래 건물이 아니었지만 일부 건물이 화재로 소실되었지만 재건하는 데 큰 역할을 했습니다. 그들의 초기 모습으로. 나는 그것을 많이 즐겼고 약 2-3 시간을 보냈습니다 :)
610,610,505,5482,"We were amazed at how beautifully presented all the buildings were. They were lacking in information though, even the tour guide didn't tell us much. Great place. Must see. Do some research before so you know more about it.",610,much,우리는 모든 건물이 얼마나 아름답게 표현되었는지 놀랐습니다. 그들은 정보가 부족했지만 여행 가이드조차도 우리에게 많은 것을 알려주지 않았습니다. 좋은 곳. 볼 수 있어야합니다. 그것에 대해 더 많이 알 수 있도록 사전에 조사를 하십시오.
611,611,506,5491,"We were there when it was the peak of autumn, and the beautiful palace garden was filled with bright colours. As many other reviewers would point out, it would be good to come in time for the guard-changing ceremony, where you get to see the different units marching around in the main square. You can plan in advance with the ceremony timings here: http://english.visitkorea.or.kr/enu/SI/SI_EN_3_2_1.jsp?cid=292853.  The grounds are clean and well-maintained, although I wouldn't wax lyrical about the sights (other than the garden yes). I might have unfairly compared this to Beijing's Forbidden Palace, but if you have been to Beijing, you might get what I mean. Nothing that much to see when you really look into each of the halls or rooms here.  It's a short walk to Samcheongdong (use the eastern exit, and work north for 7-10mins), so you could always plan to have lunch or teatime at one of the cafes or restaurants there.",611,much,"우리는 가을의 절정에 거기에 있었고 아름다운 궁전 정원은 밝은 색으로 가득했습니다. 다른 많은 리뷰어들이 지적했듯이, 메인 광장에서 다른 부대들이 행진하는 것을 볼 수 있는 근위병 교대식에 제시간에 오는 것이 좋을 것입니다. http://english.visitkorea.or.kr/enu/SI/SI_EN_3_2_1.jsp?cid=292853에서 예식 시간을 미리 계획할 수 있습니다. 나는 광경에 대해 서정적 인 왁스는 아니지만 (정원 제외) 땅은 깨끗하고 잘 관리되어 있습니다. 이것을 베이징의 고궁과 부당하게 비교했을 수도 있지만, 베이징에 가본 사람이라면 제 말뜻을 알 수 있을 것입니다. 여기의 각 홀이나 방을 실제로 들여다보면 그다지 볼 것이 없습니다. 삼청동(동쪽 출구를 이용하여 북쪽으로 7-10분 이동)까지 도보로 가까운 거리에 있으므로 카페나 레스토랑 중 한 곳에서 점심이나 티타임을 계획할 수 있습니다."
612,612,507,5496,"Beautiful Place. It was winter so there wasn't much greenery but it is still very nice. Also got to see the 'Changing of the Guards"" ceremony. Very informative. Can't wait to go back in the summer.",612,much,아름다운 곳. 겨울이라 녹지가 많지는 않았지만 그래도 너무 좋았습니다. 또한 '근위병 교대식' 행사도 볼 수 있었습니다. 매우 유익했습니다. 여름에 다시 가고 싶어요.
613,613,508,5532,"5 visits to Seoul, I came here thrice! I specially visit the place again as my previous trip I came in early autumn and mid autumn. Very much wanted a view of the palace in winter! It's lovely, the only thing is it will be more beautiful if it snowed. Simply loved this attraction so much! A great way to spend a morning in Seoul... I'll be back here again in the other seasons.",613,much,"서울 5번 방문, 세 번 왔어요! 나는 특히 초가을과 중순 가을에 이전 여행으로 다시 방문합니다. 겨울 궁전의 전망을 매우 원했습니다! 아름답습니다. 눈이 오면 더 아름다울 것입니다. 단순히이 매력을 너무 좋아했습니다! 서울에서 아침을 보내는 좋은 방법... 나는 다른 계절에 다시 여기에 올 것입니다."
614,614,509,5564,Not much explanation in English. We tried getting audio guides but they were not available. Doesn't feel so special especially if you have been to similar but bigger places in Asia like the forbidden city.,614,much,영어로 설명이 많지 않습니다. 우리는 오디오 가이드를 얻으려고했지만 사용할 수 없었습니다. 특히 아시아에서 금단의 도시와 같이 비슷하지만 더 큰 장소에 가본 적이 있다면 그렇게 특별하게 느껴지지 않습니다.
615,615,510,5569,Plan ur trip time carefully. Free english guided tour available at certain time(cant recall) pretty much strolling in the castle ground. The guards exchange ceremony is held in front of the castle gate (also at certain time of the day).,615,much,여행 시간을 신중하게 계획하십시오. 특정 시간에 제공되는 무료 영어 가이드 투어(기억이 안 난다)는 거의 성터를 산책합니다. 근위병 교대식은 성문 앞에서 거행됩니다(일시에도).
616,616,511,5571,"This is a must if you are in Seoul as there are so much to see and do around the area Recommend that you can start the morning walking around the strip just in front of the palace where there is a museum of sort underground. Then have boiled ginseng chicken lunch at a nearby restaurant (there is a famous one nearby) before heading to the Palace. At the Palace ground, you can witness the changing of guards, and sometimes traditional dance performance, and also a visit to the museum inside. Spend the late afternoon walking along the street at the right of the palace (when you are facing the main entrance) which are lined with boutique shops and restaurants. You can also walk up the hill and look at the traditional houses.",616,much,주변에 볼 것과 할 것이 너무 많기 때문에 서울에 있다면 꼭 가봐야 합니다. 지하에 일종의 박물관이 있는 궁전 바로 앞에서 스트립 주변을 산책하며 아침을 시작할 수 있는 것이 좋습니다. 그런 다음 왕궁으로 향하기 전에 인근 식당(근처에 유명한 식당이 있음)에서 삶은 인삼 치킨 점심을 먹었습니다. 고궁 경내에서는 근위병 교대식과 때로는 전통 무용 공연을 관람할 수 있으며 내부 박물관도 견학할 수 있습니다. 부티크 상점과 레스토랑이 즐비한 궁전 오른쪽(정문 쪽)의 거리를 따라 늦은 오후를 보내십시오. 언덕을 오르면 전통 가옥도 볼 수 있습니다.
617,617,512,5591,Beautiful palace. We would have left much earlier if we didn't jump in with the English tour guide. Probably would have given a lower review if not for the guided tour. Without the tour there wouldnt have been much to see.,617,much,아름다운 궁전. 우리가 영어 투어 가이드와 함께 뛰어들지 않았다면 우리는 훨씬 더 일찍 떠났을 것입니다. 가이드 투어가 아니었다면 아마 더 낮은 리뷰를 했을 것입니다. 투어가 없었다면 볼 것이 많지 않았을 것입니다.
618,618,513,5592,"A wonderful place to see. I saw some previews of Korean telenovelas but I don't pay much attention to it. Seeing this place, now I appreciate it more. A huge place and lots of history in it. It's worth a visit or 2. Take your time.",618,much,볼 수있는 멋진 장소. 한국 텔레노벨라의 예고편을 몇 번 본 적이 있지만 별로 신경을 쓰지 않는다. 이 곳을 보니 이제 더 감사합니다. 거대한 장소와 많은 역사. 방문할 가치가 있습니다. 2. 시간을 내십시오.
619,619,514,5598,"Change of guard is worth watching. The museum or place inside is small, nothing much to be seen. Ticket for just 1 palace is 3,000Korean Won.",619,much,"가드의 변화는 볼 가치가 있습니다. 박물관이나 내부 장소는 작고 볼 것이 많지 않습니다. 궁궐 1개 입장권은 3,000원입니다."
620,620,515,5599,take a good camera much time and enjoy it .....its just soo beautiful .... alone to go around sea the nature and the buildings all those colors,620,much,좋은 카메라로 많은 시간을 가지고 즐기십시오 ..... 너무 아름답습니다 .... 혼자 바다를 돌아 다니는 자연과 건물의 모든 색
621,621,516,5602,"Yes! A very big one~~ We spend three hours here but still not able to make a round.. Maybe we stop too much. HAHA  My favourite band was here one the same time and day I was there.. But I missed them as the place is too big.. Visit the museum on the outside of the entrance before u left, U can learn lots regarding the palace there..  Two significant in one time.. Yeah! Gwanghwamun and Gyeongbokgung. Save the subway fare.. Plus, u can walk down to the Gwanghwamun Square to visit the King sejong statue and also the Admiral Statue..",621,much,"예! 엄청 크네요~~ 여기서 3시간을 보내는데도 한바퀴도 못돌아가네요.. 너무 많이 멈췄나봐요. HAHA 내가 가장 좋아하는 밴드는 내가 거기에 있었던 것과 같은 시간에 여기에 있었다. 그러나 장소가 너무 커서 그것을 놓쳤다. 당신이 떠나기 전에 입구 외부에있는 박물관을 방문하십시오. 거기에서 궁전에 대해 많은 것을 배울 수 있습니다. .. 한 번에 두 가지 중요한.. 그래! 광화문과 경복궁. 지하철 요금을 절약하십시오. 또한, 광화문 광장까지 걸어가면 세종대왕 동상과 장군 동상을 볼 수 있습니다.."
622,622,517,5618,"This place was well worth the time and walk. It's quite massive and full of history. You will find yourself taking photo after photo. If you have kids that don't like to walk much, make sure you have a stroller, etc. Highly recommend this spot.",622,much,이 장소는 시간과 산책의 가치가 있었습니다. 그것은 꽤 방대하고 역사로 가득 차 있습니다. 사진 후 사진을 찍는 자신을 발견하게 될 것입니다. 걷는 것을 좋아하지 않는 아이들이 있다면 유모차 등이 있는지 확인하십시오.이 장소를 적극 권장합니다.
623,623,518,5634,"This was such a great place to visit!! The buildings are lovingly and beautifully maintained and there was so much to see!! The history of Korea was fascinating, so much I didn't know!!",623,much,방문하기 너무 좋은 곳이었어요!! 건물은 사랑스럽고 아름답게 유지되고 볼 것이 너무 많았습니다! ! 한국의 역사는 너무 신기해서 몰랐어요!!
624,624,519,5642,The palace is quite huge so we were lucky to have followed a free English tour guide from the visitor center. We avoided the crowds as much as we could while still seeing all the major attraction the palace had to offer. The tour was almost an hour long but it gave us further insight to the history and lives of those living inside the Gyeongbokgung.  The ticket also comes with free admission to the folk museum located within palace grounds.,624,much,궁전은 꽤 커서 방문자 센터에서 무료 영어 투어 가이드를 따라갈 수 있어서 운이 좋았습니다. 우리는 궁전이 제공해야 하는 모든 주요 명소를 여전히 보면서 할 수 있는 한 군중을 피했습니다. 투어는 거의 1시간이 걸렸지만 경복궁 안에 사는 사람들의 역사와 삶에 대해 더 깊이 이해할 수 있었습니다. 이 티켓에는 궁전 부지에 위치한 민속 박물관 무료 입장이 포함되어 있습니다.
625,625,520,5648,"Great palace, for reference it is much smaller than the forbidden city, but the gardens and the lake give something else to this palace. In my opinion it would be my first choice when comparing with Changdeokgung, nevertheless both attractions deserve a visit. I would set from 90 min to 2h for a good look around.",625,much,"대궁, 참고로 자금성보다 훨씬 작지만 정원과 호수는 이 궁에 또 다른 무언가를 줍니다. 제 생각에는 창덕궁과 비교할 때 첫 번째 선택이 될 것입니다. 그럼에도 불구하고 두 명소 모두 방문할 가치가 있습니다. 주변을 잘 살펴보기 위해 90분에서 2시간으로 설정했습니다."
626,626,521,5651,"It was an unintentionally visit for me. Been there since 2013, 13 hrs before my next connecting flight so that was the chance to get around in the city.  The palace has nothing much to see, building style is the combination between Japanese and Chinese. I was not sure about the ticket price but it was worth for paying.  If you wanted to pin this on your travel map that's fine, but for me once is enough. There is something else to see in Seoul.",626,much,나에게는 의도치 않은 방문이었다. 다음 연결 항공편 13시간 전에 2013년부터 거기에 있었기 때문에 도시를 돌아다닐 수 있었습니다. 궁전은 볼 것이별로 없으며 건물 스타일은 일본과 중국의 조합입니다. 나는 티켓 가격에 대해 확신하지 못했지만 지불 할 가치가있었습니다. 이것을 여행 지도에 고정하고 싶다면 괜찮지만 저에게는 한 번으로 충분합니다. 서울에는 또 다른 볼거리가 있다.
627,627,522,5660,Very beautiful palace with a very tranquil feeling. Really worth a visit. So much history. The staff is very helpful.,627,much,매우 고요한 느낌의 매우 아름다운 궁전. 정말 방문할 가치가 있습니다. 너무 많은 역사. 직원들은 매우 도움이 됩니다.
