,index,Unnamed: 0,서울대공원부정단어리뷰,index,단어
55,55,3456,"I have to say it's always interesting to come to Myeongdong. It's always changing. Most visitors are tourists but locals come here too. You can find most of the shops and stores in Myeongdong in other malls or areas in the city. But the experience of shopping outside with street food and merchant vendors make this area an interesting place to come. I recommend coming here at night time with some appetite and roam the alleys and try various foods. Bring cash (Korean won) to make things more easier. You will easily get full trying many types of foods. The food vendors are general clean and nothing crazy or weird food. Also there's many restaurants as well but too many to pick from! Finding a public restroom could be difficult but if you go into large shopping centers or coffee shops, you will be fine. It's family friendly but it gets crowded. I would say myeondong is more for shopping at known brands such as makeups and shoes while dongnaemun is more for local merchants and clothes. There's definitely a different feel. I think you can give yourself about 1-2 hours to go through myeondong streets/alleys.",55,nothing
56,56,3578,Crowded during the evening. Food booths are nothing special. Typical shops. Restaurants and Bar are around.,56,nothing
57,57,3799,"I read in a review a guy said three hours of shopping and all he walked away with was empty pockets and a happy wife! Well it's true lots of women's clothing and makeup, nothing my size or colour. But my wife had the time of her life. So totally worth it. Happy Wife Happy Life! We went late and stayed until around 1:00am and the area was packed.",57,nothing
58,58,3817,"Myeongdong is a must visit for tourists even if you aren't a shopper at heart, you can still enjoy the street food and just experience the madness! Make sure to visit Sulbing (upstairs above one of the 10 Nature Republic stores) and enjoy the Hello Kitty Cafe. Make sure to stock up on all your skin care needs; but if you do nothing else; hit up the street 7pm or after and visit the food stalls.",58,nothing
59,59,3900,There is nothing that you can not find in this market. Your family will love it. It has many cosmetics shops.,59,nothing
60,60,3955,"Waves and waves of tourist...all the shops looked the same. Repeated shops on different streets and they all sell the same products. Young women & men will stand outside the shops trying to promote their products. It's a skin care heaven shopping place for ladies ! There are many cafes, money changers too. I like the ""food hawker"" selling bbq squids, sweet paste coated fresh strawberries, the famous 32cm long ice cream on a cone. I was told that an average of 1,000,000 person passes through the street of Myeongdong. Not a place for young children or parents with prams. Go and experience the ""walk"" even if there is nothing to buy - join the crowd and have fun !",60,nothing
61,61,3997,"Depending on what time of day you go there and also what weekday you may encounter normally crowded streets to very very busy streets. Before the shops are people trying to get you to come inside the shops and give you masks as a treat, especially on the weekend. Honestly nothing bothered me there and I knew the place was good to get CDs for a good price. It is after all a shopping street and as such one should see it. The shop assistants are good with English, Japanese, Korean and Chinese. Was a fun place to stroll around and just explore.",61,nothing
62,62,4319,"For the shopaholic, it's paradise. Designer stores aplenty, with a phenomenal range of food outlets and restaurants. The street stalls are a must see, and the local food available from them can't be missed. Shop prices were disappointingly similar (if not more expensive) than Europe, but there is literally nothing that you can't find. It's an experience!",62,nothing
63,63,4373,"Competition is strife. There will be repeats of many standard makeup stores, and there are a couple of clothes stores but nothing quite sales-y like the street fashion in the underground stores. However, the store clerks are well-versed in either Mandarin or a bit of English and are super-attentive to your needs.  I dislike the crazy crowds that come here, but it would be a must-visit if you must shop in Seoul. I preferred going to Hongdae or the underground malls for my shopping thrill.",63,nothing
64,64,4403,"The shops are fine but really nothing you can't find in a hundred other places. The main reason to come here is for the amazing street food at night, some of the best I have had anywhere, especially the fried mozzarella with condensed milk (trust me, it tastes a whole lot better than it sounds) and the pork meatballs. We ended up eating here every night.",64,nothing
65,65,4456,Myeongdong is always the place to go if you're looking for anything in particular or nothing at all. It's a collection of all the famous Korean stores plus western stores too. Beware that it's always crazy crowded and that street vendors only come out at night or on the weekends,65,nothing
66,66,4575,"It is an obligatory for foreigners to come here, who never heard of Myeongdong right! It's like your Korea trip is incomplete without visiting Myeongdong, a shopping heaven and cramp with peoples! lol. So many things u can check out here, like gazillion cosmteic shops, trying Korean street foods, famous Korean boutiques, acccessories, Cafes etc. Almost everything can be found here. Since I stay nearby Myeongdong, I came here every night, eventho I have nothing to buy.",66,nothing
67,67,4746,I personally find that there is nothing much to buy at Myeongding. Lots of Korean beauty and cosmetic products. Perhaps this place is good for the ladies as most of the shops carry clothes just for the ladies.,67,nothing
68,68,4779,It's called them shopping center but there's nothing unique about it. Many western brands and mostly cosmetic shops. If you want to buy the same things that you can buy everywhere so this is the place for you,68,nothing
69,69,4791,This is the shoppers' heaven. Do nothing but shop till you drop.  Shops mainly are cosmetics / beauty / clothes / accessories / shoes.  There are also a lot food street food available along the streets.,69,nothing
70,70,4888,"You here about London, New York, Paris etc. They have nothing on this place!! I have never seen so many shops in my life!! There were shops within shops, shops on top of shops. It really is a shopping paradise!! Even if you don't like shopping there will be something here for you I guarantee.  My top tip is to go in the evening. The whole place lights up!!",70,nothing
71,71,5017,"As another reviewer said, there are a ton of Korean cosmetic shops here! I saw probably 2 or 3 shops for each brand, and I think they outnumbered all the other kinds of shops combined. So, if you're looking to stock up on some fantastic Korea beauty products for half of what they would cost to order them online, this is the place for you! They also lure you into the stores with free samples, although you don't have to buy anything. There are other kinds of shops if you want to take a look around, but nothing special. Mostly over-priced clothes and souvenir shops. My boyfriend did get a very amusing hat here though....",71,nothing
72,72,5107,"My friends and I went to Myeongdong many times, and we got very bad experience there. We do like shopping and dining there, but somehow they'll show their temper / unfriendly attitude if you just buy little stuff or nothing to buy in the shop. Not only retail shops, but restaurants. So-called shopping paradise, just so so.  對於旅客來說，明洞係一個非常出名的購物地點！但係如果在店鋪只消費少少或者完全無消費，售貨員就立即黑面、發脾氣！這裡絕對稱不上係一個購物天堂！所謂的購物熱點就是這樣！",72,nothing
73,73,5169,"Its was really cold in winter therefore wear proper winter clothes especially young children. It does get crowded but being in asia its nothing surprising.  Moreover there are lots of variety such as designer brands, local brands and market like stalls. I would recommend a whole day to fully explore the place and the street food there is good and there are heaps of places to eat and have a cuppa. I would recommended anyone who would like to buy pressies to bring home stop by here also.",73,nothing
74,74,5170,Myeongdong has lots of shopping and for beauty products at least 3 or 4 of the same shops. If you head downward there are a tonne of restaruants serving all types of food. But there is nothing better than a good Korean BBQ.,74,nothing
75,75,5195,"i love going to myeongdong, there so many cosmetic shop and delicious food. and you can shopping all around the time here. you must give space to long time here. becuse if you just going one or two hours here you get nothing. kkkkk",75,nothing
76,76,5215,really nothing to see here unless you are coming from a 3rd world country. Prices are high and you can find everything in other shopping malls.,76,nothing
77,77,5240,"Myeongdong has a long history. It's been a centre of shopping for Seoulites for years. But by 2000, Japanese started to occupy this area, and in recent few years all the tourists started coming to this area, and now it got to a point where you see more tourists than locals in the area. One of its attraction was that the area is all walk-only streets and cars are not allowed in. But now the downside is that it gets more people to fill the streets than the cars passing by, making it one of the hardest to place in Seoul to walk around. Now, it is a nice shopping district indeed. But that's if you want to hop in Uniqlo, H&M, Zara and all those global fashion brands which are available everywhere else in the world, and by the way cost more than most of other countries. Most shops are also available in many other downtown spots in Seoul, there's not a single unique shop that you can only visit in Myeongdong. Therefore, I wouldn't recommend this area so much. You can go once as a tourist attraction, but if you're looking for genuine items you can only get in Korea, I'd look elsewhere. You know almost everywhere in Seoul is extremely crowded but this area is one of the worst. It used to have history, but nothing is special now, except for Myeongdong Cathedral which is the best catholic structure you can see in Korea.",77,nothing
78,78,5382,"If you love Korean stuffs and a fan of these Korean telenovelas, this is a haven for you. This is Seoul's #1 shopping district for nothing, it got everything. No need for further introductions, upon arrival in Seoul, get a taxi and shop till you drop. Visited last Sep-12 during ""Experience Hyundai"" trip.",78,nothing
79,79,5384,"No matter you are a real shopper or only a window shopper; Myeongdong is really a ""heaven"" for you. The only problem for me is I found nothing to eat because am vegetarian.",79,nothing
80,80,5451,"Myeongdong is a commercial area and therefore it is less chance to experience the real korean shopping. Most of the shops have staff who speak different languages, eg mandarin, japanese, english etc to serve tourist from different country. This is one of the excellent service you don't find everywhere in the world.  Only shortfall is it is always too crowded, especially at night, one can hardly move around. One can try to come in the day, nothing much to see but can find some nice restaurant hiding inside the small lane.",80,nothing
81,81,5629,"This place was a bit of a letdown during my three days in Seoul after what I read about the place.  It had the usual high-end stores and the flashy neon lights. But there's nothing quirky about the place. No street performers, no people in weird costumes and nothing particularly unique, original or beautiful. It's just a straight up place to shop that you'd find elsewhere in Seoul and in most large Asian cities. It doesn't deserve its reputation for being the ""most see"" place in Seoul.  Maybe it's good for the ladies who love shopping. But as a guy, I found it nothing more than a decent photo opportunity.",81,nothing
82,82,5697,"Street that always crowds by people..nothing much i bought from here but i had fun with their 'pasar malam' atmosphere with new thingy that i had ever see. The most attraction i was looking for here is Spao. It is a boutique that must to visit by kpop fans though. You can enjoy everysing on the 5th floor, and dont forget to take sticker pictures with your bias. They offered awesome stuffs at affordable price. You also can visit everysing at apgujeong branch but you may feel regret if not buy anything at myeongdong branch which is the main everysing shop. M plaza also located in myeongdong, which Kimchi Academy is located, where you can book kimchi experience and hanbok wearing package. Hanji mirror making also including in the package with 30,000 won for 2 hours class. Classes offered in Korean, Japanese or English. They open for new package with ddeobokki making experience for 2012.  Popular Hello Kitty cafe also located here, that one i had skip on my last journey. will visit next time. Myeongdong also one of the place to buy sourvenir but no much choices and quite expensive that you can find the same thing at cheaper price at other market.",82,nothing
