,index,Unnamed: 0,서울대공원부정단어리뷰,index,단어
35,9,121,"C1 ( 2016.12.12 ) This Lotte department store brand was number 1. in Korea. I didn't like Lotte, but it was certain that there was very good department store. There was always crowded and many stores located. Especially, there was very good place to shop to foreigner , but too crowded to me.",35,crowded
36,10,135,"We only explored the lotte mart. If you want to buy korean supermarket things, this is the place. The market is crowded so it feels the market is small. You can also buy kimchi packs here.",36,crowded
37,11,139,This is a huge store with most brands available. Often crowded on weekends. Ideal for those looking for branded and duty stuffs.,37,crowded
38,12,142,"It contains 3 blocks of building, linked with footbridges, suitable for different people from young shopper to luxury brands lovers.  You can find all you want here. Not too crowded except the top few floors of Duty Free Shops, with all the chinese crowded buying different cosmetic items.  Convenience location near subway station.",38,crowded
39,13,144,"This huge shopping model is located in one of the shopping areas in Seoul, the Myongdong district.  It has a wide selection of stores, however it can be get quite crowded (at least in the weekends) hence if you need to use a fitting room you might have to expect to queue for a while.  Best option: get there early to do your shopping.",39,crowded
40,14,152,"Massive mall with ten levels of shopping but way too crowded even during off peak hours on weekdays. There were big groups crowding around the more popular cosmetic counters like Sulwhasoo. The food court was really packed and the prices were on the high side as well. It really felt like a war zone with people just pushing around and I didn't enjoy shopping there, I'll go to other malls which are not as crowded.",40,crowded
41,15,153,"The place is crowded with China tourist. No toys section for children. The food section was very crowded. Could not enjoy. We went to MCM store, the shop assistants were rude. Wont be come here for 2nd time",41,crowded
42,16,157,Very crowded with tourist you can't even get basket to shop. It was luxurious compared to lotte mart and lotte outlet but the price were also more expensive that it was ridiculous. We went there to buy snack for gift and compared the price to lotte mart in seoul station. Our heart break each time we found how we lost so much money for the same brand of lotte snack,42,crowded
43,17,161,"This review is only about the food court level at Lotte Main. It's an excellent place for eating and shopping for food items to take out, with the exception of wine and liquor (very limited selection, especially of liquor). There are several casual restaurant style places where you can order mainly noodle/rice bowls and sit down at a table to eat. And of course there are dozens of counters selling everything from sushi to pastries. There's also a more traditional grocery store area with produce, meat/poultry/fish and other items. If you go during the day it is quieter and easier to navigate, but one advantage of going within an hour or so of closing is that many of the more perishable items such as fresh-baked goods and prepared meal items with meat or fish are marked down for quick sale. We were able to get dinner for two for about 10,000 won (less than $10) and a bag full of excellent pastries all marked down by 20%. It's very crowded and bustling at that time but you can get some great bargains if you're willing to fight through the crowds.",43,crowded
44,18,163,"Yeah, this place is super super crowded, particular at the Duty Free shops at 9th and 10th floor. It feels like you are at a fish market or something, except that you are shopping for luxury brands and cosmetics. And don't be surprised, most people there are Chinese and even the staffs speak Chinese. They seem to have special promotion for foreigners from China.",44,crowded
45,19,167,"Really a paradise, especially the duty free with special amazing prices. I wish they have more brands and clothes at duty free. But it is too crowded and payment is separated at each store so it takes a lot of time in queue waiting to check out at each store.",45,crowded
46,20,184,"The mall is crowded with tourist from China, especially the duty free floors. I love the brands. A power house of all brands. Korean brands are expensive but with great quality. Toilets are clean and very accessible. The food court is overwhelming with choices and my teens are very happy to find Rocky Mountain apple candies. I only have problems with some sales assistant because they don't speak good English but they are very friendly.",46,crowded
47,21,188,"Make no mistake, the Lotte Dept. Store in Central Seoul near Euljiro 1-ga offers world-class merchandise. You will be completely overwhelmed by the breadth and quality of what you can buy at Lotte, whether it may be high fashion, food, or practically anything else.  That said, the shopping experience leaves a lot to be desired. For example, half of the B1 level is an amazing food store, with Korean groceries, international delicacies, prepared food to take home or to eat on premise. But the floor itself is not optimally laid out, there are too many people and the ceilings are extremely low. I am also not a fan of the faux Baroque architecture typically found in Lotte stores.  Once you experience B1, try to get to the Duty Free floors (9th-11th), which is likely the main reason to visit Lotte. First of all, I challenge you to find an elevator, let alone one you will be able to fit into. Once you get to the floors you will be completely overwhelmed by tourists! Times Square at Christmas is a cakewalk compared to this. My wife, who loves to shop and grew up in Seoul, swears she will never visit the Lotte Duty Free area again.  The other issue with Lotte is the relative lack of subway access. You can directly access the subway #2 line at Euljiro 1-ga but this is the loop line. You will likely need to transfer or walk to a better Metro station. Even if you are staying north of the Han River (Kang-buk) you are better off visiting the Shinsegae branch at the Express Bus Terminal south of the river in Kangnam. It's less crowded and the overall experience is better. There is no Duty Free floor but that's a plus in my book. I recommend staying away especially if you have kids with you.",47,crowded
48,22,194,"Lotte department store has many brands for men, women, kids, sports, casual, house needs, cosmetics, and many others, it took over 2 hours of walking just to explore the place and do very little shopping, it is very busy and crowded. Once you are there I would recommend that you take a nice break for coffee or tea in the middle of your shopping time.",48,crowded
49,23,209,"well, beside floor 9-11th on free tax store, which I dont really interested in . Beside, too many tourist crowded floor and the customer services are not that polite compare to other stores / floor. You should however, pay a visit to their basement on the food court area. Very interesting place to look at.",49,crowded
50,24,218,"Big and multileveled shopping mall with top designer brands such as rolex, louis vutton, prada and many more.  Be sure to grab a map when entering as this complex is not only big but also crowded with mainly china tourist.  Staff customer service is sometimes bad depending who serves you as well as how busy they are. Most of the staff can communicate in mandarins. Their English however is weak.  Do bring passport for prove entitlement of duty free. Platinum visa card holders are automatically given 15% discount on certain item.",50,crowded
51,25,220,"Anything you want, from the budget items to the highest level (they even had a section of Gucci for Kids), with a large variety of everything...  It was especially crowded on the sale floor, so best avoid that unless you really want something from there.  Good variety of gadgets and sunglasses despite this being a non-speciality store.",51,crowded
52,26,226,"We were quite surprised with the range of goods on offer, everything is overpriced, and it was overcrowded not a nice shopping experience at all. It was a nice looking department store, but if you have the opportunity to shop elsewhere on holidays like Europe, UK, Australia, then wait till then for better shopping choices and prices.",52,crowded
