,index,Unnamed: 0,서울대공원부정단어리뷰,index,단어
0,0,48,The mall is huge and you can buy almost anything you need. Parking is not difficult with payment deferred if you shop. The supermarket is also big and complete. Lines are not too long and there is a tax refund options if you bring your passport. You can spend the whole day here with a lot of food choices and variety of stores.,0,almost
1,1,58,"Of course the store sells all the items expected of any and all high-end retailers which one can find almost anywhere in the world -- but the basement food hall and grocery store is worth the trip. Yes, you can purchase ""street foods"" and sit in the dining hall to consumer, or peruse the limitless items in the grocery to take home to cook yourself. Either way, foodies will love this place -- though we have found prices of identical grocery items to be a bit less expensive at the Shinsegae Department Store a few blocks away.",1,almost
2,2,160,"We last visited here around two years ago and this is still a typical mega mall with branded apparel, bags, cosmetics and a duty free on the upper floor. Do note that some items in the duty free are much higher than what you can get for them in other stores like Shisegae, so shop around.  We loved the food court and supermarket in the basement though, and it had almost everything imaginable from vegetables to cakes and sauces and fruits, We bought a couple of punnets of strawberries for 8000 won each and they were sweet and ripe.",2,almost
3,3,195,"I have to say that the entire Lotte World is not well designed. Maybe because I am a foreigner, I am used to things being designed for the masses, where everything that can go wrong, will go wrong, so you try to make things idiot proof for the first time visitor. Like, this whole complex, the department store, the amusement park, etc, are all integrated into downtown Seoul. Not the city center, but a side city, Songpa-gu. In other words, Lotte World is the majority of Songpa-gu. That being said, it is hard to figure out where Lotte World begins, and where it ends. There is no guidance on where to go. It is just there. Park somewhere, figure it out. No shuttles, no monorails, no people to tell you where to go. Just start walking and figure it out. But this is true of all of South Korea. All of the signs inside, like where to find the bathroom or this or that, only get you half way there. Seriously, you will follow a sign, and then there is no sign, and the thing you are looking for is nowhere to be found. It is the most frustrating thing I have encountered. It is almost like they said, we'll do you a favor, but not really. And that could not be worse in a city where the temperature and the humidity both hover around 90. You will need a shower before you find a drink of water.  Sticking to topic, the department store: So, the front entrance is kind of there where the hotel entrance is, and I see people getting off of buses, I guess for the amusement park. But where do I go? I just want to buy this damn toy helicopter that my girlfriend's kid who keeps asking for it over and over and over. So, inside, am I near the department store? Hell if I know. Finally, after wandering around, I find a long hallway that leads to some stores, and hey, there is a toys r us. I found the helicopter, but only after my friends bus had left. Different cultures, I guess.",3,almost
4,4,198,"i bought a pair of ray ban sunglasses from the lotte department store in myeongdong. i assumed it was in perfect condition since it was a brand new pair and was KRW 240000 (and you'd assume for it to be of a certain quality). i started using it only a few days after it was purchased. that was when i noticed a manufacturing defect on the frame. there was a bubble under the frame coating which can only be attributed to a fault in the manufacturing process.  i brought it back for an exchange but it was stoically refused because any returns have to be done within a 2 hour time frame, even for products with manufacturing defects. needless to say i was pissed out of my mind and will never be purchasing anything from lotte department store again.  when i enquired about the warranty, they said i had to take it to the local dealership myself. no further information was given except it would take 20 days for the local dealership to decide on whether any rectification will be made. by which time i would've long left korea.  there is no customer service centre at lotte department store and when you have an after purchase problem with what you bought, all the previously eager beaver sales persons will shun you like the plague.  apart from the 2 hour storewide return policy, the salesperson also examined then pointed out very tiny, superficial marks on the frame (which i'd made accidentally) to further justify the need to adhere to the 2 hour return policy. seriously?! how would it matter unless the lotte staff were going to take the defective pair and resell it to the next unsuspecting tourist.  all the time during our conversation, she frequently asked for the sunglasses after which she'd try to scratch out the defect with her fingernails although i repeatedly asked her to stop it. she even tried to make off with it to somewhere else in the building to file the uneven frame coating down. like it's even possible and won't further damage the frame?!  almost everywhere in lotte, you will have the same lousy customer service. before you congratulate yourself on the marginal savings (if any) you've made by purchasing it there, think of all the unpleasantness you'll have to deal with if you find out a few days later that the product is defective. while tourist dollars are welcomed, all else (e.g. feedback, exchanges and returns) are not, even where the product was originally defective.  most purchases over KRW 30,000 are eligible for a tax refund but for all the saccharine sweetness of lotte salespersons (e.g. accompanying you to the cashier for their commission), not a single one will offer to print the tax refund form out for you even though you're obviously a tourist unless you specifically request for it with much difficulty in english. (the tax refund form has to be provided by the store in which you've made your purchases.)  try it if you don't believe me! for all it's worth, i'll rather pay a few dollars more and get it anywhere but in lotte! 1st world department store run by scam artists.  p.s.: my sunglasses are a lot worse for wear after the sales person's scrubbing and recounting my experience makes my blood boil.",4,almost
5,0,25,Already a good shopping center  but the goods on offer are already in the top league in terms of price If you dont have the money very loosely you wont find it,5,top
6,1,30,A lot of top brands at prices like anywhere else nothing special for my taste There is Duty Free but I dont know what is Duty Free,6,top
7,2,61,"This massive multi-floor department store stood across the street from my Seoul hotel, so I went over to check it out one day. It seemed to be a typical upscale store, similar to myriad others in the world, with many boutique shops and most prices on the high end. I noted many Korean-made items available. All floors looked well maintained and had nicely displayed merchandise. It was early November and the whole place was already beautifully decorated for the upcoming holiday season. I didn't interact with any employees so cannot comment on the staff and service.  The food court in the basement, however, brought me back to Lotte twice. I ate two very good dinners (Chinese and Korean) there and found the staff upbeat and pleasant. The cashier for the food court and at least one person at each order counter spoke good English. The area became crowded in the early evening, and I shared my table with a local resident on each visit. Both became lovely dinner companions as we discussed many topics, including what not to miss during my exploration of Seoul.  For those looking for good buys, I cannot recommend Lotte, based on what I saw. But there are plenty of other places nearby, such as Namdaemun Market with its estimated 10,172 stores. It offers bargains at many shops and provides a totally different experience from typical department stores",7,top
8,3,75,not the top mall in Seoul but you can find everything in 1 place from food to clothes. the surrounding area is great.,8,top
9,4,81,"Amazing shopping center that seems to have anything that you wold need. It is really large so it can be quite hard to find specific items. We stopped by before heading off to get tteokbokki chips, among other things. They have empty boxes available at the checkout for carrying items. There is also tape and ribbon to pack the boxes. We essentially packed what we brought and left for the airport.",9,top
10,5,86,"First impression see the main floor with your standard beauty booths. When we arrived the top floor; we decided to leave immediately. The whole top floor was filled with Chinese tourist lined up to purchase their duty free expensive things. The rest of the floors are pretty standard with different items for each floor. Finally, we arrived the basement. There were so many different variety of foods, looking delicious and tasty - it was heaven.",10,top
11,6,113,All items from head to toe and from all the age range can be found in this mall. And all designer things is here also. Its a one stop shop for everything.,11,top
12,7,116,"Nothing much, just a department store and a supermarket within a big lotte complex. Had a good Korean meal on the top floor. Born-ga by some famous chef from Korea. Big building are seldom in Hanoi. This is way off the tourist area.",12,top
13,8,118,"This is the Store of Seoul. This time, I have seen so many more pretty things from France than ever before, which more than a decade ago. The duty free shop on top floors were replaced by visitors from China rather than Japanese tourist as before. Not much of a shopper these days, in my tender age, I didn't get to see everything but food court was a necessary visit. I gave 5 star rating for it being the hub-bub of MyeongDong attraction. Things can be more pricy compared to other areas in Seoul. I am glad that the place maintained its popularity and evolved to cater the younger crowds & foreign visitors as even for choice of food in the lower floors. Somewhat crowded but this is the story of Seoul. I give credit to Koreans that tried their best to meet up to the standards of westerner or foreign visitors.",13,top
14,9,124,"This is a huge luxury shopping mall with a lot of high end brands - think Burberry, Coach, etc. There is a small supermarket and a food court, as well as some restaurants. Since this mall is higher end, there didn't seem to be too many sales worth going for, even on Black Friday. It's a nice place to walk around though. For younger and more trendy brands, there is the Lotte Young Plaza mall that is attached. You can browse this mall all the way to the top floor and take the walkway over to the Lotte Young Plaza from the cinema.",14,top
15,10,127,"Good ambience with all the christmas decorations. Plenty of stuffs to see. But supermarket is quite small. However, if you are looking for the top 10 snacks to buy, you can find it here",15,top
16,11,129,"So I bought a watch in this store and as I needed to obtain it in the airport, I handed my air ticket and passport for the shop assistant to arrange the pick-up time. The assistant wrongly inputted the date as 16/11 when it should have been 6/11. This mistake made me unable to obtain my item for which I had already paid, so I had to stop the transaction made via credit card immediately. What makes it even more frustrating is that the airport staff, after understanding my case, was unable to solve the problem for me. I left Korea without ever obtaining my item. Therefore, I truly found the staff irresponsible and unhelpful.",16,top
17,12,142,"It contains 3 blocks of building, linked with footbridges, suitable for different people from young shopper to luxury brands lovers.  You can find all you want here. Not too crowded except the top few floors of Duty Free Shops, with all the chinese crowded buying different cosmetic items.  Convenience location near subway station.",17,top
18,13,148,"This is one of the most famous (or at least most advertised) department stores in Seoul, and hence, from the time it opens till the time it's closed, there are huge crowds all over the place. It is still possible to navigate through, but be prepared for a very busy area. Use the escalators, as the lifts are packed! There are 11 floors with top 3 of them dedicated to Duty Free shopping. That's where the ""madhouse"" begins :) - in a good way! You will be able to find any kind of cosmetics there, and the prices are good. Don't forget to bargain and ask for freebies!!! I know, it is a large department store, but you still allowed to ask for discount, gifts, and freebies - and get them! All assistants are helpful and speak ok-ish English. Have your passport (or the photo of it) and your return flight details, and have your VAT removed from your total.  If you pay by Visa you can get 5-15% of the total bill. Negotiate it - with gold visa you can get 10%, with platinum -15%.  In the main store you could find great fashion - local and international. The interns one isn't a bargain, but go for the local designers and objects - you will be pleasantly surprised both by look and by price.  There are restaurants and cafes all over the place, so if you need to rest your feet and boost your energy - there are plenty of opportunities to do so!",18,top
19,14,154,"Right next to our hotel (Lotte Hotel)- next to Euljiro(1)-Ga station. This is a huge 10 storyed mall with the top 3 floors dedicated to duty free goods. Other floors have everything that you want to buy when in Seoul, but the food and bakery section in the basement is to die for!",19,top
20,15,186,"I'm American, and I frequent places like 5th Ave in NYC, Michigan Ave in Chicago, and Rodeo Drive - luxury, right?  No.  Lotte mall is ridiculous. How you have all the luxury brands all on top of each other in one building is insane. Who buys all this stuff? Apparently, lots of people do, bc the place is packed with buyers, not just shoppers!  If you are a foreigner, go upstairs to the duty free floors, where the best deals are. The supermarket downstairs is cool to check out, and it's also the best place to get something to eat, like at the noodle bars. Don't eat on the higher floors - it's overpriced and underwhelming.  There are also 2 related malls next door with more designer goods, and the other one caters to the younger set.  If you're American, realize that English isn't a standard out there, so you'll have some difficulty.",20,top
21,16,192,"Cosmetic on top floor - some how the price is lower than shops in Myendong street. Sometimes, can get additional 10% off during sales or credit card promotion like using Visa card. Love the supermarket on the Basement floor. All the instant noodles, pork meat in can and Korean products can be found here.",21,top
22,17,195,"I have to say that the entire Lotte World is not well designed. Maybe because I am a foreigner, I am used to things being designed for the masses, where everything that can go wrong, will go wrong, so you try to make things idiot proof for the first time visitor. Like, this whole complex, the department store, the amusement park, etc, are all integrated into downtown Seoul. Not the city center, but a side city, Songpa-gu. In other words, Lotte World is the majority of Songpa-gu. That being said, it is hard to figure out where Lotte World begins, and where it ends. There is no guidance on where to go. It is just there. Park somewhere, figure it out. No shuttles, no monorails, no people to tell you where to go. Just start walking and figure it out. But this is true of all of South Korea. All of the signs inside, like where to find the bathroom or this or that, only get you half way there. Seriously, you will follow a sign, and then there is no sign, and the thing you are looking for is nowhere to be found. It is the most frustrating thing I have encountered. It is almost like they said, we'll do you a favor, but not really. And that could not be worse in a city where the temperature and the humidity both hover around 90. You will need a shower before you find a drink of water.  Sticking to topic, the department store: So, the front entrance is kind of there where the hotel entrance is, and I see people getting off of buses, I guess for the amusement park. But where do I go? I just want to buy this damn toy helicopter that my girlfriend's kid who keeps asking for it over and over and over. So, inside, am I near the department store? Hell if I know. Finally, after wandering around, I find a long hallway that leads to some stores, and hey, there is a toys r us. I found the helicopter, but only after my friends bus had left. Different cultures, I guess.",22,top
23,18,198,"i bought a pair of ray ban sunglasses from the lotte department store in myeongdong. i assumed it was in perfect condition since it was a brand new pair and was KRW 240000 (and you'd assume for it to be of a certain quality). i started using it only a few days after it was purchased. that was when i noticed a manufacturing defect on the frame. there was a bubble under the frame coating which can only be attributed to a fault in the manufacturing process.  i brought it back for an exchange but it was stoically refused because any returns have to be done within a 2 hour time frame, even for products with manufacturing defects. needless to say i was pissed out of my mind and will never be purchasing anything from lotte department store again.  when i enquired about the warranty, they said i had to take it to the local dealership myself. no further information was given except it would take 20 days for the local dealership to decide on whether any rectification will be made. by which time i would've long left korea.  there is no customer service centre at lotte department store and when you have an after purchase problem with what you bought, all the previously eager beaver sales persons will shun you like the plague.  apart from the 2 hour storewide return policy, the salesperson also examined then pointed out very tiny, superficial marks on the frame (which i'd made accidentally) to further justify the need to adhere to the 2 hour return policy. seriously?! how would it matter unless the lotte staff were going to take the defective pair and resell it to the next unsuspecting tourist.  all the time during our conversation, she frequently asked for the sunglasses after which she'd try to scratch out the defect with her fingernails although i repeatedly asked her to stop it. she even tried to make off with it to somewhere else in the building to file the uneven frame coating down. like it's even possible and won't further damage the frame?!  almost everywhere in lotte, you will have the same lousy customer service. before you congratulate yourself on the marginal savings (if any) you've made by purchasing it there, think of all the unpleasantness you'll have to deal with if you find out a few days later that the product is defective. while tourist dollars are welcomed, all else (e.g. feedback, exchanges and returns) are not, even where the product was originally defective.  most purchases over KRW 30,000 are eligible for a tax refund but for all the saccharine sweetness of lotte salespersons (e.g. accompanying you to the cashier for their commission), not a single one will offer to print the tax refund form out for you even though you're obviously a tourist unless you specifically request for it with much difficulty in english. (the tax refund form has to be provided by the store in which you've made your purchases.)  try it if you don't believe me! for all it's worth, i'll rather pay a few dollars more and get it anywhere but in lotte! 1st world department store run by scam artists.  p.s.: my sunglasses are a lot worse for wear after the sales person's scrubbing and recounting my experience makes my blood boil.",23,top
24,19,213,"If you ever been to Harrods, or KDW in Berlin, etc. Lotte is a great example of one stop shopping with top notch luxury to boot. What makes Lotte even more incredible is the food hall in the basement level. I recommend coming here first, before you go and book any restaurants in Seoul. It's amazing and a foodie dream",24,top
25,20,218,"Big and multileveled shopping mall with top designer brands such as rolex, louis vutton, prada and many more.  Be sure to grab a map when entering as this complex is not only big but also crowded with mainly china tourist.  Staff customer service is sometimes bad depending who serves you as well as how busy they are. Most of the staff can communicate in mandarins. Their English however is weak.  Do bring passport for prove entitlement of duty free. Platinum visa card holders are automatically given 15% discount on certain item.",25,top
26,0,1,Went to Lotte shopping mall basement foodcourt for dinner Quite nice and crowded as it was dinner time Plus there is a supermarket next to the foodcourt Very convenient  A pity that we did not have chance to shop the whole building,26,crowded
27,1,21,Very good Looks like shoppers have returned but no longer as crowded as before on a Sunday afternoon,27,crowded
28,2,47,Lottery Department was not what I used to go it was very very crowded at this time of year But they display beautiful fresh food and luxury items as ever Being there always make me feel happy,28,crowded
29,3,61,"This massive multi-floor department store stood across the street from my Seoul hotel, so I went over to check it out one day. It seemed to be a typical upscale store, similar to myriad others in the world, with many boutique shops and most prices on the high end. I noted many Korean-made items available. All floors looked well maintained and had nicely displayed merchandise. It was early November and the whole place was already beautifully decorated for the upcoming holiday season. I didn't interact with any employees so cannot comment on the staff and service.  The food court in the basement, however, brought me back to Lotte twice. I ate two very good dinners (Chinese and Korean) there and found the staff upbeat and pleasant. The cashier for the food court and at least one person at each order counter spoke good English. The area became crowded in the early evening, and I shared my table with a local resident on each visit. Both became lovely dinner companions as we discussed many topics, including what not to miss during my exploration of Seoul.  For those looking for good buys, I cannot recommend Lotte, based on what I saw. But there are plenty of other places nearby, such as Namdaemun Market with its estimated 10,172 stores. It offers bargains at many shops and provides a totally different experience from typical department stores",29,crowded
30,4,71,"It was a weekday yet so very crowded! The mall is very big and has many floors. I recommend to check the directory for what each floor offers, so that you can better understand where to go. Otherwise you spend a lot of time navigating thru the crowds and floors. There are some floors dedicated for duty free shopping, which seemed the most crowded with shoppers pulling trolley bags to contain their things. Be prepared for the long queue to make payment for your shopping goods!",30,crowded
31,5,72,"It is a huge shopping mall, be prepared by wearing a pair of comfortable shoe wears. We went during the weekend, despite the size it was still very crowded. I would advise do some reading and know at least a little of the mall map, or else you'll have to spend more of being lost.",31,crowded
32,6,100,"Spent few days in Seoul for Business purposes and as it was next to the hotel went there in order to check out any eventual bar gains...  Was a quite disappointing experience as it was overcrowded, people pretty aggressive and when checking out the prices couldn't find anything worthy  In my opinion spend your time somewhere else",32,crowded
33,7,117,"It's nothing but a multi-story Department Store with many International Designer Brands and an incredible number of cosmetics counters, comparable to Saks Fifth Avenue or Henri Bendel in New York or Harvey Nichols in London. If I lived in Seoul or a tourist looking for tax-free Brand Name shopping, I would likely shop here. If you are a tourist not interested in buying brands that are not available in your home countries, save yourselves the headache and avoid fighting through the crowds. With the recent travel recommendations from one of the neighbouring countries, you may be able to enjoy walking through the Store without getting bodychecks these days.  The Poor Rating is not a reflection of the Department Store itself but simply the whole retail experience. It was extremely crowded and noisy when we visited.",33,crowded
34,8,118,"This is the Store of Seoul. This time, I have seen so many more pretty things from France than ever before, which more than a decade ago. The duty free shop on top floors were replaced by visitors from China rather than Japanese tourist as before. Not much of a shopper these days, in my tender age, I didn't get to see everything but food court was a necessary visit. I gave 5 star rating for it being the hub-bub of MyeongDong attraction. Things can be more pricy compared to other areas in Seoul. I am glad that the place maintained its popularity and evolved to cater the younger crowds & foreign visitors as even for choice of food in the lower floors. Somewhat crowded but this is the story of Seoul. I give credit to Koreans that tried their best to meet up to the standards of westerner or foreign visitors.",34,crowded
