,이름,별점,리뷰,날짜
88,Alex Millward,5,"If you go to Seoul, go here. On a clear day the views are amazing, I never new the residents of Seoul had so many helipads. Its relatively cheap. #Dontlookdown",2 years ago
89,Chris Kwon Lewis,4,"You can get some amazing views of the city, but the reason I'm not going to give it 5 stars for a few reasons.  First, it's a very similar experience to Namsan Tower (AKA Seoul N Tower). In fact, in many aspects it felt like a copy-and-paste experience. It's way too similar and it felt like they were too lazy and unoriginal with the design.  It was also odd the top floor had escalators going up, but not down. You have to go out and take the building stairs and come back in.  Second, other than the fantastic view, there isn't much else to do. If you're already been to Namsan Tower, don't expect too much. It will feel like a very familiar experience.",10 months ago
90,RáJess,5,"It is the highest tower in Seoul. It stands tall in Jamsil, one of the most expensive areas in Seoul. Its construction was completed in 2017. There are many international brand outlets, restaurants, stores and many more inside the tower. You can pay to go to the watching deck from where you can see the whole Seoul. Must visit place in Seoul.",a year ago
91,Chiranjeev Maini,5,"Mind blowing experience. Lotte world Tower is the tallest building in South Korea (am sure all of you are aware 😊). The view is immaculate and breath taking. After shopping for some time, I decided to visit the tower (especially the observation deck) with some of my friends and it was worth the investment. The sheer experience of standing on the glass floor gives u an Adrenalin rush. Make sure u don’t miss visiting the top floor of the tower. Elevators are super fast and within just a few seconds you will be on top. They also have a souvenir shop (which is a bit expensive) on top. Do not miss having an ice cream from the cafe. It leaves u with a sweet memory. Definitely a good investment of time and money.",3 years ago
92,David Young,5,"There is great deal of activities to do, so have some time to explore. There is a lot of sculpture, art, and interior/exterior design to see. If you walk around you sure to see more than a few wonderful suprises. This is truly one of the worlds greatest planned developments, a world treasure, and testament to hard work and dedication of the Korean people, who have built one of the greatest modern industrialized countries in history.",3 years ago
93,André,5,"The highest building in Korea with 555meters. You will need to book a ticket in advance to get up to the observation deck. Before you enter the elevator there is a lot of information about the building and you get to see some Korean art. The arrangement is very nice with impressive animations. The elevator takes you up pretty fast. The observation deck stretches over multiple floors and the views are stunning. They offer to take your pics professionally and there is also a well sorted souvenir store. If you feel like having a coffee, there is a Angel in us coffee shop too. Also a restaurant can be reached via a separate elevator. The best time to visit is right before sunset s you get to see the day and night view.",4 years ago
94,Nosi Krause,5,So worth it. The view is unimaginable!  Definitely worth your time.,10 months ago
95,Dmitri K (Krazykov),5,"Amazing view and a great experience overall, I really enjoyed the elevator ride as well, it's got screens all around you making it look like you flying! Price is about $30 bucks per adult! Before you buy check visibility board, depending on weather and pollution levels for the day you might not be able to see far!",4 years ago
96,Kenneth T,2,"I think the tower is really bad and all the shops sells extremely expensive stuff that only some people can afford. Additionally, it tries to be fashionable but fails spectacularly. It is not suitable for most people and the tall tall tower is the only thing attractive to this disrespectful building.",3 years ago
97,Gabriel Jacobs,5,Lotte World Tower is absolutely stunning! You can look DOWN at skyscrapers! Be aware Lotte tower is only a little better than Seoul Tower which is not far away. Lotte tower is the city with shopping while Seoul Tower is in nature and has lots of flowers.,a year ago
98,Mahdee Hasan,5,Very good place for SkyView of the Soul. They have 30 minute time frame but you can stay more even more. I recommend to visit just before sunset so that you can view both the daytime & night view. Standing on glass above 486M above the ground is little bit scarring but enjoyable.,3 years ago
99,Rajesh Patel,5,Tallest Building in South Korea and looking up will sprain your neck.,6 months ago
100,Krems Ryan,5,"You don't get a sense on how vast the metropolis of Seoul is until you see it from the top of a large building such as Lotte tower. The wait was relatively long to get up, but once you are at the top there is no time limit to enjoy the views which was a pleasant surprise.",a year ago
101,Bo Z,5,"If you go to Lotte World before you will get a discount on your tickets (25% off). Or if you have the right credit card you will also get  a discount (up to 30%). The service by the staff was excellent but just watch the locals they always try and push in.  Our experience was fantastic. There's a snack, ice cream and candy bar at the top.  You can go outside on the viewing deck. A MUST DO.  And it's free.  The souvenir shop at the top is very good.  When you are finished and are leaving they funnel you through a final gift shop incase you want to buy more.  The lift is so fast you hardly fee you are going up.  The only clue is that you have to equal the pressure. Your ears. ****** Take alot of pictures while you are up there********  there is also an area to get the photo at the top professionally done. It is a bit of a maze to get there but it is well worth it.  If you are in Korea it is a top 5 place to visit.",2 years ago
102,Margaret Lehmann,4,"Expensive, but one brilliant view of the city (when the sky is clear). There is a great place for ice cream and a few cafes for coffee. You can take some great photos here - perfect for Instagram. Also a great place to work on your fear of heights (glass floor walk out).",3 years ago
103,Kevin S,5,"The observatory desk visit is recommended. After you buy the ticket, there is a short walk through the exhibitions where they show some digital arts about the building. The elevator is the currently the fastest in the world. There is really cool LED displays in the elevator, which shows a small clip for the duration of the elevator.",4 years ago
104,Pathum Rathnayaka,5,Loved this place. Recommend visiting the Basilur coffee shop.,10 months ago
105,Jairo montaño,5,"It’s a great place to visit at Seoul! Not every day you can be at 125th story height!! It was very nice to see this larger city with all the other building, and the river through the pretty view! It’s another place that you can’t miss during your visit in Seoul! 💪🏻💪🏻",3 years ago
106,Jan Hoffmann,5,"Absolute amazing view over Seoul, must do in my opinion! About 30000 Won for the visit is woth it.",7 months ago
107,JuA Kim,5,"This is one of the nice view point of Seoul. When some people asked to me about a nice place in Seoul, I recomend here kkkk. And 2 years ago I visited Sky tree in Tokyo , this Lotte world tower is better than there.",4 years ago
108,Ruslman,5,"This is definitely a must see location.  You have to get down, in the basement that is, to go up, up up!  From the amazing plasma displays, the architectural history, to the phenomenal views this place is worth the trip.  We spent about 2 hours peering out of Seoul Sky and then a few more in the mall.  In Seoul Sky there are a few cafes, a gift shop and a restaurant.  The views are spectacular.  It is worth the 27000 won for adults.  Lotte Tower does not allow you to make online reservations with foreign credit cards.  So get there early.  Cheers!",4 years ago
109,Gerónimo Caldora,5,"The basic entrance fee is 27000 wan, totally worth it. You get access from the 117 to the 120 floor. To go up you use very high speed elevator. The views are incredible.  Really enjoyable.",2 years ago
110,nicky 니키 Arce,5,Very nice place. Amazing . Worth it . I will be back again. Don't hesitate to go here super worth it,a year ago
111,Fraser,5,I visited Seoul Lotte world tower in September 2019. The view from the too was amazing with a 360° view of Seoul and a glass bottom floor where you can look directly below. The elevator is one of the fastest in the world which can reach the 121st floor in less than 1 minute (22 mph). I'd recommend coming here just before sunset as the view is spectacular. Also if you search online you can probably find 2 for 1 tickets as I did.,2 years ago
112,Kristie Kim,5,My aunt and I love this area for shopping because of the upscale stores. Nice area for photography inside and outside -- it is right next to Seoul Sky where tourists can take photos above Lotte World. I like to go up in the tower and look at the view of the city.,4 years ago
113,aslam acchu,5,"Worlds 5 th tallest tower . Book the tickets in KLOOK app , then you will get a discount . Experience the speed of an elevator which covers 129 floors in just 1 minute. Sunset is awesome here. Go in the evening and wait for sunset. You can also go there by catching subway.",3 years ago
114,Molemi Pule,5,It's a well thought design and most beautiful building. It's wow and the experience was amazing. I would not mind for the second visit.,a month ago
115,Younghwan Jeon,5,Crystal mirrors are in roof floor,5 days ago
116,Danny Hetherwick,5,"Don't even think about skipping this place. Completely breathtaking views of all of Seoul. Head here around sunset for that perfect glow. Also, wait for a nice crisp clear day. It can get very hazy in Seoul. Buy your tickets online, it's 5,000₩ cheaper.",2 years ago
117,David Ko,5,"If you want to see fantastic 360 degree view in Seoul, this is the right place. It has 3 levels of sky decks and lounge on top of the building. It is quite pricey to go up, but it might be worthy.",4 years ago
118,Andrea De Santis,5,"That was one of the best attraction in Seoul, with the super massive luxury shops and the restaurant and whatnot. Going up is the best fa our you can do to yourself, the view is just breathtaking. If the weather is nice you can get outside as you can see in picture number 3. Free WI-FI",2 years ago
119,Mustapha Koroma,4,Amazing view. Very easy to access by using the metro. The mall is a place u definitely want to check out.,2 months ago
120,Stephen Lam,5,"Awesome skyscraper to visit!  A bit pricy to go up (27,000) won but well worth it in my opinion.  There's multiple observatory floors at the top, and you can experience the building in different ways.  Glass bottom floors, outside decks, etc.",5 years ago
121,Tory Skyers,5,"Awesome place  visit in Seoul. The question was efficient, the elevator ride up the tower was part of the experience. It was soooooo fast, and it didn't really feel like you were moving at all! The outside sky deck provided a great view of the city and country side, the inside clear floor was also an experience. This is touristy for me, but still worth the visit. Much like the radio tower in Shanghai.",2 years ago
122,Philip Deacy,5,An attraction of world class quality. A great way to spend time in Seoul. Lotte have done a great job.,2 months ago
123,K Webfest,5,"Lotte Corporation built a statue of German writer Johann Wolfgang von Goethe in the park of the Lotte World Tower, the tallest building in South Korea. The 5.15-meter statue is a duplicate of sculptor Fritz Schaper’s Goethe Monument (1880) in Berlin’s Tiergarten Park. Goethe was the model of inspiration for Shin Kyuk-ho, the founder of Lotte Group. The company’s name Lotte itself was inspired by Charlotte, the female character from Goethe's novel 'The Sorrow of Young Werther.'",2 years ago
124,Leena Sharma,5,Great views of the Seoul metropolitan landscape. Best to go on a clear day and possibly better than the Seoul tower (if you had to pick only one to do) as you see more. Try to avoid busy periods as when it's busy it's really busy like waiting in queues.,4 years ago
125,free shavocado,4,You can see the view of Seoul and it goes to 177 floors in 1 minute😱 You might get a little dizzy tho because it moved super quickly 😵,2 years ago
126,Sally Ouyang,5,Soooo much shopping in this tower! Also I recommend going up to the tower and seeing a great view of Seoul! It’s not super busy so no line or anything. They also have floor glass screens where you can get some great pics! Highly recommend visiting it.,3 years ago
127,salman H,5,"Lotte world is a mini town. It contains sky ride, i.e visit to observatory at 123rd floor, there is a big mall in the same building, which is connected to a big aquarium and the lotte adventure park or u may call it a theme park. The tower visit is very nice, at times it gets crowdy and lines at the elevators get a bit long. The elevator leaves u at floor 118. From there on you can go to floor 122 by escalators. Finally for floor 123 u need to climb stairs. Thats the highest point u can go  in this building. Floor 121, 122, 123 have excellent panoramic view of the city. Its amazing and beautiful view from here. There are souvenirs shops and few eating options also available on the top floors. Most exciting is the portion with glass or transparent floor, its good place for lil bit thrill and taking photos. If you have to make a choice between N Seoul Tower and Lotte world tower for climbing up, please go for lotte world tower, its much more exciting, though N Seoul Tower is also a must visit place, but if u have lotte world in your program then you may not climb up on N Seoul Tower. Its a very nice place to spend a day with family and friends.",3 years ago
128,Mugahed A. Al-antari,5,"Night show is amazing... Enjoy all games after 06PM for 10,000₩ only😉",a year ago
129,Do whatever you like,5,It’s great place to get once in a life time at least. I Recommend you to get there at dusk or night because of its beautiful scenery outward. Slightly costly but it’s valuable. Please make sure there is its own time slot to enter the main gate.,4 years ago
130,Anni M.,5,"This is a place where you need to visit at least once! Gorgeous views from the top, with cafes, souvenir shop and the glass floor. Even I'm afraid of heights I survived and actually really enjoyed :)",3 years ago
131,jiseung ryu,5,"Lotte world has one of the most varieties in restaurants and shopping available for all types of price and demographic. It is also highly close to the Charlotte theater, an amazing lake open for hikes and a lotte amusement park that is open all year round. one stop for all ages and all types of needs",3 years ago
132,Tari YD,5,"A really incredible mall of epic proportions. So many choices of stores, restaurants and attractions. You can easily spend a day here. Visit the observation floors for 27,000 won. Plan to spend an hour on top just looking, or eat in one of the restaurants. There are three floors of viewing. Walk out on the glass floor and scare yourself.",3 years ago
133,Jennifer Huang,4,"It is a really great place. Originally i think it is easy to walk around soon. Amazing sencery, dancing Roberts,  fantastic Led lights, cafe shop... Etc. But souvenirs and beverages are not cheap,  it is a pity. 😂😂 Anyway,  it is really a joyful tour attraction. It's worthy to spand money here and enjoy your special date or celebration.",4 years ago
134,Diana luxuryretreathawaii Vacation Rental Hawaii,5,"Lotte Tower is a shoppers paradise! The new building has a myriad of high end shops and restaurants. The restaurants are local or international and the food is delicious! Look for the food truck restaurants and you will not be disappointed. There is also an observation deck for the more adventurous people out there, with a glass floor balcony looking down hundreds of feet below you. Definitely an experience to remember. The view is absolutely amazing, 360, and there are several coffee shops and souvenirs available. The elevator ride to the top is around $27 but well worth it. Don’t forget to check out the extensive water park outside!",4 years ago
135,Nuhyil,5,One of the 6th tallest building in the world and tallest in South Korea there is an entry fees of 27000k won for normal and 37000 won for lounge bar which is worth it because you can get a free drink of choice at the top of the building also can use the free telescope,3 years ago
136,Keith Johnson,5,Must visit this tower if you are visiting! Amazing view at the top for around $20. The glass bottomed floor is an experience you absolutely have to see. It is an unbelievable masterpiece of engineering and totally worth it.,3 years ago
137,Jamie Carter,4,Very cool tourist attraction in Seoul that gives you a fine view of the city. The actual tower has some nice views on a clear day and there's a pretty comprehensive shopping centre below. The fast pass ticket is not worthwhile as the queue to get to the lifts isn't usually too bad unless you're visiting on a busy weekend or holiday.,2 years ago
138,Samir B.V.R,4,"Wonderful view from the top, entry fees of $27 though is little steep. The information tablets facing different directions are very informative, and can be better appreciated more if famous places around Seoul are somewhat known beforehand.",3 years ago
139,Jon Can,5,"Lottery World tower is the 5th largest building in the world. Entrance fee ￦25,500 (less than $25). Search online for discounts before heading to the tower. At the first floor you will be greeted by beautiful digital art with a Korean flare. After you will take the Sky Shuttle and while riding it to the top of the building you will see a small show. At the top the view is nice, bathrooms at almost every floor, a cafe, candy shop, and a lounge where you can have wine with a view (need to make reservations).",3 years ago
140,Alfredo Baratta,5,"Very exiting experience. The elevator is very fast, but I had no issues going up an down. The view was great, definitely a good experience, I took great photos and the fear of looking down from the floor window will remain forever in my mind :-)",4 years ago
141,Muhammad Jehanzaib,5,"It is a wonderful place to visit. But when there is a fireworks festival,  this place is more adorable to see. Lotte tower is the 6th highest building in the world and one can see the seoul sky from lotte tower  top.",3 years ago
142,Md. Aminur Rahman,5,See the Seoul from the sky touching high tower.,2 months ago
143,Njjstudio Art,5,Unbelievable view of Seoul and surrounding South Korea! Make sure you are here on a clear day! Plenty of interactive things for kids and a nice cafe and restaurant (premium prices) up top!,2 years ago
144,john kwak,5,"Had a lot of fun touring the top of Seoul. It's a bit pricey for what it is, but we had a lot of fun. Our crazy 16-month old daughter LOVED the clear glass floor partition, I refused to chase her on to it. 😂",4 years ago
145,D Max,5,"It's Seoul's iconic tower.  The ticket costs around US 30 dollars (year 2017) very affordable (compared to one world in NYC or Shanghai tower, Lotte tower is cheaper!!  And you get to see the whole city!! The views are jaw-dropping!!! Specially the glass floor where you can feel scared or dizzy!! The lifts and the lobby make you feel mesmerized!! There is a small café and two souvenirs shops, one at the top and one at the exit. There is also an expensive restaurant which you can only access with a reservation. A very nice experience.",4 years ago
146,M F,4,We didn't have the best view when we arrived at top floor 123rd. It was raining and really foggy. But thankfully it got better after a while and we had a great time.,2 years ago
147,B Wong,4,"Lotte World Tower has shopping, dinning and an observation deck call Seoul Sky.  As of the time I was there, we couldn't figure out how to pre purchase tickets as foreigners who without a local phone number.  Their online purchase require a local number to receive a text confirmation of purchase. However we went on a Saturday afternoon and were able to purchase tickets without waiting.  Tickets are sold in time interval to control traffic and wait time.  By the time we finished, around 3:30pm, the ticketing area got a lot more busy.  There are three levels to the oberservation deck, the elevator will take you to the lowest level and then you can take esculator to go up to the next two levels.",3 years ago
148,Candice Richards,5,"Beautiful shopping mall. It has an amazing view. There are tons of luxury shopping options from Louis vutton to Chanel, Gucci to Prada. There are also your more affordable options like H&M, forever 21. The food here is amazing! So many options! Cafe’s are in abundance. There is an in door theme park. Only 20,000 won! I loved it here! Make sure you go to the top of the tower!",4 years ago
149,Me3-3los,5,"Before the tower you can shop in a giant mall which was absolutely amazing. The tower’s staff are nice and friendly, plus can speak english. The Tower itself is what you call “Daebak"" which is the korean saying for amazing! Since it has 123 floors from the top the view is picturesque.",3 years ago
150,Pradeep Wasala,5,"5th tallest building in the world (555 m). ""Seoul Sky"" observation deck is located bit lower than that (478 m). Several shopping malls and restaurants located inside the same building. Free WiFi is available around.",3 years ago
151,Jeevaggan Ramanathan,4,Wow. Icon of Seoul. Aerial paranormal view is excellent. Please take coins with you to use the provided binoculars. The duty free shops in 7th and 8th floors close by 20.30 hrs.,3 years ago
152,Rachel T,4,Came here with a friend visiting Seoul. I didn't want to go but he did. It was cool and pretty but we went on a cloudy day. Cool to see once but would not go again especially for the price tag of $25.,4 years ago
153,FRANK SH LEE,4,It was pretty nice and still can feel the hard mood based on Korean culture. I was planing to see Movie and Cinema also Quiet nice but steps are not welcome for guests.,4 years ago
154,Alan Stevens,5,So many things to see and reasonably priced.  One heck of a view!,3 days ago
155,tim kim,5,Great views. Loved it.,3 months ago
156,Sunhye Kim,5,"The tallest building in Korea.  You can see the whole Seoul area! Amazing view.  Its 27,000 won but worth it.  However, it could be a long line to go up and down.  Many tourists, especially during the weekend.",2 years ago
157,I am Michelle,5,Visit South Korea for New Year and don't miss out the New year's countdown at Lotte World Tower and witness the spectacular fireworks display! You'll gonna enjoy every tiny bits of the show ♡,4 years ago
158,Exploring the beauty of Korea,5,It is worth visiting.. I was there alone but I never felt like it.. Staffs are very helpful and friendly.. I am scared of hights but I was still able to have a selfie on the glass floor  without feeling uncomfortable. It is expensive but the experience is priceless.,3 years ago
159,TheGreatSpots KangChrisKorea,5,This is not just building but it is ART. I'v been watching the history of construction. 123floors with 555meters height is the 5th largest building over the world and the most attractive landmark of Seoul. I went up to 76th floor Signiel Seoul for lunch meeting a few weeks ago. Their service was very good and view out of window was the greatest. You should visit here if you want to have the best experience in Seoul.  I attached some photos that I took around Tower and inside. Enjoy it.,5 years ago
160,Alina Sadykova,5,What I liked the most about this place is a store selling Ghibli Studio's toys and stuff. A huge statue of Totoro and Cat bus. There is a platform with glass floor on the top for those who want to check the view of the city from above.,3 years ago
161,Cullen승현,4,"A must if you are touring Seoul. The only annoying thing is the amount of people that are there. It's hard to move around without bumping into someone. But hey, that only makes the experience more Korean 😉",4 years ago
162,No Name (hjc985),5,"Stop by and see all of seoul. Essentially, you will be paying for the view and staff to run this place. It is worth the money.",2 years ago
163,Serge Magnavox,3,The people at this place need to regulate how tourists take pictures because influencers are like the plague all over the windows. I was shoved out of the way by a native couple who wanted to take pictures just because I was alone taking my own picture.  Otherwise the view is awesome and I reccomend going to the top. But the people are so aggressive it made it hard to enjoy.,2 years ago
164,Sagnik Bhattacharya,5,Great place to visit for first time foreigners in Seoul,10 months ago
165,Bryan Joo,5,"It's a beautiful place. It has a magnificent building, and it's great for shopping.",2 years ago
166,Miika Kostamo,5,Amazing experience and restaurant prices were not very high. Dinner at 123 lounge was an unforgettable experience as well. Very short lines to everything and service was excellent.,2 years ago
