,이름,별점,리뷰,날짜
0,Muhammad Islam,5,Awesome place to be.. To feel relaxed refreshed. A new perspective to your vision. It can help you clear your mind. It will definitely make you smile and refreshes you highly recommended. Plus picture booths are not for free and must look through your eyes more.. Rather than just recording it,6 months ago
1,Naveen Gurazada,5,"The view from the top is amazing. I was excited to be at the top of South Korea's tallest building. The entry to the tower is also an awesome experience, I liked the way they presented its history. Then the lift ride was fascinating with the visuals. At the top here comes the Seoul city view with the Han river. At 550m height, the experience is really worth it. Don't miss it.  For discount book your tickets online in advance.",a week ago
2,Marta Amézquita,5,"Very great tourist destination. The view of Seoul it’s amazing, and in my opinion, the pink hour is the best time to go. The whole going up experience is great. The lift takes 60seconds to go all the way up.  We took the package that offers the observatory ticket price + dinner (you can choose between 5 different dishes) + coffee or tea. So it’s very worth it.",4 months ago
3,James Vijay,5,"Great engineering marvel similar to the New York WTC. It has 125floors and the lift takes you in a minute there. Entry fee is applicable, which is not that expensive. Lots of branded shops and restaurants. Very well maintained",a month ago
4,Yi Shiean Tan,5,"Another must visit spot if you were around the area! For someone who supposedly didn’t have fear of heights, my legs still went jelly looking down the transparent floor.  The Milk Bar also offers a tasty treat!",4 months ago
5,Chandler Stroede,5,"Absolutely worth every penny. If you came across this while planning excursions in Seoul, do it. The views from the top are breathtaking and show how vast the city actually is. The entire path into the building (including the elevator ride to the top) is a fun and interactive experience that is fun for solo travelers to families.",7 months ago
6,jh son,5,"It's good for shopping~ It's in the Big 3 shopping malls in Seoul, Korea.  Very spacious shopping mall.  It's good to pass time~ Not only shopping malls, but also aquariums, movie theaters, concert halls, duty-free shops, hair salons, massage shops, gyms, arcades, Lotte World amusement park, etc.",5 months ago
7,Florian Colin,5,"Very impressive tour, the visit is very fun and the value for money is interesting. Unobstructed view of Seoul, which allows you to understand the extent of this city! I recommend",2 months ago
8,Nate Inman,5,"One of the tallest towers in the World. This place is a must see when visiting the beautiful city of Seoul. There are many things to do within the tower such as an aquarium, mall, and plenty of restaurants.",2 months ago
9,Caramel Latte,5,Absolutely stunning view. There's a cafe right on the top which serves ice cream that's really tasty. I highly recommend you take the Seoul sky tour when you visit Seoul. You won't regret it.,a month ago
10,Dadpool011235 wilson,4,This place is so huge an there's so much to see!  They have all the high end name brand stores. Everything is beautifully elegant.,a month ago
11,Little T.,5,"Elegant 123-story skyscraper opened on April 3, 2017. It is the tallest building in Korea and the 5th tallest in the world. It is huge, but you don't feel that, because it is slim and narrows towards the top. Nearby park with the lake is beautiful too. Wonderful experience all year around.",8 months ago
12,Karolina Brzezicka,5,"Beautiful view from the observation deck, before we went to the elevator that took us to the 117th floor, we saw a small exhibition. A place worth a visit.",2 months ago
13,Kaan Tu,4,"Loved the view, it is quite crowded and in my opinion slightly overrated. But a unique experience in Seoul nonetheless. Would recommend",5 months ago
14,Shivani Jadhav,5,Yesterday was my first time visiting seoul and lotte tower..best experience of my life..and that too with new friends.. You should visit lotte tower once..you will feel like u r on top of the 🌎..JUST AMAZING🥰,a month ago
15,MANG THOMAS VAIPHEI,5,Best place to visit and make sure to visit if you are in Seoul ...236 days enjoyable || recommended 👌,3 months ago
16,paul nichols,5,"Awesome experience and obviously best views of the city. Also, very well organized and easy to get to the top.",a month ago
17,emmanemm,5,Amazing experience in the tallest building in Korea. We booked on KLOOK which makes it cheaper than in person. It was very busy during the sunset on Sunday I recommend going during the week instead but definitely go during sunset,9 months ago
18,Ramiro Herrera,4,"Went during the day and it's awesome! Night time, I think during certain times, there's a firework show... we didn't get to see that. There's a cafe and restaurant on the 120th floor but the prices are expensive FYI.",7 months ago
19,Andrew Chew,5,"Great views. 4 floors of viewing areas, spread the crowd.",3 months ago
20,Valerija Strelciunaite,5,Beautiful place for time spending with friends or family. From the top you can enjoy magnificent views of Seoul city,6 months ago
21,Pervesh Maheshwari,5,Recommend once visiting. Seems over hyped. Ticket seems bit expensive,a month ago
22,Dimpi Verma,5,The place of love. Go this valentine day with your partner.y0u definitely love the place.kimchi. sarangae,5 months ago
23,Nick T. (Nico),5,Great views of the city. If you go at dusk you'll see both day and night views.,a month ago
24,Tonya Bushee,4,"The inside portion didn't have that long of lines in the morning, which was great.  Outside that afternoon the lines were too long and it took us over 45min to wait for one single ride that lasted only about 1min tops. The park could use freshening up. All the pictures I saw were of bright colors and lots of lights. Evening it barely looked lit up as well, especially since it was only two weeks before Christmas.",7 months ago
25,Donny Fahrochi,5,"I recommend you to go here in spring time, especially in cherry blossom time. Really nice weather and scene.",3 months ago
26,Pat,5,"Came on the right day…Black Friday in America, just another Friday in Korea!  Took the SRT from Pyeongtek Jije station…took about 20 minutes to get up to Seoul.  Jumped onto the Subway and were at Lotte World Tower two stops and a transfer later.   Subway stops right at the mall.   No crowd at all at 1030 Friday morning, we went right up.   Did not go out on the walkway…just enjoyed the view from the observation floors. Definitely worth doing when in town…5th tallest building in the world.",8 months ago
27,Roy Whitworth,5,For the best views of Seoul it is well worth the money. Go on a clear day and enjoy some coffee at 123 floors up overlooking the thousands of apartments and mountains in the distance.,10 months ago
28,HumanPurifier,2,Cruel traffic jam Kids are running everywhere Parking lot bill is cruelly expensive Parking bill discount coupon doesnt 𝚋𝚎 stacked even 𝙮𝙤𝙪 ʜᴀᴠᴇ two parking lot coupons. Kids’s screaming 𝚠𝚒𝚕𝚕 tear your ears apart.,9 months ago
29,Ruchi's Little World,5,"Its a jaw dropping building.. in the core of city..Its Korea's Tallest observation deck, and 5th in the world with 23 stories.. with all the urban facilities/ amenities...all the famous brands outlets...its shiny like anything... very neat...the building look like from fairytale...The architecture is stellar and amazing! This is a must visit spot if you are in this area..Very great tourist destination. overall view of Seoul it’s amazing and breathtaking if you are nor scared of height...Great shopping place and great tourist spot!!",3 months ago
30,Han,5,"Very impressive building, the view is great from the 81st floor. Didn’t actually make it all the way to the top since jt cost too much. We went up for lunch at Signiel Seoul on 81st which i dont think makes much difference since no surrounding buildings are that tall to block the view.",11 months ago
31,Lynnette Borgen,5,"Was a once in a lifetime experience, going on the  Sky bridge! We felt safe and secure the entire time. Would highly recommend this!",a month ago
32,Dominic Jahr,4,The weather was not great but the view over seoul was great.,2 months ago
33,dentedwing 1919,4,"It's very VERY big. Got lost multiple times trying to navigate from the theme park to the mall to the department store... However the staff everywhere are friendly and helpful. The department store itself is very extensive but I mostly explored the food section at B1. Lots of options and a grocery section. The restaurants on floor 11 (I think) are not bad too. Some are more pricey but you can definitely find one that's within your budget, or eat at a restaurant near the station.",a month ago
34,George D,5,"I love this tower. Tallest building in Korea. 6th in the world. I heard there are long lines for observation deck. I had 0 lines and went at about 830 pm on a weekday. It was awesome. Great views. Glass floors. Lounges, shops, cafes at the top. Absolutely worth it. I'm a bit biased because this tower means a lot to me. However it really is very beautiful. Go go go!!",5 months ago
35,Antoine R,5,Great experience and not overpriced especially when you can get the discount (for groups of 4). I’d choose this tower over the N Seoul Tower,7 months ago
36,Lina Rojas,4,The view is amazing!! And when we went there it was relatively empty so very comfortable to walk & look around. However bit expensive to just go up.,4 months ago
37,mateusz kurkowski,5,"A very nice mall.Great cafes, plenty restaurants and shopping possibilities. The aquarium was a very pleasent surprise! Worth a couple of hours. The tower and the Lotte World Park is on the to do list. Strolling along the lakes behind the mall, while watching the little boats or listening to casual piano concert is also very nice! Good place to spend a day.",3 weeks ago
38,Anindya Sundar Patra,4,"This observatory is situated on the 117-123 floor of Lotte world tower, the tallest building in South Korea.",a month ago
39,Abdulelah AlGosaibi,5,The view is super amazing and the tower observatory experience is lovely. I'd recommend you go on a clear day and during the night to see all the lights. The 123 lounge can be skipped. The milk bar should not be skipped 😄,2 months ago
40,PavanKumarBN,5,I am running out of words to describe our experience. It’s mind blowing!! Everyone must  visit the place to get awesome day/night view from one of the tallest tower. We also happened to try sky bridge. It was breathtaking and super safety to enjoy!! Must try if you are looking for some thrilling experience. Amid corona they are maintaining well!!,a year ago
41,Donna Devitha,5,Great...I wish I had courage to try the bridge,2 weeks ago
42,Robert Moreno,5,Really enjoyable! You can easily spend one hour at the observatory taking in the city sites. On the plus side you have the mall and multiple restaurants. The metro goes directly to Lotte world tower.,a year ago
43,Baatarbyek Ryskhan,5,We stayed at Signiel hotel 90th floor in Lotte Tower. Its awesome view! Totally worth it!,a month ago
44,Shielah Mavengere,5,"The Lotte World Tower is the tallest building in Korea! The surroundings at Lotte world tower are always themed with current season! I visited the Lotte world tower Christmas time in 2020 and there were lots of Christmas light displays and colorful deco. I hope to take the elevator which costs around 27,000 won to the observatory deck.",a year ago
45,Dr. Anindita De (AD),4,It was an amazing experience.  The view is outstanding,4 months ago
46,Natanael Velez,5,"At 555 meters up 🔝 Amazing building! Entrance was around 35,000 won but is totally worthy! You also have the mall at the bottom so after you enjoy the view you just can go to the mall and relax! Have a lot of places to eat and obviously clothing stores!",a year ago
47,M. Ahmed Atraktchi,5,Very beautiful place... I supose to every one going to seoul should be go there 👍,3 months ago
48,Dalton Bruno,5,"Did a walk'in. Wasn't sure where to go, to start the ticketing as there was a small crowd. But once we figured it out, the process was great. The pricing was reasonable.  It starts with the usual lower level museum/entertainment section. Then there is a elevator ride up with some cool history.  Up at the top there's so many ways to experience the views and heights. Everything was clean and easy to find. There's areas to eat, a gift shop, a bar etc. It's a fully packed expensive will do it for a 3rd time.",2 months ago
49,Austin Lee,5,"It's more than just a tower observation deck. If you get a combo package with the aquarium, it is definitely worth visiting on a sunny day. At the top, there are 4 floors with different things to see, including a glass section with nothing down to the ground. They also have digital panels that show you what you are looking at through the windows, as well as historical photos of those areas. The topmost fifth (122nd) floor has a restaurant you need a reservation for. There is also a rope bridge experience with a safety harness above the tower, for an extra fee.",a year ago
50,Benjamin Sung,1,"It was our fault that we visited on a school holiday, ""World School Festival"" or something like that. The entire park was overrun by middle and high school students, all still in their school uniforms, when we arrived after lunch. The lines for every attraction were hours long; the combined noise from the parade on the main level and the crowds was deafening; and the whole faculty was simply not navigable. On top of that, the magic pass we paid for with our tickets had some kind of glitch that caused it to fail on our phone, so we never even got into a line. After fiddling with the phone for half an hour while trying to avoid being stampeded by hormone driven high schoolers, we gave up and went to see if we could get a refund on our tickets. The ""information desk"" was a kiosk with a couple of tablets, with no staff person in sight. We fought our way through the crowd along the full length of the main floor twice looking for someone, anyone to help us; finally found a guy who showed us to a door hidden behind one of the walls of the park. By this time our 9-year- old was quietly sobbing into my arms, and I think that persuaded the clerk to grant us the refund, which he said was not normal policy. Even then, to get the refund, we had to make our way back through the crowd out to the ticket counter at the front gates, where they redirected us to the turnstiles, where they redirected us back to the ticket counter. Where they finally gave us the refund after figuring out that our magic pass had malfunctioned. But for me, even without the absurd crowd, not worth the money or time - there's so many better things to do in Seoul, and better amusement parks elsewhere if that's your thing.",a month ago
51,Judy Park,5,"Have many shops to enjoy. Also, have nice restaurants. Clean and easy to access public transportation. It has aquarium that well maintained.",a month ago
52,Joshua,5,Definetly worth visiting while in Seoul.,2 months ago
53,Annie Urbina,5,Although I am scared to the highs~ this wasn't as scary as I thought. I enjoy the view and the small interaction between the staff and the visitors~ just make sure yo go when the weather is good otherwise will not be as worthwhile as you think it may be~~~,2 months ago
54,Johnny L,4,"A good place for night view and sunset, the entry ticket is about 20/30$?! Long as I heard the tower is such a popular attraction, but regarding the corona situation, it’s still a very very popular place...eww When I buying the tickets there aren’t many people at all, but when I went up, haha still a crowed place. So, if you want to visit here, please take great care of yourself, wear masks! and bring a portable small hand sanitizer, it will be handy when you need to press the elevator buttons.",a year ago
55,J. T.,5,"You can find everything you want and the staff there is very kind if you get lost like me. The mall is very big, clean and has so nice decorations so if you want to take nice instalike pictures just go there. Outside was still some christmas decoration and a show which used the wall of the mall.",a year ago
56,Samphors UK,5,Lotte world tower is the number 6 tallest skyscraper in the world 🌎🌍.,3 months ago
57,Iris,4,A very popular tourist spot these days,4 weeks ago
58,Filip Abramowicz,5,Extremely high and luxury tower with magnificent view of whole Seoul. Really amazing. The night view is extraordinary however if you want to make great pictures it's better to visit during the day. At night lots of interior lights prevent from making good photos.,2 years ago
59,Cyril Rodriguez,4,Lotte World has improved over the last decade. It is no longer like an old mall but has been renovated to current sophistication.,a month ago
60,N. K.,4,"Very small and filled with 1-2h long queues of people for each ride, where one ride takes about 30s to 1min, so in case of visiting its better to pay extra for vip entrance not to waste time waiting in the qq.",a month ago
61,Wojtek Kajder,5,It's a must to see. Tip: Talk to the assistant and ask to do discount on tickets. It's easier when you are in even a small (3 people group).,4 weeks ago
62,Cynical Co.,5,"I enjoyed my time being at the Lotte World Tower. The starting price for adults are $25 each. Once paid, you can expect a long entrance inside and feels like it was done on purpose to keep building excitement. You eventually reach the elevator and takes less than 2 minutes to reach the very top, which is impressive. But be ready to want to yawn to get the pressure off your ears. Once at the top, you will come across some restaurants, shops, and you will be able to take photos with a glass floor, you will be able to step outside briefly, and have a walk around. You will also be watching a video presentation before hand that turns the screen off to reveal the outside to you. Overall, a great experience and worth the money.",3 years ago
63,YS Baek,5,Good place to visit with yr kids.,2 weeks ago
64,P.,5,"Amazing place.  Worth the price.  In the mall shops, the workers follow you around.  Think of it as your own personal assistant, seriously!  So you don't get offended.  I like my personal space, but different cultures have different practices.  They do that in some high end stores in the USA too though, so just think of the following store clerks as your personal staff.  It helps ease tension in any store in any country, including  in the US.",3 years ago
65,S.A Bappy,5,"Do you wanna become a bird?? haha I’m just kidding. You can’t be a bird, but you can watch something like a bird eyes. If you go to the Seoul sky Lotte world tower’s top floor, you’ll see around all areas as like a bird. You will feel an exceptional peace in your mind. You can take a different taste from here. For a few time you imagine like you you’re flying on the sky, and all buildings, roads cars or trees, everything is under yours. It would be a awesome experience.",2 years ago
66,Jimmy Zuehl,5,"Pretty cool. A bit of a long process to get to the top, but once there, the view is spectacular. Paid extra to visit the lounge, which includes a drink. Was worth it, as the lounge was practically empty, compared to the busy observation decks below. Don't bother trying to get a picture at the first level. It's the busiest level. Each level tends to get less and less busy, yet  the view gets better and better the higher you go.",2 years ago
67,Lily Dawis,5,"A great complex that will please all ages. A few buildings connected through sky bridge, families will enjoy the dedicated area with many playgrounds and shops.  Edgier shoppers may opt for the posh Avenue L. Great fashion brands and rarefied items may be found. So many restaurants and cafes to choose from as well. 1 day certainly won't be enough to explore the complex.",3 years ago
68,Geoff Pook,5,"Very impressive observation tower. Not such attractive views as Namsan Tower due to its location but at 500m up and with panoramic views, see through floors and outside viewing it is very impressive. Worth visiting before, during and after sunset with no time limit on how long you stay up there. There are some cafes and a souvenir shop too.",2 years ago
69,Nkateko Mdaka,4,"Enjoyed my time here, we went to the Dreamer 3:45 gallery show at the Lotte museum of Art. It was amazing",7 months ago
70,Omeed Moghadam,5,"Highly recommend coming to Lotte World Tower, specifically Seoul sky. The views of Seoul are absolutely breathtaking. It feels like you're on an airplane looking down at the city. There is plenty of windows that each offer a different angle that you can look through for house. There are about 5 floors where you are able to take photos, drink coffee, and grab a small bite. One of the floors has a glass floor which is both terrifying and beautiful!",2 years ago
71,Vikasdeep Singh,5,"Tallest skyscraper of South Korea with awesome observatory deck, some big brands shops, restaurants and hotels.  It is worth visiting the observatory deck but I would recommend to go there in evening to enjoy night view of Seoul city.  On deck you can easily spend 1 hour but not more than that required. Enjoy the glass flooring to experience the breath taking view.",3 years ago
72,Jacob,5,"Wonderful views of the building. Have been to the top in the past, which also had great views. The observation is best on clear days with high air quality, although it's difficult to plan for that in advance. The mall is also very nice with many options.",4 years ago
73,D B,5,"Looks cool 😎 I am scared of watching tall and big buildings though!  You can enjoy lunch time at the lake right next to it, plenty of restaurants to eat, many nice cafes in walking distance.",9 months ago
74,Ana,5,Definitely a must stop in Seoul. I recommend going close to sunset time so you can experience both daylight and night time Seoul. It has been one of my most memorable places to date. 5th tallest building in the world! You have to check it out.,10 months ago
75,Matt Porter,5,The Lotte World Tower is a great place to visit.  There is so much to see and do that you can't possibly take cover it all in one day (I will review the mall separately as well as the restaurants we ate at while here).  Our main goal when visiting Lotte World Tower was to visit the observation deck on floors 117-120.  The trip up is on a state of the art elevator where you feel immersed in the LED screens lighting up around you.  Once at the 117th floor you can take in incredible views of Seoul and the surrounding landscapes as you work your way up the 120th floor.  Be sure to check out the outside deck as you take in the views and walk on the glass floor looking straight down if you dare!,2 years ago
76,Yogi s,4,Really great place to look around the city! I recommend going there around sunset time to see the nice sunset and the night view. I would also recommend checking the micro dust level as some days you can't see much.,2 years ago
77,Prasad Birari,5,It was wonderful experience. The view from 123rd floor of the tower was mesmerizing.,7 months ago
78,Rahul K Gupta,5,"Really, very lovely place. This is world’s fifth largest building with 124 floors as well as world fastest elevator. It goes on 124 floor within 60 seconds. We could see whole Seoul from that building. Really amazing view from the top. Before going there, please ensure that weather should be cleaned so that you can see clearly too far. I love it. There is also LOTTE DUTY FREE STORE so you can buy many international goods. I wanna go there again and again. Trust me you will never regret. Enjoy",3 years ago
79,Mahmoud Ibn Sadeque,5,A must go for all in Seoul,a month ago
80,Rich K,5,Very cool multilevel experience. The elevator ride is worth the price of admission. Do not miss!,2 weeks ago
81,Rohini Nair,5,It was worth visiting the fifth tallest building in the world. Lotte's elevator is the fastest elevator on earth. It will reach the 120th floor in 30 seconds. The ticket price for adults are 27000 won each. 123 lounge is amazing. It looks so royal..,2 years ago
82,Uinsion,3,"Great views! Bit pricey! If you're paying with a visa, it's 20% of the ticket!",2 weeks ago
83,Hannah Allyse Kim,5,"This is a must-see landmark in Seoul surrounded by a theme park, restaurants, walking trail / park, and a world-class shopping mall. You can take an elevator to the 31st floor (I believe you can even go to the top for a fee) and get a spectacular view of Seoul.",4 months ago
84,JM Gateri,5,Once in a lifetime kind of experience,a month ago
85,Zeynep Ekitli,5,Amazing view like from top of the world. The visuals projected inside the elevator allow you to enjoy even when going up and down. Must see place!,3 months ago
86,Shannon Hill,5,"Visiting a friend who took me to this tower. It's roughly $20 a ticket to get to the top. They have amazing effects throughout and many opportunities to take professional photos which cost $13 a photo. The multiple lines were a little annoying. You wait in a line to have them tell you to get in another line which then separates you into two lines, but that's just me being picky. There's 6 stories at the top with different features. There's a small gift shop, and a cafe. I really enjoyed the presentation.",2 years ago
87,Garrett Watson,5,"Impressive tower and beautiful lake. Going to the top is worth it! Try to arrive just before sunset if you can.  Great for walking, although can get a bit crowded on weekends. You can go up to the ~30th floor for free and grab a bite / iced cream.",4 years ago
