,Unnamed: 0.1,index,Unnamed: 0,덕수궁부정단어리뷰,index.1,단어,번역
0,0,0,31, Since it has not been restored yet you may think that it is more flat than other palaces and lacks much to see It seemed to show the pain of our history in its own way ,0,much,"아직 복원되지 않아서 다른 궁궐보다 평평하고 볼 것도 별로 없다고 생각할 수도 있겠지만, 우리 역사의 아픔을 나름대로 잘 보여주고 있는 것 같다."
1,1,1,127, Its not as spacious as Gyeongbokgung Palace and theres not much to see but the buildings where East and West meet are new and pretty ,1,much,경복궁만큼 넓지도 않고 볼거리도 많지는 않지만 동서양이 만나는 건물들이 새롭고 예쁘다.
2,2,2,136, Its not too big and its great to take a walk and enjoy I am very much looking forward to the flowers that will bloom one after another such as cherry blossom peony wisteria and pear tree ,2,much,"너무 크지 않고 산책하며 즐기기에 너무 좋아요 벚꽃 모란 등나무, 배나무 등 연달아 피어날 꽃들이 너무너무 기대됩니다"
3,3,3,174, It may not seem like much but once you step inside there is something unusual about the weight of history ,3,much,별 것 아닌 것 같지만 안으로 들어서면 역사의 무게에 비범한 무언가가 있다.
4,4,4,249,A small palace compared to that of Gyeongbukgung and Changdeokgung This palace is perfect for those who wanted to visit one but do not have much time The palace allows visitors to understand the ancient Korean culture There is a change of guard ceremony at fixed timings here,4,much,"경북궁, 창덕궁에 비해 작은 궁궐 가보고 싶었지만 시간이 많지 않은 분들에게 안성맞춤인 궁궐로 한국의 고대 문화를 이해할 수 있습니다."
5,5,5,251,There is a common believe that most South Korean Temples look pretty much alike and that is an undeniable truth Nonetheless there is a hidden differential beauty on each one of them Here at this temple we could appreciate the differences  This palace also has a lot of dynamic history as has been occupied not only by the Korean Royal family In 1897 after the incident when Emperor Gojong took refuge in the Russian legation he returned to this place and named it Gyeongungung again During the Japanese occupation of Korea in 1592 the residential buildings became a temporary royal residence after all the other palaces were destroyed by fires  Many of the structures here have since been removed or sold In 1933 all buildings except for a few central and western style buildings were removed It was then made a park and opened to the public  At the end of the trail you may walk youll find a turquoise Blue Fountain European looking On the left of this you will find a smaller part of the palace detached unit and on the right of the fountain youll be right in front of the Deoksugung National Museum of Modern  Contemporary Art  Its important at the door to purchase the full package ticket so that you can appreciate both Palace and Museum  Since 2007 restoration work to restore Deoksugung Palace to its original specifications  This work has been ongoing We do recommend extensively this palace although we couldnt appreciate the full beauty as it has been a bitter winter this January but in Spring must be definitely wonderful  Dont miss it,5,much,한국의 대부분의 사찰은 모양이 거의 비슷하다는 공통된 믿음이 있으며 이는 부인할 수 없는 사실입니다. 그럼에도 불구하고 각 사찰에는 숨겨진 다른 아름다움이 있습니다 여기 이 사찰에서 우리는 차이점을 이해할 수 있습니다 이 궁에도 많은 역동적인 역사가 있습니다 조선 왕실뿐만 아니라 1897년 고종이 러시아 공사관으로 피신한 사건 이후 이곳으로 돌아와 다시 경운궁이라 명명했다. 다른 모든 궁전이 화재로 소실된 후 거주지 이곳에 있는 많은 건축물이 그 이후로 철거되거나 매각되었습니다. 1933년에 일부 중부 및 서양식 건물을 제외한 모든 건물이 철거되었습니다. 그 후 공원으로 지정되어 대중에게 공개되었습니다. 트레일을 따라 걸으면 청록색 파란색 분수 유럽풍이 보입니다. 이 왼쪽에 궁전 데트의 작은 부분이 있습니다. 2007년부터 덕수궁 복원 공사로 궁과 박물관을 모두 감상할 수 있도록 풀 패키지 티켓을 구입하는 것이 관문에서 중요하다. 궁전 원래 사양의 궁전 이 작업은 계속 진행 중입니다 올 1월은 혹독한 겨울을 보냈기 때문에 완전한 아름다움을 감상할 수는 없었지만 이 궁전을 광범위하게 추천합니다. 그러나 봄은 확실히 멋질 것입니다 놓치지 마세요
6,6,6,256,This is a much smaller palace as compared to the grand Gyeongbokgung palace and is in the heart of the city We landed there just in time for the changing of the guards ceremony which is again not as elaborate as the one at Gyeongbokgung but is still nice You can watch the ceremony from the street You need a ticket only to enter the palace grounds The visit does not take much time as the palace grounds are small The guide pointed out to us some of the structures dating back to 1600,6,much,웅대한 경복궁에 비해 훨씬 작은 궁궐이고 도심 한복판에 있다 우리는 경복궁만큼 정교하지는 않지만 여전히 멋진 근위병 교대식에 맞춰 그곳에 착륙했다. 거리에서 의식을 볼 수 있습니다 궁전 부지에 입장하려면 티켓 만 필요합니다 궁전 부지가 작기 때문에 방문에 많은 시간이 걸리지 않습니다 가이드는 1600으로 거슬러 올라가는 건축물 중 일부를 우리에게 지적했습니다
7,7,7,278,Dropped by here because it was on our way and walked the grounds A few beautiful nature corners and buildings are pictureworthy as usual Otherwise not much to see here but if its on your way its worth stopping by,7,much,도중에 들렀고 경내를 걸었기 때문에 여기에 들렀습니다. 몇 개의 아름다운 자연 코너와 건물은 평소와 같이 그림이 아름답습니다.
8,8,8,299,This palace and the surrounding grounds are much smaller than the nearby Gyeongbokgung Palace but it is still worth a visit if you have an hour or so to spare We arrived just as the changing of the guard ceremony was starting 11am which takes place just in front of the main gate There wasnt such a big crowd so we had a good view of the ceremony After that we took a walk around the westernstyle garden and the interesting buildings in different architectural styles Part of the site was under renovation but there was still plenty to see including the Modern Art Museum,8,much,이 궁과 주변 경내는 인근 경복궁에 비해 훨씬 작지만 1시간 정도 여유가 있다면 한 번 가볼만한 곳이다. 정문 사람들이 많지 않아서 예식을 잘 볼 수 있었습니다. 그 후 우리는 서양식 정원과 다양한 건축 양식의 흥미로운 건물을 산책했습니다. 현대미술관을 비롯한
9,9,9,308,Small place which only takes half an our or so to walk around Not much to see inside The main attraction is the changing of the guard ceremony It was excellent Lots of interesting uniforms to look at and excellent drummers,9,much,걷는 데 우리 반 정도 밖에 걸리지 않는 작은 장소 내부는별로 볼 것이 없습니다 주요 명소는 근위병 교대식입니다 훌륭했습니다 볼 흥미로운 유니폼과 훌륭한 드러머가 많았습니다
10,10,10,309,Deoksugung is a lot smaller than the other Seoul palaces Gyeongbokgung Changdeokgung but its still worth visiting Its much more quiet and offers a break from the city on a hot day Take you time and sit around for awhile observing locals and enjoying the scenery Since its centrally located Deoksugung also offers great views of traditional palace buildings with a bunch of modern skyscrapers in the background  a combination of old and new that makes Seoul so interesting,10,much,덕수궁은 서울의 다른 궁궐보다 훨씬 작습니다. 경복궁 창덕궁은 여전히 ​​방문할 가치가 있습니다. 훨씬 더 조용하고 더운 날 도시에서 휴식을 제공합니다. 시간을내어 현지인을 관찰하고 경치를 즐기며 시간을 보내십시오. 덕수궁은 또한 서울을 매우 흥미롭게 만드는 옛것과 새것의 조합을 배경으로 많은 현대식 고층 빌딩이 있는 전통적인 궁궐 건물의 멋진 전망을 제공합니다.
11,11,11,311,We visited as we had a little time and were in the area It is cheap to visit but there isnt much to see compared to the other palaces The changing of the guard ceremony is fun to watch and there is an explanation of what is happening in English There is some information about the buildings in English but not very much I would say it isnt worth going if you only have a few days in the city but stop by if you will be around for a week or more,11,much,우리는 시간이 조금 있고 그 지역에있어 방문했습니다. 방문하는 것은 저렴하지만 다른 궁전에 비해 볼 것이 많지 않습니다. 근위병 교대식은 보는 것이 재미 있고 무슨 일이 일어나고 있는지 영어로 설명되어 있습니다 건물에 대한 정보가 영어로 되어 있지만 그다지 많지는 않습니다. 도시에 며칠만 있으면 갈 가치가 없지만 일주일 이상 머무를 예정이라면 들러보세요.
12,12,12,316,Deoksugung palace is very interesting palace for me Beside the location that in the middle of the city and just next to city hall the palace was very easy to reach This palace also smaller than the other two Ive been visited But its nice to started your palace tour with this one  Its like past and present met in one place There are few historic pavilions and yet there are modern and western buildings in same complex  Very interesting for see but not much to explore But its very nice experience especially if you came when the guard changing ceremony  Extra info  When you get hungry and need something to snack on you can try waffles just next to it,12,much,덕수궁은 나에게 매우 흥미로운 궁전입니다. 도시 한가운데와 시청 바로 옆에있는 위치 외에도 궁전은 매우 쉽게 도달 할 수있었습니다.이 궁전도 다른 두 궁전보다 작습니다. 이것으로 과거와 현재가 한 곳에서 만난 것 같은 역사적인 파빌리온이 거의 없지만 같은 단지에 현대식 및 서양식 건물이 있습니다 볼 수있는 매우 흥미롭지 만 탐험 할 것이 많지는 않지만 특히 경비원이 바뀌었을 때 온 경우 매우 좋은 경험 세레모니 추가 정보 배가 고파서 간식이 필요할 때 바로 옆에 있는 와플을 먹을 수 있습니다.
13,13,13,317,This grounds of this palace are much smaller than most of the others in the city Entrance is only 1000kr however despite the bargain price this place is relatively empty This allows you to stroll the grounds and take numerous photos without the hoards of tourists which you will find in the other palaces,13,much,이 궁전의 부지는 도시의 다른 궁전보다 훨씬 작습니다. 입구는 1000kr에 불과하지만 저렴한 가격에도 불구하고 이곳은 상대적으로 비어 있습니다. 이로 인해 많은 관광객 없이 경내를 산책하고 수많은 사진을 찍을 수 있습니다. 다른 궁전에서
14,14,14,340,We managed to secure tickets for the Secret Garden in Deoksugung on our first day in Seoul and all other days for our Seoul trip was sold out While the weather forecast was not good we proceeded on to visit this palace and its garden  Of course it would be a much better visit in gorgeous autumn weather but we managed to enjoy the gardens and the castle complex with its spectacular foliage before the huge downpour Do allow at least half a day in good weather to fully appreciate this complex,14,much,우리는 서울에서의 첫날과 서울 여행의 다른 모든 날에 덕수궁의 비밀 정원 티켓을 확보 할 수있었습니다. 일기 예보가 좋지 않은 동안 우리는 계속해서이 궁전과 정원을 방문했습니다. 화려한 가을 날씨에 방문하는 것이 훨씬 더 좋지만 엄청난 폭우가 내리기 전에 장관을 이루는 단풍으로 정원과 성 단지를 즐길 수 있었습니다. 좋은 날씨에 이 단지를 완전히 감상하려면 적어도 반나절 시간을 허용하십시오.
15,15,15,353,This palace is near City Hall and costs W1000 to enter It is closed on Mondays  There are free guided tours in English twice a day at 1030  1330  The palace was the home of two kings the first in the 16th17th centuries and then again in the 19th20th centuries  The best building is the Throne room which has exquisite dragon carvings on the ceiling  Note that the complex houses the Seokjojeon Hall Anybody can visit the basement  not much to see there particularly if you cant read Korean The best parts are the first and second floors But you have to book on the site webpage in advance Or for foreigners there is a special rule to allow up to five to sign up on a waiting list first come first served This hall was built in about 1910 and is a mixture of western and Korean styles The hall is now the Daehan Empire History Museum and is definitely worth a visit The visit is guided and should take about 45 minutes  Time to visit would be up to an hour longer if you go into the hall,15,much,이 궁전은 시청 근처에 있으며 입장료는 1000원입니다. 월요일은 휴무입니다. 1030 1330에서 하루에 두 번 영어로 된 무료 가이드 투어가 있습니다. 궁전은 16세기 17세기와 19세기 20세기에 두 왕의 집이었습니다. 가장 좋은 건물은 천장에 정교한 용 조각이 있는 왕좌의 방입니다. 복합 단지에는 석조전이 있습니다. 특히 한국어를 읽을 수 없다면 누구나 지하를 방문하여 많이 볼 수 없습니다. 가장 좋은 부분은 1층과 2층입니다. 사전에 사이트 웹 페이지에서 예약해야 합니다. 또는 외국인의 경우 대기자 명단에 최대 5명까지 등록할 수 있는 특별 규칙이 있습니다. 선착순으로 이 홀은 1910년경에 지어졌으며 서양식과 한국식의 혼합입니다. 홀은 현재 대한제국 역사 박물관이며 꼭 방문할 가치가 있습니다. 안내를 받으며 약 45분 정도 소요됩니다. 홀에 들어가시면 방문 시간이 최대 1시간 더 소요됩니다.
16,16,16,360,Stayed for a few days in the Plaza hotel which is just in front Deoksugung and was curious to know what is inside  Entrance fee is quite affordable and you get a decent guide for the different buildings however personally I enjoyed much more relaxing under the shadow of the trees just enjoying the view than learn about the history of the place,16,much,덕수궁 바로 앞에 있는 플라자 호텔에서 며칠 머물렀고 내부에 무엇이 있는지 궁금했습니다. 입장료는 꽤 저렴하고 다른 건물에 대한 괜찮은 가이드를 얻을 수 있지만 개인적으로 나는 그늘 아래에서 훨씬 더 휴식을 즐겼습니다. 장소의 역사에 대해 배우는 것보다 경치를 즐기는 나무
17,17,17,391,As I have done most of the palaces this one didnt have anything special no must see factor until I went round the Historical Museum This was the tick in the box for this Palace The w1000 also includes the museum and if you want to walk round head over as soon as you arrive and get yourself on a tour It is access by tour only and they leave every 30 minutes but gets full quick as the groups are only small Shoes off and slippers on they gave me an English audio so I could follow round but obviously the passionate guide was giving the locals much more than I was hearing All renovated in the last 10 years but decorated as best as they could from old photos and with some of the original furniture The history you get is the best thing and even some photos of the old emperors and emperoresses Your 1000 doesnt also get you into the art gallery that will cost you more,17,much,내가 대부분의 궁전을 해왔기 때문에 이 궁전에는 특별한 것이 없었습니다. 역사 박물관을 둘러볼 때까지 꼭 봐야 할 요소가 없습니다. 이것은 이 궁전의 상자에 있는 체크 표시였습니다. 도착하자마자 투어에 참여하고 투어로만 액세스 할 수 있으며 30 분마다 출발하지만 그룹이 작기 때문에 빨리 만석입니다. 분명히 열정적 인 가이드는 내가 들었던 것보다 훨씬 더 많은 것을 현지인들에게 제공하고있었습니다. 모든 것은 지난 10 년 동안 개조되었지만 오래된 사진과 원본 가구에서 가능한 한 최선을 다해 장식했습니다. 당신이 얻는 역사는 가장 좋은 것입니다. 당신의 1000은 또한 당신에게 더 많은 비용이 드는 미술관에 당신을 데려가지 않습니다.
18,18,18,396,Being the smallest one among the four palaces I got to in Seoul not sure how it compares in size with Gyeonghuigung which is the only one that I didnt get to among Seouls five palaces this is not a palace like Gyeongbokgung which is kind of a world of its own with its huge grounds where youll get an immersion experience of the Joseon era days but what this palace offers just because of its significantly smaller grounds compared to Gyeongbokgung is nice contrasting views of traditional palace buildings  their modern highrise counterparts right outside the confines of the palace grounds including the interestingshaped allglass structure of Seoul City Hall which can be seen from the raised platform around the main palace building which will kind of give you an idea how far Korea has come from those days of the Joseon Dynasty And those relatively small grounds of the Palace actually merge on one side to the left of the main palace building while facing it or equivalently to your right if you go all the way to the end of the pathway from the entrance gate after coming in from the street with the grounds of a big museum with a lovely fountain in front although Im not sure if the museum is considered part of the Palace for admission purposes or if it can be entered from another side  And unlike at the other palaces the main building of this palace can be entered not just to look at from right outside so you can get a closeup view of the throne stage Also present here at the entrance gate are two or three ceremonial guards didnt see them on the way in at about 10 am though only saw them on the way out about an hour later but Im sure theres no big ceremony involving a lot of guardsmen in colorful attires with some holding beautiful flags as at Gyeongbokgung since theres simply no space here for such a ceremony  Coming by subway City Hall Station Lines 1  2 is where to get off and youre pretty much right outside the Palace once you get out of the station onto the big street Sejong Daero just a 1to2minute walk to the entrance gate And what I suggest for the ticket is getting an integrated ticket for 10000 won the equivalent of 10 US dollars which is good for like a month and which gives you admission to four of Seouls five palaces except for Gyeonghuigung which Im sure is a small one maybe even smaller than this one  Jongmyo Shrine; also do keep in mind that this palace along with Changdeokgung  Changgyeonggung are closed on Mondays whereas the main palace Gyeongbokgung  Jongmyo Shrine are closed on Tuesdays,18,much,"서울에서 가본 4개의 궁 중 가장 작은 궁궐이라 서울의 5개 궁 중에서 유일하게 가보지 못한 경희궁과 크기가 어떻게 다른지 모르겠다. 조선 시대의 몰입감을 경험할 수 있는 거대한 부지가 있지만 경복궁에 비해 부지가 훨씬 작기 때문에 이 궁이 제공하는 것은 전통 궁궐 건물과 현대식 고층 건물이 경복궁의 경계 바깥에 있는 대조되는 멋진 전망입니다. 조선시대로부터 한국이 얼마나 멀리 왔는지 짐작할 수 있는 본당 주변의 높은 플랫폼에서 볼 수 있는 흥미로운 모양의 서울시청을 비롯한 궁궐의 경내와 비교적 작은 경내 궁전은 실제로 마주보고 있는 동안 주요 궁전 건물의 왼쪽에 병합되거나 y인 경우 오른쪽에 동등하게 병합됩니다. 아름다운 분수가 있는 큰 박물관 부지가 있는 거리에서 들어와 입구 게이트에서 통로 끝까지 가십시오. 박물관이 입장 목적으로 궁전의 일부로 간주되는지는 확실하지 않습니다. 또는 다른 쪽에서 들어갈 수 있는 경우 그리고 다른 궁궐과 달리 이 궁의 본관은 밖에서만 볼 수 있는 것이 아니라 왕좌의 무대를 가까이서 볼 수 있도록 들어갈 수 있습니다 여기 입구 문에도 있습니다 두세 명의 의식 경비원은 오전 10시에 들어오는 길에 그들을 보지 못했지만 약 1 시간 후에 나가는 길에서 그들을 보았습니다. 경복궁에서는 이런 행사를 할 공간이 없기 때문에 지하철로 오시는 경우 시청역 1호선 2호선에서 내리는 곳이며 역에서 나와 큰 거리 S로 나오면 궁전 바로 밖에 있습니다 이종대로 입구 게이트까지 도보로 1~2분 그리고 티켓에 대해 제가 제안하는 것은 10,000원에 통합 티켓을 얻는 것입니다. 이는 한 달 동안 좋은데 서울의 5개 궁전 중 4개를 입장할 수 있습니다. 내가 확신하는 경희궁은 이 종묘보다 작을 수도 있다. 또한 창덕궁 창경궁과 함께 이 궁은 월요일에 문을 닫는 반면, 본궁 경복궁 종묘는 화요일에 문을 닫습니다."
19,19,19,440,I didnt expect much from this palace its small a third of its original size and gives an impression of a lessthankorean palace sibce there are modern buildings in it BUT It has difinitely exceeded my expectation Firstly it was considerably less crowded than Gyeongbukgung even in its peak time which is 11 am when the Changing of the Guard takes place Secondly the Changing of the guard is a wonderful experience you can follow the marching band around and watch the change comfortably and then even pause a few times to let you take photos with the guards Thirdly the history of the different buildings that compile the palace is very interesting One of the buildings is a fusion between traditional korean architecture and imperial architecture and to my opinion it was spectacular  For the meek price of 1000 won I recommend going I arrived around 920am so I even managed to get a free english tour with a guide before following the marching band  Overall I spent 3 hours exploring including the guard change and half a guided tour,19,much,"나는이 궁전에서 많은 것을 기대하지 않았습니다. 원래 크기의 1/3이 작았고 내부에 현대적인 건물이 있기 때문에 한국보다 못한 궁전의 인상을줍니다. 그러나 예상을 확실히 초과했습니다. 첫째, 성수기에도 경북궁보다 훨씬 덜 붐볐습니다. 근위병 교대식이 있는 오전 11시 두 번째 근위병 교대식은 행진하는 밴드를 따라가며 편안하게 교대식을 지켜본 후 잠시 멈추어 근위대와 사진을 찍을 수 있는 멋진 경험입니다. 세 번째 궁전을 구성하는 다른 건물의 역사는 매우 흥미 롭습니다. 건물 중 하나는 한국 전통 건축과 황실 건축이 융합 된 것입니다. 제 생각에는 장관이었습니다. 1000 원의 저렴한 가격으로가는 것이 좋습니다. 행진 밴드를 따르기 전에 가이드와 함께 무료 영어 투어를 할 수 있었습니다. 전반적으로 나는 g를 포함하여 탐험하는 데 3시간을 보냈습니다. uard 변경 및 반 가이드 투어"
20,20,20,451,You cant help but notice when visiting this ancient Palace that you are surrounded by modern day high rises in the heart of the city  This was a very popular Palace for school children to visit as there had to be several hundred children on site  The grounds are very nice and much bigger than expected There is a mixture of Western and Korean architecture Make sure to grab the brochure expaling everything at the entrance way  Definitely worth a look Very cheap to get in only 1000 won but free if you are 65 or older,20,much,이 고대 궁전을 방문하면 도시 중심부의 현대식 고층 건물로 둘러싸여 있다는 사실을 알 수 있습니다. 이 궁전은 수백 명의 어린이가 현장에 있어야 했기 때문에 학교 아이들이 방문하기에 매우 인기 있는 궁전이었습니다. 멋지고 예상보다 훨씬 큽니다 서양식과 한국식 건축이 혼합되어 있습니다 입구 길에서 모든 것을 설명하는 브로셔를 꼭 잡으십시오 확실히 볼 가치가 있습니다 1000 원에 매우 저렴하지만 65 세 이상인 경우 무료
